109600,30106333,76561198008952250,0,9,5751,0,5548,1416696974,The microtransactions have become genuinely predatory and the game is no longer worth trying to get into. Don't waste your time or you will inevitably find yourself weighing whether or not it's worth investing copious amounts of money trying to keep up with the updates that make your previous cash investments worthless. (spoilers: it's not worth it),1487794692,1680644369,False,0,0,0.497404873371124268,0,True,False,False
109600,30233678,76561198020185016,371,40,11126,731,5448,1708423750,"I like this game but, every time when i want give a new chance i still meet problems with high latency and its not my internet connection, in world of warcraft i have about 32ms, here i have about 160-220ms thats for game where you must jump from hit nearly umplayable. I recommend this game for people who are close to server.
Update: after some years its this game much less palyable like before if youa re from europe its waste of time even download it, better spend time in some alternative games who care about people gameplay quality.",1488255764,1626315279,False,1,0,0.511040985584259033,0,True,False,False
109600,30236821,76561198071040548,604,15,87,0,87,1488272304,"★★★☆☆


[h1]Played hundreds if not thousands of hours before it was available on Steam. Quit a few years ago, but feel my review still holds today.[/h1]


Pro's:
Great combat mechanics: Most classes are fun to learn and have a real role in group situations.
Controls feel fluid and tight: Dodging feels good and is rewarding.
PVE content is exceptional: Many zones, many dungeons, many bosses, many gear sets.
Graphics are above average.


Con's:
[b]Pay to Win aspect [u]RUINS[/u] PVP. [/b]
Content gated heavily by daily quests.  
Not open world.
No real end game ""raid"" content you might expect from a MMO of this caliber.
Company seems to have shifted focus to making this a console game.
PC community dying/dead/small.",1488273259,1624397688,False,4,0,0.555761635303497314,0,True,False,False
109600,30099064,76561198123331715,0,7,48536,0,4703,1683200600,"A lovely multiplayer game with a really friendly and helpful community.  It's not difficult to play, deep plot lines, and never-ending quests (which is good in my books).  It's one of those games I always end up coming back to.",1487769781,1572734030,True,1,1,0.518518567085266113,0,True,False,False
109600,29430000,76561198120467596,176,9,17980,0,13034,1485296694,Neverwankah,1485115503,1532376046,False,0,0,0.47826087474822998,0,True,False,False
109600,30196536,76561198064792880,193,8,39359,0,22455,1695119597,"good F2P MMO game thats not complete P2W

just do not touch PvP",1488117544,1526208875,True,8,0,0.602791070938110352,0,True,False,False
109600,30247432,76561198337588478,210,99,493,0,380,1692154121,Really fun!!,1488312907,1488312907,True,1,0,0.487804889678955078,0,True,False,False
109600,30247294,76561198072980563,0,2,10565,0,6586,1532252335,"Awesome game, very addictive :)",1488312496,1488312496,True,1,0,0.506329119205474854,0,True,False,False
109600,30241986,76561198146996338,75,12,3956,0,2409,1597267321,"PROS: 
When you've reached like level 3 you're gonna start to nerd this game A LOT

The game is constantly updated to either fix bugs or add in new content

If you're into MMO RPGs you're gonna love this game to bits

CONS:
'astral diamonds' wich you use to buy stuff in the AH (Auction House) (buying items off others) are kinda tricky to get if you don't have 2 friends with you or if you're under level 20.



RATING: 9,5/10",1488294928,1488295337,True,9,0,0.576671600341796875,0,True,False,False
109600,30233890,76561198006008695,0,27,56,0,56,1399947214,?,1488256955,1488256955,True,0,0,0.458715617656707764,0,True,False,False
109600,30229116,76561198139449266,0,91,5,0,5,1402058060,whats with the awful music for that trailer? lmao.,1488234297,1488234297,False,1,0,0.380158364772796631,0,True,False,False
109600,30217656,76561198099509044,46,3,2249,0,963,1542891276,"The game graphics wise is a little seedy, and the questing and content may be a little mediocre, but it makes up for it with the combat system. One of the best looking and most fun I've seen in an mmo. It's a good game to go casual with and kill time with but I wouldn't be investing all my time into this.",1488194764,1488194764,True,1,0,0.519230782985687256,0,True,False,False
109600,30213465,76561198081687405,0,19,517,0,517,1422443619,Pretty good. There's allot to do and learn. Takes up a heckin lot of memory though.,1488172943,1488172943,True,1,0,0.519230782985687256,0,True,False,False
109600,30198395,76561197970401580,0,14,223,0,223,1407947377,"Extremely fun, great environments and its free to play!",1488122225,1488122225,True,0,0,0.480769246816635132,0,True,False,False
109600,30197688,76561198142952676,0,48,15,0,15,1433446848,I was addicted as a young one,1488120356,1488120356,True,0,0,0.480769246816635132,0,True,False,False
109600,30181373,76561198528247948,0,5,1821,0,934,1596687536,Great game. Reminds of a lot of classic rpg games.,1488067272,1488067272,True,1,0,0.504587173461914063,0,True,False,False
109600,30180169,76561198220682084,359,84,214,0,214,1436629185,10/10,1488063175,1488063175,True,1,0,0.463951706886291504,0,True,False,False
109600,30151927,76561198188401423,0,1,3726,0,1103,1631636848,"I've got 4 letters to describe this game for you guys, 1: P 2: O 3: O 4: P that spells SH&%. The optimization of this game will go down in history as the worst, the FF pc ports run better then this game and they weren't even meant for the PC. I have to atleast give these guys a nice pat on the back though for achieving something, we might not all be perfect but guess what theres still a place for us in this world. Like many before me have tried, no matter how much you try and disguise a piece of poop it will still just always be a piece of poop.",1487974742,1487974742,False,2,0,0.438606619834899902,0,True,False,False
109600,30148037,76561198064577415,0,4,5198,0,4326,1493999512,a very good game,1487963018,1487963018,True,0,0,0.469162911176681519,0,True,False,False
109600,30128973,76561198182068135,0,20,2369,0,2139,1624641176,Pure pay to win especialy the PVP! I loved this game alot but over time it gets so grindy and not worth it everything is just zen/astral diamond based if u dont have any of these ur will be doing same stuff over and over again until u get some ad and then gain few stats increase on ur gear and the same sh repeats over and over again i would better play Elder Scrolls Online just a tip for someone who was abt to start playing Neverwinter just dont... Dont do that... Pure waste of time and good mod..,1487889813,1487889813,False,49,1,0.615600824356079102,3,True,False,False
109600,30128023,76561197982242646,0,1,127,0,19,1487947618,amazing game,1487886422,1487886422,True,0,0,0.422317326068878174,0,True,False,False
109600,30126244,76561198062497768,0,3,16981,0,12189,1662176713,still waiting for this to be available on mac. i'll keep waiting.,1487880606,1487880606,True,1,0,0.433416694402694702,0,True,False,False
109600,30121925,76561198128571733,0,2,2929,0,2792,1498070750,"Dis gem is wery nice! I recomend it to everyon who want to chil ;)
God bless Polend kurwa!!!",1487866302,1487866302,True,1,0,0.314909189939498901,2,True,False,False
109600,30121150,76561197993736033,0,72,2409,0,2404,1461774277,yes.,1487863925,1487863925,True,1,0,0.390432626008987427,0,True,False,False
109600,30118660,76561198165284994,36,3,1080,0,1080,1487753357,Cool game for lost time :p,1487855436,1487855436,True,1,0,0.469216197729110718,0,True,False,False
109600,30116666,76561198014626156,0,19,6317,0,2151,1518215274,I like this game. But i can not add friends. I want to know that some functions are not turned off because this game is free.,1487847286,1487847286,True,0,0,0,1,True,False,False
109600,30112162,76561198126362169,0,1,5354,0,2199,1686927529,kel2zed say: recommmmmmend,1487822858,1487822858,True,0,0,0.450391650199890137,0,True,False,False
109600,30111863,76561198007066753,0,35,8889,0,8873,1429387905,"it was nice while it lasted, played the entire game about 4x on 4 different characters, did lots of pvp and every dungeon in the game but it all kinda went to shit as soon as i had to upgrade my gems and artifact to the max.
its simply impossible getting the best ones without doing some form of pay2win through cash shop or botting yourself ingame currencies over multiple accounts.
that being said the game is fun for a playthrough just to get most of the story since the areas in this game are pretty nice (the ones where you dont sit inside of a sewer for an hour) and the quests are pretty fun.",1487820946,1487820946,False,26,1,0.544753968715667725,2,True,False,False
109600,30111821,76561198111242788,25,1,3715,0,1926,1582851740,"Have been playing quite a bit of this game recently.  Just found out about the Foundry aaaaaaaaand...... it's gone.  That fact almost turned me off of this game if it wasn't the only good D&D game in my opinion.  The Foundry being broken is a pretty big deal though and I most likely will loss interest in simply playing this game as I normally do with MMO's.  The user generated quests got stupid excited only to be majorly let down by the game and by the support team that is supposed to cover the game.  

TL;DR:  If you came for Foundry you might as well turn around unless you like boring MMO's",1487820767,1487820767,False,28,1,0.552849888801574707,3,True,False,False
109600,30111128,76561198004131548,0,38,554,0,554,1387671850,The characters all run as though they were constipated.,1487817152,1487817152,False,3,6,0.432614058256149292,0,True,False,False
109600,30108283,76561198313195661,0,1,1510,0,439,1530313549,"quality game, nice action combat. Got a nice atmosphere to it, somewhat clunky feel when riding through a city. Id describe it as a WoW with non tab targeting combat as it is well paced and well made
",1487802342,1487802342,True,2,0,0.454549908638000488,0,True,False,False
109600,30105851,76561198071589284,445,17,156,0,156,1487806895,"I have only play around 3 hours on PC,  but on Xbox I have played at least 50 and even though its like most MMO's and is mostly either grind up for hours, or pay to win it is still a good game.",1487792798,1487792798,True,0,0,0.497404873371124268,1,True,False,False
109600,30105843,76561198216497099,0,15,632,0,5,1642448135,"not actualy ben able to play the game as the updates are hgh and take  days to be accepted 
I was looking forward to trying to play as I have played stand alone before .
My lap top is i5 8gb ddr and windows 10 
willl atempt again 
But as was 15/02/17 can not reccomend",1487792766,1487792766,False,0,0,0.459183663129806519,0,True,False,False
109600,30102586,76561198009073722,440,31,5352,0,5343,1454155673,"Its pretty fun to play, altogether solo friendly if you prefer that, but forget endgame if you're not willing to spend hundreds to thousands of $, or even more hours on arcane farming and grinding strategies to get endgame gear.

It isn't pay to win by the thinnest of technicalities in this respect, but if you're not terribly concerned with having best in slot gear at enchants for your gear, you can have a lot of fun.

But you'd best believe that if you let yourself get bit by the competetive itch, be it for PVP or progression in PvE, you're going to pay dearly for it in time, dollars or both.   You will not get around that.   The grind will impress you, even if you think you're accustomed to grinding.",1487781514,1487781514,True,0,0,0,0,True,False,False
109600,30101217,76561198045984390,198,24,175,0,175,1386312005,love the girls voice singing in 1st vid. prob so hot. fap,1487776889,1487776889,True,0,3,0.464800208806991577,0,True,False,False
109600,30091791,76561198083335803,274,20,17652,0,6967,1632238331,This game is awesome. Would recommend.,1487732915,1487732915,True,0,0,0,0,True,False,False
109600,30085327,76561198183842454,0,11,3021,0,2993,1487960848,"my favourite mmorpg game
5/5
",1487704866,1487704866,True,1,1,0.50134044885635376,0,True,False,False
109600,30084946,76561198072889262,0,14,128,0,125,1454476340,"amazing ,, :)",1487703710,1487703710,True,0,0,0,0,True,False,False
109600,30083588,76561198146074808,0,5,194880,0,157484,1662231265,"After playing this game for a while, i have to say i have enjoyed many hours of game play. Yes, you can pay ( with a ton of cash, it is not cheap) to obtain the end-game enchantnments and mounts quicker but nothing that you can not get with spending some time grinding out content. The best possible thing for any new player coming into the game would be to find a good guild. This will save you tons of time. Money can not buy you skill, i see 3.2 item players out dps and out play 4.3 players everyday. If you like Wow or mmo's , you will enjoy this game. ( I suggest buying VIP, it is worth it for 10$ )",1487699632,1487699632,True,3,4294967295,0.531521081924438477,0,True,False,False
109600,30080339,76561198009259566,0,10,49614,0,23722,1532981712,"""There is no such thing as a free lunch""
Time is money. You will invest one or the other to achieve top tier gear. 
Not the DnD experience with a D-20 but 'new' mechanics to level the playing field between a lvl 1 wiz and a lvl 1 warrior- Cant say I agree with it, but a necessary evil if you want a MMORPG/F2P game to succeed. 

Decent story
Great setting
Great combat
Good music
Nice graphics

Prepare to grind or pay.",1487689034,1487689034,True,0,0,0,0,True,False,False
109600,30066224,76561198072701593,1704,77,1675,0,1495,1472953848,Physics are fun. Horses in here are almost as good as skyrim horses.,1487624577,1487624577,True,0,2,0.467100232839584351,0,True,False,False
109600,30053243,76561198133487462,0,10,5616,0,846,1664599570,love it.,1487579884,1487579884,True,0,0,0,0,True,False,False
109600,30047879,76561198072717735,39,2,3767,0,1741,1685326956,"Neverwinter you get what you put in.

What I mean by this, Zen market purchases  can help a player have a faster start then free players. All player will have to grind daily for the real in game currency ""Astral Diamonds"". Do the quests get the rewards, earn the glory during pvp, and you will find this game is not so ""pay to win"". 

Not on steam, I have played this game when it came out and kickstarted this game as well. This is still one of the best free to play mmos on the market. If you actually get into the storyline durring your adventures, find friends or a guild, and this game will delievers the DnD experience.

",1487552257,1487552257,True,0,0,0,0,True,False,False
109600,30031853,76561198124418509,0,8,847,0,843,1593870278,Really enjoy  this game. A bit monotonous. But the fighting system is good and the community seems a lot less toxic than most.,1487502825,1487502825,True,0,0,0,0,True,False,False
109600,30024705,76561198104394174,0,5,1782,0,97,1507178728,Not recommended at all. Constant crash without reason. confusing UI and bindings,1487475488,1487475488,False,1,0,0.508196711540222168,0,True,False,False
109600,30009577,76561198139554077,0,10,2514,0,1491,1511858588,"is dungoons anf dagons, is good",1487426969,1487426969,True,0,0,0,0,True,False,False
109600,30006073,76561198199493043,193,67,489,0,228,1505063475,asd,1487416782,1487416782,True,1,0,0.465507984161376953,0,True,False,False
109600,29977828,76561198100011276,0,1,3059,0,2873,1448761258,"Awesome RPG, especially if you're a fan of D&D. LOVE that it is free to play!!!",1487310905,1487310905,True,0,0,0,0,True,False,False
109600,29961314,76561198073866299,0,2,505,0,505,1487241747,"The worst game ever.. and its 10gb. graphics are so awful the designer is a f***king blind and gameplay looks stolen from dark souls. i am not recommended this game for new players its boring and useless game. i was wasted my 10gb for this game and i can download so much better games.

If your a new neverwinter player and want to download this game, DONT!. 
Trust me and play another f2p games its not worth it.",1487248644,1487248644,False,1,0,0.31674271821975708,6,True,False,False
109600,29946655,76561198156195039,0,4,2778,0,1985,1540141671,Its just better then WoW to be honest,1487182475,1487182475,True,1,0,0.433333337306976318,1,True,False,False
109600,29938175,76561198193173439,0,2,4595,0,3426,1496827336,"This game is absolute fraud. Do not play this game. The developers are lying, cheating, fraudulent crooks. Absolutely the most expensive game you will ever play. This is a casino covered up by a video game with worse odds of winning than a progressive jackpot. Absolutely the greediest developers on any game I have ever played in my entire life.",1487150883,1487151046,False,2,0,0.390522927045822144,0,True,False,False
109600,29922659,76561198054172794,0,2,91178,0,81199,1705929675,"First Review ever...
PPlayed this game when first came out was great and loved the Pvp and didnt need to spend much money to be competative...
Now a total cash grab dont expect to be a great PvP setting without spending at least $1500 on gems artifacts and the whole lot to be anywhere near topp teir!
Real shame was a great game that has been totally ruined... sad to see what it has become stop being so greedy ARC!",1487085630,1487085630,False,85,3,0.781673669815063477,4,True,False,False
109600,29911126,76561197990686172,56,32,1705,0,1433,1601382043,"+combat
+graphics
-grind",1487029055,1487029055,True,0,0,0.479041904211044312,0,True,False,False
109600,29908681,76561198051181265,35,1,590,0,546,1487018084,"Tried playing the game on three seperate occasions, to be stoped by constant errors. its a shame as i had heard good things!!",1487018156,1487018156,False,0,0,0.468965500593185425,0,True,False,False
109600,29901855,76561198210818313,0,1,296,0,296,1487003953,Nice!,1486998724,1486998724,True,2,0,0.516225993633270264,1,True,False,False
109600,29892111,76561198126564213,0,9,436,0,385,1424290385,Not really like yet,1486964932,1486964932,False,0,0,0.426657438278198242,0,True,False,False
109600,29884728,76561198248450574,26,9,2263,0,1150,1658015535,"This game is just, amazing to me, I love how the worlds look, I like how the bosses are, it's perfect IMO. Would recommend to people who like MMORPG games. <3 Also the class system is perfect! :D
",1486939757,1486939757,True,0,0,0,0,True,False,False
109600,29879835,76561198112172466,0,3,14918,0,11016,1560398770,"If you have problems playing this game go to your Steam Library and RMB click on the Neverwinter title, this will bring up a menu & you want to select the last option 'Properties'. The Neverwinter Properties window will open, select the Local Files tab & click on verify integrity of game files. It always comes back on my machine that 2 files could not be verifed & have to be reacquired. This whole process takes just a few seconds to complete. You may have to reset your modem after this until it gets a configuration that it likes. IT CHALLENGE COMPLETE!!!!!",1486924730,1486932400,True,0,0,0,1,True,False,False
109600,29877185,76561198185478705,0,9,3444,0,1946,1519657935,Very nice game dosnt need a very strong PC and it is very fun!,1486917485,1486917485,True,0,0,0,0,True,False,False
109600,29876464,76561198145802382,0,1,8163,0,4180,1609105813,as a fan of D & D this game is pretty good to scratch the itch,1486915570,1486915570,True,0,0,0,0,True,False,False
109600,29868277,76561198069187512,0,2,15823,0,1642,1679512966,Very cool game! Hours of game play and an awesome world to explore.,1486891402,1486891402,True,0,0,0,0,True,False,False
109600,29856615,76561198353513965,0,11,401,0,67,1499920197,"Couldn't Even...
Took To Long To Patch...
Boring...",1486844627,1486844627,False,0,1,0.410557180643081665,0,True,False,False
109600,29454529,76561198078574743,0,13,6959,0,6944,1486832596,"A ton of currencies, broken mechanics, lots of farming, and incredibly low drop rates.",1485228904,1486832666,False,0,0,0,0,True,False,False
109600,29849284,76561198247044864,9,1,110,0,110,1471006702,sucks if u have low end pc :))),1486824375,1486824375,False,0,1,0.373208910226821899,0,True,False,False
109600,29848336,76561198202664207,0,22,5022,0,2302,1526917596,match is played for you who have friends who like to play together,1486821723,1486821723,True,3,0,0.512971222400665283,0,True,False,False
109600,29840268,76561198146448620,118,57,26,0,26,1486795206,GG WP !!!,1486793951,1486793951,True,0,0,0,0,True,False,False
109600,29835891,76561198147018100,0,3,19324,0,11535,1702259668,Been playing this game for months.  It is true to the classic DVD game.  Always entertaining storyline.  You can play solo or with a team.  If you play solo at level 40+ expect to pay a little on zen market items.,1486774079,1486774079,True,0,0,0,0,True,False,False
109600,29829219,76561198013400028,298,40,5181,0,4899,1486943252,"A disclaimer - it's a game set in Forgotten Realms universe, but don't expect DnD-like gameplay. 

Now what should I say about this game...
Neverwinter is a MMORPG, and a really good one. I was somewhat off for the first few hours, but the game gets better and better with every hour you spend in it. 

A disclaimer #2 - if you don't like timegate mechanic and grinding dailies don't read further.

Let's start with some pros:
+ Setting - I'm definitely a FR lover. You should know that Salvatore helped with writing some of the quests in the game. You will also meet some amazing characters like Bruenor Battlehamer, Drizzt Do'Urden or Minsc&Boo. 
+ Music - wether you're in the heart of Neverwinter, traverse the Underdark or purge the Dread Ring of the undead you'll always be accompanied by really nice tunes. It's an MMO so obviously music does not play THAT BIG of a role, but the tracks playing at the background do not disturb you.
+ Character development(bright part) - it's really well made. While power upgrading does not matter much, traits and boons can passively make your character stronger in different ways(for example make your trap also deal damage over time, and even stronger against immune targets)
+ Combat - you're basically on the move all the time, combat is dynamic, there is a lot of dodging, blocking and watching out for enemy attacks
+ Endgame - that is just my opinion but endgame is great. Dungeons are challenging(unless you get boosted by that 3k+ player), long, bossfights are fun. There is always something to do due to campaigns which not only give great rewards but boost your character stats via boons. Also progress is slow paced but significant enough to see the difference between those two items, 30-40 item levels or that one tier of your artifact. 

Cons
- Hard to earn currency - getting AD as a fresh player is a pain in the arse. Enough said. 
- AD to Zen converting ratio - Zen is that ""real money"" currency of NW. And while gathering AD to exchange for Vip(1k Zen - 500k AD) is not that big of an issue, trying to get AD to buy Zen while also managing your characters equipment is. Artifact here, refinement stones there, goodbye 120k AD here. 
- Outdated graphics - we're in 2017, yet graphics sometimes feel like a 2012 game. It doesn't look bad, it had actually aged quite well, but I think devs should consider making some upgrades here and there. 
- Character development (sad part) - boons from campaigns are a double edged sword. They greatly increase character capabilities, but good luck getting most of them. Some of them are after huge timegates(ToD, Dread Ring, Underdark) and others are just annoying to start with(Icewind Dale, fuck you).

My final mark would be somewhere around 7 or 8 out of 10. It's definitely a game worth at least trying out.",1486750131,1486750131,True,15,0,0.682559669017791748,0,True,False,False
109600,29816433,76561198018956104,0,12,1309,0,772,1491952174,"If you are old school D&D player? Do not play this game. You choices are very limited. You are stuck with one class, It uses the 4th ed rules, you can not multi-class, your class choice is stuck with one weapon choice, you can not use a  weapon outside your class, same goes for armour, magic types do not use melee weapons so no spellswords here amd things like that. It plays nothing like a neverwinter 1 or 2. I would say that if you do not mind that then you just might enjoy this game. I am not but that is my choice.",1486702680,1486702680,False,0,0,0.462046205997467041,0,True,False,False
109600,29809984,76561198271375310,0,7,22,0,22,1486673460,"This game is actually pretty weak.

I was expecting something good coming from the Perfect World entertainment, but starting with the laggy server to the weak battle engine, everything dissapointed me.",1486673516,1486673516,False,0,0,0.481215685606002808,0,True,False,False
109600,29793753,76561198218474471,508,438,1154,0,653,1518156230,ITS AWESOME BOOOYYYYYYYY,1486609307,1486639059,True,1,0,0.415879011154174805,0,True,False,False
109600,29798053,76561198094418396,0,4,57719,34,22929,1708577491,COOL,1486633097,1486633097,True,0,0,0.472440958023071289,0,True,False,False
109600,29791221,76561198090836403,183,10,22068,0,14624,1605350035,best mmorpg i have every played still yet to find one like it i love the style of combat compared to all other mmorpg all in all great game,1486595545,1486595545,True,2,1,0.532209813594818115,0,True,False,False
109600,29779284,76561197988325525,0,9,5105,0,4651,1486552263,"I made a purchase on Neverwinter on the undersatnding that I would receive a ""First Time Buyer's Pack"" The text on screen says (accessed by presing Alt then ""Y"" [Zen Market]) ""You will receive this item through in-game mail after transfering at least 500 Zen to your account"" (I transfered 1000 Yen through steam wallet) Then when I make an in game ticket the company says it does not apply to Steam transactions. Which they never told me in the first place. Then they tell me if I want a refund go to Steam. To be honset I think this company is deliberately scammig Steam users.",1486552310,1486552310,False,195,12,0.760294914245605469,7,True,False,False
