109600,29771947,76561198051320288,0,6,5265,0,4027,1603524082,"Don't expect the greatest game of all time, but expect the perfect formula for hijinks with your dad friends. Combat is pretty damn fun and in general it is a good looking game. Its not really about the leveling or the world for me, but the journey into maddness.",1486512557,1486512557,True,11,2,0.598673164844512939,0,True,False,False
109600,29753334,76561198114785075,0,4,7685,0,6270,1530945145,"i like it alot
",1486433982,1486433982,True,0,0,0.472440958023071289,0,True,False,False
109600,29751101,76561198147102180,0,2,155,0,155,1486428613,Best Game Ever Got Alot Classes To Choose From,1486422344,1486422344,True,0,0,0,0,True,False,False
109600,29747717,76561198008874274,0,15,28126,0,12280,1626945484,Actually a really fun and good looking Dungeons and Dragons MMO. Unfortuantely its completely Pay to Win which really ruins the end game experience.,1486409623,1486409623,False,116,4,0.730539143085479736,2,True,False,False
109600,29721681,76561198086399997,0,4,49008,0,18055,1693831794,Please Fix the Server of Neverwinter there always a bug in patch and i always downloading the whole i dont know why but i already installed there is a probem in crpytic i dont know how to explain just pls fix your server and game i like the in game but i hate the wat whenever i nid to patch as if im always downloading the whole game wtf!!!!,1486309009,1486309009,False,1,0,0.476327687501907349,0,True,False,False
109600,29704907,76561198249495128,0,3,2123,0,1248,1522189469,really fun game,1486248004,1486248004,True,0,0,0.476190477609634399,0,True,False,False
109600,29620120,76561198136071437,0,6,4694,0,3462,1624240520,Play this with friends and do a player made adventure. Make sure it's a spooky adventure cause that's always fun: 100% recommended with friends.,1485921561,1486243067,True,0,0,0,0,True,False,False
109600,29677152,76561198319749143,24,4,419,0,419,1486154113,good gane but it shouldnt update while u play it creates lag ffs,1486154195,1486154195,True,0,0,0,0,True,False,False
109600,29629666,76561198009620561,0,13,1954,0,1943,1485961806,"Incompentency is the first thing to come to mind when I hear the title Neverwinter. This game has been out since 2013 and there are still an abundance of people that cannot play the game for more than a couple minutes without a fatal crash that requires reverifying the same 2 broken files over and over again. I've fiddled around with this games file's compatibility settings for far too long for it too be worth it. The 30 hours I have were logged back around the release of the game before it hit steam, back then it's only problem was piss poor graphics optimization that caused, you guessed it, big crashes. Bottom line is if you can get this game to work it might be okay, but it barely works for a significant amount of people and the bottome line is a product on steam should work especially if its 4 goddamn years old.",1485962078,1485962078,False,0,0,0.463209480047225952,0,True,False,False
109600,29620543,76561198137059758,0,12,7687,0,7234,1487113294,"strange game... free to run head long into a time sink of diminishing returns

but it does have dragons and pirates...",1485923780,1485923780,True,1,0,0.496091395616531372,0,True,False,False
109600,29619125,76561198032708720,0,2,2177,0,2177,1486128809,issues....,1485916945,1485916945,True,0,0,0.44836956262588501,0,True,False,False
109600,29613039,76561198003676161,0,2,24077,0,14914,1504858440,5/5 stars,1485892540,1485892562,True,0,0,0.492537319660186768,0,True,False,False
109600,29611679,76561198167851395,106,2,3442,0,2831,1602427037,INGAME PATCHING IS A PIECE OF SHIT!!!!!!,1485888160,1485888160,True,0,0,0.492537319660186768,0,True,False,False
109600,29606329,76561198027995968,751,8,820,0,623,1578184917,Its feels bad man.,1485872090,1485872090,False,1,0,0.441942602396011353,1,True,False,False
109600,29599885,76561198043734142,247,16,2420,0,289,1680509301,"What can I say about this game that hasn't been said a thousand times already? I haven't played this game much since launch, so my review is going to be a bit dated. End game content is a boring grind. The Foundry quests are pointless as they took away all of the rewards, which is sad because those are some of the best quests in the game. The early content is fun and engaging and the combat can be very enjoyable and fast paced. With constant nerfs to classes, your favorite class to play may be absolute garbage in a few months. And it sounds like end game gear has become pay to win. This game was really fun when it first launched. Unfotunately now it's just an unoptimized turd in the punch bowl.",1485846066,1485846066,False,0,0,0.459930330514907837,0,True,False,False
109600,29596762,76561198042321244,309,11,3370,0,3370,1481164575,Don't play this.,1485828959,1485828959,False,0,0,0.45835307240486145,0,True,False,False
109600,29590603,76561198065753764,0,99,122,0,122,1489684336,"Horrible RX 480 optimization. ""Old video card driver"" I GOT THE NEWEST FUCKING DRIVER THERE IS BELLEND",1485801951,1485801951,False,11,5,0.446299225091934204,3,True,False,False
109600,29576077,76561198079799281,106,35,7464,0,6634,1569676420,Meh,1485735254,1485735254,True,1,0,0.523809552192687988,0,True,False,False
109600,29570205,76561198136316699,0,14,2954,0,2681,1487548218,"Go play WoW instead
",1485714086,1485714086,False,2,0,0.448708117008209229,0,True,False,False
109600,29546331,76561198199654411,0,18,5762,0,2786,1531379719,"Ive Played it for a while on console, logged in over on PC and im still loving the game, leveling up can be annoying sometimes but whatever, overall a good game.",1485625063,1485625063,True,0,0,0,4,True,False,False
109600,29543584,76561198325201646,153,3,10290,0,1802,1676387176,"Neverwinter is the game that will always be remembered by its impressive game mechanics and interesting story plots. This RPG is awesome to play and it would certainly drive anyone to stay for hours, days even!",1485616798,1485616798,True,0,0,0,0,True,False,False
109600,29540119,76561198028375765,472,9,23862,0,12650,1639336684,"The game is called ""Neverwinter"" and yet theres still winter ? nice clickbait you made me spend almost 200 hours playing clickbait......


I recomend this game really dank and also,be prepared to be ashamed that there actually is winter :(",1485606137,1485606137,True,0,1,0,0,True,False,False
109600,29533381,76561198141081094,0,4,195,0,195,1484365343,this game is shit,1485575818,1485575818,True,0,0,0.476190477609634399,0,True,False,False
109600,29529790,76561198070855591,0,3,1169,0,1169,1485625992,"i dont really have anything bad to say, its just a good game... so im just going to say...



<('-'<)    <('-')>    (>'-')>   Kerby Dunce...     :P",1485557250,1485557250,True,0,0,0,1,True,False,False
109600,29526914,76561198236838416,0,1,97,0,97,1485546239,"I can't believe that the entire Asia region is banned. I'm living in Taiwan and would love to try this game, but can't. There should be a region lockout on Steam if this is the case, don't waste legitimate user's time installing it only to find out they can't play it. Better yet, Arcgames could support these regions!
",1485546603,1485546603,False,25,1,0.564903736114501953,3,True,False,False
109600,29522571,76561198106999800,0,1,185,0,184,1404462914,"I ended up really loving this game when I first played it, it was different from other free multiplayer games I'v played and I would gladly Recommend ppl to at lest give Neverwinter a go before judging it. tho Neverwinter still need same more things in the game. :3",1485531497,1485531497,True,1,0,0.523809552192687988,0,True,False,False
109600,29511351,76561198080725573,83,17,4664,0,2003,1574621262,The best crashing simulator I've ever played.,1485474237,1485474237,True,1,2,0.517054080963134766,0,True,False,False
109600,29507470,76561198094454669,298,18,3542,0,2493,1493012767,Awesome very fun to play solo or in parties only thing i dislike about it is when you buy content through steam and there suppose to get a promo item it doesn't give it to you for example i bought 1000 zen through the steam store as my first item and i did not get the first buyers pack you got to  buy it through the launcher or gift card but overall pretty flucking epic,1485458153,1485458153,True,0,0,0,0,True,False,False
109600,29493352,76561197963958895,991,27,2814,0,1581,1655611298,"I'd been having serious performance issues with this game since I upgraded my video card. No real reason for it aside from piss poor optimization. Believe me, I tried everything. From driver changes, to forum posts, extensive google searching, and ritual sacrifice. So I stopped trying. Jump forward nearly a year later, and I figure I'll give it another shot. Somewhere along the line they updated the game to the point of being playable again! Very exciting for me, since I truly enjoy this game and was bummed out I couldn't play it.

If you are like me and the game ran poorly for no reason, give it another go. It just may be fixed for you too.",1485394238,1485394238,True,3,0,0.539167106151580811,0,True,False,False
109600,29492904,76561198043990703,0,20,32304,0,31026,1613893513,"Awesome game. Shitty Free To play structure. If you like nickles or dimes then dont play this shit. RNG boxes will rape your bank before you get anything worth a fuck. Campaigns that force you to log in for ten days to repeat a garbage ass daily before you get enough of what you need to advance to the next portion, rinse repeat until you can move along. The gap between end game people and people that are just coming back or just starting is rediculously huge. To the tune of someone doing 80 million damage while you do 6 million... I know how to get to that damage level i just dont see myself playing this game as a second job to get there. This game was not like this in the beginning when i started to play and would be great if it went back but someone on the management team at this studio is a greedy fuck and needs to calm down. I want to reccomend this game but there is no maybe option so I rounded down like a jerk.",1485391843,1485391843,False,1,0,0.501863360404968262,0,True,False,False
109600,29492487,76561198126193402,0,12,2960,0,2960,1421993339,nah,1485389586,1485389586,False,0,0,0.498753130435943604,0,True,False,False
109600,29460649,76561198119066826,0,3,913,0,441,1514143380,"As of right now, I have 11 hours logged on Steam.
From patching the game.",1485259166,1485259166,True,1,4,0.502074718475341797,0,True,False,False
109600,29433428,76561198060644439,110,3,64834,0,62058,1702336089,"good f2p/p2p fusion, some things only found ingame p2p players will pay for thoe items",1485128715,1485128715,True,2,2,0.504466652870178223,0,True,False,False
109600,29428042,76561198165004184,0,19,433,0,123,1505088806,I play this game a lot and I realized you should only download if you have a lot of free time. Trust me. I started play yesturday morning and I just got off this afternoon. Either I need help or this is just that good a game.,1485109734,1485109734,True,1,1,0.47826087474822998,0,True,False,False
109600,29427416,76561198123346614,137,66,11893,0,2595,1656820172,good game recommended if you like D&D,1485107881,1485107881,True,1,0,0.467065900564193726,0,True,False,False
109600,29425558,76561198055247657,234,136,5745,0,5745,1425474522,AlwaysSummer is a great game for the price. You'll start off in a training camp somewhere in Texas to learn how to parashute and how to use guns properly. Ahh you also can use toilets first FPS next to Duke Nukem where you can see yourself on the toilet great game overall.,1485102240,1485102240,True,1,1,0.464135020971298218,0,True,False,False
