1243830,159303056,76561198444855763,173,10,1379,0,1379,1701472329,My favorite thing in the world is yelling at my friends as if we were married couples because I know how to organize but they clearly do not. (I love them very much same w my sister),1708923755,1708923755,True,0,1,0,0,True,False,False
1243830,159299561,76561199126301406,0,2,1290,626,1211,1708923575,nice,1708918868,1708918868,True,0,0,0,0,True,False,False
1243830,156164006,76561197960770719,29,2,50,1,50,1708390181,not even an hour in and my girlfriend gave me a migraine,1705492942,1708764233,True,0,0,0,0,True,False,False
1243830,159086603,76561199118140909,0,3,57,0,57,1697745152,"es el per juego wue jigadop
",1708718769,1708718769,True,0,0,0,0,True,False,False
1243830,159029258,76561199527084532,0,1,14,14,14,1708664220,I cant even connect with my friends and play together! I own all you can eat and they have overcooked 2 but even if I chose overcooked 2 we cant play. Its why i bought this game >:(,1708664378,1708664378,True,1,0,0.523809552192687988,0,True,False,False
1243830,158817554,76561199106742486,0,1,105356,3435,105168,1708616448,"love it, clearly having played daily since 2020",1708448436,1708448436,True,1,1,0.50724637508392334,0,True,False,False
1243830,158782827,76561199003262087,14,1,5123,0,5123,1690648529,"it was a great game with great visual , but please fix the server issue, i stop playing just because of the server issue was really sucks and i dont know why.",1708408015,1708408015,True,0,0,0,0,True,False,False
1243830,158061685,76561198996286237,0,2,1739,20,1672,1707971989,"Really good for enhancing communication and cooperative skills with friends! You guys fight each other and never talk to one another again. Problem solved :D

But seriously, love playing this with my friends and family!",1707640331,1707640331,True,0,0,0,0,True,False,False
1243830,157972995,76561198296981421,0,1,204,0,204,1707538094,You can't play with your friends if they have the vanilla Overcooked 1-2,1707541866,1707541866,True,9,1,0.644729077816009521,0,True,False,False
1243830,157962430,76561199089528667,0,3,929,292,606,1708913289,nigfa',1707528105,1707528105,True,0,0,0.403225809335708618,0,True,True,False
1243830,157676674,76561199495184603,0,5,726,230,495,1708467083,"I would totally recommend this game to other players! I didn't play it in solo mode yet-but together with my boyfriend and it was so much fun. We laughed alot during this game and even tho sometimes it was quite frustrating to not get the 3 stars at first (with some practice it was totally makeable)...BUT on the other hand it wasn't boring at all to play the levels over and over again till we made it. It's a game where you can have fun together and in which you really rely on each other. Plus we aren't even finished yet tbh, because you can actually try getting 4 stars after the story- so it won't be easy for us. Anyway- I hope ya all can give this game a shot and have also a lot of funny moments within this game.",1707169394,1707169394,True,3,0,0.565217375755310059,0,True,False,False
1243830,157673678,76561198040198214,237,51,556,0,299,1707691551,I love cooking,1707167474,1707167474,True,0,0,0,0,True,False,False
1243830,157641414,76561199066405952,22,3,161,0,117,1707723195,this game taught me im just a much better chef than my partner,1707130467,1707130467,True,0,1,0,0,True,False,False
1243830,157614959,76561198068485114,0,38,161,27,122,1707877723,"I really enjoy the game itself, but I bought this to play with my friends and it CONSTANTLY is disconnecting us. After every match we all get disconnected, and then have to hope that it will let me create a new session, but that ALSO tends to crash. Not sure how a game that's been out this long is having this bad of an issue, its basically unplayable. I unfortunately spent my 2 hours playing and cannot refund.",1707090450,1707090450,False,2,0,0.537166893482208252,0,True,False,False
1243830,157518968,76561198072801732,95,3,1533,0,1533,1706989763,Buy the original which is great because this game crashes all the time and is unplayable.....,1706989826,1706989826,False,0,0,0,0,True,False,False
1243830,157460854,76561199530189673,0,4,182,0,126,1707262047,great way to ruin friendships....LOOL,1706932411,1706932411,True,0,0,0,0,True,False,False
1243830,157402204,76561198974916911,116,44,359,0,359,1703635041,"my friends are mad but if you cant take the heat get out the kitchen
",1706874130,1706874130,True,0,0,0,1,True,False,False
1243830,157234651,76561198203573544,0,3,414,0,238,1706751846,pain,1706674669,1706674669,True,5,2,0.574677526950836182,0,True,False,False
1243830,157226517,76561198272002109,0,3,298,0,252,1707434666,EVERY THING,1706663593,1706663593,True,0,0,0,0,True,False,False
1243830,157170344,76561199564770012,3,1,310,126,172,1708520150,Can't play with many people at all. Rubbish.,1706597927,1706597927,False,0,0,0.476190477609634399,0,True,False,False
1243830,157153021,76561199216680154,52,4,2211,0,2092,1707100360,Definitely a great game with friends and the fact its cross play all consoles!,1706572461,1706572461,True,0,0,0,0,True,False,False
1243830,157150957,76561199024916815,0,6,2287,171,1983,1708149792,good game,1706569574,1706569574,True,0,0,0,0,True,False,False
1243830,156874486,76561199078369139,0,12,2504,0,2405,1707011738,Best game to play with friends,1706283892,1706283892,True,0,0,0,0,True,False,False
1243830,156684687,76561198976404066,3,1,746,0,719,1706085496,nice,1706083841,1706083841,True,0,0,0,0,True,False,False
1243830,156670718,76561198418507120,45,4,34,0,34,1706063890,Game is too buggy to play. Constant disconnects and a good chance of the game not starting.,1706063985,1706063985,False,6,0,0.584007382392883301,0,True,False,False
1243830,156601273,76561199085223541,76,19,694,0,694,1705984122,feelinh like a woman,1705984341,1705984341,True,4,2,0.498371362686157227,0,True,False,False
1243830,156491339,76561198323932455,0,5,2914,1,2896,1708114563,I like everything,1705863728,1705863728,True,0,0,0,0,True,False,False
1243830,156471729,76561199380088071,0,1,12731,3007,3371,1709075821,"It's such a cute game, but it's definitely a co-op game. You have to be a prodigy to be able to pass the levels on your own. If you guys also don't have friends, like me - you can join the Overcooked discord, where you can always find people to play with",1705848520,1705848520,True,0,0,0,0,True,False,False
1243830,156216256,76561198993186463,0,2,309,0,195,1705723253,"way too early review,, review. i played this with my friend for 3 hours today and we found it pretty fun, we will be playing more tomorrow.",1705559648,1705559648,True,0,0,0,0,True,False,False
1243830,155993476,76561198083963559,0,43,1595,0,1595,1705199975,"I had such high hopes for this game. I love the Overcooked! series, and I played both original games to completion. They were so much fun that when I saw this game on the store page, I bought it immediately. 

Unfortunately, while the game itself keeps the magic of the originals and even adds some really fun new worlds and content, the connectivity issues make this game absolutely unplayable. My friends and I were disconnecting constantly, and one of the worlds just straight up would not work. After experiencing these issues, I browsed the reviews and forums, and this is a very common issue and has been a problem since release. It certainly seems like Team17 has no plans to fix this game and its server issues.

While there is lots of fun to be had, I would recommend just buying the two original games and skipping this one; it's more trouble than it's worth.",1705265906,1705265906,False,2,0,0.54356849193572998,0,True,False,False
1243830,155940071,76561198154005598,0,1,283,0,164,1706153331,Disconnects literally every time we load into a game. We cant even play one game,1705207135,1705207135,False,1,0,0.517241358757019043,0,True,False,False
1243830,155921439,76561198243015930,0,23,390,0,390,1696277425,Me and my husband have never enjoyed screaming at each other this much,1705184508,1705184508,True,0,0,0.495495498180389404,0,True,False,False
1243830,155901696,76561198827112545,2282,470,3008,0,3008,1696244368,"It's simply a compilation of Overcooked 1 and 2 with nothing new added. For instance, while you could throw ingredients in Overcooked 2, you still can't do that in the maps from Overcooked 1 within this compilation. This compilation pack might be more suitable for those who haven't played the previous Overcooked games, but since multiplayer is server-based rather than host-based, there are quite a few issues with bugs and lag, making it challenging to recommend.


단순히 1+2입니다. 하지만 3은 아니네요.",1705166087,1705166087,False,43,1,0.716792702674865723,0,True,False,False
1243830,155900909,76561198336267255,0,16,442,0,412,1705167086,Great,1705165282,1705165282,True,0,0,0,0,True,False,False
1243830,155769699,76561198123776297,0,3,6395,0,4353,1706984004,"I need more levels, and if I could choose, more thinking and less running around like an idiot.",1705001958,1705001958,True,4,1,0.545454561710357666,0,True,False,False
1243830,155723792,76561198375566760,0,5,7093,1,1347,1708993363,GREAT,1704937498,1704937498,True,0,0,0,0,True,False,False
1243830,155713805,76561199093874733,0,4,505,0,237,1705349242,slay,1704923641,1704923641,True,0,0,0,0,True,False,False
1243830,155637574,76561198888640246,0,7,720,0,661,1705206393,"When playing coop online, your character tends to move down and left without touching the control. Devs, you gotta fix this!!!",1704823644,1704823644,False,1,0,0.481081068515777588,0,True,False,False
1243830,155626030,76561198110527752,0,134,453,0,408,1707701974,This game goes hard af frfr,1704811882,1704811882,True,0,1,0,0,True,False,False
1243830,155548595,76561199350529590,86,5,303,0,303,1703792766,"Really recommend this game, has both overcooked 1 and 2 and has a much cleaner ui",1704714439,1704714439,True,0,0,0,0,True,False,False
1243830,155541858,76561199518639274,0,2,2016,0,1763,1707806078,"Why Overcooked gets you mentally handicapped. So currently at midnight (PST) My partner and I were playing the extra trimming named ""Campfire cook-off"". Enjoying ourselves listening to jazz and having a splendid time with each other. Until we had this aggravating level that had us pulling our hair and wanting to throw off customers into the waters and imagine they were filled with alligators or brain-eating amoeba. The level labeled   ""3-4"". So I must advised all yee who play this lovable game to mentally and strategically prepare yourselves for a whirl of a level. I shall not spoil what happens in that level, for it must be a surprise for the few who read this review, and shall suffer as we have.....
Really fun chaotic game with your partners or friends :D",1704704190,1704704190,True,0,0,0,1,True,False,False
1243830,155540845,76561198103374155,0,3,1019,0,1019,1704702335,fun to yell at friends while playing this game,1704702463,1704702463,True,0,0,0,0,True,False,False
1243830,155535702,76561197997503316,0,1,656,0,524,1704702342,fun with friends,1704693550,1704693550,True,0,0,0,0,True,False,False
1243830,155397350,76561198332060232,19,3,1073,0,678,1705685212,great game fun to play with your partner <3,1704555198,1704555198,True,0,0,0,0,True,False,False
1243830,155093120,76561199139656828,28,3,1298,0,248,1707789507,"One of my favourite games to play ever, and probably my favourite co-op game. I play it with my friends online and with my family on our Switch. The controls are so easy to learn and are very beginner friendly with a big focus on accessibility and inclusivity that is so appreciated. The levels offer so much variety and cultural influences and you never feel like you're playing the same level over and over again. I more than recommend this game, get it on every platform (cause its cross platform too), play it with everyone you know!
",1704231496,1704231496,True,1,0,0,0,True,False,False
1243830,155025534,76561198150914025,0,1,241,0,241,1704160593,Im really disappointed as me and my fiance had so much fun with OC2 that i bought us this one after we completed the other games. we were able to complete about 2-3 hours of gameplay just fine but now we are never able to play this game together and it constantly disconnects us from the lobby. we do not live together so the only way for us to play this rn is online plat and it DOESNT WORK!! I love the concept of the game and the other game worked but this one doesnt for online play and im really sad ): PLEASE FIX IT!!!!,1704161020,1704161020,False,0,0,0,0,True,False,False
1243830,154991337,76561198165465860,25,1,1486,0,1106,1706457133,why this game always disconnected to lobby :((,1704129971,1704129971,False,0,0,0,0,True,False,False
1243830,136296272,76561199142391373,62,14,674,0,211,1703897308,the bear (2022),1680899692,1704073810,True,0,0,0,0,True,False,False
1243830,154896107,76561199014030448,0,3,602,0,373,1706350536,OVERCOOOKED BESSTTTT COOKING MARSHAMWALOW,1704029980,1704029980,True,1,2,0.519313335418701172,0,True,False,False
1243830,154889420,76561199128360916,0,11,1557,0,1450,1704031626,cook burn cook server die cry whine stress lose happy,1704023496,1704023496,True,0,0,0,0,True,False,False
1243830,154871328,76561198010738038,460,6,46,0,46,1704002103,The campaign multiplayer does not work playing 4 player online coop. The common reviews and forum posts point to this being a common issue for the last 3 years and never were addressed.,1704002301,1704002301,False,5,0,0.583333313465118408,0,True,False,False
1243830,154807804,76561198163536974,0,10,2546,0,2546,1703724570,"Had a lot of fun playing it, overall a great game with a good variety of levels and playable characters. Couldn't miss a chance to pet Kevin.",1703945286,1703945286,True,1,0,0,0,True,False,False
1243830,154786371,76561198127149271,0,56,2126,0,2123,1706063942,Yes,1703925002,1703925002,True,0,0,0,0,True,False,False
1243830,154685580,76561198079989890,0,4,8215,0,5359,1707197099,"Burn, baby, burn!",1703824115,1703824115,True,0,0,0,0,True,False,False
1243830,154684001,76561199084471075,44,26,196,0,196,1703822255,cool game,1703822264,1703822264,True,0,0,0,0,True,False,False
1243830,154506064,76561198023353840,0,6,1120,265,335,1708393779,"So You'll See Some Review That Don't Recommend This Game Due To Bugs Or Whatever. I Have Been Playing This Great
Game For A Few Hours Now. And I Haven't Experienced Any Issues (Well Besides My Own Skill Issues) I Will Note This
Game Is Way Better Multiplayer. So Make Sure You Have Someone That Will Play This With You. So If You Don't Have Anyone To Play This With. It Might Not Be As Fun For You. But Its Still A Amazing Game.",1703645620,1703645620,True,3,0,0.540983617305755615,0,True,False,False
1243830,154456265,76561199072190229,0,3,859,0,125,1704788235,stress free game!,1703602138,1703602138,True,0,0,0,0,True,False,False
1243830,154397826,76561198072012698,0,2,2734,0,2734,1703536715,cooking,1703536844,1703536844,True,0,0,0,0,True,False,False
1243830,154386245,76561198207769496,88,10,894,180,421,1708695613,this is the best version when we compare for overcooked 1 and 2.,1703526589,1703526589,True,0,0,0,0,True,False,False
1243830,154235933,76561199167967769,47,29,298,0,203,1703556498,woman,1703359393,1703359393,True,0,0,0.476190477609634399,0,True,False,False
1243830,154207712,76561198095439777,0,65,326,0,326,1703334848,Fun even solo. The difficulty ramps up faster than in Overcooked 2.,1703334878,1703334892,True,1,0,0.522058844566345215,0,True,False,False
1243830,154167269,76561198169346824,0,1,540,0,540,1690567055,So much fun! Fast paced cooking game with friends. People should play this game for team building exercises.,1703286305,1703286305,True,0,0,0,0,True,False,False
1243830,154096967,76561198092747682,0,3,44,0,44,1703204084,Kept crashing for our party of 4. Could not get all players to connect at once without an error. Didn't get to play even one single game. All of us requested a refund.,1703206161,1703206161,False,12,0,0.661159515380859375,0,True,False,False
1243830,154048567,76561198329725659,0,1,577,0,214,1707020904,it gives all overcooked 1 and 2 levels,1703147775,1703147775,True,0,0,0.476190477609634399,0,True,False,False
1243830,153960627,76561199582097093,0,1,266,0,222,1703113011,so much fun! u need a friend for this one,1703028763,1703028763,True,0,0,0,0,True,False,False
1243830,153897670,76561198804119626,168,78,285,0,285,1686815810,guess you could play it solo but its fun with friends (:,1702958475,1702958475,True,2,0,0.54356849193572998,0,True,False,False
1243830,153871128,76561199110201989,0,3,1097,0,1097,1698707093,played with friends a few times. we are not friends anymore,1702923211,1702923211,True,41,72,0.803125143051147461,0,True,False,False
1243830,153809265,76561198416966822,175,164,462,0,260,1704614561,yes,1702838726,1702838726,True,0,0,0,0,True,False,False
1243830,153796666,76561198263770867,0,7,1368,0,907,1703489564,"I like co-op feature the best. If only if servers are stable enough to avoid disconnection and lags.
Other than that, this game is so much fun!",1702826544,1702826544,True,0,0,0,0,True,False,False
1243830,153770127,76561199107413689,27,1,736,0,147,1705758953,I need throw option.,1702795843,1702795843,True,0,0,0,0,True,False,False
1243830,153709445,76561198010641079,0,18,5448,0,5448,1687816520,My wife likes playing,1702729185,1702729185,True,4,0,0.571911633014678955,0,True,False,False
1243830,153402931,76561198434377987,0,21,728,30,194,1708312814,"Remove the giant circles and triangles under the player models! Or at least make it an option to disable because it is highly distracting.Also, why are all the chefs unlocked by default? That took 50% of the fun out of the game for me immediately. Please address these.",1702331413,1702331413,False,1,0,0.459016412496566772,0,True,False,False
1243830,153348675,76561199096047257,0,3,867,0,368,1704682692,its COOL,1702265635,1702265635,True,0,0,0,0,True,False,False
1243830,153348111,76561199091001985,0,4,186,0,186,1702264796,good,1702264839,1702264839,True,0,0,0,0,True,False,False
1243830,130958920,76561199088163145,102,7,5281,0,3741,1704179672,chop,1673858576,1702243685,True,0,0,0,0,True,False,False
1243830,153286864,76561198008293191,83,8,153,1,14,1708984141,Ghost artifacts of UI at top when playing on steam deck. Developers know the issue but won't fix it.,1702204673,1702204673,False,14,0,0.64578014612197876,0,True,False,False
1243830,153074201,76561197970361654,0,39,1248,0,917,1705099097,"I own Overcooked 1 with all DLCs and Overcooked 2 with all DLCs. Love both of them. Played 100s of hours.
Bought this for the updated graphics and additional bonus levels during a sale.

The main part of the game seems to work for me, but the game has bugs which get never addressed. For example, some levels are made in a way that the timer only starts rolling once you deliver the first meal. So you can prep all the ingredients and then deliver super quickly later. In this version, the timer just runs always when you try to get 4 stars. That way, you can never reach the 4 star score.

I see in the forum that this has been reported several times and the feedback from the moderator was ""it was handed it to the development team"". But it's not fixed for months or years. What else can you do than give this game a negative review. They had no issue taking my money. This stuff worked correctly in Overcooked 2, but not in this version. So thumbs down!",1701985325,1701985325,False,46,3,0.781789660453796387,0,True,False,False
1243830,153037117,76561198143421192,0,3,385,0,352,1704123930,addicting,1701943640,1701943640,True,0,0,0,0,True,False,False
1243830,140263498,76561199497598199,0,7,54909,4056,182,1709059624,"(*´▽｀)ノノ
If you want to play this game with other players not stay together and use the same computer.You must defray extra cash for accelerator,it is necessary,a software to make sure you and others can keep contact instead of loss the contact,the pay expenses is persistent, if you want this service,you should pay for it,although we already had all the content about the game,but if you want enjoy the function,still need to do something.Then I think it is fantastic as a cook game,the general appearance of a picture is cute,playing method is also interesting,but it is just my thinking,so if you do not like this game,that is all right,I have to say it is horrible we need to solve the problem about the game by ourselves,before the problem be seen,I know nothing about it and think I can use all of the part and enjoy my time after download,I was flurried.So somebody  said the matching mechanism is rubbish,I think so.It is not itself provide it for you,the truth maybe absurd,no kidding.
If you want to see other player's personal information,you need the software called steam++，maybe the requirement can be changed if you are live in different place,if you can't get into steam community,you can have a try.Even if you used the accelerator,you still have the chance loss the contact with others,it seem not have method to solve the problem,as I.If other people and you used different accelerator,your feeling may become bad because at this time control yourself in the game will be more difficult than usual.  However,as long as the game can be played,it is enough for me,the game is wicked.
By the way,when you play with others online,at the very start somebody stay together with you(maybe one，two,or three),as long as they don't secede,you can play with them for long time without somebody midway add,you and others can keep contact and nobody disturb yourselves,until somebody quit,I like this truth,and that's why I stay here,I only like play with one person at the same time.Only with the person I like and wish become together,just stay along with me,at this time,I always be happy.We can enjoy the time belong to ourselves and nobody else,that's really so warm,joyful time,took me so many sweet memories and pleasure.The game took me some fun,I really really like this game.",1687074657,1701940473,True,1,0,0.523809552192687988,0,True,False,False
1243830,152986240,76561197995142326,0,84,1115,0,1115,1643075569,"It is good.
Would like to play more complex recipes instead of caotic kitchen levels though.",1701870194,1701870194,True,0,0,0,0,True,False,False
1243830,152770615,76561198000691864,0,10,1066,0,625,1706322897,"YOU SAY IT'S TOO LATE TO MAKE IT
BUT IS IT TOO LATE TO TRY?
AND IN OUR TIME THAT YOU WASTED
ALL OF OUR BRIDGES BURNED DOWN",1701573069,1701573069,True,1,0,0.482564657926559448,0,True,False,False
1243830,152594732,76561198435451049,0,5,951,0,652,1704760592,The best game to play with friends as long as you're fine with scream laughing as they fall in water for the 100th time,1701366646,1701366646,True,0,0,0,0,True,False,False
1243830,152545098,76561198215763211,24,5,1107,0,879,1705601369,"So I heard you wanna work at a Michelin Star Restaurant? Food, pressure, and shouting? You came to the right place.",1701298566,1701298566,True,0,1,0,0,True,False,False
1243830,152511838,76561198096031453,104,7,436,0,435,1701261781,I need plates!,1701261701,1701261701,True,3,0,0.539622604846954346,0,True,False,False
1243830,152375606,76561198044172235,0,38,4881,0,2063,1706115849,It's still rawwwwww,1701162284,1701162284,True,0,0,0,0,True,False,False
1243830,152063833,76561198015322978,0,2,887,0,539,1701472957,"It's one of most soul crushing experiences you'll ever have while playing solo. If you play with your friends, you'll lose your friends. 4 stars.",1701012847,1701012847,True,0,0,0,0,True,False,False
1243830,152053661,76561198050717936,0,22,1669,0,967,1704376219,Best couple game ever,1701009222,1701009222,True,0,0,0,0,True,False,False
1243830,151952241,76561198141850925,0,30,501,0,408,1702435397,Highly recommended,1700965020,1700965020,True,0,0,0,0,True,False,False
1243830,151919531,76561199006160977,0,4,296,0,296,1700950242,"The game had potential but the amount of error codes you get is not worth the little amount of fun you might have. I did everything the team advised other players to do (since it is not a unique incident and has been happening since 2021). I am so very pissed off. We never were able to play with 3 people, but then even with 2 people, it started disconnecting me and I am not about to get into another fit of annoyance because of it.",1700950847,1700950847,False,0,0,0,0,True,False,False
1243830,151681283,76561197999441911,141,7,1807,0,753,1702850311,Best coop game I have ever tried,1700859573,1700859573,True,0,0,0,0,True,False,False
1243830,151599781,76561199233140134,21,9,464,0,414,1700840651,cool game,1700837627,1700837627,True,0,0,0,0,True,False,False
1243830,126618027,76561198062579359,306,4,9774,0,9278,1697327395,"AAAAAAAA esse jogo é maravilhoso, divertido com os amigos, super coop, podendo jogar online ou mesmo dividindo a tela, sendo possível até 4 pessoas jogando ao mesmo tempo. O jogo é uma loucura, dividindo entre momentos de gritaria e desespero ""CADÊ?! NÃO TEM PRATO! ALGUÉM LAVA O PRATOOOO"" HAIODSFHOS e momentos engraçados. É preciso criar estratégias e organização entre as pessoas para que cada um faça um papel específico para não perder os pedidos. Super divertido. Nessa edição contém os Overcooked 1 o 2 e as DLCs. Recomendo.",1669300255,1700771616,True,2,1,0.53503185510635376,0,True,False,False
1243830,151318855,76561198119909830,0,7,835,0,834,1700745932,Can direct play with different platform is good,1700745875,1700745875,True,0,0,0,0,True,False,False
1243830,151295883,76561198430958028,117,3,547,0,400,1700835125,i get achievements for being a menace to my friends.,1700738486,1700738486,True,0,0,0,0,True,False,False
1243830,146971872,76561198987421282,0,2,41,0,41,1695599412,"DO NOT get the game if you plan on playing online multiplayer, it does not work and will only disconnect you if you try. The game has been out for 3 Years and they still haven't fixed it.",1695599726,1700699813,False,17,0,0.664317429065704346,0,True,False,False
