1243830,141793895,76561198283069149,0,14,2104,0,2004,1694030728,This game is very fun! I think 2 games + bonus content for $40 is a good price.,1689030670,1689030670,True,1,0,0.511002421379089355,0,True,False,False
1243830,141741531,76561198323446079,0,76,333,0,316,1690183212,"One of the highlights of Overcooked! All You Can Eat is its multiplayer experience. You can join forces with friends or family members and work together in chaotic kitchens to prepare and serve delicious meals. Cooperation and communication are key as you face various challenges and race against the clock.

The gameplay is addictive, featuring unique kitchen layouts and crazy cooking scenarios in each level. From chopping ingredients to cooking, assembling dishes, and even washing dishes, it's a whirlwind of culinary madness that demands quick thinking and coordination.

Overcooked! All You Can Eat is the ultimate edition, combining both Overcooked! and Overcooked! 2 along with all the DLC content and additional features. It offers a bountiful buffet of culinary chaos.",1688973966,1688973966,True,0,0,0,0,True,False,False
1243830,141714903,76561198318888686,0,2,567,0,272,1689560682,This game is simply awesome. KEVIN IS BEST BOI AND DESERVES ALL THE PETS.,1688939220,1688939220,True,0,0,0,0,True,False,False
1243830,141627279,76561198371968385,0,1,279,0,154,1689379804,overcooked more like overpriced :( the connection issues are super frustrating with random disconnects or the game trying to connect to twitch or go offline. i loved overcooked 1 and overcooked 2 but all you can eat is disappointing. the actual game was fun but the connection issues make  it unbearable to try and play,1688847318,1688875610,False,2,0,0.523809552192687988,0,True,False,False
1243830,141646847,76561198057353527,0,8,150,0,97,1688934820,"I love Overcooked, but this is a buggy, laggy mess that just ain't it. Not sure if there's any plans to change it, but I'm really glad I grabbed it on sale and didn't pay full price.",1688869874,1688869874,False,6,0,0.576799094676971436,0,True,False,False
1243830,141578351,76561198077168214,0,28,249,0,246,1705732394,Great party game. I believe there's crossplat which is a nice feature.,1688797478,1688797478,True,0,0,0,0,True,False,False
1243830,141565712,76561198152739265,0,1,553,0,553,1688780648,The network issues for multiplayer have not been fixed and its been years please fix,1688780727,1688780727,False,0,0,0,0,True,False,False
1243830,141488784,76561198298266661,0,12,19,0,19,1688678925,"Currently unplayable. Online takes an eternity to create a room and when it finally works, it's lagged.",1688691424,1688691424,False,0,0,0,0,True,False,False
1243830,141487107,76561198105711174,0,10,425,0,253,1689819234,"absolutely wonderful ! I was one millisecond late on putting the patty on the burger and my wife is now filing for divorce, shes taken the kids, it was her last straw, we couldnt get 3 stars on the level after about 10 hours of attempts, my kids and twitch chat were watching and they all booed me, my kids asked W or L in the chat, it was just Ls...  ive lost all followers now, all subscribers, my kids absolutely despise me, my extended family was watching the stream and are now disowning me, the clip was shared around my office and ive been fired effective immediately, i only have enough money for 3 months rent. ive lost my job, my house, my family, my love, and my life, i have nothing left, nothing, except one thing, Overcooked! all i have left is this fantastic game that ruined me",1688689249,1688689249,True,95,134,0.871768176555633545,0,True,False,False
1243830,141423293,76561199223867808,0,2,844,0,192,1689637035,",,",1688619886,1688619886,True,0,0,0.476190477609634399,0,True,False,False
1243830,141420413,76561199157464534,0,2,782,0,181,1691041108,I LIKE FOOD,1688615984,1688615984,True,0,0,0,0,True,False,False
1243830,141419808,76561198845424542,23,1,939,0,939,1685932127,nice,1688615043,1688615043,True,0,0,0,0,True,False,False
1243830,141280282,76561199058242093,51,4,1255,244,767,1708642623,"cooking, cooking, cooking i say",1688464930,1688464930,True,0,0,0,0,True,False,False
1243830,141249981,76561198015463227,0,1,2630,47,2327,1708988780,me and my girlfriend really enjoy this game. My first review in steam that is how we like it!,1688424591,1688424591,True,5,0,0.57433086633682251,0,True,False,False
1243830,141180410,76561198228127148,0,3,48,0,48,1688347427,"Network issues please fix, will be refunding",1688347514,1688347514,False,2,0,0.52173912525177002,0,True,False,False
1243830,141161074,76561198074160817,0,2,148,0,148,1688326021,"Hey guys, so this game is great but it has 2 glaring issues that it seems  team 17 has failed to address in the years since this  has been out, and searching online has yielded zero solutions. First being: if you and your buddy's have not completed the tutorial mission, when completed  in a group session it disconnects you and your friends until you have all completed it solo. secondly, that previous issue is the only one so far if you only play with 2 people. if you try to play with more than 2, online basically isn't even in the question. it saddens me greatly because the game is great, both games standalone are great, but the lack of care for the community really shines through with this title alone. Even their team 17 support page shows evidence that they are dodging the issue so until they actually fix this issue, I can't recommend it if you want to play with more than one other friend.",1688327067,1688327067,False,10,0,0.584893226623535156,0,True,False,False
1243830,141041312,76561198215781259,0,25,1288,0,1152,1698030575,"a nice chill coop party game, great value when its on discount",1688208674,1688208674,True,0,0,0,0,True,False,False
1243830,140986253,76561198360395909,0,4,866,0,230,1706290971,"recomended must have, great game play solo or co op",1688144030,1688144371,True,0,0,0,0,True,False,False
1243830,140871134,76561198134518987,160,29,467,0,467,1670694370,Nice fusion - ha!,1687987880,1687987880,True,0,0,0,0,True,False,False
1243830,140762728,76561198184978717,0,11,4150,86,334,1708917346,gg,1687824354,1687824354,True,0,0,0,0,True,False,False
1243830,140745544,76561199043198096,0,1,1105,0,858,1687907672,very hard game but lots of fun,1687801839,1687801839,True,0,0,0,0,True,False,False
1243830,140648137,76561198045647819,0,31,1119,0,1060,1688518236,i only play with one person but its been fun,1687658145,1687658145,True,1,1,0,0,True,False,False
1243830,140609805,76561197975335937,515,26,18,0,17,1687606200,"I bought this after Overcooked being an infamously good game, I bought to play couch co-op with my partner.

We instantly gave up on playing because the game already ruined first impressions by the fact you cannot simply swap players around. The order/colour of your players is locked into whatever controller order is established in the main menu.

So there is no way to do ""hey lets retry that level but swap places"" or even choose the places initially for preference.

The only way is to quit the game, reboot it, and initialise the other controller first so it becomes P1.

It is unfathomable to me how such a basic quality of life thing, in a game designed to be played with multiple people, is just completely absent.",1687606133,1687606133,False,20,5,0.508387446403503418,0,True,False,False
1243830,140295655,76561198385579095,0,15,1194,0,1114,1693020805,love all these freaking games,1687116237,1687116237,True,3,1,0.537933766841888428,0,True,False,False
1243830,140239497,76561199008158428,0,5,1715,0,1331,1699234402,I would recommend this game to any dynamic duo out there but alas it is not for the feint of heart especially in some of the dlc levels. I'm looking at you Campfire Cook off.,1687035606,1687035606,True,1,0,0,0,True,False,False
1243830,140196928,76561198002591556,0,1,3013,0,1587,1697505284,Fantastic game with lots of replayability,1686978888,1686978888,True,1,0,0,0,True,False,False
1243830,140131944,76561198039580161,301,179,206,0,206,1686458245,"⠁⡼⠋⠀⣆⠀⠀⣰⣿⣫⣾⢿⣿⣿⠍⢠⠠⠀⠀⢀⠰⢾⣺⣻⣿⣿⣿⣷⡀⠀
⣥⠀⠀⠀⠁⠀⠠⢻⢬⠁⣠⣾⠛⠁⠀⠀⠀⠀⠀⠀⠀⠐⠱⠏⡉⠙⣿⣿⡇⠀
⢳⠀⢰⡖⠀⠀⠈⠀⣺⢰⣿⢻⣾⣶⣿⣿⣶⣶⣤⣤⣴⣾⣿⣷⣼⡆⢸⣿⣧⠀
⠈⠀⠜⠈⣀⣔⣦⢨⣿⣿⣿⣾⣿⣿⣿⣿⣿⣿⣿⣿⣿⣿⣿⣿⣿⣅⣼⠛⢹⠀
⠀⠀⠀⠀⢋⡿⡿⣯⣭⡟⣟⣿⣿⣽⣿⣿⣿⣿⣿⣿⣿⣿⣿⣿⣿⣿⣿⠀⡘⠀
⡀⠐⠀⠀⠀⣿⣯⡿⣿⣿⣿⣯⣿⣿⣿⣿⣿⣿⣿⣿⣿⣿⡿⠋⣉⢽⣿⡆⠀⠀
⢳⠀⠄⠀⢀⣿⣿⣿⣿⣿⣿⣿⠙⠉⠉⠉⠛⣻⢛⣿⠛⠃⠀⠐⠛⠻⣿⡇⠀⠀
⣾⠄⠀⠀⢸⣿⣿⡿⠟⠛⠁⢀⠀⢀⡄⣀⣠⣾⣿⣿⡠⣴⣎⣀⣠⣠⣿⡇⠀⠀
⣧⠀⣴⣄⣽⣿⣿⣿⣶⣶⣖⣶⣬⣾⣿⣾⣿⣿⣿⣿⣽⣿⣿⣿⣿⣿⣿⡇⠀⠀
⣿⣶⣈⡯⣿⣿⣿⣿⣿⣿⣿⣿⣿⣿⡿⠋⣹⢧⣿⣿⣿⣄⠙⢿⣿⣿⣿⠇⠀⠀
⠹⣿⣿⣧⢌⢽⣻⢿⣯⣿⣿⣿⣿⠟⣠⡘⠿⠟⠛⠛⠟⠛⣧⡈⠻⣾⣿⠀⠀⠀
⠀⠈⠉⣷⡿⣽⠶⡾⢿⣿⣿⣿⢃⣤⣿⣷⣤⣤⣄⣄⣠⣼⡿⢷⢀⣿⡏⠀⠀⠀
⠀⠀⢀⣿⣷⠌⣈⣏⣝⠽⡿⣷⣾⣏⣀⣉⣉⣀⣀⣀⣠⣠⣄⡸⣾⣿⠃⠀⠀⠀
⠀⣰⡿⣿⣧⡐⠄⠱⣿⣺⣽⢟⣿⣿⢿⣿⣍⠉⢀⣀⣐⣼⣯⡗⠟⡏⠀⠀⠀⠀
⣰⣿⠀⣿⣿⣴⡀⠂⠘⢹⣭⡂⡚⠿⢿⣿⣿⣿⡿⢿⢿⡿⠿⢁⣴⣿⣷⣶⣦⣤",1686875699,1686875699,True,6,4,0.490823328495025635,0,True,False,False
1243830,139910952,76561198049568788,448,28,2270,0,2224,1687403716,"One of the best coop games I've ever played. Fun, challenging, and long-lasting.",1686515417,1686515417,True,0,0,0,0,True,False,False
1243830,139710666,76561198010447907,0,14,284,0,284,1671089907,"I was excited to have everything rolled into one with new chefs, levels and nicer graphics.

But then you guys ruined it by having to be online regardless of single or multiplayer, and that it was all server side which meant unstable connection, extreme lag and disconnects. Thanks for ruining one of my favorite co-op games. At least Overcooked 1 & 2 will still work and be playable in 10 years unlike this game which will inevitably be shut down.",1686179630,1686179630,False,56,0,0.81507718563079834,0,True,False,False
1243830,139665517,76561198071081462,0,1,582,0,282,1686968294,Fantastic game to play with friends!,1686098696,1686098696,True,0,0,0,0,True,False,False
1243830,139660171,76561199020318022,0,23,412,0,28,1707618271,Gordon ramsay asked if you could cook in real life! not a GAME,1686088775,1686088775,True,0,0,0,0,True,False,False
1243830,139581972,76561198097388093,0,8,22807,0,18212,1704471136,"Started playing this game with my girlfriend; 6-month passed, I'm playing with my wife now.",1685955782,1685955782,True,257,26,0.931526601314544678,2,True,False,False
1243830,139538180,76561198052736926,0,1,1602,0,1441,1688900251,the true test of a relationship. play it with your partner <3,1685884894,1685884894,True,0,0,0,0,True,False,False
1243830,139456489,76561199048209093,0,8,689,0,536,1699573392,"This game makes me angry. Not because its a bad game, but because my friend is so stupid I actually can't do anything. She hurts me with how bad she is at this video game, and then she yells at me when I do the smallest thing wrong, while shes starting fires, and letting the whole kitchen burn.",1685762095,1685762095,False,1,5,0.426745772361755371,0,True,False,False
1243830,139204328,76561199408805268,27,25,2858,0,1834,1697720736,"As many people said, cross-platform connection is slow and unstable, but the game is worth buying at a discount price if you don't already have Overcooked 1 and 2.",1685355194,1685722216,True,0,0,0,0,True,False,False
1243830,139401501,76561198140793070,0,7,555,0,226,1694229352,GREAT GAME!! when it decides to work!! in 2 people online it works great. the second you put 3 ppl it disconnects,1685671302,1685671302,False,2,0,0.508928596973419189,0,True,False,False
1243830,139239412,76561198317589501,47,2,351,0,351,1685401372,slay :D,1685401502,1685401502,True,1,0,0.5,0,True,False,False
1243830,139142119,76561199231847873,30,2,1009,0,604,1706262867,"Good game
",1685264043,1685264043,True,0,0,0,0,True,False,False
1243830,138237609,76561198048822633,482,14,1875,0,101,1690398853,"I bought this well aware that there are online connectivity issues, but usually play either locally or through Steam remote play together, as I have done with Overcooked! 1 and 2, so I thought I would be unaffected by the aforementioned issues. However, I got disconnected from the network (error screen, which ended the level prematurely) while playing a level SOLO a few seconds from the end. What a pain even solo play is affected. Due to this, I solemnly cannot recommend this title.

EDIT: after 15 hours
I really wanted to change this review to positive, since there are additional chefs, levels and a graphical overhaul of Overcooked! 1, but having single player require online connectivity really killed the buzz for me, especially since the disconnection issue ruined another level. I finished achievement hunting in Overcooked! 1 and 2 and still feel Overcooked! 2 holds its own.
As others have mentioned - this title may be worth it if someone does not already own the previous titles, and does not mind potential disconnects (even on solo play).",1683986437,1685023943,False,25,1,0.714224815368652344,0,True,False,False
1243830,138933074,76561198046104216,0,5,3261,0,1354,1704071998,You could have at least fixed the stupid bugs from the earlier games like correct meals not being accepted on horde levels because reasons™ before wanting more money from people,1684966356,1684966356,False,0,0,0.476190477609634399,0,True,False,False
1243830,138770771,76561199115681630,72,31,968,0,198,1690287945,🎅🏿,1684770310,1684770310,True,1,1,0.507729887962341309,0,True,False,False
1243830,138617633,76561199088234611,0,9,515,0,191,1689778360,"If you play with steams remote play there are no connection issues
",1684595363,1684595363,True,0,1,0,0,True,False,False
1243830,138440935,76561198406067629,94,10,409,0,175,1701439205,Bought it for the fox,1684339198,1684339221,True,0,1,0,0,True,False,False
1243830,138340531,76561199224414026,0,11,142,0,13,1707566285,"If you search for an ideal game to play with your friends at a game night,
overcooked never disappoints. From chill gameplays, to intense moments,
I am sure everyone will love it! i was playing Overcooked in the friend's house
for a long time and i decided to buy it myself.

Looking forward for upcoming updates.",1684163010,1684163010,True,2,0,0.531422257423400879,0,True,False,False
1243830,138303701,76561198064206435,288,17,558,0,176,1685687528,let him cook,1684087868,1684087868,True,2,3,0.523441791534423828,0,True,False,False
1243830,138266226,76561199092889782,0,1,196,0,192,1684028635,"Fun game but absolutely trash connection.  When I try cross-play with friends the game says connection failed and we all get kicked no matter who hosts. Honestly love the game otherwise, just practically can't play it with friends",1684027887,1684027887,False,6,0,0.55779421329498291,0,True,False,False
1243830,138195414,76561199096396789,174,31,40,0,40,1683915672,"E005-4 The Game Couldn't Be Joined.
The Best Game I've ever played, I can't even play this game with my friends.
Why this shitty bug till now still haven't get fixed -_-",1683915869,1683915951,False,10,0,0.587745308876037598,12,True,False,False
1243830,138123038,76561198976781442,0,1,395,87,267,1708841531,"the game is so unresponsive that its pretty much unplayable. Online I am constantly missing plates and ingredients like I never have before in the previous games. some levels are better with how they run and some I am just glitching across the screen completely unable to complete the round.

I go this on sale for 60% off and I would still say that it is not worth the money.",1683777613,1683778003,False,5,0,0.532795071601867676,0,True,False,False
1243830,137968693,76561198988888000,0,1,1730,0,1148,1704122815,"Improved version of both overcooked 1 and 2. Better graphics! and more content to play !! 
However, this game is not keyboard friendly and favors controller :(",1683493100,1683493100,True,2,0,0.531422257423400879,0,True,False,False
1243830,137721874,76561199383125098,0,7,4123,0,1015,1702420891,"So much chaotic fun. Great test of coordination. Challenging, but not overly frustrating.",1683105915,1683105915,True,2,0,0.539295375347137451,0,True,False,False
1243830,135142698,76561198027979755,400,61,6031,0,346,1704231820,Can't plate on multiple levels due to glitching. And there are levels where the character or food will glitch and get stuck on the counter! Wouldn't recommend the All You Can Eat purchase!,1679463191,1683051492,False,2,0,0.523809552192687988,0,True,False,False
1243830,137555944,76561199192001165,0,1,2515,0,2512,1682867291,the best game ever,1682865984,1682865984,True,0,0,0.465795964002609253,0,True,False,False
1243830,137456532,76561199156574958,0,2,2647,0,2163,1690035437,need more new levels,1682735668,1682735668,True,12,2,0.655468404293060303,0,True,False,False
1243830,137250835,76561198012775288,0,13,722,0,271,1685861235,"Good co-op game, easy to learn",1682380495,1682380495,True,0,0,0,0,True,False,False
1243830,137099922,76561198046635516,0,20,1167,0,1167,1682151580,"Honestly I can't understand the negative reviews on this game, it's filled with content, has probably no bugs(I've not seen one yet and I've been playing this game for many hours now) and it's a lot of fun. I've been playing coop with my friends and we haven't had a single problem even once. Honestly this is a great game to play even if you own overcooked 1 and 2 and i recommend this game to everyone.",1682154315,1682154315,True,3,1,0.504081368446350098,0,True,False,False
1243830,136907153,76561199221688278,0,5,1174,0,472,1682435443,Excellent game ever had,1681827336,1681827336,True,3,0,0.54816138744354248,0,True,False,False
1243830,136900532,76561198063508146,235,38,70,0,70,1681025920,"Overcooked is one of the all-time great couch co-op games (and now online too!)

The graphics are super cute and the gameplay is relatively simple, but don't be fooled; some of the harder levels will definitely get your heart racing. If you're the kind of person who likes to 3 star everything, it's got good replayability. Even if you aren't though, there's plenty of content to go through once. Really the only thing I don't like about the game is the story. I didn't feel it added anything worthwhile, but the game will keep forcing you through it in order to progress. That's minor though, and the gameplay more than makes up for it.

Overall, it's a good one to have in your arsenal, and keys can be found for like $9. It's definitely worth it!",1681816663,1681816663,True,0,0,0,0,True,False,False
1243830,136872858,76561199210361124,0,1,16543,411,10147,1708957349,"Its annoyingly addictive, it frustrates me so much but I cant stop playing! Just 1 more try.....",1681759781,1681759781,True,0,0,0,0,True,False,False
1243830,136662220,76561198343364296,0,14,192,0,192,1681443996,Gordon Ramsay approves of this game.,1681444722,1681444722,True,0,0,0,0,True,False,False
1243830,136616866,76561198328384066,625,18,507,0,327,1697269103,i did all the dishes...,1681376776,1681376776,True,0,0,0,0,True,False,False
1243830,136505440,76561198258600441,58,1,483,0,405,1696902389,"It is a Great game to play with Friends

- I have seen bad reviews on the online connection, non of my friends own the game so I may never experience that myself.

+ I do however share my game via Remote Play together, one friend on his  computer, and another on his phone.  I have had zero issues, works Great, end nobody else had to buy the game, only takes for one to own it and share. 

Remote Play Together is key for me.",1681183165,1681183165,True,0,0,0,0,True,False,False
1243830,136446312,76561198038753547,0,233,695,0,695,1681089975,"It's a cute little collection. The first one is much harder, but the second is a better balanced game. I think it's worth it on sale especially.",1681090009,1681090009,True,0,0,0,0,True,False,False
1243830,136063537,76561198084702365,154,11,194,0,168,1680569066,"Cant play with friends, wtf?",1680567883,1680567883,False,4,0,0.562748432159423828,0,True,False,False
1243830,135976234,76561198451179402,137,100,1492,21,506,1708536412,"This game is great! LITERALLY ALL OF THE GAMES AND DLCS COMBINED
The Server connection is good too, I was getting concerned because of the negative reviews about the connection and ping being bad but the server for me and my friend is working exactly as we thought :D
Right now while I'm making this review, we are kinda close to finishing overcooked 1 remake and we still got like 215 levels left or something to finish the whole game :D This is gonna be a fun ride.",1680458366,1680458366,True,0,0,0,0,True,False,False
1243830,107197985,76561198082222441,206,2,1140,0,278,1707649547,I had a 4-hour session playing Co-op with no issues at all. It's a fun game that is worth the price.,1641188338,1680392789,True,0,0,0,0,True,False,False
1243830,135906524,76561198148348451,0,22,3009,0,314,1705337580,FUN,1680381146,1680381146,True,0,0,0,0,True,False,False
1243830,135852535,76561198093292083,665,27,912,0,730,1681511368,"do not ignore the comments about how bad the lag is, this game fucking sucks now",1680323771,1680323771,False,9,0,0.605000019073486328,0,True,False,False
1243830,135786969,76561198196350829,0,6,1320,0,1320,1680247560,When will you develop the 'Overcooked 3'.,1680247760,1680247760,False,3,0,0.498427689075469971,0,True,False,False
1243830,135735411,76561198393803246,0,8,1068,0,629,1680614602,Game for those who like stress,1680178952,1680178952,False,2,3,0.45616757869720459,0,True,False,False
1243830,135729997,76561199071157195,0,5,1019,0,1019,1672080289,Stay away if you plan to play with a friend online. Waste of money. Team17 could not fix the problem.,1680170669,1680170669,False,5,0,0.54356849193572998,0,True,False,False
1243830,135724214,76561198156726077,110,7,394,0,239,1690668909,"Never actually owned an Overcooked game myself so I wanted to spring for this one with all the content! I saw all the reviews about the servers being bad for online matches, but I'll give my personal experience and say I've been playing online just fine at least with one other person. I haven't had a single disconnection or lag spike at all; matches have gone very smoothly on our ends. Of course this isn't the case for everyone, but I recommend trying it out first.

As for the game, it's Overcooked! It's just as fun and chaotic as all the others. I'll say the movement feels slightly glitchy sometimes and my character may teleport weirdly around obstacles/other people but not bad enough to ruin the gameplay. I've had lots of fun so far! Especially if you don't own one of the previous games, give this a try!",1680159561,1680159561,True,1,0,0.523809552192687988,0,True,False,False
1243830,135722715,76561199076416701,83,2,676,0,51,1705145450,garbage server,1680156462,1680156462,False,1,0,0.476190477609634399,0,True,False,False
1243830,135696043,76561198847148038,36,1,301,0,301,1680117091,"very fun, good lore, arguements may ensue beware",1680117244,1680117244,True,0,0,0,0,True,False,False
1243830,135443919,76561198081641967,0,16,129,0,78,1690083502,"I played both Overcooked games previously with friends, so please ignore the low playtime. This game is a true test of friendship, grit, stress tolerance, the ability to improvise, multitasking, and frontal lobe development. I don't work in Human Resources, but this looks WAY better than any teamwork exercise. The soundtrack is charming, and you have lots of characters to choose from. Try to get your friends to play it with you though (ideally the ones without anger managent issues or the ones more prone to giving up easily), and it will be worth it.",1679800397,1680046747,True,5,0,0.562866032123565674,0,True,False,False
1243830,135639838,76561198114113035,230,9,44,0,44,1680043435,"Completely unplayable with friends. Such an awesome game however we were getting constant disconnects. Really upset. was looking forward to co - op OC 1 as this function was unavailable before. Devs please sort ASAP 

sadly had to refund for now :'( 

can someone let me know when this is fixed <3",1680043934,1680043934,False,15,0,0.639309465885162354,0,True,False,False
1243830,135639829,76561198111207498,287,10,56,0,56,1680043432,"I HATE having to write this. It breaks my heart. I read the reviews and thought ""It cant be that bad right?"" 

Overcooked All You Can Eat is literally unplayable online. Error after error. We flushed our DNS, validated files, ran as admin checked forums etc. Any support was pure deflection - ""check your connection, it must be an issue on your side""
If we got into a game (and that is a big if) we would disconnect after each level forcing us to regroup and roll the dice again only to disconnect and repeat the process. Get Overcooked 2 instead which had no issues connecting with others all.",1680043927,1680043927,False,15,0,0.653342068195343018,0,True,False,False
1243830,135590342,76561198122849308,0,11,47,0,47,1679849016,Game feels awful to play with noticeable latency to the controls. Not a responsive gameplay compared to the previous games. Not sure what the developer did but even my non-gamer wife pointed it out.,1679989012,1679989012,False,7,0,0.49966198205947876,0,True,False,False
1243830,135515433,76561197991933033,0,10,36,0,36,1679875177,"Played with a friend for ~40 minutes.  Attempted 5 different games (varying arcade, overcooked, and overcooked 2).  All 5 had disconnects as varying points.  Don't buy if you plan to play with a friend.  Networking issues that are still unsolved after 2 years?",1679876061,1679876061,False,10,0,0.584267675876617432,0,True,False,False
