1243830,121142542,76561198157590502,140,11,850,0,30,1695600557,Thought it didn't have the husky from Overcooked 2. It was hidden under the beagle skin.,1661306061,1661313819,True,0,0,0,0,True,False,False
1243830,121095409,76561199174832100,0,9,1168,0,300,1701832663,muy lindo juego,1661230452,1661230452,True,0,0,0,0,True,False,False
1243830,120971702,76561198197416669,0,1,748,0,748,1659312211,Everything i wanted ouo now just need people to play with....,1661047579,1661047579,True,0,1,0,0,True,False,False
1243830,120913346,76561198256320209,0,21,1881,0,430,1682142037,Suitable for family & friends entertainment.,1660956306,1660956306,True,0,0,0,0,True,False,False
1243830,120682756,76561197993857920,0,8,2491,0,1167,1679914081,"This is just a mashup of OC1 and OC2 with their DLCs and no bugs fixed at all
They only added Crossplay",1660582668,1660582668,False,13,0,0.641502618789672852,1,True,False,False
1243830,120420329,76561198063630477,0,2,21037,0,14349,1686965992,good.,1660180826,1660180826,True,0,0,0,0,True,False,False
1243830,120395929,76561197992132861,166,17,7515,0,2410,1670009054,"it allows online play for OC 1 and OC 1/2 will be a timeless classic up there with pvz
great fun",1660145041,1660145041,True,0,0,0,0,True,False,False
1243830,120128521,76561198084468288,283,18,1261,0,287,1703783409,"I recently married and my wife is not that in to gaming, but she likes playing with me. I love that this game is ""easy"" enough for my wife to play it, and that we can play together, not agains each other. I wish there were more games like this one, that not only allow us to play using the same computer, but also in a team.",1659734966,1659734966,True,0,0,0,0,True,False,False
1243830,102474665,76561198354947053,0,112,3682,0,965,1665851252,"If you've played Overcooked 1 or 2, this is simply a collection of both with some new levels, which is not worth a full price. If you've never played Overcooked series, this is the perfect one for you. Have fun.",1636447375,1659474120,True,113,0,0.916641771793365479,0,True,False,False
1243830,119725905,76561198143465061,260,4,5993,0,5434,1666986306,The ultimate test of one's marriage/relationship/friendship. You will sink or swim. Highly addictive and who doesn't love petting Kevin.,1659132663,1659132663,True,21,2,0.694357991218566895,0,True,False,False
1243830,119715155,76561199229561196,47,38,426,0,252,1689905483,"Overcooked is stressful and relaxing at the same time. It's great with friends but slightly tedious in single-player. The levels where mice steal your food are also extremely frustrating, but overall, Overcooked! All You Can Eat is a great game,",1659118429,1659118429,True,0,0,0,0,True,False,False
1243830,119629874,76561198205117895,0,5,1638,0,1565,1689448705,The Ever Peckish Rises 2-1 is bugged :(,1658999200,1658999200,False,0,0,0,0,True,False,False
1243830,119568148,76561199099097573,0,10,842,0,828,1695877007,pro game,1658916767,1658916767,True,0,0,0.488782048225402832,0,True,False,False
1243830,119544435,76561198034965058,67,22,3843,0,1530,1701541922,"Whenever anyone reviews Moving Out, they compare it to this game. So, I'm gonna go ahead and compare this to Moving Out! Take that, anyone!

To start out with, you can't smash windows like in Moving Out. You can't throw objects through windows like in Moving Out. You can't heave an office printer like in Moving Out. You can't put furniture you found on the street into houses like in Moving Out. You can't take back furniture from a rat that looks absolutely adorable like in Moving Out. And you can't slap your boss like in Moving Out.

However, you can pet Kevin.


I see why people love this game over Moving Out.",1658882797,1658882797,True,2,0,0.516891896724700928,0,True,False,False
1243830,116374992,76561199268289691,0,3,27649,0,186,1689538811,"I've finished almost all the levels in <Overcooked> here, and had practice a lot in Arcade Lobby. I'd say that any level from  <Overcooked!2> is more meaningful than any map or DLC from <Overcooked!>,
most level designs of the maps in <Overcooked!> are too single,lack of the performance of cooperation and having strong sense of separation. The difficulties of story(1) is not progressive, most of them are around the same level of difficulties and model sets are quite similar.
""Festival seasoning"" is okay, but still can't compare with any map from ,<Overcooked!2>
  I think <Overcooked!2> is the real masterwork, you can see through it's the brainchild from designers, every level of it is meaningful and needs ability of thinking ,judging, and asks for intensive cooperation.I think that's why <Overcooked!2> is still so popular nowadays.(2)'s overall design ideas are the unique thing that no other similar games can compare.
  I personally prefer Kevin levels, I know most new players and some of old players don't like them,but Kevin levels will actually become easier when you have understanding of it, degree of proficiency is not as useful in Kevin levels. It asks more for tactics and comprehension.
<Overcooked: All You Can Eat> only added 2 new maps, ""Birthday Party"" and ""The Ever Peckish Rises"",they are okay ,but ""obstacles"" in some levels seem to too intentional and a bit useless, i don't know if it's because the production team is lack of inspiration. And ""The Ever Peckish Rises"" seems to borrow from <Overcooked!>'s model, I don't know why did they do this.  They seem to be made from different team from ,<Overcooked!2>. I'd say for players who loves <Overcooked!2>, you guys won't like them.
  If the creation team really wants the overcooked series to last long, you guys should't think of how to let people leave <Overcooked!2> , to let them move out and buy a ""new game"", but think of how to keep the players, to make real meaningful maps, or even make new mainlines and add them into the most popular production.
  All in all, <Overcooked; All you can eat> is not worthwhile for buying or playing, because most maps from<1> are..... I'd say, boring ,for players who played <2> already, the new maps they made are not better. The overall optimization they made for the game is super low, it's better not to optimize at all. There are tons of bugs that <2> doesn't have, I'm not going to list here.
  Anyway, if you are a lover of overcooked game, you'll be disappointed.
*
This is my original comment:
omfg it sucks,it's so annoying, so slow, and you can't say it's because of internet or the configure of my laptop , my CPU isn‘t that trashy and my internet is fine,i'd say that it's really horrible,you can barely match up with anyone and most people in All You Can eat play really not that well but they are very aggressive and they insult a lot, if you buy this you can always enjoy your solo time and insult from others, and it always go offline suddenly,very annoying.",1654172997,1658865243,False,3,1,0.521615326404571533,0,True,False,False
1243830,119523802,76561198222978496,11,4,924,0,282,1694812006,"Great game, but need updates",1658859513,1658859513,True,0,0,0.488782048225402832,0,True,False,False
1243830,119366727,76561198091668608,118,2,309,0,309,1658644588,honestly it was quite fun but i feel like its only fun with others great game to play with friends!,1658644781,1658644781,True,0,0,0.488782048225402832,0,True,False,False
1243830,119128004,76561199187923503,0,1,7898,0,5022,1696164300,very good game.,1658312095,1658312095,True,0,0,0.488782048225402832,0,True,False,False
1243830,118988784,76561197961271267,1266,8,2211,0,1035,1669613180,"Incredibly fun if you have stress management, can handle multiple things at once, and are okay being yelled at. Difficult to master each stage, but feels good when you get it going like an oiled machine. One of my favorite games. Will serve off floor again.",1658110342,1658110342,True,1,0,0.507782936096191406,0,True,False,False
1243830,118756287,76561199006066557,32,9,472,73,93,1708233555,"This game is so fun! I love the style, and how goofy it just is. It's a lot of fun to play with friends, and does present a fairly difficult challenge considering everybody has to work together! I love this game!",1657731217,1657731217,True,1,0,0.523809552192687988,0,True,False,False
1243830,118730686,76561199085412589,104,12,1303,0,1028,1680493010,Me gusta cocinar con mi wife! :D,1657688435,1657688435,True,7,1,0.601071417331695557,0,True,False,False
1243830,118559443,76561198272028848,75,22,3401,0,228,1707008449,good game,1657441716,1657441716,True,0,0,0.475121378898620605,0,True,False,False
1243830,107737722,76561198023191961,500,122,85,0,68,1641832534,"Devs abandoned this version due to low sales due to scamming $40 out of customers who owned every single previous level.

Editing my review to let everyone know - there has been zero content added since the dev replied to this review. This has to be a scam right? There's no way they are working on the game still with zero actual updates to the game in 6 months since they last replied to me. Insanity.",1641830541,1657251061,False,15,1,0.538946747779846191,0,True,False,False
1243830,118169638,76561198994359292,36,1,2455,0,716,1672823667,The game is very addicting! It's best played with friends and family since each level is unique.,1656901856,1656901856,True,0,0,0,0,True,False,False
1243830,118167702,76561198018516072,704,111,672,0,401,1660972959,"Absolutely recommended, i love this game",1656898895,1656898895,True,0,0,0,0,True,False,False
1243830,118117663,76561197974181612,0,4,953,0,645,1657169699,I hate this game,1656839731,1656839731,True,2,6,0.495659410953521729,0,True,False,False
1243830,117871199,76561198352309224,0,50,489,0,480,1668291527,"You always wanted to know what it's like to work in a kitchen.
Then the game is just right, a lot of despair and insults are the order of the day here.
Really fun game where you have to coordinate and agree a lot.",1656521329,1656521329,True,1,0,0.5,0,True,False,False
1243830,117848077,76561198220476411,0,2,553,0,369,1656576895,"Absolutely love the game. I've been playing largely using the Assist Mode, this allows you to control 2 cooks, which can help alot when one of you needs chopping done whilst something is cooking and you don't have anyone to play with. It's fun as single player, but where it really opens up is with the multi player, where everything just descends into chaos. 
I would recommend using a controller, I use a Switch Pro which makes it feel alot easier.",1656493611,1656493611,True,5,0,0.566473960876464844,0,True,False,False
1243830,116911242,76561198059203629,0,1,86,0,86,1655107153,"GAME IS A BANGER AND YOU SHOULD ABSOLUTELY GET IT ON CONSOLES!!
AVOID ON PC!!
DO NOT BUY ON STEAM IT IS ONLY 1 PERSON ONLINE AT A TIME!!

On consoles you can have 2 players local and join 2 players online
on PC you can 2 players local OFFLINE
if you join an online game even with 2 local players and multiple controllers, it will bump you and make it so you can only play 1 person per PC online. 

Game is fun AF and would absolutely recommend on CONSOLES, not on PC!!",1655107721,1655107721,False,100,4,0.705745041370391846,0,True,False,False
1243830,116794975,76561198201164125,0,7,7072,0,1915,1707618838,Love Overcooked,1654913342,1654913342,True,1,0,0.523809552192687988,0,True,False,False
1243830,116753112,76561199275728288,5,1,1606,0,1128,1700867957,Soooo fun!! Addictive and great fun to play with friends. Keep those additions coming!!,1654838665,1654838665,True,1,0,0.52173912525177002,0,True,False,False
1243830,116744961,76561198327270864,0,5,1954,0,575,1700438280,good game,1654820355,1654820355,True,1,0,0.508196711540222168,0,True,False,False
1243830,116744614,76561197982697821,0,8,1010,0,419,1659900492,"This game is nothing but fun.  But if you play with a loved one, it will test the strength of your relationship LOL...",1654819647,1654819647,True,12,7,0.651467978954315186,0,True,False,False
1243830,116511522,76561198061158007,143,16,2278,14,1069,1708842067,"All the stress of watching Hell's Kitchen, with all the fun of cute little critters frolicking in the wilderness. 10/10 play this game with friends.",1654414372,1654414372,True,2,0,0.518248140811920166,0,True,False,False
1243830,116392149,76561198309424485,264,9,569,0,484,1654652066,"overcooked is a fun game to play when you've got friends over, throwing not being in the first overcooked makes it significantly harder, but i still think 2 is more fun than the original.",1654199671,1654199671,True,0,0,0,0,True,False,False
1243830,116304235,76561198802651652,0,21,2970,0,2409,1697834853,It's good,1654028770,1654028770,True,0,0,0,0,True,False,False
1243830,115888918,76561198830022630,0,1,592,0,273,1668140151,"I bought this game at half price during Team17's publisher sale. Before this purchase, I owned Overcooked! 2 without any DLCs on the Nintendo Switch. 

This game is great fun with friends, definitely, just like the other Overcooked! games. The assist mode is a very welcome addition, especially because not all of my friends game a lot or are familiar with controller games. It prevents everyone from getting frustrated on a nice afternoon. It also makes playing with younger kids much easier, as the game gets much harder further into the story. I would recommend getting AYCE to anyone who hasn't previously purchased one of the games and want to have some (chaotic) fun with friends. 

I personally don't regret buying AYCE on Steam mostly because OC!2 on my switch can serve as a more portable method of playing as I could bring it to someone else's, and for the price of the original Overcooked! plus a bit more, I get to play the original AND all DLCs (in addition to the OC!2 I already have) on my PC, which I think is better than on a switch. However, if it wasn't on sale, I might be a bit more hesitant when it comes to this purchase. 

I probably will not recommend this game, especially when bought at full price, to someone who already has at least one previous game (OC!1 or OC!2) and on the same platform. Unless you intend to play with someone online and cross-platform often, or just want to collect them all, you could probably just stick to what you have right now, especially if you've bought DLCs before.",1653300096,1653300096,True,1,0,0.523809552192687988,0,True,False,False
1243830,115852340,76561198094703462,0,1,819,0,464,1654264387,INSANE GAME OMG.,1653234566,1653234566,True,0,0,0,0,True,False,False
1243830,111600228,76561199122252182,16,3,9989,0,235,1680866050,"Bought at 50% off. $28AUD
OC 2 on Epic Games - terrible online connection experience for Australia. Painful rubberbanding 80% of games.

AYCE: 
Online experience:
- Connection is *much* better, possibly steam > epic servers, and dedicated Australia server. 
- Light rubberbanding is rare. However, ""powerpoint presentation"" visuals sometimes when due to someone else is hosting. 
- Easier to find skilled (not new player) teammates, as dedicated players buy AYCE and people on epic likely picked up OC2 for free (me).

Pros:
- OC1 levels online multiplayer, and all existent DLC. 
- Being the latest installment, *will get more developer attention than OC2.*
- Remote play any level with non-owners. 

Cons: 
- Scarcer people in online public
Maybe don't bother if you have OC2, as more people have that. Deffo only buy when discount.
- Common ""Powerpoint presentation"" visuals when not hosting. Sometimes light rubberbanding, but never as bad as OC2 was.
- Strange 3d interaction collision when dashing up stairs, items getting placed on ledges, out of reach. Deffo not perfect, may or may not be due to combined lag.

(a little disappointed that 99% chefs are available immediately, and don't have to unlock).",1646489962,1653196535,True,8,0,0.588254034519195557,0,True,False,False
1243830,115749421,76561199206642201,0,3,761,0,482,1704247278,fun,1653075007,1653075007,True,0,0,0,0,True,False,False
1243830,115568059,76561199046130143,0,7,346,0,312,1682106987,UMMMMMMMMMMMMMMMMMMMMMMMMM,1652741886,1652741886,True,0,0,0,0,True,False,False
1243830,115515110,76561198062631481,1069,44,859,0,196,1664148422,worth it,1652642163,1652642163,True,0,0,0,0,True,False,False
1243830,115483157,76561198279556888,0,17,1635,0,382,1673287604,good,1652597487,1652597487,True,0,0,0,0,True,False,False
1243830,115474077,76561199073418790,0,2,2202,0,484,1671662195,The absolute best!,1652581212,1652581212,True,0,0,0.496688753366470337,0,True,False,False
1243830,115397985,76561198060683018,328,18,449,0,334,1656653782,"Absolutely Great, was told at first that this game gets far too difficult to be fun, however I think that it is a perfect party game. With four people its just the right difficulty and i've never gotten frustrated enough to give up on a level. We spend pretty much the entire time yelling at each other and blaming each other for everything, but its one of my favorite party games.",1652462048,1652462048,True,2,0,0.515151500701904297,0,True,False,False
1243830,114976877,76561198802289167,0,3,1079,0,600,1692903345,One of the best co-op games! It`s very fun and unique!,1651740063,1651740063,True,4,0,0.551122188568115234,0,True,False,False
1243830,113606927,76561198164277159,0,1,3134,0,2915,1676756601,"This game is fantastic, my wife have played every iteration of Overcooked MANY times over (220+ hours). It's been an abnormally long time for a new DLC though, I hope they have something coming out soon or a fully new game (my wife and I will pretty much get anything for this game that comes out based on our current experience).

The only reason this specific one got mixed reviews initially was a controller issue and long-time fans that already bought everything else (this is mostly just overcooked 1+2 with upgraded graphics and 2 new DLCs). They did eventually give owners of the original games a notable discount though.",1649548906,1649548906,True,0,0,0,0,True,False,False
1243830,113456540,76561198034123030,1527,15,1590,0,419,1662517139,"Great gameplay, good bundle of content, but the networking is a bit of a pain when you have high latency (playing UK -> Seattle results in some dropped inputs).",1649296770,1649296770,True,0,0,0,0,True,False,False
1243830,112837532,76561198126920791,0,7,1548,0,644,1700379372,LOV EIT,1648273379,1648273379,True,0,0,0,0,True,False,False
1243830,112599957,76561198106914717,0,1,602,0,317,1667376196,"The game feels very buggy compared to the previous version of Overcooked 2, with the movement feeling awkward and delayed.",1647878383,1647878383,False,10,0,0.575047135353088379,0,True,False,False
1243830,103951089,76561198985015956,0,15,2083,0,2006,1703711087,"If you're looking for a review on this game you've come to the wrong place, but if you're looking for an outstanding pie recipe you've come to the right place.

Ingredients:

1. 6 tablespoons unsalted butter
2. 1/2 cup white sugar
3. 1/2 cup brown sugar
4. 1/4 cup water
5. 1/4 teaspoon cinnamon
6. 1 pinch salt
7. 5 apples - peeled, cored and sliced
8. 1 pastry for double-crust pie

Directions:

1. Preheat oven to 425 degrees F (220 degrees C).
2. Combine butter, white sugar, brown sugar, water, cinnamon, and salt in a saucepan over medium heat. Bring to a boil, remove from heat and set aside.
3. Roll out half the pastry to fit a 9-inch pie plate. Place bottom crust in pie plate; pour in apple slices.
4. Roll out top crust into a 10-inch circle. Cut into 8 (1-inch) wide strips with a sharp paring knife or pastry wheel. Weave the pastry strips, one at a time, into a lattice pattern. Fold the ends of the lattice strips under the edge of the bottom crust and crimp to seal.
5. Pour butter-sugar mixture over top of pie, coating the lattice, and allowing any remaining sauce to drizzle through the crust.
6. Bake in the preheated oven for 15 minutes. Reduce heat to 350 degrees F (175 degrees C), and bake until the crust is golden brown, the caramel on the top crust is set, and the apple filling is bubbling, 35 to 40 more minutes. Allow to cool completely before slicing.
",1637876177,1647751691,True,0,0,0,0,True,False,False
1243830,112212483,76561197999588294,0,2,232,0,214,1656788427,"ERROR E015-7

All of my friends got this game and wanted to play together. We have tried everything at this point and have had no resolve. We have flushed the cache, cleared the DNS, rebooted our PC's. Uninstalled and Reinstalled. It just gives us the error every time we pick a save slot and attempt to load the map. Any help would be appreciated at this point as we all spent $40 on it and played more than 2 hours so can't refund our purchase. This is highly infuriating as there has been no fix put out. I do not recommend anyone download this game!",1647306415,1647306415,False,5,0,0.479351609945297241,1,True,False,False
1243830,98743360,76561198049307273,277,4,1517,0,1146,1647061170,"When the game works its fun, but multiplayer refuses to work for more than 2 levels. Really sad that this has been an issue for months and the devs havent said or done anything to remedy it. Heres to hoping they fix the game since I'm past the refund window.
Edit: its now November and still having multiplayer connectivity issues.  Cannot go past level 4-4 as the save files always get corrupted and the game constantly errors out after getting there Also DLC's error out. What a waste of money holy smokes
Edit 2: March of 2022 still no fixes for the game, even though updates have stated the multiplayer problems have been fixed its all lies. Still cant play for more than 2 levels with my friends online. 40 bucks still wasted",1630718200,1647060756,False,14,0,0.650463521480560303,0,True,False,False
1243830,112003147,76561198406269560,41,2,384,0,302,1653273426,This game is listed as FULL controller support on PC. I was only able to play this game twice if I was lucky to launch the game and the controllers were detected. There is no fix for this. DO NOT BUY IF YOU INTEND TO USE CONTROLLERS.,1647041445,1647041445,False,3,0,0.496503502130508423,4,True,False,False
1243830,111911397,76561198861649996,0,4,4265,0,2049,1689189333,"Had a best friend once.. We played this game together.. Now i have to play this game by myself because we had a fight.. 

Would play it again!",1646910633,1646910633,True,0,1,0,0,True,False,False
1243830,111884548,76561198139201152,0,5,4578,62,2484,1708924803,"I can't remember a lot of times I laughed so hard and raged so bad. This game got me so addicted I play it alone when non of my friends are available, or even get to the point to gift it to people so they play with me.",1646863652,1646863652,True,5,3,0.573482990264892578,0,True,False,False
1243830,111882289,76561199104073373,0,19,2199,0,32,1688366508,very very fun but quick question team 17 can you play with friends how own one of the 2 games or do your friends also need all you can eat?,1646860417,1646860417,True,0,0,0,0,True,False,False
1243830,111880760,76561198399250324,0,6,3113,12,1125,1708484626,I love this game! So funny and end up fussing with a  friend or significant other. Def one of the better co-op games in my book!,1646858363,1646858363,True,0,0,0,0,True,False,False
1243830,111875390,76561199092347483,0,2,1366,0,265,1699744928,well designed and fun,1646851339,1646851339,True,0,0,0,0,True,False,False
1243830,111768773,76561198180284799,577,229,53,0,53,1646690474,"scam, its both the first and 2nd game resold into one.",1646690625,1646690625,False,4,0,0.3845367431640625,0,True,False,False
1243830,111717152,76561198830645358,0,2,7313,0,609,1684038508,NEVER GETS OLD,1646617714,1646617714,True,0,0,0.46092379093170166,1,True,False,False
1243830,111624067,76561198210065053,0,15,1050,0,879,1660080648,good game cause it has all the overcooked content in one place,1646510980,1646510980,True,0,0,0.485327333211898804,0,True,False,False
1243830,111405128,76561198216272176,0,1,6156,0,4148,1697954526,"First off, this game is really only for people who don't have the majority of Overcooked! content, as well for people who really don't care about the price, though I do recommend getting the game on sale. 

Overcooked! is an amazing game. It forces you to cooperate with your friends through 200+ transforming and challenging kitchens. The game tries not to become overly repetitive, by constantly offering new and unique mechanics, like new recipes and environmental switches, though the game can get a little repetitive at times.
Though, if you do plan on doing multiplayer, be a little cautious, as while it hasn't screwed up yet for me, it has for many other people.
In all, unless you already have most of the Overcooked! content out there, the game is definitely worth it. To me, its a solid 9.5/10",1646255443,1646255443,True,3,0,0.533615171909332275,0,True,False,False
1243830,111126178,76561198451457372,175,5,513,0,256,1675819533,epic game,1645930006,1645930006,True,0,0,0,0,True,False,False
1243830,110847066,76561198974866329,0,2,877,0,348,1685811454,Great Fun!,1645647992,1645647992,True,0,0,0,0,True,False,False
1243830,110493075,76561198400762546,7,3,2503,0,318,1698918083,Quite fun. 7/10 as a rating.,1645193653,1645193653,True,0,0,0,0,True,False,False
1243830,110418724,76561198048336103,0,93,3405,0,1874,1694387778,"It's all fun and games until everything's on fire and all the chefs are ♥️♥️♥️♥️ing [i]dead[/i].
[spoiler]Then it becomes merely 🆗.[/spoiler]",1645099680,1645099775,True,3,5,0.506473660469055176,0,True,False,False
1243830,110387751,76561199115518010,0,1,9364,39,2292,1708883882,"Me and my friend is having really hard time playing this version! Can anyone Help?
We couldn't play together on Overcooked, but we could play together on Overcooked 2.
All you can eat, she gets SUPER slow for some reason.
Would appreciate any suggestions to help this issue
T.I.A",1645052354,1645052354,False,1,0,0.482859939336776733,0,True,False,False
1243830,110243336,76561198013979960,0,1,3123,0,53,1695325326,one of the best couch co-op games ever,1644864115,1644864115,True,0,0,0.47413790225982666,0,True,False,False
