1243830,97864339,76561199171950326,0,2,1214,0,1152,1629387977,"If you have never owned any Overcooked installment, this is the one to get. It includes all DLC, and it supports cross-platform play, so you get to play with friends who own this version on their Nintendo Switch. However the connection can be pretty wonky sometimes, you might have to spend a fair bit of time trying to set up your party on bad days. Remote play together is also frustrating and confusing to set up at times. Would recommend getting this on discount rather than full price.",1629384647,1629384647,True,1,0,0.5,0,True,False,False
1243830,97845681,76561198983210605,0,1,32161,58,11165,1709046515,"I have reported the problem regarding DEFAULT KEY SETTING ""Left CTRL key not responding"" to Team 17 couple months ago, and guess what, they have no plan to fix it.
I mean there's still tons of issue going on with Overcooked All You Can Eat even til now, and yet Team 17 have NOT release any new updates attempt to fix the issues since March. 
Team 17 can be negative or perfunctory about anything because All You Can Eat is a one-time-purchase product (for now), you will get all the DLCs with the price of the game. So whoever is planning to purchase the game should bear in mind that the game developer is NOT going to help if you have encountered any issue with the game.",1629359832,1629359832,False,15,0,0.659676849842071533,0,True,False,False
1243830,97796513,76561198017439011,0,2,1877,0,170,1691486027,"if you already own both OC1 and 2, and the DLCs, and you are a hardcore fan feeling tempted to buy this, please don't. i voted OC every year for awards because of how much i love this game. however. this ""remastered"" version of the game has really disappointed me and many other fans of OC. there are many bugs and online coop connection is glitchy. The game seems to be created to earn more money from diehard fans of the game, because it looks like no thought and attention to details were even put into it unlike in OC1 and 2. I have to say i am extremely disappointed at the way this game turned out and also, with team17 for also updating us on the wrong platforms. the free updates given to All You Can Eat should not be announced on other versions of OC. I hope that there will be more content added to this game in the future, but till then, this is not even worth buying on a discount.",1629288863,1629288863,False,32,1,0.729694724082946777,0,True,False,False
1243830,97735601,76561198010878481,1150,66,89,0,60,1677507854,"Lots of bugs with input. The 2nd controller doesn't connect. Sometimes first controller doesn't connect. Only 1 new campaign, with 5 levels, but half of those levels were reused cooking cakes. When connecting 2nd controller, mouse selects the controllers chef, and it has a weird UI glitch after. Not sure if local coop was tested properly, because a lot of it is a regression from the past games. I would assume most of the player base plays with local coop. I really hoped for more, but this game didn't have new content. A lot of graphics reworks. Music and graphics is great, don't get me wrong.
I would recommend this for (new players only) others after they fix all the bugs with input. But overall I cannot recommend this, as most of the fans would of played the first two. I feel like they fired their programmer and game designer, and just kept an artist on pay roll.",1629202835,1629202835,False,4,1,0.491604059934616089,1,True,False,False
1243830,97577038,76561197992991423,247,93,3156,0,513,1663814132,"I love Overcooked, but I don't like this little marketing trick. I highly recommend you purchase this over 1 or 2 since it has everything. Kind of rips off those of us who already purchased 1 or 2 or both. I didn't purchase Overcooked 2, so in the end this was worth it but it is still a disgrace. This is the complete game. I only recommend it if you don't own any of the Overcooked games.",1628980497,1628980497,True,1,0,0.506289958953857422,0,True,False,False
1243830,97530970,76561198031216621,0,5,173,0,173,1628922890,"DO NOT BUY THIS!!!!! It does not work on multiplayer it is unplayable,

THANKS FOR KILLING OVERCOOKED FOR ME!!!!!
",1628923144,1628923144,False,4,0,0.512975513935089111,0,True,False,False
1243830,97525076,76561198848715134,229,41,35,0,35,1628913893,"░░░░░░░░░░░█▀▀░░█░░░░░░
░░░░░░▄▀▀▀▀░░░░░█▄▄░░░░
░░░░░░█░█░░░░░░░░░░▐░░░
░░░░░░▐▐░░░░░░░░░▄░▐░░░
░░░░░░█░░░░░░░░▄▀▀░▐░░░
░░░░▄▀░░░░░░░░▐░▄▄▀░░░░
░░▄▀░░░▐░░░░░█▄▀░▐░░░░░
░░█░░░▐░░░░░░░░▄░█░░░░░
░░░█▄░░▀▄░░░░▄▀▐░█░░░░░
░░░█▐▀▀▀░▀▀▀▀░░▐░█░░░░░
░░▐█▐▄░░▀░░░░░░▐░█▄▄░░░
░░░▀▀░░░this game░░░▐▄▄▄▀
░░░░░░░░░░░░░░░░░░░░░░░",1628914039,1628914039,False,10,6,0.473896533250808716,0,True,False,False
1243830,97518391,76561198209233597,247,78,600,0,223,1661029585,yes,1628904135,1628904135,True,0,0,0.498304188251495361,0,True,False,False
1243830,97512895,76561198055098302,0,5,1168,0,258,1641694510,very fun and very smooth. love the additional character colours and looking forward to more free dlc content.,1628895139,1628895139,True,1,0,0.523521125316619873,0,True,False,False
1243830,97508400,76561199150786466,0,4,1974,0,1878,1639622705,"Great game, great fun, even if you have no friends and play by yourself (not that I would know or anything)",1628888578,1628888578,True,1,1,0.523521125316619873,0,True,False,False
1243830,97495263,76561198075986504,233,25,509,0,221,1679740121,The online game is so laggy.,1628872253,1628872253,False,4,0,0.541909515857696533,0,True,False,False
1243830,97470733,76561199173102038,0,3,724,0,219,1705217401,muy fácil,1628842448,1628842448,True,1,0,0.523521125316619873,0,True,False,False
1243830,97464896,76561198032624392,0,2,2978,0,460,1680229973,The perfect local co-op!,1628833555,1628833555,True,2,0,0.545356988906860352,0,True,False,False
1243830,97450601,76561198107804369,583,16,913,0,695,1665788394,"If you want to play Overcooked, buy the (original) individual games. For whatever reason, this remake is not better than the originals. Lag, glitches, and overall sluggish on every action you make. This is across different PC's, and different networks. Definitely more prominent in co-op. I enjoy the game enough to continue to look passed these issues, unfortunately to me. Plus it seems that the newer content will be going straight to this game... Unfortunate, with the performance issues. Will update review if anything improves.",1628812618,1628812618,False,6,0,0.522003591060638428,0,True,False,False
1243830,97376181,76561198053695489,0,2,34,0,34,1628712479,"We tried to play co-op with 4 people and constantly got network errors.
Don't buy if you want to play online.",1628712751,1628712751,False,11,0,0.572692334651947021,0,True,False,False
1243830,97369890,76561197982288437,590,4,12,0,12,1628702283,"Don't buy for couch co-op!
Seems like the game doesn't properly support two controllers. I tried with two Steam Controllers with the default gamepad scheme. The first is picked up right away, but when I connect another, the game just doesn't notice it at all or sometimes even fails the first controller so I have to Alt+F4 on the game. Sad since Overcooked 2 works perfectly with the same controller setup.",1628704735,1628704735,False,3,0,0.503806352615356445,0,True,False,False
1243830,97354987,76561198813455775,0,1,2815,0,206,1707730713,The only things is there no customization of the Chef or to unlock Chef with you achieve certain stages like overcooked 2. Just hope the TEAM 17 will allow customization of Chef or even sell chef cloth and accessories,1628687372,1628687372,True,0,0,0,0,True,False,False
1243830,97354158,76561198001829047,0,18,42716,515,478,1708939036,"Real fun multiplayer game! Got Overcooked2 for free on EpicGames, and decided to buy this one to try out the first game, and other DLC as well. Really hope online multiplayer grows!",1628686321,1628686321,True,0,0,0,0,True,False,False
1243830,97282523,76561197998100833,608,14,613,0,142,1669425838,"I own the originals and I actually read the description, so I knew what I was buying. It was worth the money (on sale) for the improvements. 

And of course the games themselves are amazing.",1628586619,1628586743,True,0,0,0,0,True,False,False
1243830,97277987,76561198025128344,0,29,622,0,214,1697268005,"Needs plate! What do you mean I can't deliver? It's RAW! I call that rare meat. This kitchen is lit, who threw out the fire extinguisher?",1628579206,1628579206,True,0,1,0,0,True,False,False
1243830,89043667,76561198263566669,0,19,932,0,313,1694731190,"My score: (8/10, due to some issues in general that can be hopefully fixed)

FYI: A friend and I found that to help with the controller issue (at least with using Xbox) plug it in before you start the game and when it prompts to either Press A or Spacebar, Press A on the controller to ensure you are playing with a controller.

As someone who has played both the first and second games, I still ended up getting this because of cross-platform multiplayer, access to all the content from both games in one package, and online multiplayer for the first game. Sure it still has bugs and some other weird issues, but besides that this is a good value if you have never played either any of the Overcooked games, never played any of the DLCS, or for any other reasons.

Edit: Now that the game has been out for a while, I feel that there are still some issues with performance. I usually run the game on lower graphics quality, however it uses a lot of graphical power where most of my GPU usage always with this game will be almost 100% (maybe its just me). I feel like this game isn't even that demanding specs-wise but it really takes a lot out of my 1060.",1616654089,1628557571,True,14,1,0.623051822185516357,0,True,False,False
1243830,97263207,76561198012855067,428,54,350,0,19,1704772506,"It's a bit questionable to have a remake of the first two games for a high price at expense of original fans, but for those of us who lack one or the other game, it's great.

Except the game has a lot of time limited content that's now permanently unavailable. Content that was only available when basic fundamentals of the game weren't even working. They've since been fixed, but that content is now permanently lost, and that's a malicious practice. Time limited Fear-of-Missing-Out content is rampant in today's industry among larger titles, and something I REALLY loathe seeing in Indie titles.

Until something is done to allow this content to be unlockable or available through other means, I can't help but leave a negative review. 
I appreciated the first Overcooked game, but the way the franchise has been handled, monetized, and rushed since has me scared for the future of Overcooked.",1628554929,1628554929,False,398,1,0.949989855289459229,0,True,False,False
1243830,97259595,76561198041079751,0,13,1088,0,851,1656823495,"The definitive version of the series - better visuals and the combined games in one spot, and crossplay, which is really nice. The biggest downsides are they didn't add the ability to throw food to the first game (a major missed opportunity imo) and that you cannot play with people who do not have this version of the game (all you can eat) but do have Overcooked 1 or 2. I have not had any of the other issues that people have mentioned.",1628549145,1628549145,True,16,0,0.617286980152130127,0,True,False,False
1243830,97251017,76561198812995473,0,1,2044,0,994,1695338506,"I was wary of the quality due to a lot of the early reviews, but that didn't stop me from picking this baby up! I've played OC,OC2, and almost every DLC before this, and I've been able to share my love of the franchise with my good friends! ""Hell's Kitchen the game"" was how my friend put it after he finished his first time through the game, and still to this day.

Crossplay works well {at least from PC to Nintendo Switch}, most of the connections issues were from my friends' internets which are kinda meh when it comes to online.

Many happy stressful times ensued as we didn't communicate well enough, slid off every single platform, laughed our butts off, and saved the Onion Kingdom from the Peckishness and Unbread.
 I highly recommend this game to family and friends no matter how far the distance, because of this bad time we are still in, you can still have some darn good fun with this amazing indie franchise!",1628537459,1628537459,True,0,0,0,0,True,False,False
1243830,97182951,76561198995729250,0,6,8575,0,2315,1696123283,"This game is about GAMEPLAY GAMEPLAY GAMEPLAY!!!! They added great graphics just because they're good people. Great for family playing, one of the best couch multiplayers i've ever seen",1628441416,1628441416,True,1,0,0.478407323360443115,0,True,False,False
1243830,97080502,76561198122124653,0,3,6245,0,2797,1680494985,fun,1628302469,1628302469,True,1,0,0.480032473802566528,0,True,False,False
1243830,96601640,76561198073668287,0,53,378,0,233,1629491402,Wheelchair cooking and dishwashing simulator :D,1627601353,1628090912,True,0,0,0.445102781057357788,0,True,False,False
1243830,89052585,76561198008811689,0,10,7138,0,196,1704501838,"Not sure what everybody's problem with controllers are.  I have two USB Xbox 360 controllers and they seem to work fine directly connected to my PC.

However, trying this through Steam Link, it doesn't even sort of work at all.  I think I tried to play it maybe 10-15 times through the Steam Link and was only able to get past the first screen once, and the second controller didn't work.  Word to the wise, Steam Link doesn't work with this. 

The game is a prettier version of Overcooked 1+2 plus the DLC, so at the moment there's really nothing else different here.  Supposedly they're going to release more levels for it, but I don't think they have as of this writing.

I can't say I recommend the game, but it definitely improved Overcooked 1 and 2 in my opinion....so maybe?",1616670645,1627923173,False,1,0,0,0,True,False,False
1243830,95941864,76561197998567349,0,1,1345,0,550,1671735831,"It's a pretty good game. The Online server is not that bad, it's just sometimes lagging. We have lots of fun with our friends. Hopefully we can meet more players online.",1626585503,1627437853,True,0,0,0,0,True,False,False
1243830,96275564,76561198261311202,0,3,2223,0,658,1667978687,ultimate couch game bye,1627105351,1627105351,True,0,0,0.420615255832672119,0,True,False,False
1243830,96246857,76561198822396340,0,1,440,0,345,1627790492,"Shitty connection. the ""Sessions"" created are confusing and always erroneous.",1627059299,1627059299,False,2,0,0.485327333211898804,0,True,False,False
1243830,96220896,76561198843742613,235,4,927,0,551,1704515828,"I don't understand most of the negatives reviews. Are you reviewing the game, or are you reviewing the decision to do a remastering? It's not a ""remake"", it's a remaster. It's Overcooked 1 and 2 with better graphics and some other features (like online multiplayer for Overcooked 1 ""campaing"")... And that's it!

If you already have Overcooked 1 and 2, you are going to get almost the same experience with this game. If you don't (l only had Overcooked 1), you are going to enjoy this game. Really.

I mean, check the reviews of Overcooked 1 and 2, and you can see this is a really good game.",1627017704,1627017704,True,5,2,0.440370351076126099,0,True,False,False
1243830,95822799,76561198947234968,0,2,105,0,105,1656446951,"这个游戏的初衷就是为了联机和好有享受友尽或者合作的好游戏， 但是我与我好友联机时甚至没有跨平台都无法连上， 十分可惜，现在只能把它放文件夹里吃灰了, 希望游戏制作组能尽快解决这个问题， 因为不只有我一个人在等带着个问题的修复, 毕竟这个游戏现在只出来不到两个月
I buy this game during the time that is on sale and recommended by my friend. After the series of wasting time for trying to connect with my friend. The basic problem is online connection is terrible that even don't allow same platform contact. I hope the company could fix this problem immediately, not only me and my friends' expectations, most of customers have this sort of problem. Accordingly, I choose to send the negative comment to let the team made this game to see this comment, because the negative comment is more obvious and valuable to espy and peruse. That is so pity which it only can sediment inside the storage right now.",1626410930,1626410930,False,9,0,0.565950334072113037,0,True,False,False
1243830,95732861,76561198372459281,0,2,4212,0,908,1651071109,Spend your time with family by this game,1626279504,1626279504,True,3,1,0.495309591293334961,0,True,False,False
1243830,95690754,76561198006821318,251,42,4024,15,1517,1708716840,"whats not to like about Overcooked. 
It is overpriced if you own 1&2 , but hey, a man has to eat something right?",1626217025,1626217025,True,1,0,0.496688753366470337,0,True,False,False
1243830,95629725,76561198406104087,178,5,1915,0,249,1695169682,"Awesome game to play with friends, doesn't get old easily.",1626130159,1626130159,True,1,0,0,0,True,False,False
1243830,95556949,76561198037356791,140,3,56,15,40,1707946148,my only issue is that if you own this version you cant play with someone that just owns overcooked 1 or 2 they need to own all you can eat,1626030360,1626030360,True,1,0,0,0,True,False,False
1243830,95478963,76561197987482663,362,15,1541,0,911,1630264004,"Very fun and worth it for all the content.

The only downside is the jankyness with this port. Some small multiplayer issues, the game not recognizing keyboard input when you're using a controller... some very minor annoyances.",1625931534,1625931534,True,2,0,0.523809552192687988,0,True,False,False
1243830,95043981,76561199071766422,0,1,1436,0,555,1672595583,super cute game.,1625414108,1625414108,True,1,0,0.469305455684661865,0,True,False,False
1243830,94908536,76561198073084389,0,7,338,0,237,1673711901,"Just an awesome game to play with people !
Especially managers and perfectionists !",1625256943,1625256943,True,1,0,0.469305455684661865,0,True,False,False
1243830,94422080,76561198272440907,0,1,1152,0,420,1697907484,Challenging!,1624721711,1624721711,True,1,0,0.443747133016586304,0,True,False,False
1243830,94152880,76561199172277478,20,4,465,0,326,1628263819,cool,1624347356,1624347356,True,0,0,0.49438205361366272,0,True,False,False
1243830,94084434,76561198105068208,0,5,918,0,467,1628722088,Rubbiiiiiiiiiiiiish serviceeeeeeeeeeeeeeeeeee,1624225488,1624225488,False,5,0,0.493624687194824219,0,True,False,False
1243830,94020270,76561198206664572,0,32,3117,0,1845,1671515792,"The main draw of this game is to play Overcooked 1 & 2 (plus all DLC) content cross-platform, and for that, this works well - I've played online without issue with friends on Steam and Switch. If you already have OC 1 and/or 2 and aren't interested in cross-platform play, this might not be the purchase for you.",1624127689,1624127689,True,22,1,0.708593308925628662,0,True,False,False
1243830,93987552,76561198038254056,0,22,603,0,593,1648377310,"The netcode for this game is just plain bad.
Rubberbanding experience on 4 player online, and constant disconnections occurring here and there.

Even though the visual is greatly improved for the two previous game stages, I would have to call a pass to anyone who wants to give this a try. And get Overcooked 2! at a discounted price instead which somehow have better netcode than this version.",1624078292,1624078292,False,15,0,0.615232527256011963,0,True,False,False
1243830,93930821,76561198045167889,162,9,2401,0,85,1686016120,"Can't play multiplayer in a multiplayer game. Devs have been silent about the problem,",1623982763,1623982763,False,57,0,0.799673497676849365,0,True,False,False
1243830,93793049,76561198041219230,230,33,3152,0,1133,1696082009,"Hotseat it's great, don't know about the online multiplayer.",1623750927,1623750927,True,0,0,0,0,True,False,False
1243830,93698555,76561198061271334,0,201,10,0,10,1616680626,ok,1623611480,1623611480,True,0,0,0,0,True,False,False
1243830,93558104,76561198958503837,0,1,3500,0,637,1688310396,After 2 years this is still my favourite game,1623406850,1623406850,True,0,0,0,0,True,False,False
1243830,89005432,76561198095656554,0,3,453,0,15,1667134832,All gewd now :),1616596193,1623148876,True,0,0,0.635165214538574219,0,True,False,False
1243830,93107004,76561198064919053,0,1,1971,0,339,1676820692,Server very poor,1622728055,1622728055,False,10,0,0.569220781326293945,0,True,True,False
1243830,93078555,76561198209888795,0,1,13589,0,4614,1695432109,Multi-player Diner Dash.  It's fabulous.  Hours of puzzling out how to get 4 stars per level - or for those less hard core it also lets you advance with only a single star.  Awesome game.,1622679620,1622679620,True,2,0,0.509978592395782471,0,True,False,False
1243830,92770820,76561198087134656,0,3,241,0,129,1704835513,cool,1622259990,1622259990,True,0,0,0.470848947763442993,0,True,False,False
1243830,92603054,76561198855033310,27,1,25,0,25,1621996705,"As long-term fans of overcooked, I have already purchased overcooked! and overcooked! 2 as well as all of the DLC. I was under the impression that the new game would have more new content. I was underwhelmed and disappointed when the majority of the content was content I have already played. In addition to this, I was never able to find people in the online public matches. If it was cheaper than 45$, it may have been worth it for the improved graphics and the few new maps. This seems more targeted for new players and I wish that was more clear. This is one of my favourite game series and I hope to have the opportunity to play more content in the future.
:.)
- Overcooked OG player",1621997216,1621997216,False,29,2,0.643106639385223389,1,True,False,False
1243830,92559398,76561198870511495,0,1,464,0,400,1621932281,a lot of fun and the new mode that gives you more time makes it even more enjoyable,1621928539,1621928539,True,4,0,0.507663846015930176,0,True,False,False
1243830,92548499,76561198088280116,1286,11,728,0,63,1664754469,Did co-op over parsec remote play and online co-op at the same time. No lag or issues. Was pretty fun.,1621904420,1621904420,True,2,0,0.477938264608383179,0,True,False,False
1243830,92290711,76561198893760054,0,8,3520,0,1662,1687589273,"My girlfriend and I love playing overcooked together it is a really fun concept of a game. Unfortunately, the multiplayer for this game is god awful. The servers are so laggy it gets to the point where it's unplayable. You will be trying to move fast and your character will just teleport to the left or right often times flying you off the edge of the map. You can be standing still and this will still happen to you. It is very disappointing considering how much we love the game. Please just fix your servers and this game would be amazing",1621488505,1621488505,False,18,1,0.67720562219619751,1,True,False,False
1243830,92290670,76561198851274356,0,1,3467,0,1659,1687589257,"Not worth it. I don't have the first game of overcooked so I thought it'd be worth it anyways, since I have played overcooked 2. The multiplayer is so. fuckin. buggy. Only two players and we bounce around everywhere or freeze. It's so ridiculous how bad it is. It's been like this since the beginning and I figured after a couple months it would be fixed. Nope, idk whats the hold up since this is a pretty big deal to the game to make it playable. If you have the first and second overcooked dont get anyways. If you don't I'd wait for a pretty damn good deal. It isnt worth $2 with its play-ability, currently.",1621488428,1621488428,False,7,0,0.512113749980926514,0,True,False,False
1243830,92228349,76561198066252653,519,4,192,0,186,1628900318,"Idk what some of the reviews are talking about, ive had no problem with controllers",1621374894,1621374894,True,0,0,0.476190477609634399,0,True,False,False
1243830,92190613,76561198136015660,0,6,800,0,797,1694179319,"Great game, but NO. Here is why:

Online multiplayer is still buggy. Kicks me / my friends out for no reason, and sometimes we just cant use it without knowing why. And everyone must own the game.
Then what bout local multiplayer? It supports up to 2 person (both Keyboard  / both Controller, no mixture) even for Remote play. And you cant be like 2 person on switch + 2 on PC. 

While I do enjoy this game, I think this is a serious issue that they have to fix it for PC port.",1621315052,1621315052,False,25,0,0.702377498149871826,0,True,False,False
1243830,92184402,76561198391245182,0,1,5526,0,2901,1678609808,"Crossplay is great and basically only reason to get it
This game is a remastered version yet overcooked 1 levels don't have updated controls
Level selection on arcade is a bit frustrating because its somewhat random 
I haven't been able to add people over steam but doing it on the switch is seamless 
I use a ps4 and a wireless xbox controller with 0 problems

A bit frustrated over this updated game but if you are playing it for the first time with your special one and/or friends you'll love this game. IGN 8/10",1621301966,1621301966,True,0,0,0,0,True,False,False
