1649080,129808971,76561198835735556,0,8,8905,0,8148,1688801289,"It is a very cute game, It is fairly easy to play even for an older person.like me. It did take a while before I figured out what it wanted me to do. But afterwards I had an easier time playing it. It is very easy to maneuver the objects and the whole setup of the game is really easy to find thing. I like this Two Point Campus game much better than your other game, Two Point Hospital, which I can't really play that much, because it is harder to understand and harder to use and maneuver the objects, rooms and I wish Two Point Hospital could be mapped more like Two Point Campus, which is not only easy to play, to find what you need to build, but the whole Two Point Campus game set up is easy to find what you need. Every game is a learning curb, but I find this game a lot more easier for not only for older people but even for very young children to play. I would recommend for people to check it out. It is a relaxing game. An you can take your time in playing it and design your campus the way you would like. I like this game very much and I would recommend it for old and young people alike.",1672524630,1672524630,True,6,0,0.598786115646362305,0,True,False,False
1649080,129700482,76561198002638841,160,9,14096,0,7106,1702837636,"The best game that I played during this year of 2022. I really enjoy all challenges that the game purposes, its very cool, I hope to see more updates and DLC's.",1672415741,1672415741,True,1,0,0,0,True,False,False
1649080,129681557,76561198264203413,0,1,5543,0,5133,1674283344,挺好玩的，期待DLC,1672398315,1672398315,True,1,0,0,0,True,False,False
1649080,129679095,76561198099413132,0,7,8873,0,918,1698087187,If you like two point hospital you will like this.,1672395504,1672395504,True,0,0,0,0,True,False,False
1649080,128025620,76561198236748184,0,23,13916,0,3892,1705122831,"I've played Two Point Hospital (TPH) extensively, with all the DLC's, and I was interested to see if Two Point Campus (TPC) would be just as good, or, as sometimes happens, worse, as a sequel. 

While TPC does share a few similarities with TPH: I recognise some of the staff and student/patient names, the same graphic rendering, similar funny animations, TPC also goes beyond that to be more expansive in the way the game is played. There is a new choice to build your own campus from the ground up, not just placing rooms into pre-built structures. If you don't like the base structure the devs have included, you can demolish it and build a better shape, or size of base structure that you like. 

As you play further through the 12 levels/campuses, you also have the option of including more or less courses that you have unlocked. This means that you can make unique universities each time you decide to replay any particular one. A Sandbox mode has been included too so there is a lot of replayability while you build your best campus ever. 

I've not had issues with stability, no crashing, but the pawns sometimes have a few pathing issues. They do tend to cluster up in doorways, and often walk into each other, getting stuck or pushing each other along. Once or twice, characters have just gotten stuck in a random place and just won't move again. It's not game breaking though, and a quick fix for this is to hit 'Quick Save' and then reload the game. The stuck student will then resume as normal.  

Some of the radio broadcasts are just not funny, unfortunately. The 'student' broadcasts by Felicity Bellbottoms are a bit cringey, just not hitting the right note. But, Sir Nigel, Ricky and Harrison Wolff are on top form, as ever. 

It's definitely worth a go, and you'll have plenty of fun with the constructing as well as the exterior decoration function. The themes are also well thought out and you won't lack for entertainment. One caveat I will mention is not to allow in too many students too early on, as it can get frenetic and cause problems with students not getting enough assistance in their learning, resulting in more fails or drop-outs. 
Despite the two minor pathing drawbacks I have mentioned, I am really enjoying it. :} 
",1670315052,1672376405,True,15,0,0.703436374664306641,0,True,False,False
1649080,129592354,76561199001988700,0,3,4141,0,1695,1696637805,"If you are looking for a fun and casual management sim I highly recommend this game. It's  pretty relaxing to play...although I have gotten myself into quite a few sticky situations by not paying close enough attention to my money or some of the time deadlines on objectives. The different maps are fun, and I really enjoy the design aspect. I have to be really mindful of time when I play because it's very easy to lose myself for hours. It can start to feel a little repetitive after awhile so I'm excited for more DLC content.",1672309223,1672309223,True,0,0,0,0,True,False,False
1649080,125075634,76561198066879221,0,2,3600,0,32,1707541905,"Had issues when I first picked up this game. Per devs troubleshooting, I excluded folders from antivirus, re-installed graphics card, and re-verified game files. Spent almost an hour in game and it no longer crashes and seems to be running smooth. Am now a happy gamer again. :)",1667776278,1672288014,True,0,0,0.481543511152267456,0,True,False,False
1649080,129531919,76561198817960086,0,9,8031,0,7582,1691646467,great,1672247517,1672247517,True,0,0,0.474452555179595947,0,True,False,False
1649080,129499829,76561198068844635,0,20,3630,0,3456,1672407180,"For those who liked TP Hospital, this game is a great follow up. With so many different locations and course options, it has great replay ability.",1672216209,1672216209,True,0,0,0,0,True,False,False
1649080,129479310,76561198054727170,216,14,6158,0,6073,1694147742,"I got this game after Two Point hospital. The hospital game was kind of fun, had reasonable gameplay, and had some good comic elements. This was a chance to step forward in the gameplay but was a missed opportunity. Having played the hospital game a lot, the gameplay in this game was far too similar. As a result, there was not that much in the way of new challenges. And it also meant that boredom set in quickly. Most disappointing was that universities offer fantastic opportunities for comedy, but there is almost none. There can be no larger target for comedy and satire, but they somehow missed this. If you have not played Two Point Hospital, this may be an okay buy for some light gameplay. But no more than that.  Buy one or the other of the games, not both and I would go with Two Point Hospital between the two.",1672193177,1672193177,False,3,0,0.541072845458984375,0,True,False,False
1649080,129467885,76561199195382501,0,1,1353,0,913,1695271935,"The Game is awesome great stuff right here play it, its worth it",1672181946,1672181946,True,0,0,0.474452555179595947,0,True,False,False
1649080,129435040,76561198350207749,0,3,3930,0,231,1702229791,Love it. It's hilarious.,1672154106,1672154106,True,0,0,0.474452555179595947,0,True,False,False
1649080,129402818,76561198094524087,0,1,6074,0,1648,1687543893,If you like to complete challenges and such I would recommend as I find them a good challenge,1672121136,1672121136,True,0,0,0,0,True,False,False
1649080,129316415,76561197980428093,0,5,5635,0,1299,1674521960,"This game makes me time travel. 

Also the way they shake their butts during the parties is on point.

Highly recommend if you have something to do and absolutely don't intend on getting it done.
RIP cleaning my bedroom.",1672040788,1672040788,True,13,4,0.642109394073486328,0,True,False,False
1649080,129302247,76561198206377513,194,11,346,0,266,1680535556,"I have had no issue while playing the game, i find its a good game to pass the time and zone out to while playing, think its worth the price",1672024497,1672024497,True,0,0,0,0,True,False,False
1649080,129282595,76561198027353904,0,1,4858,0,3276,1688501501,It's fun to play. very immersive.,1672004334,1672004334,True,0,0,0,0,True,False,False
1649080,129250381,76561198041858010,64,3,4206,0,311,1707411314,"Very fun, awesome game",1671975596,1671975596,True,0,0,0,0,True,False,False
1649080,129243589,76561199013543608,0,15,2610,48,873,1708378510,"Virtually the same as Two Point Hospital, just with a new context. Still good though.",1671969366,1671969366,True,0,0,0,0,True,False,False
1649080,129125797,76561198133317351,32,3,19288,0,13216,1705281462,Love the game!  Two Point makes awesome content for the game.,1671832531,1671933768,True,3,0,0.523809552192687988,0,True,False,False
1649080,121394212,76561197994190576,0,89,10672,0,1531,1697887842,"Similar to Two Point Hospital with a some good tweeks to the gameplay. Having gone back and played TP Hospital again recently I prefer this game. TP Hospital is inherently funnier, but the announcements in this game are great, and because you can change the courses on each map, it makes each map a bit different and more replayable.",1661723775,1671904088,True,0,0,0,0,True,False,False
1649080,127066188,76561198235968158,0,2,951,0,765,1670996742,"This game saved my life.

I am 69.

My ex-husband and I have a daughter together, and adopted our son together. They are now both 4 years old.

When we were going through our separation, I found myself lost and miserable. I was self destructive. I got so mad one day from everything spiralling out of my control that I punched some concrete in a moment of overwhelming emotion. That caused me to break my 5th metacarpal in my right hand... my working hand... my games hand.. the hand that I held and carried my children to bed with.. The hand I desperately needed to make sure I could continue to provide.

After learning of the severity of my self-inflicted damage, I was borderline suicidal. Keep in mind that just a few months before this, I was the happiest man with no history of depression or anxiety. I have never had fits of rage, or been one to break down and cry, but I was in a low spot that just really buried me from being able to see the light on the other side.

Having nothing better to do, I searched for a game I could play, ONE HANDED while I recovered. I somehow stumbled upon this game and read some of the reviews. I decided that it had to be worth a shot... I must admit, I didn't beat the game, or play nearly as long as some of you. In fact, I may have only played this game a day or two.. With that being said, after doing so, I had a new found joy and hope for life. I was able to put behind me the pain and suffering that had been cast over me. I was able to experience other peoples joy and happiness. I was able to see the fruits of my ""labor"". I relaxed for 5 ♥♥♥♥♥♥♥ minutes to this music long enough to realize that I was going to be okay.

After coming to that realization, I turned the game off, and I went back to work. It hurt my hand like hell but I was motivated. I stopped feeling so damn sorry for myself, and I became the father I needed to be in that moment, not the weak boy I was behaving as.

Today, I am close friend with my kids mother. We don't fight, or argue, or say hurtful things to each other. We are parents, and friends.

I now have 3 kids. My third child is, wait for it, ALSO 4 YEARS OLD. The man I am with was going through a very similar situation at the time of my own separation, and we just stumbled in to each others life unexpectedly. We have been in a relationship for a year now, and are very happy together.

Moral of the story, you never know what life holds in store for you, and if I would have given up when all the odds were stacked against me, I wouldn't be where I am today. This silly little game helped me realize that.

Thank you.",1669482759,1671790118,True,0,0,0,0,True,False,False
1649080,129059667,76561197970801184,0,55,63,0,63,1670205625,A lackluster Sim game which took the two point hospital model and for some reason thought it would be better with even less content,1671758238,1671758238,False,8,0,0.523006916046142578,0,True,False,False
1649080,123239800,76561198030992523,0,3,10499,0,5747,1693946778,I really wanted to enjoy this game as I am a massive fan of 2 point hospital. And overall I have. I have updated my review as many bugs do seem to have been stamped on - and nothing is perfect i suppose. i am now inclined to play the dlc in due course as i have had value from the main game.,1664733674,1671718177,True,0,0,0.534924507141113281,0,True,False,False
1649080,128968222,76561198017401112,0,31,4176,0,2709,1679011461,Not a bad relaxing game to play,1671632219,1671632219,True,0,0,0,0,True,False,False
1649080,128957560,76561199099350720,0,42,234,0,64,1678847097,"Seems like an ok game, it is just very anti climatic",1671614946,1671614946,False,1,0,0.395920813083648682,0,True,False,False
1649080,128939034,76561197967122245,866,6,1766,0,1766,1665568996,"Fun, taking the recipe of two point hospital and applying onto this game.",1671582992,1671582992,True,1,0,0.523809552192687988,0,True,False,False
1649080,128928386,76561198827499507,0,3,424,0,424,1671514125,If you like simulation games this is a good game to play.,1671566602,1671566602,True,0,0,0,0,True,False,False
1649080,128904340,76561198408783044,0,2,2726,0,982,1693793603,I love playing this game! I can't wait to make this a regular game series on my YouTube channel 'HollywoodStyle Gaming' this year.,1671535168,1671535168,True,0,0,0.424778759479522705,0,True,False,False
1649080,128880053,76561199040245273,0,3,2161,0,2133,1671815739,"This is a great sim builder game for those who like low pressure, less customization, less of a ""learning curve"" type games. There aren't a bunch of decisions you have to make or details you need to keep track of compared to some other sims, but you still get the feeling you are in control of the gameplay. You can definitely lose track of time in this and just play for years and years after you have completed the achievements.",1671493982,1671493982,True,0,0,0,0,True,False,False
1649080,120714591,76561197977431584,0,23,825,0,372,1671464407,"Edit: After 7 more hours of trying, I can really say this game just isn't fun.  It's boring and I've got no more ability to continue giving it additional chances.  Sadly, I am uninstalling at this point.

Original: After 6 hours of play and getting three stars on the first two campuses, I guess my overall feel is a little disappointment.  I didn't feel any of this in Two Point Hospital, but it may not be a fair comparison to make since I went into TPH completely new and now with TPC I have some of the concepts already down pat and there aren't that many new ones.

So, it feels a bit tedious already.  The main issue is that the campus runs a year at a time, just like a school would.  During that year you might have some things you can do/handle/upgrade but many times you end up just fast forwarding through the entire year because the objective you need to accomplish isn't possible that year.  That's a big design flaw in my opinion.

TPH had a lot more charm as well.  TPC feels like it wants to be different and is hanging out with the emo kids and playing guitar.  I actually love the music, but it's not charming.  The art style didn't get super updated, but it's not really charming anymore either.  Things got less rounded but without any added realism so it just feels a little bit identity-less.  It's still the identity of TPH, except now it doesn't really fit well within itself.

I will continue to play and will change the review if necessary, but if you've never played either title I would completely recommend you play Hospital instead of Campus.",1660632928,1671464460,False,2,0,0.481590569019317627,0,True,False,False
1649080,128855862,76561198076080449,0,2,640,0,226,1704567666,it cool,1671462197,1671462197,True,0,0,0,0,True,False,False
1649080,128850854,76561198279299013,0,2,9679,0,9588,1689742174,I just love this game. it has so many options and its very detailed oriented.,1671455479,1671455479,True,0,0,0,0,True,False,False
1649080,128619848,76561198160913084,70,9,4313,0,3179,1671463465,Very good fun. Possibly more fun than TPHospital.,1671131100,1671131100,True,0,0,0.476190477609634399,0,True,False,False
1649080,128611803,76561198972170592,0,1,8391,0,5915,1698680448,"Fun, different from Two Point Hospital, but still the same premise.  Learning how to run a campus is still kind of a mystery, so not quite as ""simple"" as Two Point Hospital.  But the customizations and building mechanics are much better in the Campus game - very much a huge jump ahead!",1671121316,1671121316,True,1,0,0.503311276435852051,0,True,False,False
1649080,128576847,76561198072421129,185,14,5916,0,483,1705638071,if you like two point hospital you will love this games.,1671066266,1671066266,True,0,0,0,0,True,False,False
1649080,128559460,76561198996335320,0,2,9100,1847,5951,1708630882,"I hate school, but this game turns school into fun! Or a nightmare, depending what you do! Tbh, I love this game, would recommend!",1671042074,1671042074,True,1,0,0,0,True,False,False
1649080,128526296,76561198116427615,0,10,458,0,182,1700346519,"Such a fun game, I've only played this a bit here on Steam but have almost 20 stars on Xbox. Absolutely addicting during the school years , then once you hit summer break and do all your upgrades so easy to just start another year. Hard to break that cycle sometimes when you have nothing else to do on ur days off lol",1670994055,1670994055,True,0,0,0,0,True,False,False
1649080,128512133,76561198006302406,0,1,4409,0,2478,1694807306,Fantastic game.  Has some issues compared to 2 Point Hospital but has been imploring over time.,1670972680,1670972680,True,0,0,0,0,True,False,False
1649080,128497063,76561198023012285,0,19,1354,0,1354,1670951726,"Two Point Hospital is one of my all-time fave's.  I still have it loaded and ready to go.  Two Point Campus is ""ok"" but not on a par with Hospital. The challenge is not as great and the game play is not as amusing. Basically, once you get your rooms built, you just sit there watching the game run. Choosing your staff isn't as critical and I haven't hit a point where things are on the verge of meltdown, as can happen in Hospital. There are student demands that you might have to meet occasionally, but refusing them doesn't seem to have much effect. There is a research facility, but, again, it doesn't play a significant role. I'm 23 hours in and on my 4th campus, so that's probably a decent sample. I certainly won't be buying the expansions.",1670952833,1670952833,False,1,0,0.508301436901092529,0,True,False,False
1649080,128495148,76561197974883007,876,39,321,0,282,1673651718,"I just cant get into this unlike 2PH,  and the whole having to plan events for students... its pointless busy work and unneeded complication to the game.  It just does now keep me interested an i end up closing the game withing like 10 minutes.",1670950724,1670950724,False,3,0,0.505500853061676025,0,True,False,False
1649080,128455574,76561198090056199,0,3,209,0,186,1672167339,A+,1670890975,1670890975,True,0,0,0,0,True,False,False
1649080,128434908,76561198230941652,0,3,3752,0,261,1703816437,So far really enjoyable and lots to do. Performance does drop a bit when your campus gets huge but i suppose that's to be expected. Overall happy with my purchase.,1670864144,1670864144,True,0,0,0,0,True,False,False
1649080,128394738,76561198997685522,0,1,2145,0,1154,1691591377,better version of tph. way more relaxing. gameplay is super funny,1670800377,1670800377,True,0,0,0,0,True,False,False
1649080,128351926,76561198077598347,0,6,1580,0,1150,1693321622,"Right. First two levels finished to 3 Stars and I am ready to write a review. I've read a lot of gubbins about this game, that it's repetitive and derivative and if you think this? You don't get the point. Sim management is grounded in mundanity, because without it you simply do not learn. I absolutely ADORE what TBC has added to the IP: the ability to auto schedule events, the range of decorations, and most importantly the DIVERSITY of the whole thing. There are some huge game-changers though for me, and external landscaping might yet keep me occupied for DAYS in sandbox mode. I am REALLY looking forward to doing this sim justice over Xmas 2022, thank you for making an old gamer very happy <3",1670752758,1670752758,True,0,0,0.451977401971817017,0,True,False,False
1649080,128288234,76561199223835205,0,19,4315,0,2195,1677455018,,1670675352,1670675352,True,0,0,0,0,True,False,False
1649080,128267433,76561198001702400,0,17,11250,0,6406,1707530024,"If you like Two Point Hospital, you'll LOVE Two Point Campus!",1670646447,1670646447,True,0,1,0,0,True,False,False
1649080,128257687,76561199005485446,0,1,3821,0,2104,1691703746,So good obsessed with this and Two Point Hospital! Would in fact recommend to a friend :),1670632724,1670632724,True,0,0,0,0,True,False,False
1649080,128254247,76561198125349986,0,21,723,0,510,1670723376,Great game. love it,1670628000,1670628000,True,0,0,0,0,True,False,False
1649080,128243084,76561198020195391,380,40,1081,0,837,1670839890,I'm meant to be doing work for my real life Masters Degree. What am I doing instead? Tryharding to 100% Two Point Campus. This IS extra credit right...RIGHT?,1670614060,1670614060,True,0,0,0,0,True,False,False
1649080,128180519,76561198031231040,0,1,5359,0,4154,1680334137,It's brill.,1670527963,1670527963,True,0,0,0,0,True,False,False
1649080,128160397,76561198976645422,0,54,253,0,220,1670512393,addicting,1670505394,1670505394,True,0,0,0.47826087474822998,0,True,False,False
1649080,128103178,76561198330355329,0,5,5150,0,3322,1687331844,"Every scenario is just almost the same, except the courses allowed. This game cannot entertain me",1670421395,1670421395,False,3,0,0.516129076480865479,0,True,False,False
1649080,128102916,76561199292730233,0,1,4682,0,2659,1704137129,"Pretty cool, i was also a fan of TPH so this was really nice",1670421056,1670421056,True,0,0,0,0,True,False,False
1649080,128097835,76561198050603321,0,2,9467,0,5424,1693407005,"Fun and well balanced management game, had me hooked from the start. An improvement on the previous game; two point hospital",1670414052,1670414052,True,0,0,0,0,True,False,False
1649080,128069735,76561199023513647,0,1,9623,0,6430,1671827122,It's great,1670367975,1670367975,True,0,0,0,0,True,False,False
1649080,128069312,76561198220612355,0,1,1137,0,1069,1701634228,Great Fun,1670367364,1670367364,True,0,0,0,0,True,False,False
1649080,128068156,76561199191354676,0,4,7320,0,2963,1679614451,"5 Stars! Such a great game. If you enjoy this style games, this is the best around.",1670365586,1670365586,True,1,0,0.523809552192687988,0,True,False,False
1649080,128060248,76561198030337888,159,6,2855,0,1220,1678984194,Nice game if you like Two Point Hospital,1670355728,1670355728,True,0,0,0,0,True,False,False
1649080,128048458,76561198882577773,66,4,7048,0,6527,1692153549,This is one of my favorite games. It is great if you like management style games.,1670342940,1670342940,True,0,0,0,0,True,False,False
1649080,124096461,76561198129095867,0,20,4444,0,4444,1666216556,"Pretty fun, getting 3 stars on the final campus seemed pretty anti-climatic. I don't think I ever finished TPH so this may be the standard.


Nice try Sega, I ain't paying $10 for what looks like one campus? I'll be waiting for a 50% off or better sale, thank you.",1666233129,1670276306,True,0,0,0,0,True,False,False
1649080,127898215,76561198242811188,0,5,5630,0,3635,1702021853,"Big improvements overall from 2PH, in fact, going back to the game's hospital origins feels distinctly lacklustre in comparison. I'm sure developers didn't meant to eradicate the playability of their OG with a spin-off but this has undoubtedly happened.

Outside of the regular challenges, once you figure out a few tips and tricks this game is easy enough to play with the humour and gimmick unable to see it through the occasional urge to play for an hour or so.

Overall fun, an improvement on the past iterations (to a fault?) and one to buy when a) on sale and/or b) for those who like organisational/strategy sim games.",1670141442,1670141442,True,3,0,0.550561785697937012,0,True,False,False
1649080,127884141,76561198030725215,0,9,678,0,678,1669589645,Seriously! You come out with a DLC like 3mo after release! This game seemed unpolished when released. I tried to return it but already played 2hrs. Not worth the purchase price base game.,1670122606,1670122606,False,3,3,0.501657426357269287,0,True,False,False
1649080,127876418,76561198008919420,0,10,1157,0,1157,1668914132,"3 Words for next game idea. TWO POINT HOTEL!!!!
Please everyone spread this so developers will notice!",1670112319,1670112319,True,581,17,0.937829077243804932,0,True,False,False
1649080,127855072,76561198118162006,0,4,18936,0,10503,1703720320,"After putting 175 hours into this game and getting all but two achievements, I will have to say- this is a great game. Its a love letter to the old roller coaster tycoon games and they really shine by fixing some of the glaring issues that were in the original  two point hospital game. The game has easy and challenging points. I loved looking up guides to see what other people did to achieve the goals, and then would go and do it my own way seeing if I could do it better or faster.
I would totally recommend this game and look forward to seeing the DLCs that come out for it as well.",1670089698,1670089698,True,0,0,0,0,True,False,False
1649080,127694508,76561197998409591,0,2,329,0,329,1669856449,"What a disappointment of a game. It's basically a barrage of pointless tasks to fill your campus of stuff to get the bonus associated to them. No strategy elements like in Two Point hospital which I played extensively. 

The UI is needlessly complicated and is a downgrade from TPH. 

Still loved the soundtrack and radio.",1669901824,1669901824,False,13,1,0.556877970695495605,0,True,False,False
