1649080,143444866,76561198398417785,0,6,8532,0,4942,1694849740,"Love the game just like I love Two Point Hospital!
Comes with greater tools option so we can just Copy Paste room that has been created.
A lot improvement in the visual as well.",1691229882,1691229882,True,0,0,0,0,True,False,False
1649080,143436760,76561198051704719,0,4,5935,162,5012,1708873072,Great！,1691217517,1691217517,True,0,0,0,0,True,False,False
1649080,143418714,76561198042818405,0,8,5277,64,4290,1708211008,So much fun...need more DLC's please...,1691190089,1691190089,True,0,0,0,0,True,False,False
1649080,143414463,76561199220566569,0,2,6051,0,6014,1691186737,"After being a fan of Two Point Hospital, I was initially 'meh' about Two Point Campus. But once I got into it and opened more universities, I really enjoy it",1691184573,1691184573,True,0,0,0,0,True,False,False
1649080,143414182,76561197998266429,0,134,44,0,44,1691181205,"Something just felt a bit off when I was starting with it. Hard to put a finger on exactly though I suppose it's everything like Two Point Hospital but with LESS freedom, LESS impact on the outcome of every scenario, the humour/setting just works a bit LESS. 

Didn't stick with it for long in truth. The layout is slightly more cluttered. The radio isn't as good, the tannoy announcements etc.... just.... nah. Such a shame.",1691184223,1691184223,False,3,0,0.531345129013061523,0,True,False,False
1649080,143392137,76561197998651405,0,5,13896,0,730,1700338675,"It's slow-going at first, but gets much more interesting as clubs and social spaces open up.",1691159851,1691159851,True,0,0,0,0,True,False,False
1649080,143371705,76561199251641056,0,2,1251,0,345,1691235529,fun,1691130929,1691130929,True,0,0,0,0,True,False,False
1649080,143367726,76561199057794100,0,8,478,0,404,1696119501,no good,1691123871,1691123871,False,1,0,0,0,True,False,False
1649080,143363187,76561198076711175,0,1,1889,0,1045,1691406930,"It's a fun game, I miss the fun music and announcements of TPH but I am still enjoying this game a lot. I love throwing the parties for the kids!",1691116323,1691116323,True,0,0,0,0,True,False,False
1649080,143359575,76561198000829027,0,30,3192,0,709,1694208062,It's like two point hospital except it replaced the bad parts with good parts and kept the good parts that were already there,1691110722,1691110722,True,0,0,0,0,True,False,False
1649080,143351628,76561198261008729,0,8,2389,0,616,1692853278,this is like if sims university and that zoo planet game had a baby. i like,1691099808,1691099808,True,0,0,0,0,True,False,False
1649080,143343742,76561198003813613,0,1,61101,0,5740,1695659630,Fun and entertaining approach to a sim management game. In the same fashion as Two Point Hospital but not as gruesome. Lost many hours to it trying to train and research the right courses.,1691090832,1691090832,True,0,0,0,0,True,False,False
1649080,143318728,76561198123658559,0,1,6098,0,5168,1699804013,Yes,1691066213,1691066213,True,0,0,0,0,True,False,False
1649080,143309471,76561198971275833,290,16,704,0,620,1701582761,WHAT TIMME IS IT,1691052662,1691052662,True,0,0,0,0,True,False,False
1649080,143296126,76561198134110487,0,9,9842,0,6205,1706068803,"I have a grad degree in school administration.  It is completely useless for playing this game. 

5/5",1691028345,1691028345,True,8,15,0.628378391265869141,0,True,False,False
1649080,143294390,76561198214945264,0,111,10,0,10,1691025299,"It would not let me play Sandbox until I played some of the main story mode. I will decided what I  do, thanks. I decided to refund.",1691025395,1691025395,False,1,0,0.320342272520065308,0,True,False,False
1649080,143272613,76561198164245025,0,10,2323,0,1725,1691265341,"For 15 € is a good game, it is like TPH. But i would like some better rooms. I like rooms where you can increase their effectivness. But most of the fun rooms (class rooms) have super big main element and there is not much to do.  And i would like to see how much an assistant have made money in shop and general UI needs a little bit love.",1690996297,1690996297,True,0,0,0,0,True,False,False
1649080,142121002,76561198070328808,0,4,3588,0,1049,1705106928,"What a nice game! You can build your very own campus using sandbox mode for creative mode or just do the campaign mode. In Sandbox mode, you have 100 million cash and you can create your campus of your dreams!
--------------------------------------------------------------------------------------------------------------------
You can have courses like Sciencetography, Virtual Normality, Musically, Funny Business, Gastromony and more! You can rename students and staff to funny names. Each of them has funny names. You can build like a lecture theatre, savoury kitchen, science lab, VR lab, dormitory, student lounge, staff room, student union, training room and more! 
You can create events like a concert in the Student Union if you have the stage. You can have like Jasmine Odyssey, DJ Sue Chef, Boogie Knights, Ripped Chords, SU party and more! 
--------------------------------------------------------------------------------------------------------------------
You also can have films in the lecture theatre like Funny Flim, Sci-Fi Film, Horror Film and more!
There are other events like in the Cheeseball field and others like in Savoury Kitchen. 
--------------------------------------------------------------------------------------------------------------------
In my opinion I think I will recommend for this game. Very nice and cool graphics. I like the way that there are funny names for students and staff. 9.7/10 very good game. 90% rating for me.      
------------------------------------------------------------------------------------------------------------------
Also I got the brand new Space Academy DLC which is very very nice. I will post a review on that DLC soon.",1689416596,1690972450,True,0,0,0,0,True,False,False
1649080,143246896,76561198305496102,0,50,1586,0,843,1691824687,I bought it after trying during free weekend and I have no regrets!,1690961087,1690961087,True,0,1,0,0,True,False,False
1649080,143246645,76561198158764571,0,1,4057,0,810,1692427958,"I love this game, super entertaining and incredibly fun. I played TPH and TPC is just as good <3",1690960660,1690960660,True,0,0,0,0,True,False,False
1649080,143228840,76561197979849619,0,20,7398,0,7251,1695600907,Many improvement much fun,1690928342,1690928342,True,0,0,0,0,True,False,False
1649080,143213087,76561198175773781,0,13,308,0,268,1693214112,Rektor Simulator,1690908660,1690908660,True,0,0,0,0,True,False,False
1649080,143203486,76561198142102016,0,89,1112,0,763,1690918135,Great game,1690897209,1690897209,True,0,0,0.47413790225982666,0,True,False,False
1649080,143196039,76561197970774969,0,50,1390,0,1151,1691235536,"Last free weekend i Played around 18 hours for free, now I bought the game so it's prob worth the money. Eventualy I get bored with it but thats ok.",1690886210,1690886210,True,2,0,0.512614667415618896,0,True,False,False
1649080,143193363,76561198131297980,225,43,113,0,113,1690881738,"Too repetitive, too boring",1690881873,1690881873,False,0,0,0,0,True,False,False
1649080,143186664,76561198847766590,135,19,434,0,434,1690869505,"Fun sandbox game for those who like to balance resource management and keeping track of your staff. Reminds me a bit of Roller Coaster Tycoon, only you're not allowed to pick up the students, staff are fair game though, lol.",1690869575,1690869575,True,1,0,0.520201981067657471,0,True,False,False
1649080,143180995,76561197969120396,754,6,3386,0,1959,1692513918,"Great game.  If you liked two point hospital then you'll enjoy this.  I found it MUCH easier than Hospital though, its definitely a fun low stress way to tick away 40+ hours.  Tons of quality of life improvements over Hospital.  If you are new to the series I would suggest warming up with this game first before moving to the original game.",1690858967,1690858967,True,7,0,0.564395010471343994,0,True,False,False
1649080,143159507,76561198042564557,64,3,619,0,302,1691198172,Great game play,1690828029,1690828029,True,0,0,0,0,True,False,False
1649080,143158851,76561198130681102,0,11,4991,0,913,1702659048,"Love the game, although some organisation tools could be improved. Timetables could perhaps have a manual option for assigning courses to rooms. Right now it is a pain to make a dedicated building for certain subject to lower the time students spend walking around.",1690827237,1690827237,True,0,0,0,0,True,False,False
1649080,143149852,76561199092407472,0,1,3308,0,428,1702525316,This game is addicting!! I love it,1690816562,1690816562,True,0,0,0,0,True,False,False
1649080,143139315,76561198348273751,0,7,2072,0,942,1691868159,"I prefer this game over Two Point Hospital, not sure why, maybe its my thing against hospitals?

The only downside is the music, the music in Two Point Hospital is so much better, and that is without adding any music or mod. I would happily listen to it all day. Two Point Campus needs a longer range of music as well as the capability to add more music. I know I can mute it, but I love the DJs and my music would just be out of sync.

The gameplay itself is very much like TPH, so if you liked that, you would like this.

TLDR;
TPC is TPH without the mods and good music.",1690803019,1690803019,True,1,0,0.504884839057922363,0,True,False,False
1649080,143131580,76561199028538090,0,2,10628,0,9025,1696879122,"A lovely game with a nice pacing, though it is less engaging then Two Point's previous game, Two Point Hospital.
The idea of running a campus is great and the devs have truly put a lot of effort into making everything alive and funny. The game plays fluent and most bugs are resolved quickly (1-2 weeks) on Steam.
As per my opening line, the game is not as engaging as TP Hospital. Mainly because you tend to build during the Summer vacation period and when the break is over, you can more or less sit back, relax and watch everything in action. This is not bad, though you typically do not need to intervene when classes are going, apart from fulfilling wishes from students throughout the year (ie schedule a party or place a specific object somewhere). This can make a gameplay a bit boring from time to time, especially when you are after a specific star which requires you to go through multiple years.
Still I recommend this game as it is packed with humor and looks, plays and feels great. Am sure we will get some more DLC in the next 1-2 years to keep the game fresh and entertaining. Just don't expect the same level of engagement like in TP Hospital.",1690790325,1690790325,True,1,0,0.504884839057922363,0,True,False,False
1649080,143116735,76561198317606713,0,39,1168,0,619,1691779506,"
terrible humor",1690763192,1690763192,False,0,0,0.42141452431678772,0,True,False,False
1649080,143095215,76561198013088357,0,30,7443,6,422,1708609611,"If you like city builder, management games,  the sim etc, Recommended! Very addictive.",1690736431,1690736431,True,0,0,0,0,True,False,False
1649080,143092999,76561199116218804,0,2,4902,0,271,1705475511,yes,1690734037,1690734037,True,0,0,0,0,True,False,False
1649080,143088761,76561198003884003,0,6,4254,0,4131,1690736795,"This game is very fun and whimsical, and definitely scratches the itch for management games. There's a ton of customization options as well, which means each map feels unique, despite the mechanics being similar.",1690729605,1690729605,True,5,0,0.587784647941589355,0,True,False,False
1649080,120501573,76561198001284031,0,3,1754,0,122,1690895352,"I replayed this after some time and now am into it. Maybe I was just grumpy the first time I played (see below), or they fixed some things(I played too long ago to remember). Maybe a bit of both.

Either way, am now really enjoying it. 


>>I loved 2 point hospital(which was a great updated clone of Bullfrog's Theme Hospital) and was very excited for the campus version. Sadly, it is bad - humour is off, game loop is weak, management is simplistic. There are fundamental design flaws here. It is also very expensive for something that is basically poor.<<",1660317571,1690727546,True,0,0,0.412499994039535522,0,True,False,False
1649080,143084665,76561198103355402,0,30,700,0,542,1690807862," the game itself is quite boring and no support to steam workshop,",1690725174,1690725316,False,1,0,0.489406764507293701,0,True,False,False
1649080,143076591,76561198002734128,3327,906,1742,0,279,1692158461,"Yes.

https://youtu.be/WAjPYs3yz_w",1690716122,1690716122,True,0,0,0.379357099533081055,0,True,False,False
1649080,143070359,76561198081313721,0,14,933,0,857,1690953192,So much fun!!!!!  Lots of enjoyment :),1690707063,1690707063,True,0,0,0,0,True,False,False
1649080,143069654,76561198087457407,0,28,5366,355,739,1708280818,"Loved 2 point Hospital so I though I'd give this one a try....12 hours later I'm now getting all the DLC packs so ya...pretty entertaining game. If you like builders and you have a sense of humor your gonna love it,",1690705945,1690705945,True,0,0,0,0,True,False,False
1649080,143057648,76561198096327497,0,20,514,0,514,1690758692,"After almost 7 hours of troubleshooting and changing settings around and watching tutorials on how to fix the low frame rate, i can't i give up. The optimisation for this game is so horrible. Do not buy this game, its on sale for a reason and now I know why.",1690686094,1690686094,False,3,3,0.451739758253097534,0,True,False,False
1649080,143057589,76561198029401546,91,1,1336,0,343,1705362847,"If you like simulation games that will keep you busy for hours, this is the game for you. Two Point studios didn't disappoint with Two Point Campus. I give it a 4.5 out of 5, very solid game.",1690686007,1690686007,True,0,0,0,0,True,False,False
1649080,143044128,76561198289345424,0,7,25854,0,1298,1694153517,pretty fun time sink,1690665298,1690665298,True,0,0,0,0,True,False,False
1649080,143037675,76561198185715509,0,2,983,0,878,1691082013,"Relatively quick play through, though I can see playing multiple times to perfect your campuses. Definitely wait until it's on sale. I got it for 50% off and that's really all I can see myself paying for it.",1690657105,1690657105,True,0,0,0,0,True,False,False
1649080,143037003,76561199365146643,0,2,15397,64,12133,1708105070,"nice game! i recommend this 
i have completed main game + 1 DLC. then, I'm going to buy a last DLC soon.",1690656305,1690656305,True,0,0,0,0,True,False,False
1649080,143024599,76561197976872825,0,10,317,0,71,1690838574,Took less than an hour to unlock Sandbox mode. Why are people complaining about this?,1690642526,1690642526,True,0,0,0.461309522390365601,0,True,False,False
1649080,143008598,76561198321044696,134,5,32,0,32,1690622513,"I thought there will be different gameplay, but It basically just like two point hospital, but instead of the patient leave after being cured, these student stays for a period of time.",1690622780,1690622780,False,1,0,0.5,0,True,False,False
1649080,142994552,76561198575192453,128,37,590,0,199,1690849809,As boring as Two Point Hospital,1690600502,1690600502,False,3,0,0.378288775682449341,0,True,False,False
1649080,142973107,76561198020457557,1202,12,4119,0,3024,1693033087,"One of those sim games that's very easy to lose a couple of hours to, but feels much less involved than Two Point Hospital was. Shame the student AI is horrific sometimes, makes getting some of the three stars very awkward.",1690570177,1690570177,True,0,0,0,0,True,False,False
1649080,142961178,76561198029669699,411,40,585,0,443,1690595675,fun,1690557203,1690557203,True,0,0,0.469798654317855835,0,True,False,False
1649080,142920850,76561198895201711,0,10,119744,0,37855,1707353092,"Has all the fun and charm of the Two Point Hospital game and it's highly addicting.  Aside from one or two small issues, the game is wonderfully bug free....except....

I can not see more than a full building or so - all these photographs posted on the web showing the campus from high above, or shown that same way in numerous videos, are impossible for me to duplicate. Basically speaking, my ""zoom"" pulls back only so far and consequently makes it difficult to see anything but the building I'm working on - I need to scroll around the map to view which properties are available since I can't zoom out enough to see them or see how neighboring buildings might be doing without scrolling over to that side of the screen.  It's quite frustrating, but a problem I can live with.  So long as the game itself is playable, and it is.",1690497737,1690497737,True,6,0,0.580986440181732178,0,True,False,False
1649080,142719388,76561198847659981,0,1,7534,0,3737,1691104276,Great game. Challenges are tricky but fun.,1690225347,1690225347,True,0,0,0,0,True,False,False
1649080,142706761,76561198000548258,0,1,2441,0,2135,1690469614,Lots fun for those of us who are fans of Two Point Hospital.,1690210376,1690210376,True,0,0,0,0,True,False,False
1649080,142623368,76561198075479508,347,37,11533,0,3445,1703268500,"If you've done 2 point hospital, you'd like this one too. It's a close cousin, but very relateable to the hospital. Looks a little more deeper but it's easy enough to get into. Recommended totally, worth your time.",1690088004,1690088004,True,0,0,0,0,True,False,False
1649080,142590463,76561198129273180,0,8,2089,0,1191,1692202307,A fun game. Love it!,1690040818,1690040818,True,0,0,0,0,True,False,False
1649080,142552530,76561198040107668,688,79,331,0,331,1688691242,"I never played the Two-Point games, so this is new for me. It's really fun just to create these wacky schools and see where the students go! A great sims-like experience.",1689981046,1689981046,True,0,0,0,0,True,False,False
1649080,142531165,76561199232436300,0,1,15048,0,6150,1702064179,Very fun strategy game you can pick up and put down easily.,1689953455,1689953455,True,0,0,0,0,True,False,False
1649080,142517229,76561198402830102,0,4,2120,0,1686,1690541002,"This game has the best controls and functionality of any sandbox builder I've seen. If there's been a school builder, hospital builder, zoo builder, you name it, I've played it, and with them there always seems to be something weird about placing or moving objects or pathing or weird angles making wall design and placement of objects on walls just confusing or impossible. But this game is seamless and functional. It's definitely much sillier in tone than other builder games, so if that's something you'll mind this is not the game for you. That being said, I much prefer realism and accuracy in my builder games and I still really enjoy this one and the lighter tone and feel it brings. It's challenging, but not stressful, and it's very well designed.",1689934730,1689934730,True,0,0,0,0,True,False,False
1649080,142502146,76561199074015581,0,1,7590,0,7379,1697762293,I love the Two Point games and Campus does not disappoint! So much fun!,1689906866,1689906866,True,0,0,0,0,True,False,False
1649080,142491082,76561198317722079,735,4,4131,0,2545,1692887338,I got more out of this game than I ever got from real college.,1689888915,1689888915,True,0,0,0,0,True,False,False
1649080,142444701,76561199104467002,0,1,1655,0,208,1700996840,The gameis very easy to play,1689823448,1689823448,True,0,0,0,0,True,False,False
1649080,142403322,76561198832812671,373,151,147,0,147,1688668931,"As a sequel to Two Point Hospital, yes it's very similar but there is of course the newer setting but also a lot of Quality of Life improvements which makes building in this game so much better than the previous one",1689771124,1689771124,True,0,0,0,0,True,False,False
1649080,142383524,76561198272536171,47,20,4913,4,3151,1708144613,fun game once you figure how to work things out,1689739847,1689739847,True,0,0,0,0,True,False,False
1649080,142307738,76561198054166552,0,3,2987,319,1393,1707999794,".
",1689651379,1689651379,True,0,0,0,0,True,False,False
1649080,142293491,76561198021953217,53,5,4632,0,4632,1689630091,"---{ Graphics }---
☐ You forget what reality is
☐ Beautiful
☑ Good
☐ Decent
☐ Bad
☐ Don‘t look too long at it
☐ MS-DOS

---{ Gameplay }---
☑ Very good
☐ Good
☐ It's just gameplay
☐ Mehh
☐ Watch paint dry instead
☐ Just don't

---{ Audio }---
☐ Eargasm
☐ Very good
☑ Good
☐ Not too bad
☐ Bad
☐ I'm now deaf

---{ Audience }---
☑ Kids
☑ Teens
☑ Adults
☑ Grandma

---{ PC Requirements }---
☐ Check if you can run paint
☐ Potato
☐ Decent
☑ Fast
☐ Rich boi
☐ Ask NASA if they have a spare computer

---{ Difficulty }---
☐ Just press 'W'
☐ Easy
☑ Easy to learn / Hard to master
☐ Significant brain usage
☐ Difficult
☐ Dark Souls

---{ Grind }---
☐ Nothing to grind
☐ Only if u care about leaderboards/ranks
☑ Isn't necessary to progress
☐ Average grind level
☐ Too much grind
☐ You'll need a second life for grinding

---{ Story }---
☐ No Story
☑ Some lore
☐ Average
☐ Good
☐ Lovely
☐ It'll replace your life

---{ Game Time }---
☐ Long enough for a cup of coffee
☐ Short
☐ Average
☐ Long
☑ To infinity and beyond

---{ Price }---
☐ It's free!
☑ Worth the price
☐ If it's on sale
☐ If u have some spare money left
☐ Not recommended
☐ You could also just burn your money

---{ Bugs }---
☐ Never heard of
☑ Minor bugs
☐ Can get annoying
☐ ARK: Survival Evolved
☐ The game itself is a big terrarium for bugs

---{ ? / 10 }---
☐ 1
☐ 2
☐ 3
☐ 4
☐ 5
☐ 6
☐ 7
☑ 8
☐ 9
☐ 10


Grab this review template here! 👉 https://vojtastruhar.github.io/steam-review-template/
",1689630553,1689630553,True,0,0,0,0,True,False,False
1649080,142232983,76561198369679620,0,9,2113,0,2105,1690051677,.,1689547940,1689547940,True,0,0,0,0,True,False,False
1649080,142193101,76561199146572309,0,1,6021,0,607,1694357478,Kinda similar to two point hospital but has so many extra features. Kind of addictive and I love it!,1689506585,1689506585,True,0,0,0,0,True,False,False
1649080,142028018,76561198178638829,0,10,343,0,221,1689549395,Great game,1689297750,1689297750,True,0,0,0,0,True,False,False
1649080,141983564,76561198814871193,39,3,662,0,662,1689077720,sedap uh,1689252904,1689252904,True,0,0,0,0,True,False,False
1649080,141957541,76561199247160516,0,1,6100,0,1927,1701412801,Enjoyed it!,1689217201,1689217201,True,0,0,0,0,True,False,False
1649080,141933708,76561197991896535,430,9,2690,0,2083,1707545050,"Building a campus for outrageous staff and students is so much fun! Create your own Hogwarts or Space Academy and reach for the highest level of graduates. Make sure to build enough toilets, showers and dormitories to house your students and staff facilities including a lounge, training and research facilities. Oh, and don't forget student recreational rooms and clubs, host movies nights in lecture theatres and events in student lounges. Run different courses with various requirements like a Jousting Field or Cooking room and Magic Spell rooms.

I really enjoy the graphics style, music and fun atmosphere of this game as well as the graduated challenges of each campus. My old college pales compared to Two Point Campus!",1689196555,1689196555,True,0,0,0,0,True,False,False
1649080,141932539,76561198928875835,0,1,5247,0,2752,1699316967,This game is hilarious and so addicting. I love it.,1689195328,1689195328,True,0,0,0,0,True,False,False
1649080,141932488,76561198876737201,0,17,716,0,551,1689345620,"Been waiting for game to come down in price....magic game play, hours of fun, DLC added too.",1689195279,1689195279,True,0,0,0,0,True,False,False
1649080,141886453,76561197972513038,0,3,7865,0,2495,1700439270,"Im running a 
Intel® Core™ i9-10900KF CPU @ 3.70GHz
NVIDIA GeForce RTX 3080
32 gig ram
With the hours Ive played Ive enjoyed, but the game crashes so much I cant recommend it! Ive tried every fix available! From High to low settings the games crashes constantly I havent made it through but maybe 4 campus before im to frustrated to continue! Yes everything is updated and all the files have been checked over and over again! I just cant fins an answer anywhere! Im not new at this!! Just beware!",1689144349,1689144349,False,0,0,0,0,True,False,False
1649080,141868825,76561198061609087,0,1,9864,0,9122,1690337073,An improvement on Two Point Hospital. Placing items and doors is much easier.,1689119318,1689119318,True,0,0,0,0,True,False,False
1649080,141849226,76561198046704227,0,2,3172,0,976,1690052609,"Its a good game but way too easy, Two point hospital had some challenge and caused you to fail or repeat the harder hospitals. Other then it being to easy everything has improved from the last game and while its super easy its still a nice game to play in the background while watching a show.",1689098703,1689098703,True,0,0,0,0,True,False,False
1649080,141809905,76561199494327481,0,1,647,0,209,1689959525,its a fun game,1689052342,1689052342,True,0,0,0,0,True,False,False
1649080,141788774,76561198025209591,0,1,9361,0,1518,1691645050,Very engaging. Love all the management features - there's more than there first appears.,1689024844,1689024844,True,1,0,0,0,True,False,False
