1649080,159420135,76561198959533439,0,1,12155,2276,12155,1709071396,much fun,1709071382,1709071382,True,0,0,0,0,True,False,False
1649080,159412279,76561198171455066,278,187,538,538,538,1709061221,Very fun and addictive game. Easy to learn. Love the radio brought memories form the game The Movies,1709062552,1709062552,True,0,0,0,0,True,False,False
1649080,159371903,76561199094927937,0,25,356,323,356,1709011527,fun,1709011536,1709011536,True,0,0,0,0,True,False,False
1649080,159367908,76561198327103296,167,68,816,816,774,1709071337,"Man, I didnt know was it this addictive... The customisable sims like elements makes it perfect.",1709005766,1709005766,True,0,0,0,0,True,False,False
1649080,159344161,76561199566370267,1,1,722,722,582,1709056089,A worthy continuation of the Two Point Hospital that polishes old mechanics and adds new fun content!,1708975702,1708975702,True,0,0,0,0,True,False,False
1649080,159291852,76561199250047445,0,5,4341,0,4341,1696554569,"love this game, i could play for hours",1708909002,1708909002,True,0,0,0,0,True,False,False
1649080,159280987,76561199019771206,0,1,9421,2852,9107,1708915799,obsessed with this game.,1708896936,1708896936,True,0,0,0,0,True,False,False
1649080,159258153,76561199563125908,0,9,2919,2919,2408,1709065153,"Fun game, but I love building and management",1708879382,1708879382,True,0,0,0,0,True,False,False
1649080,159252449,76561198097655451,0,2,757,403,359,1709072102,Game crashes after initial load so it is unplayable.,1708875245,1708875245,False,1,0,0.467546761035919189,0,True,False,False
1649080,159129171,76561198403941064,160,61,1073,1073,981,1708769233,love it,1708762929,1708762929,True,0,0,0,0,True,False,False
1649080,159121088,76561198021485540,1026,50,85,0,85,1700847783,"This game lacks the ""ruin the economic status of an entire generation"" kinda impact I want to have on my students. 

I don't want them to learn, I want to reap as many sweat sweat stacks of cash as I can while creating a hivemind of dweebs. Oh, i also want a feature where we can have biased scholarly articles that are pushed so I can get a director position I don't deserve and make some insane political takes.",1708754014,1708754014,False,0,2,0.284588813781738281,0,True,False,False
1649080,159116180,76561199299660763,11,9,331,201,238,1708858749,This game is great 10/10!,1708748428,1708748428,True,0,0,0,0,True,False,False
1649080,159048558,76561198027144126,0,1,5970,2113,5534,1708957736,You will love this if you miss your college life,1708687518,1708687518,True,0,0,0,0,True,False,False
1649080,159020866,76561198145557738,0,6,2245,1025,2245,1708652552,its alright :),1708654493,1708654493,True,0,0,0,0,True,False,False
1649080,158975914,76561198067945704,0,4,1753,1165,1239,1709042225,.,1708613061,1708613061,True,0,0,0.442804425954818726,0,True,False,False
1649080,120405370,76561198016563049,0,117,45,0,45,1660156988,"Barely Every Student is Black or Beige rarely White Students  what is this??

And on Top you are using Gender Language? You gotta be kidding!

Won´t get a single Cent from me!",1660157254,1708515206,False,0,0,0.339196324348449707,0,True,False,False
1649080,158879751,76561198264641529,27,6,3748,3748,809,1709072184,A fun and amusing game that doesn't tax your brain too much!,1708510795,1708510795,True,0,0,0,0,True,False,False
1649080,158879457,76561198026428548,0,2,13102,0,13102,1704608659,"I grew up playing Theme Hospital so when the creators of that game came up with Two Point Studios, and Two Point Campus, I had high hopes/expectations for their releases. I was not disappointed, these games are different in all the right ways and I love that my daughter can play them too.",1708510412,1708510412,True,0,0,0,0,True,False,False
1649080,158865174,76561198147164110,0,31,436,436,190,1708825978,I like this one better than two point hospital,1708491437,1708491437,True,0,0,0,0,True,False,False
1649080,136544141,76561198013680956,0,4,20790,0,20790,1678335529,"Absolutely adored this game. It's even better than its predecessor in its mechanics and, especially, in its utterly charming writing. I even googled for longer than I care to admit for the identity of the writers just to see more of their work, but the information is nowhere to be found. Two Point Studios, if you read this, give us names. They're brilliant!",1681247521,1708488709,True,0,0,0,0,True,False,False
1649080,158835554,76561198171840093,0,15,461,461,214,1708593348,get the game on discount. loves it so far,1708463043,1708463043,True,0,0,0,0,True,False,False
1649080,158832572,76561198037569049,0,13,2824,2824,2015,1708995135,"There are many improvements to this game over their last installment.  Including rooms no longer shut down to upgrade.  The attackers and infiltrators are better handled.  The game has kept me playing for a number of low stress hours.  It is worth the money, even more so if you got it on sale like I did.",1708460731,1708460731,True,0,0,0,0,True,False,False
1649080,158815851,76561198106257806,0,5,3475,281,3310,1708965312,"One of the best builder games you can get right now, especially if you like thematic games and quirky features",1708446917,1708446917,True,0,0,0,0,True,False,False
1649080,158734599,76561198236824588,0,2,847,850,30,1709065998,"Just played it for the first time, really enjoyed it for now and also have very funny game too.",1708365821,1708365821,True,0,0,0,0,True,False,False
1649080,158642524,76561198855978011,0,6,833,833,267,1708827503,"i love the two point game, enjoyable for hours and hours... quite addictive real.",1708275396,1708275396,True,0,0,0,0,True,False,False
1649080,158603268,76561198024950727,501,24,18,18,18,1708239662,it's like two point hospital but bad,1708239741,1708259046,False,5,1,0.504700660705566406,0,True,True,False
1649080,158587340,76561197996241199,0,35,8115,1043,8115,1708222882,"A fun little sim to chill, not very hard or in-depth but very charming and tounge-in-cheek. I enjoyed my time =)",1708223016,1708223016,True,2,0,0.520958065986633301,0,True,False,False
1649080,158566462,76561199122754901,0,1,1002,1002,277,1708889004,Game is fun and easy to play. Very relaxing and time goes by quickly. 100% recommend. Reminds me of the old School Tycoon game from the early 2000's.,1708206252,1708206252,True,0,0,0,0,True,False,False
1649080,158522772,76561198053812656,0,3,228,228,36,1708264038,"Just started, but it is a fun game where you can build and manage a school.

Controls are fine and it works on steamdeck, but the tiny screen doesn’t help. 

",1708169985,1708169985,True,0,0,0,0,True,False,False
1649080,158482077,76561199041689648,0,1,426,426,343,1708130115,"This is the first Two Points game that I have played, and I love it so much. It scratches the itch School Tycoon did for me as a child, both for the game's humor and complex management system. I couldn't recommend it more!",1708125127,1708125127,True,0,0,0,0,True,False,False
1649080,158419215,76561197985045543,26,2,891,891,292,1709008423,Building stuff,1708054866,1708054866,True,0,0,0,0,True,False,False
1649080,158389593,76561198099250889,0,14,2114,1735,1028,1709065827,if you like two point hospital ypu'll like this,1708019120,1708019120,True,0,0,0.476190477609634399,0,True,False,False
1649080,158372806,76561198036436352,0,6,1987,356,1696,1708369484,great game. love that they keep adding little bits of content. Wonderfully replayable,1708002427,1708002427,True,0,0,0,0,True,False,False
1649080,158084909,76561198087989020,0,1,4409,1350,2235,1708565262,Fun and easy to play. Love all the quirks and the sense of humour of the game.,1707663170,1707663170,True,0,0,0,0,True,False,False
1649080,158044676,76561198109672422,0,12,1588,0,1588,1707617625,No,1707617685,1707617787,False,1,0,0.388325035572052002,0,True,False,False
1649080,157892174,76561199091750439,0,3,925,0,596,1707461549,Great game,1707441817,1707441817,True,0,0,0,0,True,False,False
1649080,157814062,76561198000325052,270,10,2175,2,2173,1708126541,A fun relaxing game. Enjoyable. Holds my attention. Low commitment.,1707349724,1707349724,True,0,0,0,0,True,False,False
1649080,157810504,76561198372197923,0,10,1307,0,1307,1707344354,"very fun to play, but can get repetitive with some tasks",1707344528,1707344528,True,0,0,0,0,True,False,False
1649080,157807811,76561198130272294,0,1,8273,0,7132,1707684368,Great,1707341008,1707341008,True,0,0,0,0,True,False,False
1649080,157664498,76561198065253532,0,1,2897,0,1664,1707798154,"I enjoy the game, primarily finding the most time, space, and cost effective ways to level up your campuses, at least until you have enough cash to make your campus extravagant!",1707156804,1707156804,True,0,0,0,0,True,False,False
1649080,157567450,76561198037246903,324,500,4642,0,4642,1705094232,"It is a good game but it is too expensive. Gameplay is a bit slow and there are some problems with the design. Sometimes students get stuck and cannot get their needs and some of the rooms give the invalid item error, even though it shows as normal. Weirdly, upgrades for personnel are expensive, while they also expect a better salary. Also, for some weird reason, all of the personnel at training queue leave their job, when a new person is requested. Other than that, radio is pretty limited and you are forced to listen the same conversations over and over. The core of the gameplay is fun and there are a lot of different courses but they are a bit hard to upgrade. Still, it was an enjoyable game for me with being chill and slow pace. It is a bit pricey but can be purchasable at sales, especially with a bundle for some important DLCs.",1707045315,1707045315,True,0,0,0,0,True,False,False
1649080,157444469,76561199369658317,0,2,2822,0,2675,1706921848,Lots of fun,1706913018,1706913018,True,0,0,0,0,True,False,False
1649080,157405811,76561199100318341,90,23,206,0,206,1706878020,"becomes boring after a litte while, wish i could refund it tbh. def not worth 29.99",1706878117,1706878117,False,3,1,0.463708370923995972,0,True,False,False
1649080,157368767,76561198078039122,0,6,543,0,540,1707539192,"I just got this game because I wanted to build a Magic Knight Academy... which took me a lot more time to unlock then I had thought, but by then I was hooked. All the academies are interesting and unique, and building a balanced campus with a variety of academies is fun.",1706829984,1706829984,True,0,0,0,0,True,False,False
1649080,157217643,76561198369400917,0,2,360,0,355,1706651739,awesome gameplay,1706651565,1706651565,True,0,0,0.484670847654342651,0,True,False,False
1649080,157203544,76561197993233284,0,2,1956,209,1477,1708837831,"I like this sequel to Two Point Hospital.  It builds on the formula that made hospital great while balancing some of the chessing abilities (you can't just hang 20 of the same poster in a room to increase its level, you have to mix it up).  The humor is still there and I love seeing where we are going next.",1706638071,1706638071,True,0,0,0,0,True,False,False
1649080,157129165,76561199594243951,0,1,200,0,200,1706545231,A fun strategy and management game,1706545314,1706545314,True,0,0,0,0,True,False,False
1649080,156994256,76561197997793862,199,10,16324,328,12202,1708091450,"Overall, the game is a good value, and if you liked Two Point Hospital you will probably get some enjoyment here.  But one serious step backwards was the decision to not support Steam's workshop. Instead the game partners with mod.io for mods, and it is just plain garbage.  Very few people bother to take the time trying to deploy mods on mod.io. While Two Point Hospital had thousands to pick from, this one only has about 300. Many of those are just recolors, and none of them are music packs.",1706396858,1706397091,True,0,0,0,0,True,False,False
1649080,156957502,76561198971723947,0,2,2432,0,364,1707677117,"I recommend this game if you enjoy management games. 

Cute graphics, easy to learn and play. Gets more challenging with time but it feels so rewarding to keep advancing to different locations and keep developing in order to gain more and more stars!",1706367116,1706367116,True,3,0,0.526134371757507324,0,True,False,False
1649080,156781494,76561198014130933,407,355,782,0,782,1691110555,Why couldn't my school be like this.,1706189470,1706189470,True,0,0,0,0,True,False,False
1649080,156706194,76561198022867797,0,2,7702,0,7220,1706559742,"So fun, a lot like Two Point Hospital. The animation style is super cute, with a lot of funny little characters and double meanings to delight in. The game presents some challenges without being too overwhelming or stressful, and still having the satisfaction of meeting goals and checking things off lists of things to do. I got 100% of the achievements (with DLCs) within about a month of playing; again, some of the tasks can be challenging but nothing is too stressful. A nice cute and calm game, appropriate for all ages.",1706109065,1706109065,True,4,0,0.529459238052368164,0,True,False,False
1649080,156640035,76561197980689583,0,122,183,0,183,1694946459,boring,1706028674,1706028674,False,1,0,0.430364608764648438,0,True,False,False
1649080,156517263,76561199063634818,0,1,7773,0,7755,1705891729,i love,1705890249,1705890249,True,0,0,0,0,True,False,False
1649080,156515272,76561198405122844,0,6,1422,0,705,1706383963,I personally find this more entertaining than two point hospital. (I got sad after patients kept dying in my hospital). Students seem to pass their courses with ease in this game...I haven't had a single student that failed yet.,1705887988,1705887988,True,0,0,0,0,True,False,False
1649080,156504303,76561198115118932,0,1,2003,0,1920,1706818591,Addictive and easy to jump into.,1705875161,1705875161,True,0,0,0,0,True,False,False
1649080,156483738,76561198312226720,32,9,8962,1141,3820,1708986465,I really really like it,1705857586,1705857586,True,0,0,0,0,True,False,False
1649080,156451163,76561198063007746,0,7,1980,0,1952,1705838926,"It is a really fun game, very straight forward to get the goals done, but it is hard to achieve really high level of success, e.g. staff happiness is impossible to get beyond 70%!

My main gripe is the music.... it is cheap and repetitive! but other than that, it is a fantastic sim game, it is quite relaxing to play.",1705829570,1705829570,True,0,0,0,0,True,False,False
1649080,156401041,76561198994776175,0,6,1095,0,989,1705803815,I enjoy playing this game,1705776955,1705776955,True,0,0,0,0,True,False,False
1649080,156325715,76561197968240625,517,15,21531,21,20808,1707938531,"Two Point Campus is an Excellent Sequel to a well established game, Two Point Hospital.
General synopsis is just Build a school, manage your staff, profit from students.

Overall differences from hospital is that you can build outside, decorate until your hearts content, with many different courses there is so much more flexibility in your style of game play, whether you love playing slow, decorating and letting your students run wild, or playing fast and chaotic, trying to maximise your profits, there's many different ways to play. 

Between Campus and Hospital, Campus plays much more relaxed to its hospital counterpart, you have much more control over everything, how many students come in at any point, you can adjust the buildings and sizes to fit your needs, and once youre set up you can just let it run and watch how the year plays out.",1705700116,1705700116,True,0,0,0,0,True,False,False
1649080,156025447,76561198053338458,0,3,2960,1,2768,1708228005,Played on SteamDeck and PC. Can be used to fill in your free time during commuting time on the train. Easy to play and pause. Not as hectic as two point hospital.,1705312638,1705312638,True,0,0,0,0,True,False,False
1649080,155928608,76561198168941930,0,2,2791,0,2018,1705961469,"I ended up buying this game because of a same themed mobile game tycoon. I did NOT expect how awesome this game would be! Overall it is amazing for me!

The graphics and the general feel/aesthetic is very goofy and lighthearted. That makes the game perfect for unwinding and generally chilling and enjoying your time while playing it. I love the creativity behind every little goofiness, from the radio hosts to the little cute animations the students make while interacting with various items.

I also love how it feels rich and unending. Every time I think I've reached a point where the grinding and repetitiveness starts, the game changes up the beat. Granted, I've played around 30hrs yet, but it has managed to capture my attention more than 10 hours and I'm still excited for new things, so I count that as a win!

It has its challenges, but they're manageable and they don't take you away from the fun of the game, nor jolt you out of the immersion out of frustration. If you are looking for a more hardcore managing and challenging game, then this is not for you. 

Some people have mentioned that it gets repetitive sometimes, but in my own experience, it shifts up the things the exact right moment. It does have a pattern indeed, but not to the point that everything becomes boring. 

Overall, it's a goofy, lighthearted, chilling game, that takes you managing your own campus and giving you the satisfaction of watching it thrive. It can get challenging, but not to the point it takes the fun and chill out of it.

One of my favourites in this category! I'm so glad I stumbled upon it!",1705192603,1705192603,True,0,0,0,0,True,False,False
1649080,155876548,76561198309878017,0,12,1093,0,1093,1703825361,i <3 skool,1705140279,1705140279,True,0,0,0,0,True,False,False
1649080,155835609,76561198083295838,0,22,904,205,225,1708611543,"Sleeping time has gone, eating time has gone, study time has gone. What have I achieved? I pay fees to see my own campus working. And it's working! Working is fun, studying is fun, running is fun. Running away from reality and truth. Truth is virtue and so am I. I don't lie but when I lie, it's for a greater good. Spend your money here and play a fool. I meant full. Full steam ahead.",1705088807,1705088807,True,1,1,0.5,0,True,False,False
1649080,155828294,76561198042628422,0,57,10017,0,10017,1705081197,A Good creative game. Worth a try!,1705081719,1705081719,True,0,0,0,0,True,False,False
1649080,155820544,76561197964958973,302,3,1594,0,1110,1705411509,A lot of fun and really captures the feeling of Ye Old'e Theme Hospital.,1705074203,1705074203,True,0,0,0,0,True,False,False
1649080,155802994,76561199083864067,15,3,36,0,36,1705050302,"I like the idea of this game but it’s kinda boring.. slow paced and the art style is not my vibe. Get it if you like a chill game you don’t really need to pay attention to, if not I’d pass.",1705050592,1705050592,False,0,0,0.44871792197227478,0,True,False,False
1649080,155784882,76561199488527058,0,1,3259,0,3097,1705183147,"Great game! Very addictive. Cute graphics and funny voice-over at times. The game can become quite repetitive at some points but it's an overall great game. I have also played Two Point Hospital (All DLCs too) and while most people prefer that game, I have to say I think Two Point Campus is my favourite.",1705021213,1705021213,True,0,0,0,0,True,False,False
1649080,155709057,76561197973783676,0,55,171,0,171,1704917776,"The humour is annoying, the music is grating, the game has a lot of waiting around, the art style is ugly.

I don't recommend unless you don't mind the things I listed above.",1704917835,1704917835,False,0,0,0.453172177076339722,0,True,False,False
1649080,155697375,76561199057083635,47,13,209,0,208,1705156221,"very fun & challenging, can go on forrrreverrrrrrrrrrrrrrr",1704904641,1704904641,True,0,0,0,0,True,False,False
1649080,155604260,76561198865672222,0,1,6869,1114,354,1708747985,Fun game.,1704778563,1704778563,True,0,0,0,0,True,False,False
1649080,155585144,76561198029248908,0,2,7297,0,4341,1707838138,Fun and relaxing,1704753048,1704753048,True,0,0,0,0,True,False,False
1649080,155531380,76561198350906044,391,165,2458,0,2413,1704770499,Fun game. similar to the hospital one,1704687015,1704687015,True,0,0,0,0,True,False,False
1649080,155505755,76561198229134160,80,16,807,55,662,1708275930,I got this game on a whim and now it's one of my go-to cozy games for if I want to play something while watching a show/movie/youtube video.,1704658753,1704658753,True,0,0,0,0,True,False,False
1649080,155498806,76561199041878433,0,4,1166,137,692,1708203201,This game is so good! I love this game and it fells good to see my students fail/succeed,1704653071,1704653071,True,0,0,0.476190477609634399,0,True,True,False
1649080,155463153,76561199037528904,0,2,3909,403,966,1708367042,"It's a fun game to kill some time, but not very challenging and pretty mehh in comparison to Two Point Hospital. Try Two Point Hospital instead if you haven't yet.",1704619875,1704619875,True,0,0,0,0,True,False,False
1649080,155293060,76561198965851957,0,4,7005,115,1115,1708867772,"Nice game, I like Campus more than Hospital, many types of campus. But some bugs when building rooms are annoying.",1704445241,1704559533,True,0,0,0,0,True,False,False
1649080,155395420,76561197993255429,0,1,1664,0,1664,1704550628,"Oh well, I liked Two Point Hospital, a great new Version of the classic Theme Hospital idea.

I was looking forward then to see another type of these games now themed around Universities, the Theme still is quite interesting, the graphics are good.

But...

.. why are the controls and gameplay so much less sophisticated than in Two Point Hospital?!
I feel like doing something that was easy in Two Point Hospital is cumbersome in Two Point Campus.

Can I recommend this game? Good question.

I like the theme, but I do not like the controls.

Let's say, you are a die hard fan of this kind of game, then go for it. If you are just a casual player considering either Two Point Hospital or Campus, go for Hospital!

Cheers!",1704553641,1704553641,False,5,0,0.582655847072601318,0,True,False,False
1649080,155348672,76561198044057301,359,9,2280,0,2280,1704299768,"Enjoyable, only criticism is the student count in the end game. Couldn't break 300. Wanted to have a university with all courses and loads of students for each, alas impossible with these hard limits in place.",1704500792,1704500792,True,0,0,0,0,True,False,False
1649080,155321568,76561199389084246,112,16,1223,0,1188,1705306176,"Fun and addicting game, cute graphic.",1704475302,1704475302,True,7,0,0.577637553215026855,0,True,False,False
1649080,155303966,76561197973539993,0,30,460,0,460,1704458317,"Idk, it feels like Two Point Hospitals ugly Brother. Unpolished, lack of Features. If you have played the other one first, dont bother.

You cant prioritize which Room should always have an Employee in it.

There are a lot of pathing issues.

Some Students are about to quit bc everything is low for no Reason bc they.do.not.move. At all. They just stand there. Why cant i grab them like old School Roller Coaster Tycoon? They have so much damn Freetime, to go sh*t or shower. In 1 Year they have 3 Lectures that take 1 Month each, so they have 9 Months to do whatever they want, but they dont do anything. Everything is there, everything has time to refill. Whats the damn Problem??

It takes effing forever to upgrade Employees and Buildings for no Reason and you CANNOT upgrade them before a new Term, so its always Chaos each Semester.

Also you do not know if you have enough sleeping Rooms. There is no indication whatsoever if its enough or not.

Although im happy to hear the same Voice Actors for the Radio Stuff and Announcement, but after 1 Hour you heard everything already. TP Hospital had much larger Variety.

Students want you do add certain things, but why? There is no indicator either that makes them happy or something.",1704458996,1704458996,False,3,0,0.548416733741760254,0,True,False,False
1649080,155255098,76561199488863845,0,1,4896,41,2813,1709031119,Something slightly addictive about this game... Relatively straightforward but challenging at the same time,1704400648,1704400648,True,0,0,0,0,True,False,False
1649080,155222288,76561198067250988,0,8,1033,0,819,1705665892,"Purrrr-fect game to just relax, and zone out :)

⠀⣴⣿⣦⡀⠀⠀⠀⠀⠀⠀⠀⠀⠀⠀⠀⠀⠀⠀
⠀⣼⣿⣿⣿⣷⡀⠀⠀⠀⠀⠀⠀⠀⠀⠀⠀⠀⠀⠀
⣼⣿⣿⣿⣿⣿⣿⣿⣦⣄⡀⠀⠀⠀⠀⠀⠀⠀⠀⠀
⣿⣿⣿⣿⣿⣿⣿⣿⣿⣿⣿⣷⣶⣤⣤⣶⣶⣿⣿⡗
⣿⣿⣿⣿⣿⣿⣿⣿⣿⣿⣿⣿⣿⣿⣿⣿⣿⣿⠟⠀
⣿⣿⣿⣿⣿⣿⣿⣿⣿⣿⣿⣿⣿⣿⣿⣿⣿⠃
⣿⣿⡇⠜⠙⣿⣿⣿⣿⣿⣿⣿⣿⣿⣿⣿⠀
⣿⣿⣿⣶⣿⣿⣿⣿⣿⠋⡹⠙⣿⣿⣿⡇⠀ Cat
⣿⣿⣿⣿⣿⣿⣿⣿⣿⣷⣶⣾⣿⣿⠛⠀⠀ Like to pet
⣿⣿⣿⣿⣿⣿⣿⣿⣿⣿⣿⡟⠛⠁⠀⠀
⣿⣿⡿⠻⠿⠿⠿⠿⠛⠹⠑⠀⠀
⠟⠁⠀",1704371584,1704371584,True,1,1,0.432302683591842651,0,True,False,False
1649080,155196605,76561199516378716,0,3,24403,7851,2206,1709068450,Another romp of a management games from the 2Point Stable. It doesn't disappoint,1704337595,1704337595,True,0,0,0,0,True,False,False
1649080,155192612,76561198406855353,0,14,5990,0,5373,1707352910,"A continuation of Two Point Hospital (itself a spiritual successor to a classic) Campus does well at cutting out a lot watery parts and keeping what's valuable. The experience is more compressed and less wasteful. I'll probably finish at ~100 hours, well-spent.",1704333034,1704333034,True,0,0,0,0,True,False,False
1649080,155187796,76561198089531503,70,2,6992,0,5061,1705143910,"fun time waster. different enough from tph to feel fresh, while having enough similarities to be super easy to pick up.

If you enjoy tph, would definitely recommend picking it up on sale.",1704328170,1704328170,True,0,0,0,0,True,False,False
