1649080,121003432,76561198057241108,0,4,5088,0,1690,1683673767,"Love this game.  I've played a lot of Two-Point Hospital, so pullover in how the game operates was quite easy due to my experience with their other game.  I can see if I was completely new to the series and how things operate, the instructions for this game in the opening aren't as clear as they could be.  There's a lot of complex concepts that I've picked up from threads and game-experience that aren't lined out in this game.  An example of this, which is new to Two-Point Campus, is the campus building features. I made it through 4 universities, all 3 stars, before figuring out there's a way to build paths.  

Build mode can be a little weird at times (sometimes I consistently click the rooms in an attempt to grab an object that was misplaced instead of actually grabbing the objects).  Overall though, the game is fantastic with just a few little tweaks I'd make to the building portion.  I'd also like a few more screens to be more easily accessible such as job lists -- it'd be nice to see an overall instead of having to go into individual staff screens to get to their job list.  I'd like room objects to function like they did in Two-Point Hospital such as marketing desks and training items.  Right now, you have to click the room to get to training instead of clicking the item. Same with Marketing -- clicking the desk shows you details about the desk, not the actual marketing options.

Overall I'd give the game an 8/10, deducting just a few points off for some awkward building issues (they work, just awkward sometimes), and then issues outlined above. Some things could be explained a little more clearly.  And PLEASE add more entertainment options!  My students are always bored and seem to ignore the given entertainment options I have everywhere, except for room events!",1661097293,1661097293,True,0,0,0,0,True,False,False
1649080,121002579,76561198864039794,0,3,4861,0,386,1677718528,Fun game,1661096275,1661096275,True,0,0,0,0,True,False,False
1649080,120997619,76561198099010954,0,1,9600,0,1477,1707597045,The best.,1661090377,1661090377,True,0,0,0,0,True,False,False
1649080,120995705,76561198032795654,0,13,1174,0,665,1702160972,YES,1661087971,1661087971,True,0,0,0,0,True,False,False
1649080,120980690,76561198064286679,0,5,2428,0,588,1688363029,"Great game, if you loved two point hospital you will love this game,",1661063751,1661063751,True,0,0,0,0,True,False,False
1649080,120969842,76561199053576396,0,1,7601,0,2400,1672718853,"A great variation on their original, Two Point Hospital, Two Point Campus allows you to design the college campus of your dreams. Great for those who enjoyed management games such as Zoo Tycoon and Roller Coaster Tycoon from years ago.",1661044365,1661044365,True,0,0,0,0,True,False,False
1649080,120969286,76561198079641630,0,27,16161,0,1481,1679850098,"A very enjoyable, funny game. A great addition to the two point series!",1661043454,1661043454,True,0,0,0,0,True,False,False
1649080,120968638,76561198072599503,0,5,2184,0,378,1662122596,"I bought the switch copy, but the switch copy is a big buggy for now. The STEAM version is much better. Runs smoothly. Great game. Very similar to two-point hospital.",1661042322,1661042322,True,0,0,0,0,True,False,False
1649080,120966960,76561198408872340,0,30,981,0,673,1668727701,everything's great except having to budget. I just wanna build,1661039386,1661039386,True,0,0,0,0,True,False,False
1649080,120966700,76561198057150950,0,10,812,0,476,1661064214,"Runs a lot like Two Point Hospital but with a few extras and improvements. I've always loved the charm of TPH and this keeps that charm. If you like TPH, this is definitely worth picking up.",1661038992,1661038992,True,0,0,0,0,True,False,False
1649080,120960400,76561197960328150,0,16,974,0,615,1661197297,it's okay..,1661029320,1661029320,True,0,0,0,0,True,False,False
1649080,120960288,76561198125218110,0,1,1540,159,878,1708877299,"Just as goofy and fun as their previous title Two Point Hospital, Two Point Campus is a great game that requires careful management, and a good sense of humour. The game easily sucks you in for hours at a time.",1661029171,1661029171,True,0,0,0,0,True,False,False
1649080,120959869,76561198143278215,0,12,1221,0,1215,1682021493,"It goes without saying that if you loved Two Point Hospital; you'll love this too! 

I'm a fan of the Uni theme - especially since I'm a Uni dropout, so I can live vicariously through this game (as well as through Dinosaur Fossil Hunter).

Assuming that you've played Two Point Hospital; the mechanics are largely the same - with improvements of course. For instance, you can now fit in more toilet stalls into a smaller room configuration than you could in Two Point Hospital. Definitely an improvement! Room configurations feel like they have way more options and customisation options than before.

In addition, Assistants are now the MVPs. Like, seriously. They were mostly overlooked in Hospital; now they're arguably the most important. Janitors too. And I'm a fan of this change; it definitely adds way more depth and drive to get everyone trained up as best as they can be.

The UI looks a little different to Hospital, and sort of takes some getting used to. All in all, it's very familiar to before.

At the time of this review (August 2022), there are some minor bugs - nothing game-breaking (that I've experienced, at least), and I'm sure that they'll get ironed out very soon.

Great game; seriously addictive. I've no doubt that I'll go and pick this up on the Switch too, as I had Hospital on all platforms. 

Well worth the price, and I look forward to future expansions.

Just putting it out there as a future Two Point game idea; I hope that they do a Two Point Airport!",1661028622,1661028622,True,0,0,0,0,True,False,False
1649080,120959124,76561199008435569,0,4,7477,0,1392,1695344017,LOVE IT! Def similar to Two Point Hospital but does have some differences too!,1661027533,1661027533,True,0,0,0,0,True,False,False
1649080,120943538,76561198964412138,29,5,8164,0,804,1704580610,Great humor :),1661007443,1661007443,True,0,0,0,0,True,False,False
1649080,120940925,76561198882164880,0,5,6010,0,627,1707647975,The game is really good and if you enjoy playing management sims you will like this game,1661004084,1661004084,True,0,0,0,0,True,False,False
1649080,120896398,76561198324319561,0,1,2877,0,2422,1700488791,"""We're sorry for the litter that you--  oh sorry that's mine""",1660930409,1661003837,True,0,0,0,0,True,False,False
1649080,120940613,76561198057258664,1291,122,1210,0,1100,1674696724,"Full Review To Come:


If you have played Two Point Hospital then you will know what to expect from Two Point Campus, and trust me when I say that isn't a bad thing.  This game is addictive fun, most of all I what really like the game play which hearkens back to the old 'Theme' series of games way back when,  I love the humour in the game too.

Can't recommend Two Point Campus highly enough!",1661003646,1661003646,True,0,0,0,0,True,False,False
1649080,120940068,76561197989047578,0,5,158,0,158,1660926666,"I'm a long time fan of theme hospital. I bought Two Point Hospital on day one and loved it. I played every DLC and loved it. I Really *really* wanted to like this game, but I just.... don't... After beating the first two campuses I simply have no desire to start a third and my time with TPC is probably already at an end.

The style is very similar to TPH, with the same cute graphics, the same radio presenters and ( possibly unpopular opinion ) many of the same jokes forced into a slightly different context to sound more ""university'y"" Once I noticed this it bugged me more and more. 

For some inexplicable reason they've also added a tonne of menu options and icons that add a never ending cascade of popups and panels for you to scroll through. The result was that I spent more time squinting at button tooltips than playing the game. Despite all the extra UI buttons I still can't find what I'm looking for most of the time (I'm looking at you events organiser screen)

What really lets this game down though is the core gameplay loop. Its just dull. You set up some rooms, click the ""start year"" button and survive a barrage of whiny requests for ""a new bench"" or ""a guitar poster"" (once you've filtered out the incessant monthly profit/loss mails - what was wrong with the TPH style popup!? )  which you dutifully plonk down (literally anywhere) to push a happiness bar up. The academic year ends, some more bars fill up. your progress to ""X/10 students passing whatever"" goes up and you rinse and repeat until you get your next star. 

I was able to define a winning strategy for this game which was to start the year, leave it running in the background for 5 minutes whilst I did something else, return and fulfil all the requests, repeat the cycle until the end of the year and repeat. In my opinion, any game where you can spend  half of your time not playing the game and still win is doing something wrong

You also spend an inordinate amount of time designing rooms to be nice looking. For people who enjoy the sims, that's great, but I've never wanted or cared about attractive rooms. I'm much more interested in playing the game and beating its management challenges. Two Point Hospital was great in that it gave you the choice - want to deck all your GP's offices out with posters? go for it! Want to completely ignore it and occasionally crank out a prestige 5 room to stop a staff member leaving? That's cool too! Being forced into becoming an interior decorator was really not what I wanted to spend my time doing.

After TPH's fast-paced, challenging and complex, but intuitive, overlapping game systems, TPC feels like a ""dumbed down for casual gamers"" clone that somehow manages to port across all of the individual parts of TPH whilst completely losing the heart of what made it great. What a shame",1661002937,1661002937,False,12,1,0.654545426368713379,0,True,False,False
1649080,120938933,76561199142804252,0,1,5504,0,631,1678459143,I loved the original Bullfrog Theme Hospital game and I was thrilled when I learned about Two Point Hospital. Two Point Campus is another great extension of this concept and just different enough in game mechanics to not just seem like a complete repeat. Loving it so far.,1661001395,1661001395,True,0,0,0,0,True,False,False
1649080,120937623,76561198009667110,0,165,10524,0,104,1707809354,"I've spent an embarrassing amount of time playing Two Point Hospital and the old Theme Hospital.

Starting Two Point Campus, the formulae are already familiar and the general interface is very similar. So far, everything is just better. Room design and editing, object placement, and notifications are all refined in so many little ways that it adds up to a huge improvement in UI across the board.

I never recommend games at full price, but I think this is worth it.",1660999670,1660999670,True,0,0,0,0,True,False,False
1649080,120931441,76561198425883494,0,1,2696,0,1338,1666962979,"For Me TP Campus, is incredible, I am a Long time Sims player, and have enjoyed this and TP hospital far more,
Highly recommend, its fun and challenging with enough to make it personally creative! 

 <3 LOVE LOVE LOVE Two Point Campus.",1660989728,1660989728,True,2,0,0.523809552192687988,0,True,False,False
1649080,120928501,76561198030942656,0,1,3079,0,2406,1661024488,"This is a great addition to the ""Two Point"" franchise.  It carries on from Hospital and means that players who know that title won't have such a steep learning curve.

It is NOT, as some people have suggested, just a new skin however.  There are plenty of new mechanics and gameplay.  A few times I have found myself wishing I had a little more control over errant Sims (sic) ;) but maybe that will come with time.

I was getting a bit tired of Hospital.  I felt some of the DLC was a bit contrived.  But this has me captivated again.  Great work Sega.",1660984348,1660984348,True,0,0,0,0,True,False,False
1649080,120916762,76561198108389713,0,4,10901,0,382,1701034005,"If you like Two Point Hospital's quirky characters, the announcer, and game play, you'll enjoy this game.",1660962329,1660962329,True,0,0,0,0,True,False,False
1649080,120916299,76561198056209846,0,1,8076,0,3645,1700592280,"it is a fun management game, well worth the money",1660961565,1660961565,True,0,0,0,0,True,False,False
1649080,120910398,76561198282058572,0,5,677,0,677,1660878705,"I think it is a good game but once you have played it for a few hours, it is very repetitive from one sandbox to another. You keep on doing the same things over and over again until you get to a point where there are far too many buildings, students, and staff things to keep track of. Definitely not worth 40 bucks. 

Some things are pretty annoying:
1) Cannot build vertically. All rooms and buildings are single-floor only. When was the last time you saw a university with no multi-floor buildings?

2) Every room needs pointless decorations and knick-knacks to increase attractiveness and campus level. I don't understand why staff with their own rooms cannot put up their own posters and other decorations in their rooms?

3) The humorous take on classes seems funny at first but it quickly wears off. Would like to see some actual real-world courses, items, etc. in the game. Some aspects such as those of knight school and intruders are just annoying. 

4) Too much micromanagement in some aspects of the game. You sometimes need to manually assign a private tutor to students who are at risk of failing. Seems enough at first but when you have multiple courses each with 3-4 years of students, it quickly become tiresome to do these assignments manually. 

5) Too many pointless or annoying notifications about students needing love benches, specialty kiosks, parties or events that bury some of the important ones such as students needing items to complete assignments. 

Overall, I think I just find the whole game a bit juvenile and over-the-top for my liking. 

",1660951060,1660951060,False,0,0,0,0,True,False,False
1649080,120907274,76561198018598516,0,70,922,0,532,1661232201,Lots of fun is had by all!,1660945842,1660945842,True,0,0,0,0,True,False,False
1649080,120906164,76561197997420219,0,5,1664,0,287,1662043982,n.a,1660944181,1660944181,True,0,0,0,0,True,False,False
1649080,120905549,76561197992738030,368,106,2388,0,2365,1671007980,It looks like they learned a bit from their previous attempt. However the radio hosts are annoying and announcer is very cringeworthy.,1660943283,1660943283,True,0,0,0,0,True,False,False
1649080,120904957,76561198117235306,0,5,2299,0,2299,1660941860,"I really want to like this game, I 3 starred the majority of the universities and only 1 starred the final 4 universities out of curiosity to see how long it would take to effectively ""finish"" the game. Unfortunately this game is far shorter than Two Point Hospital base game despite having the same number of levels.

Campus has lost some of the magic of TPH for me, it's a lot less active than TPH and feels a fair bit easier. It's disappointing to see that some courses are only associated with 1 personality, these personalities and the gimmicks such as Cheeseball are fun at first, but quickly became stale.

I can't in good faith recommend this game when TPH exists as an alternative, the UI is unintuitive and I sorely miss the ability to assign staff tasks from the main staff menu. The ability to make and edit your own buildings is a nice improvement on TPH, but that's the only positive I can give. The gameplay becomes too dull too quickly for it to be worth buying at full price, if the game really is calling to you please get it on sale and wait for quality of life updates to be added.",1660942421,1660942421,False,0,0,0,0,True,False,False
1649080,120904931,76561198057558068,0,2,1617,0,508,1694572171,If you like Two Point Hospital than you'll like this game too.,1660942388,1660942388,True,0,0,0,0,True,False,False
1649080,120904742,76561198016158271,168,5,2198,0,1099,1675571056,"I've never played a Two Point game but I was pretty excited when I saw this game was coming out. Its actually really fun, I love the designs of the classrooms, the customization of everything, and the humor. There are some cons, mainly how the game doesn't allow for different room sizes outside a square, and its not great at information sharing, but overall its very enjoyable.",1660942103,1660942103,True,0,0,0,0,True,False,False
1649080,120902134,76561197985434547,331,33,2879,0,2359,1671042829,great fun and addictive just like theme hospital and two point hospital.,1660938461,1660938461,True,0,0,0,0,True,False,False
1649080,120900628,76561198137634982,0,19,7887,0,3481,1704643135,"Students prefer to party than taking a shower just like in real life. 

Fun game to remember your college days. Now i want to play cheeseballs too.",1660936358,1660936358,True,0,0,0,0,True,False,False
1649080,120898369,76561198365946129,0,17,5047,0,1833,1705113354,Love it shall not spoil anything though. Wont be worth it if I do leave spoilers.,1660933175,1660933175,True,0,0,0,0,True,False,False
1649080,120897754,76561197977308969,0,5,272,0,272,1660275645,"If you have played Two Point Hospital then this will be a disappointment. This is basically a slightly less interesting reskin of TPH. If you have not played TPH then you may like this game. It's not terrible. My complaint is not that it's bad, my complaint is that it's almost SAME as TPH but TPH is better, so you'd be better off just playing Two Point Hospital instead of this, or go back and play it some more instead of this.",1660932320,1660932320,False,7,0,0.556886553764343262,0,True,False,False
1649080,120896474,76561197998329354,0,22,1295,0,415,1679146358,I have not gotten too far into the game but it has improved on a lot of two point hospital. The flow is great and it has the same charm as previous games.,1660930516,1660930516,True,0,0,0,0,True,False,False
1649080,120895446,76561198076715773,0,5,4786,0,374,1701883378,Another great game I hope they keep coming out with this type of content!,1660929240,1660929240,True,0,0,0,0,True,False,False
1649080,120890429,76561198011963525,198,10,3484,0,1474,1692289239,"Another amazing game from Two Point, with it's quintessential zany British Humour , from the names of your Teachers and students to the course names. its gets progressively more difficult but so far not impossible like I found some of the levels on TPH. 

If you enjoyed TPH or Evil Genius 2 then this game is for you.",1660922651,1660922651,True,0,0,0,0,True,False,False
1649080,120884874,76561199093924415,0,13,905,0,439,1670084787,great like awesome meatballs,1660915518,1660915518,True,0,0,0,0,True,False,False
1649080,120876614,76561198107566795,0,131,63,0,63,1660901950,"I did like it, but not enough to make it worthy of £35.",1660902032,1660902032,False,6,0,0.560827970504760742,0,True,False,False
1649080,120875885,76561198030860358,81,9,773,0,479,1706544767,"Sorry to be one of the naysayers, but I'm bored already after two campuses. It's technically competent as a game and an improvement on Theme Hospital, but the thought of having to start yet another campus from scratch fills me with dread - it's a chore.",1660900813,1660900813,False,7,0,0.586653292179107666,0,True,False,False
1649080,120873534,76561198447979974,96,11,1823,89,96,1707936860,"The concept of TPC is absolutely fantastic. Particularly, humor it still has.",1660896391,1660896391,True,1,0,0.523809552192687988,0,True,False,False
1649080,120653716,76561198019014829,441,105,1700,0,1207,1689618567,"Frankly... If you have played one scenario past the tutorial to the end, you have played them all.
A wizarding school plays the same like a gastronomy school, plays the same as a knight school. Nothing ever changes aside from the roomtypes. 
You can't even get particularly creative, because the themes of each map are determined by the map itself, Once you start a school year you essentially just sit around and twiddle your thumbs, unless some kind of emergency occurs.  There's not point in really caring about the students, they dont even care about themselves and deplete all their needs regardless of how close the things they'd need are. And so long as you dont put everything on the literal other side of the campus or completly ignore their assignment requirements, they will end the year with an average of A anyway. 

Its kinda just a dress-up game for buildings. There is no real noteworthy economy simulation going on, there is no real education simulatiuon going on. you do not care about your students, teachers nor other employees",1660536005,1660883911,False,1,0,0.497942358255386353,0,True,False,False
1649080,120867118,76561198065042188,0,3,337,0,311,1668144772,"What I like about this game is that I can do a lot of things. Restart whenever I wanted to without losing what I unlocked. I think the only problem I encountered was moving/deleting items in a room. Most of time when I click on the time, the whole room is selected instead of the item I wish to remove/move. But not really a big hindrance from letting me enjoy the game.

Recommended if you just wanted to do a mixture of sim-like game + idle game (idle in a sense that you watch those students and teachers do things hehehe)",1660882639,1660882639,True,0,0,0,0,True,False,False
1649080,120847190,76561199133267638,0,4,11751,0,182,1707847223,It`s great!,1660847957,1660847957,True,0,0,0.462962955236434937,0,True,False,False
1649080,120840497,76561197996417387,387,3,6905,0,810,1706302861,Make people smarter or funnier or whatever I dunno,1660838647,1660838647,True,0,1,0.485436886548995972,0,True,False,False
1649080,120838527,76561198007915768,0,9,5223,0,1992,1662562435,"If you are a TP type of game enjoyer, don't miss this one it's the same quality game (even if the graphic engine is the same as TP Hospital).
If you are new to the franchise, it's unique style as a building/management game must be tasted at least ones in a gamer lifetime.",1660836050,1660836050,True,0,0,0,0,True,False,False
1649080,120834862,76561198120918803,155,13,3883,0,1921,1665242135,This game has me continuously playing. I am enjoying it so much that I have added to my streaming list! Well done devs!,1660831033,1660831033,True,0,0,0.485436886548995972,0,True,False,False
1649080,120833418,76561198850798447,0,1,15181,0,3500,1692638865,"Fantastic sequel to Two Point Hospital, would recommend for anyone who enjoyed TPH but also anyone who enjoys management style games.",1660829007,1660829007,True,0,0,0.485436886548995972,0,True,False,False
1649080,120831040,76561199011141420,30,19,784,0,282,1688736569,Good Game Very Good Tips,1660825291,1660825291,True,0,0,0.485436886548995972,0,True,False,False
1649080,120382705,76561198008665334,0,5,1755,0,174,1701617775,"If you enjoy playing Two Point Hospital and/or the classic Theme Park/Theme Hospital titles, then you will have fun playing Two Point Campus! So far, I've only played just under 3 hours, which means I've only experienced the content at the start of the game. Its very good so far.

The game is a joy to play! Lots to see and do. If you love your sim management games, then this is for you.

Thumbs up!",1660125216,1660818188,True,5,0,0.534928083419799805,0,True,False,False
1649080,120819043,76561198118533162,0,3,2770,0,1027,1661540646,great game,1660801029,1660801029,True,0,0,0.480336219072341919,0,True,False,False
1649080,120810079,76561198088715087,0,9,1851,0,487,1698193687,I would definitely wait for a few patches because the game can be extremely frustrating and some of the room capacity issues are rampant.,1660783087,1660783087,False,2,0,0.502651095390319824,0,True,False,False
1649080,120807547,76561198022527897,0,3,7388,0,1912,1705349109,"Great game, and very worth the price.",1660778563,1660778563,True,0,0,0,0,True,False,False
1649080,120806743,76561198182554938,0,6,13555,0,1033,1676347727,Good game! Great sequel to Two Point Hospital. Looking forward to DLCs!,1660777166,1660777166,True,3,0,0.556234240531921387,0,True,False,False
1649080,120805965,76561198078942593,0,2,3190,0,472,1675340851,It good,1660775886,1660775886,True,0,0,0,0,True,False,False
1649080,120803436,76561198412177349,61,16,3366,186,1169,1708834681,What's not to like? It's what it says on the tin. Love the references to the previous game!,1660771888,1660771888,True,0,0,0,0,True,False,False
1649080,120801631,76561198375220408,0,11,2498,0,435,1693873577,Very cool sequel,1660769175,1660769175,True,0,0,0,0,True,False,False
1649080,120798600,76561198025146354,0,1,18034,0,2997,1695832022,"TPC is super fun, but like everyone else is saying: easy. With Hospital I could complete 1or 2 stars fairly easily but 3 stars across the board took a bit more research to make happen... and that took a couple of months. With Campus, I'll probably be 100% complete by next week.

I want to reiterate I am still having a lot of fun with this game, but am hoping future DLC content adds more challenge. The scheduling detail has a lot of potential for that challenge, but as of right now indifferent to complete levels.",1660764742,1660764742,True,2,0,0.545454561710357666,0,True,False,False
1649080,120796973,76561198070256001,304,9,6703,0,1093,1680287926,"Excellent game, as good as Two Point Hospital which is my all time favourite. Definitely buy this game, I am utterly addicted!",1660762575,1660762575,True,0,0,0,0,True,False,False
1649080,120792883,76561198108929961,0,47,1234,0,318,1661453837,,1660756914,1660756914,True,0,0,0,0,True,False,False
