1839950,159268327,76561198331471575,283,9,1252,1252,1252,1708923891,"A super fun game, Worth the buy in my opinion. A few shortcomings though, the game can feel like it forces you to save scum in certain scenarios. For instance, the enemy ai can rocket you from the fog of war without any way of predicting or preventing it besides reloading and being more careful. So the ai clearly have that typical advantage of not actually being blinded by fog of war so your just playing at their mercy. 

I started the game on realistic but holy hell dont do that. The aforementioned issue is exacerbated tenfold as any and all of your units become made of paper. and the ai become literal Terminators (lol) with that i mean they become insanely more tanky by a large margin, and will wipe out anything you send at them. Only my Abrams and the founders rocket unit with the javelin can stand a chance, Forget using any of your other units, especially your infantry which will die immediately in any gun fight since the enemy infantry are dialed up to eleven. But that was on realism difficulty, story mode if far more forgiving and beatable without losing your entire army in a single skirmish.

The story is not terrible, we could of got a lot worse, but instead we got a return to a style of story i haven't really seen since i was a younger. Just a story to be told with fun and challenging missions and a narrative to keep the pace going. Nothing too serious. I love all the optional objectives, makes the missions feel a lot more fun and getting some useful units or gear is always nice. 

Not sure how we are suppose to move around the map with limited supplies. I guess we are suppose to keep our army pretty small if we want to back track or go out of the way? No matter what i did i couldn't get enough supplies to do any of the objectives on the travel map. Much less travel to, say the integrator camp for the best upgrades. That was literally impossible. Idk maybe i didnt fully understand the system, i just keep selling extra vehicles for goodwill and the mission rewards would give me enough to move forward but any type of excursion out of the main path was not going to happen when you have 3 days of supplies and the main objective is 3 days supplies travel but that juicy integrator camp is also 3 days travel the OTHER way, what, do i have to sell my entire army off just to visit some out of the way side task? 

All in all its a fun game with potential, I hope they will add workshop to the game, it would be really great to see what kind of mods this game could inspire. I think it could really benefit it and mod probability is a good way to promote your games longevity.",1708887044,1708937106,True,4,0,0.568627476692199707,0,True,False,False
1839950,159310603,76561198007190384,0,7,3108,3108,3077,1708937612,"If World in Conflict and Call to Arms had a baby, that would be it.",1708935745,1708935745,True,0,0,0,0,True,False,False
1839950,159310528,76561198093826251,223,35,874,874,874,1708935400,"The game is really fun. Very satisfying to gun down enemies with your tanks but take care, if you blink they might go Boom. The AI is annoyingly persistent and packs a punch. Resource management and micro management are key to surviving each mission with minimal losses. Graphics are Good, gameplay is fun, Audio is Good. For people who like a challenging strategy game with no base building,have a go, it's worth it!",1708935626,1708935626,True,0,0,0,0,True,False,False
1839950,159309724,76561199054066102,48,2,368,368,368,1708912563,"Look I love a good terminator game but if I'm being honest setting it in the Dark fate timeline is so stupid but thats something I can look past, but what really annoys me is:
When using trailers for the truck's instead of doing a turn the truck will instead reverse into the trailer and they'll both slide along the road.

AI path finding is shit, I had a single guy running headlong into a wall because he simply did not understand that his squad had gone into the door 4 feet away, not to mention that units will collide and run against each other instead of simply avoiding each other.

Some Positives:
I like the branching options in some levels, like I can help this guy and anger another guy, save this guy or do this objective for some extra troops or weaponry.
The Fact you need to rearm and repair your stuff between missions and have the choices to attach weaponry and extra armour to vehicles.
 
Now do I think this game has potential? Yes.
Would I waste $50AUD if I knew about these issues? Depends, I do like Terminators and Real-Time Strategy Games but at the same time this game only recently came out so I could only hope it gets better over time.",1708934289,1708934289,False,0,0,0,0,True,False,False
1839950,159307894,76561198006942634,0,32,2190,2190,2190,1708930946,"Has some Janky game mechanics and UI needs some work, nothing that cant be fixed with some patches, overall I feel the game is pretty kick ass, the features that do work overshadows its short falls, totally recommended 7/10, decent fun to be had",1708931308,1708931308,True,1,0,0,0,True,False,False
1839950,159030369,76561198126951567,163,13,1487,1487,1487,1708923305,"I am not sure how I feel about this game. Its actually really fun and pretty good, but there are bugs that make it very very hard to recommend if you are a serious player. First is a relentlessly brutal mission system. This would not be so bad, but Auto saves go from frequent after finishing every major objective to, GG you get like 2 auto saves. Frankly I am stuck on like the third map and its not hard but I have saves and auto saves that set me back 20 or 30 minutes of progress. I Highly recommend save after every time you do something significant. Another thing adding onto this is that in the 3 main mission, you have cut seen fights, cut seen fights you can lose. Which means that the mission failed and you have to start over. These are optional fights but there almost no point in doing them because you have no control and there is a risk that you will lose whatever you have done between major objectives and doing the optional objectives. Finally the game is actually kind of buggy. This is by far not the buggiest day 1 game, but it becomes very obvious. Units can get stuck on each other because they are going around a corner. Units will be stuck holstering and equipping their weapon, I have seen it happen 7 or 8 times back to back. You sometimes just have to span movement button because fundamentally the units are just stuck on nothing or their path finding sends them not only the longest way but also the most enemy infested. 

The biggest thing that make me not want to recommend is the randomness. I enjoy some random aspects, missing 8 anti-tank rounds back to back forcing them to be resupplied is not something I enjoy. There is no way other than experience to increase accuracy but maxed units still have a fairly high chance of missing there target.

The game is fun, and realistically I am playing on Medium difficulty and trying to save as many units as possible. I usually go middle of the road between easy and hardcore mod so I usually do either Hard or medium mode depending on the setting available. But I highly recommend the first time going through the game play on store mode unless you are an expert tactical gamer. So I guess I will recommend, the game is actually fun and other than an inconsistent auto save system and extreme punishment on lower levels its not bad. Normal or Medium is what I believe most developers make as a their intended difficulty so if that is the case I believe they did a good job balancing so far nothing feels unfair but at the same time you will wish you had a Commissar to execute some of your men because I believe they are working with Legion with how often they miss.

Edit: I know why I have a love hate relationship with this game. This feels like Fallout Tactics, and This game is much more infuriating. In Tactics, love it or hate it, but you had like 4 units, and everything was balanced around that. Terminator however does not know how many units you have, You have extreme amounts of units to compensate. I can kill 700 units and they are still getting reinforcements. They will flat out say that They don't have reinforcements, yet they constantly have more units. If you could dry the forces it might get Easier but they are never drained, you will run out of bullets before they run out of men.

After playing some more of it and thinking more on it... I can't recommend the game. The game is simply too hard and is not challenging, but frustrating. I have like 8 squads of Militias, 2 of Infantry and 2 skirmishers. Militias are trash and you can't spend resources to turn them into proper Infantry or Skirmishers. So in reality I have to push with 4 units. I have like 8 vehicles but most missions I can't bring them in. You have no way to Replace units during a mission so if you loose too many Skirmishers or Infantry you have to pull them back and if you don't you will lose that unit forever. In any other RTS I would say okay, Do this and this and then it will be fun. This is almost like you are so pissed off that you can't help but continue. I mentions wanting to shot some of my men for their accuracy, Well it is just as bad if they are firing guns or tanks shooting rounds. You have 600+ enemies and 40+ enemy vehicles. You have such an absurd KD ration is that the best options is slowly push to your object hold make sure you get an ammo trailer and truck to pull it and just keep replenishing your troops ammo as you push, but don't get to bold because, while your AT misses every other shot (usually they miss 2 or 3 and hit Once), the enemy hits every shot unless you duck behind a building (even then the round just might get luck and go through it). Don't play unless you want a game so annoying that you can't help but play it. Also I turned this down from Medium to Easy or Story mode, and its better but the AI opponent is great at firing rockets at your tanks and just bad at everything else.

Edit 2: I love this game but I honestly can't recommend it. Every mission takes between 4-5 hours. And I think my biggest issue remains the path finding and accuracy of units. I am in mission 6 with 3 Abrams tanks and 4 BFV and I will watch as they miss every shot on an opponent tank despite 2 of the units being max level experience. If there was less randomness I think I could recommend the game. Usually I advocate for more randomness, but in this instance I believe that the randomness is almost too unrealistic. A M1 Abrams can hit a moving target at a range 2100 yards. If you were playing as movement or Cartel I might understand but the main faction is basically the last of the Military and highly trained yet they can not hit a target 20 feet away? Pathfinding isn't the worse but I really have issues how when a unit moves they keep moving for 3-5 seconds after you give another command. I will tell them to enter a building just then tell them enter the building they are next to and they run to the other building just to run back and Units look like like strings when they leave a building and don't stay together. Slytherine please fix path finding and the unit accuracy and I can actually recommend the game. I will concede I am trying to save every unit I can possibly save, but I like doing challenge runs and my challenge was to save as many lives and vehicles as possible. But the challenge should come in on difficulty level and not base mechanics of playing the game like movement and firing. I am at the point I can not trust my units to take on a target so I blob all my vehicles and just send them in to slowly pick apart the enemy.",1708665782,1708927958,False,0,0,0.511225461959838867,0,True,False,False
1839950,159304290,76561198035002181,915,19,295,295,295,1708674786,"in it's current state i can't recommand the game have many absurd mechanism , you want to save more troops ? you get punish for it by an absurd upkeep, you have ammo and fuel truck but you also need to resupply them ( there should be infinite ressource for fuel and ammo truck and very valuable if lost in battle you restart ) , other issue being that your troops are too squishy while enemies unit too difficult to kill, the second open world mission of the game is a good exemple go and kill a convoys of 5 tanks while you ATGM unit , tank and other unit can't even scratch the paint while the enemies just can shoot your drive off, burn your vehicule or literally blow it up in 1 hit

it's a good game but Filled with absurd mechanism it feel like they mixed alot of genre together and came up with this abomination of a game",1708925527,1708925527,False,0,0,0,0,True,False,False
1839950,159302912,76561198869467129,0,1,1589,1589,1431,1708937726,This is the first realistic RTS I've really played and I've loved learning how to play.,1708923537,1708923537,True,1,0,0,0,True,False,False
1839950,159302820,76561197997578035,0,4,3028,1800,2997,1708935262,On of the few RTS games that made me have to actually think and plan... 100% recommend!,1708923407,1708923407,True,1,0,0,0,True,False,False
1839950,159301978,76561198006576860,0,74,32,32,32,1708922031,"This will probably be a good game, when it's finished.

It's not finished yet.

Skirmish mode isn't even close to finished.

Otherwise, the graphics are ok, the sound is ok, the story is bland and uninteresting.",1708922223,1708922223,False,0,0,0,0,True,False,False
1839950,159300279,76561198023208567,816,25,26,26,19,1708919856,"The game has next to no Ultrawide or higher res support, if you attempt to raise the res to a like 21:9 it will just cut all the menus off, the launcher has no settings option either so you have to go into username documents, the games files, then change it via the XML config file to even get the game to launch again without crashing.

It's literally unplayable if you run ultrawide.",1708919770,1708919770,False,1,1,0.4634723961353302,0,True,False,False
1839950,159205094,76561198094989483,261,19,598,598,598,1708918744,"While this game can be fun in its current state the bugs and bad ai make the game frustrating and almost unplayable. Tanks and other units won't engage hostile armor when within range and in clear line of site. Allow the enemy to steam role you as they just roll up to you with their armor unopposed. Not to mention the trucks with weapon turrets can get stuck in the air and are just frozen with no way to move them or de-crew them. Until they do some patching I can't recommend this game at its current price point.

Also for example, there's a mission where you infiltrate a human drug cartel and spark a revolution to over throw them. When this happens at one point you can bring reinforcements to the fight which get slaughtered as your units spawn stacked on each other and the cartel will bring in artillery from a tech encampment to shell you which has god level accuracy and basically locks you into the mission as its almost impossible to beat so you can't progress the game without losing everything you have.",1708828905,1708919007,False,1,0,0.439014434814453125,0,True,False,False
1839950,159298792,76561198020437196,0,8,463,463,463,1708916160,"I enjoyed the starter levels immensely but by the desert level (3 or 4) the game became slow, very slow, and very forced. I found myself having to slowly run from one place to another then back again just to get to the beginning of the level, and then all over again... and this was not on story mode. That hour of my life spent trying to get the mission going was the last hour they are going to get from me. There are good parts to this game, and parts that feel overlooked and the later weighed more than the former on my time.",1708917765,1708917765,False,0,1,0,0,True,False,False
1839950,159297819,76561198007815153,0,14,32,32,32,1708915800,"got two missions in and I could already tell the game wasnt for me. I went in blind, never watching and spoilers on the gameplay, I just new it was Terminator so ""fuk yeah"".

That being said, its tough where to start. The overall UI is super cluttered and unit management isnt smooth. The, for the 30 minutes I played it, the game just felt clunky. I expected it to just ""grab me"" and Id be playing the hell out of it.

Im gonna say no to this one merely because it feels like it needs one more level of polish and even a 50% increase and the overall game speed.",1708916489,1708916489,False,0,0,0,0,True,False,False
1839950,159297530,76561198079819170,0,4,628,628,266,1708937980,"I would recommend it's very unique for an RTS game you have to micro-manage nearly your entire army while also making an effective army. But the missions still need to be changed as some of them take hours just to complete.

Overall It's a fun game",1708916096,1708916096,True,0,0,0,0,True,False,False
1839950,159296127,76561198292575403,0,4,362,362,362,1708576741,"Its an interesting concept, and I love the idea of building up an army to fight an army of terminators, but the balancing is WAY OFF. It relies way too much on savescumming, and drags the game down from any fun it can be. Get it when it goes on sale, and once they balance out the game way more than it is now.",1708914293,1708914293,False,0,0,0.477941185235977173,0,True,False,False
1839950,159295805,76561198007301544,0,1,3631,3658,3399,1708927848,"Very fun, Reminds me of the WW2 Sudden Strike games when they were still fun and challenging......just with killer robot dogs now.",1708913837,1708913837,True,0,0,0,0,True,False,False
1839950,159292941,76561198217994511,187,3,2346,2346,2329,1708911029,"Deeeeejm that scratch my itch and hunger for good, nearly perfect RTS.
Story is nice and catchy
You care about your units bcs u need to, kinda Homeworld-ish but with complex resource managment
Its unforgivable with strategy, u need to find a way (a lots of Quick Saves like in old times :D)
Graphics and atmosphere is on point for this theme
No bugs or crash on my side

Not much options for skirmish, 4 maps 1v1 but i believe there will be more in future
Overall well spent 35€, enjoyed every minute of it (39 hours on record)

thanks for a good time and gimme continuation",1708910266,1708910266,True,0,0,0,0,True,False,False
1839950,159291352,76561198434244556,119,15,321,321,199,1708915782,Its hard as hell but its also a lot of fun though youll do a lot of save loading but if you enjoy that and multiplayer battles you will enjoy this,1708908367,1708908367,True,0,0,0,0,True,False,False
1839950,159291235,76561199258396500,0,5,273,273,273,1708907393,"This game is way harder than i though for a story mode, I got ravaged on the 3rd mission like butter.
Please tone down the difficulty for new players",1708908230,1708908230,True,0,0,0,0,True,False,False
1839950,158943197,76561198230570976,0,19,3101,3101,3101,1708899270,ADD SANDBOX MODE,1708573430,1708903467,True,0,1,0.49011528491973877,0,True,False,False
1839950,159287014,76561198090258897,0,21,706,706,590,1708910175,"I, personally, have had fun with this game at times, however I don't think many other people will. The game throws lots of very good units at you very quickly, and has a very very fast time to kill in engagements. It gives you a very big toolkit, some easy logistics, and a persistent army that you can tailor to your playstyle (in theory) BUT in the campaign you are kind of railroaded into choosing very safe options to safeguard your units, and will still lose a lot of them as you play and the game just feels very at odds with itself. Like the low time to kill combined with an inability to replace downed squad members in mission just feels like it's conspiring to bleed you dry of all good combat capability in the first third of a mission and leaves you kind of scrambling to try and work around not losing your damaged squads for the rest of the mission while still completing all of your objectives with a dwindling supply of men and vehicles. It's just not cohesive. I'm still going to finish it, because I AM having some fun with it, it's just not as much fun as you could be having with say, Homeworld or one of the old Total War games.",1708903141,1708903141,False,1,0,0.503803551197052002,0,True,False,False
1839950,159285686,76561198051144644,142,1,3892,3892,3848,1708937797,PLEASE FIX PERFORMANCE. The start of the campaign isnt horrible for fps but could be better. Deep into the founder campaign i'm now getting 20 fps on urban maps. Its giving me a headache even trying to look at the screen. Your game is a gem other than this,1708901689,1708901689,True,1,0,0.523809552192687988,0,True,False,False
1839950,159285291,76561198057473543,0,1,458,458,458,1708901206,Game is way too hard. 700 things to manage at a time. way too many objectives per mission.,1708901275,1708901275,False,2,1,0.495111584663391113,0,True,False,False
1839950,159283717,76561199012870872,0,15,708,708,477,1708922870,"Needs a lot of patching done, not even on the 5th mission and im experiencing constant screen hangs (game continues but screen frozen). this inst a full release, give this game a couple more months. wait to buy, save the headache of troubleshooting.",1708899666,1708899666,False,0,0,0,0,True,False,False
1839950,159283316,76561198011332472,0,20,1485,1485,901,1708934271,"Apart from being guilty of having a rather messy name Terminator: Dark Fate - Defiance is a solid RTS/RPG hybrid.

I haven't tested Skirmish or Multiplayer yet, so I can't comment on those. But the Campaign is a lot of fun,  if misleading. 

The Campaign is not a straight forward RTS, you don't build a base/units and try and sweep the enemy from the map. instead it plays a lot more like Jagged Alliance with a touch of Fallout: Tactics. Your ""Army"" is made up of units/vehicles you scavenge from the field or trade for from friendly settlements each unit levels up and can be further specialised with unique abilities and equipment load outs. 

Your supplies are finite and need to be carefully managed, it maybe awesome to have that M1 Abrams with a plasma cannon, but it's also going to cost a fortune in supplies to keep it battle ready. What this results in is you needing to make difficult decisions about the composition of your army,. You also can't do everything in every map, your choices will matter (at least they have so far) so you need to choose your objectives carefully and learn to live with the consequences.

You are a guerrilla force facing off against a far superior enemy with almost limitless resources. You don't get the luxury of being able to take everything for every situation, you need to be focus on modifying/enhancing the strengths of your army.
To that end the game gives the player a lot of freedom in just what that army's strengths are. There are many options with many different ways of customising them. You could have a very small but powerful force of high-tech modern units that cost a fortune to maintain and are hard to replace, but can hit like a sledgehammer and are too stubborn to die easily. Alternatively, you could create a highly mobile force of cheap/disposable vehicles that are specialised in ambushing and hit-and-run strikes or a Mad-Max style army of modified Semi-Trucks and trailers all heavily modified with scrap armour and as many guns as you can modify the chassis to fit.

Overall, Terminator: Dark Fate - Defiance will most likely appeal to those who enjoy games like Jagged Alliance or strategy games that include a focus on Logistics and Strategic Army Management. If you are looking for a Starcraft style RTS with endless amounts of units smashing against one another, you will be disappointed.",1708899274,1708899274,True,1,0,0.523809552192687988,0,True,False,False
1839950,159282593,76561198170658781,147,20,15,15,15,1708898311,"i have a up to date computer nothing was running went to lowest setting very bad glitches and game running slow , btw my pc is 2022 computer great hard and ram drive",1708898522,1708898522,False,1,0,0.523809552192687988,0,True,False,False
1839950,159281873,76561197994025561,0,7,1186,1186,1169,1708917101,"I want to recommend this game, but I can't. It's a terminator game in the ambiance of a different timeline I'm not used to, but that isn't the issue here. The issue is that the first four missions are a struggle (was playing on hard), but I felt there was something more I could do and just do it better. The fifth mission, the cartel mission, is damn near unplayable. It has infinite spawns for the enemies so you can't wait them out. Half the mission is based on RNG randomness, but you can stomach through it. But in the last part of that mission, it is almost impossible. 

I've been checking the discussions to see the strategies people use, but in this strategy game, there is only one way to tackle the 40-60 minute mission that has to be followed perfectly. Worse, even if you follow it perfectly, you can lose an essential squad in two seconds and the mission becomes unplayable and you have to reload. I've reloaded the same save about 10-15 times trying to push through it, going so far as to drop the difficutly.

The point of this rant is that until this gets fixed, I can't recommend the game. It has so much potential and some difficult but rewarding mechanics. But that mission.... it breaks the flow, makes me hate the game, and I can't play it until it gets balanced. 

I'll delete my review if/when they fix it, but damn, I am broken and frustrated with this game that I was fervently waiting for.",1708897831,1708897831,False,20,2,0.632604002952575684,0,True,False,False
