1839950,159213282,76561198022759252,0,7,188,188,188,1708835736,"If you take the base concept, it's good. If take the mechanics it's good.  If you take the IP, it's ok (much prefer Skynet to Legion tho.) If take the scale, it's decent. But when together, it's a fucking mess. So first off, you gotta worry about individual members of a unit, but you can't reinforce except outside of a mission. Which can make some units fucking worthless, like say a sniper team down to 1 guy, or the ATGM team, down to 2 or 1. Add in the seeming ability for some guys to one shot, it makes infantry play a nightmare. Not to mention the sheer scale of the missions just makes the game unfair. Like I get that humans are squishy and outgunned, but when I gotta deal with a convoy of 3 tanks, when I have none, and the enemy tanks can repair and one shot my vehicles, it's not fun. Add the confusing branching objectives that can be complete bs, like when you need to hide and then engage Legion with a timer, when you're across the damn map, is bad game design. I should not have to spend upwards of 3 hours on a mission.",1708838109,1708838109,False,3,0,0.505890071392059326,0,True,False,False
1839950,159212995,76561198041694214,321,2,725,725,465,1708853700,"Overall it is a fantastic game, great RTS with a solid story, if a little absent minded with command structures and forced with some of its lines, It does kick me out of missions to the main menu every now and again.",1708837783,1708837783,True,3,0,0.526217222213745117,0,True,False,False
1839950,159207761,76561198028354902,0,84,1101,1101,759,1708928377,"Bloody Hard but fun, loving the campaign for sure and the skirmish is decent enough (Playing as the robots is awesome of course)",1708831957,1708831957,True,2,0,0,0,True,False,False
1839950,159207230,76561198038030046,0,1,456,456,334,1708849951,"I'm a simple man. I wanted to watch M1 Abrams duel ChatGPT drones with laser rifles. I got my wish.

...also its actually a pretty darn fun RTS too, and I haven't encountered anything wonky. IMO worth the full price; if in doubt, definitely something to pick up on sale.",1708831361,1708831361,True,4,1,0.545780956745147705,0,True,False,False
1839950,159206608,76561198205803979,0,28,1095,1095,889,1708878122,"I love this game despite its shortcomings in many aspects. Its obviously based in the Terminator Dark Fate universe which means a period of transition between projectile weapons and plasma weapons and I love it.

The gameplay is a cross between Company of Heroes, Men of War and Battle Brothers which works really well.

I hope the devs keep supporting, adding content and fixing the rough edges. I also would like to see better camera control, something like the Total War or Homeworld or Wargame type camera control (more vertical pitch). That would make it amazing/immersive",1708830604,1708830604,True,0,0,0,0,True,False,False
1839950,158930879,76561198881517031,0,16,414,414,414,1708830170,Yay i waited so long for this game. I'm enjoying it. I'll come back later to give my thoughts. The game seriously needs CPU Usage optimization it freezes whenever action is happening.,1708559571,1708830372,False,0,0,0.432156264781951904,0,True,False,False
1839950,159206164,76561198080346937,303,3,232,232,232,1708688886,"I did enjoy the demo so I was looking forward to playing the game. The first three missions (that you play through in the demo) are legitimately quite good, surviving against a dangerous army of robotic killing machines and escaping missions beat up but still barely hanging in there to continue raging against the machines feels SO right for the setting. The first few four or so missions and skirmish matches (though I haven't had much time to dabble in them) showcase the game at its best and it is a legitimately solid RTS, especially if you're a fan of games like Syrian Conflict.

Unfortunately, the game drops the ball pretty hard after its solid start. 
To start with the campaign's strategic layer, each mission leads into the next, remembering your decisions and keeping your army in the state it was in last battle. If you lose a soldier in a squad, that squad will be down a member until you find a replacement, and a squad or vehicle being blown up is dead for good (including named hero units! RIP big bob). Units take up supply and you need to manage the size of your army to make sure you can keep up with their demand.

This sounds like a great idea on paper, but in execution, this leads to losses being punishing in a game with very high lethality. Battles are large, its hard to keep track of everyone, and that's troublesome when every lost vehicle or squad screws over your future prospects. An ATGM or plasma cannon from across the map obliterating your Bradley in a single hit or Rev 9 terminators eviscerating a ranger squad with pinpoint precision would be fine if units where more expendable or battles where smaller/easier to micro. Neither of these conditions are true, so good luck trying to control upwards of 30 units when trying to minimise losses for the next battle. Thankfully, the developers do provide a mid battle pause function to help, though pausing every 10 seconds to check three seperate battles and make sure my units in buildings aren't staring at walls instead of shooting through windows isn't exactly my idea of an engaging RTS. 

In battles, vehicles feel responsive and fun to control, they're probably the most enjoyable part of combat. Tanks feel like their namesake, technicals are appropriately potent for supporting infantry with machine gun fire and the various battle-trailers and weapons platforms the Movement trucks and dozers can pull are very thematic and fun to use. Sometimes pathing can get weird though, especially when shift clicking to queue up multiple orders (I find the game doesn't like shift click very much in general). You don't get a ton of vehicles, and they're limited by harsh supply requirements, but they're impactful and fun to use, right up until half your vehicles get obliterated from across the map by ATGMs and force you to reset.. 

Infantry, are, well, a mess. Like in similar games, they're able to garrison buildings and are somewhat fragile when outside of cover, so you'd hope buildings would work, but they're incredibly inconsistent. Infantry will sprint across floors to get to a window on the opposite side of where the enemy is coming from, then dash back to where they started, then go to stare at a wall and then go to some random window, which is hopefully one they can shoot the enemy from. If a building connects to another, like a prison complex being split into blocks, then don't even expect them to do anything to their enemy neighbours other than run around in circles and get their heads popped by snipers. Sometimes it works perfectly and my infantry conduct a good ambush while other times it makes me question if they aren't terminators in disguise trying to screw me over. 

So lets say you lose most of your rangers to rockets because they where too busy admiring the fine interior design of the gas station. They still killed the enemies in the end so you can just heal them up and send them back in, no need to worry about it. Except you do have to actually worry about it because you can't heal squads in the middle of combat. If the anti tank specialist gets his head popped like a watermelon by a laser sniper rifle provided directly from monolith HQ, that squad is ineffective for the rest of the battle against 80% of the legion roster, hope you're cool with your elites suddenly being a liability, where the best thing you can do is hide them in a corner somewhere so the squad doesn't get wiped.

The campaign just, doesn't fit together to form the vision of what its going for. Infantry are fragile but also most are too valuable to be used as cannon fodder, yet they can't be replenished once injured in battle. The various enemy factions are dangerous and lethal, and you're usually always on the back foot, but missions expect you to fight against superior numbers and superior technology and not only survive but win. Your supplies limit the ability to bring a huge force and instead encourage a smaller more elite warband, yet every battle expects you to be bringing the entire founders military in the opening and a full horde of movement rebels in reinforcements. 

The game had a great start and if the mechanics weren't actively fighting themselves, this could be a damn good RTS, not unlike something I'd play in my childhood, but at current, I cannot recommend the game. Slitherine do have a good track record with other RTS titles, so its even more surprisingly seeing how badly the strategic layer of the campaign meshes with the large scale battles. And what really sucks is the mission design is really good, each mission has an interesting premise and cool and unique mechanics to manage, and they would be great fun if you weren't worrying about the state of your army and if you'll have enough troops left alive for the next mission. The individual parts of the game are all individually good but everything goes up in flames once they're connected to the chassis of the game.",1708830080,1708830080,False,4,0,0.552957355976104736,0,True,False,False
1839950,159205661,76561198045107917,0,98,157,157,98,1708833893,"This game came out of nowhere and I really love it so far.  It plays a lot like company of heroes with a little bit more logistics.  The only thing I wish this game had was any kind of cinematic camera / freecam mode, the units look really cool and i wanna get up close and take pics of them!",1708829525,1708829525,True,1,0,0.444444417953491211,0,True,False,False
1839950,159205649,76561198021849114,0,2,1081,1081,446,1708937516,"This is a cool game, has the feel of men of war but it takes some effort to get the hang of and isn't for beginners. If you are not a good at strategic games you might have issues even on the so called easy difficulty, you will need to save a lot.",1708829510,1708829510,True,0,0,0,0,True,False,False
1839950,159204290,76561198023729375,0,11,918,918,707,1708873882,"Please, if you love terminator and have wanted an RTS, this is it! this game is awesome, and i cannot recommend this enough. after playing Terminator: Resistance, i definitely wanted something like this, and they hit the nail on the head. its hard as hell to beat, and you lose people left and right to the robot menace. but damn it makes you so happy when you beat em. only complaint i have currently is the New Tortuga mission has alot of RNG and you will get frustrated. just save before you challenge people, and then keep trying until you get the result you need.",1708828033,1708828033,True,0,0,0,0,True,False,False
1839950,159204277,76561198003081535,0,14,438,438,288,1708924595,"This is what I am waiting for.
It a very fun RTS tactic game.",1708828018,1708828018,True,0,0,0,0,True,False,False
1839950,159203319,76561198042714887,0,27,574,574,278,1708913819,"im a few hours in but so far from my experience its hitting alot of good boxes.

Essentially if you have ever played men of war Assault squad or Gates of Hell then you will be immediately familiar with the squad tactics, vehicle repair and recovery and so on.

it essentially takes that combat system, makes it nice and pretty (lasers etc) and improves on it a bit, the campaign so far is good and im enjoying the mechanics.

if you have never played MOWAS or GoH before and are quite new to this type of game, its simple really, hold your forces back and use counters against the enemy, enemy tank incoming? send forward the ATGM squad and kill it, enemy spamming infantry? hunker down and shoot them with your own, or better yet send a vehicle they cant counter at them.

the great thing is this game essentially hits that neuron in your brain of out tactic'ing your enemy by then having you take your loot and losses between missions, do better early means youll do better later but dont get too greedy cus you cant supply everything.

its probably the most effort any Terminator series game is EVER going to get in a while and what we had before and its also a pretty nice representation of the future war.

would recommend, definately!",1708826928,1708826928,True,0,0,0,0,True,False,False
1839950,159203288,76561198167942820,0,17,967,967,358,1708900616,"Отличная игра от Кошек (геймлей Сирии, музыка из Власти Закона)",1708826890,1708826890,True,0,0,0,0,True,False,False
1839950,159201270,76561198197023365,0,5,1995,1995,1454,1708931310,"Great game hard learing curve
",1708824700,1708824700,True,0,0,0,0,True,False,False
1839950,159200576,76561197971945981,0,8,796,796,796,1708824009,Made me question why I even like RTT,1708823927,1708823927,False,1,0,0.516129076480865479,0,True,False,False
1839950,159042877,76561198066330733,0,9,3328,3328,2407,1708929139,"I don't know what to say ...... just too much problem 
1. the unit slow and horrible respond 
2. weapon drop not very useful  .
3. Horrible UI design 
4. Cover system SUCK",1708681236,1708823843,False,6,0,0.47961890697479248,0,True,False,False
1839950,159196931,76561197964893195,0,12,660,660,376,1708898964,"Save scum the RTS.

I want to love this game; but when I lose a vehicle, use 1 too many ATGMs, and want to say 'It is what it is.' Nope here's a line of Legion armor. Now I have to go into the previous mission 3 hours ago to insure I have the 1 extra squad, the 1 extra vehicle it goes on and on. Scale of battles is too fucking massive for the persistent campaign.
This is CBT, nothing else, there's no fun.

I love the almost RPG elements that remind of an enhanced Fallout Tactics, the combat mechanics themselves are good; but fuck the campaign, fuck the FOUR skirmish maps. There's no content beyond the CBT, and it's so ingrained into the campaign itself that nothing could fix it without just redoing most likely EVERY mission. I might be wrong and the game stops torturing you after mission 6, but I don't want to flay myself trying to find out.",1708819991,1708821793,False,0,1,0,0,True,False,False
1839950,159197522,76561198083307130,321,10,475,475,475,1708733506,"Wish there were an in-between on steam reviews, but eh..

Many good ideas, but its built like a small unit tactics game while also fielding oddly large armies and very big missions.
Not a great mix.

I love the strategic layer, mission design and army composition (in the context of the persistence mechanics) are rather bad.",1708820649,1708821279,False,0,0,0,0,True,False,False
1839950,159198065,76561197997859213,0,4,2361,170,2341,1708821294,"Perfect tactical game: deep, versatile, complex, fun. Looks reasonably good as well.",1708821227,1708821227,True,0,0,0,0,True,False,False
1839950,159198022,76561199626944350,0,1,725,725,522,1708833423,"Im here from Syrian Warfare times, and YES i recommend this game! 5 stars!",1708821178,1708821178,True,14,0,0.631187677383422852,1,True,False,False
1839950,159197662,76561198093859628,0,9,1833,1833,1378,1708879115,I love that squads are persistent after a mission and that you can equip them with different weapons in between missions. This game is difficult even on normal difficultly but that's mainly if you let all your units die you won't be able to just build replacements you just get what the missions give you. Overall its a great game which seems to really fit into the terminator universe.,1708820792,1708820792,True,0,0,0,0,True,False,False
1839950,159195509,76561198140461579,0,1,1341,1341,479,1708912386,Very nice...,1708818506,1708818506,True,0,0,0,0,True,False,False
1839950,159194838,76561198014206982,0,131,615,615,429,1708924487,"I'll admit, I actually bought the game and returned it but something told me I didn't give it enough time to see everything it had to offer.

I'm actually happy I bought it again, because the game is pretty awesome! The campaign seems like its going to be a really long game, because the campaign map itself is HUGE! Make no mistake, this game is insanely hard. I'm playing on Hard difficulty and so far I think they nailed down the ""Humans fighting for survival"" aspect, because you're severely outnumbered, outgunned, and have to use your units and position them smartly. The game plays similar to wargame, so you have a variety of units that can do various things. You can upgrade the units, and train them during the campaign map inbetween missions to give them better equipment. I like how you can upgrade humvee's or any vehicle and give them better armor, and weapons.

A few things I would like to see improved are, directions on where enemies may be coming from. Sometimes I positioned my units thinking the enemy was going to come from that direction, but they came entirely on the opposite side. Maybe it gets better in different parts of the campaign. 

Another thing I would like to see improved is the supplies. Everything costs supplies, so you have to pick and choose what units to keep and what units to disband, because the upkeep will make or break you. There's ways to alleviate it by trading, and such, but you don't really know how many units to keep, or what is in store for you going further into the campaign, so you may disband too many units and not have enough to beat the next mission. Possibly anyway, but I can see that happening. I think the upkeep is too high for the units, and should be adjusted a bit.

Overall the game is fun and I hope they keep expanding it, because I could see it becoming pretty popular.",1708817838,1708817838,True,0,0,0,0,True,False,False
1839950,159194648,76561198014932787,702,82,1276,1276,910,1708937828,"[b]Syrian Warfare with Less Mines[/b]

When I played the demo for this game, I was hooked. I was hooked so much that the moment the demo ended I immediately bought Syrian Warfare just to scratch the itch that waiting for this game made me feel. The fact that the demo cuts off immediately after giving you a taste of the persistent unit mechanics was absolutely genius marketing.

Unfortunately, reality doesn't mix well with expectations, and it was a sobering experience.

First thing's first: For the price point the game is good. It is not very well polished, units get stuck on terrain, mission scripting can go insane at times, but it's unique and topical enough with good enough mechanics that I am satisfied with my purchase. You get what's on the tin: An RTS game set in the Terminator universe, complete with online skirmish modes and a whole single-player campaign. The rest of this is just going to be nit-picks of things that I found particularly jarring so other people can know what it is they'll be getting into:

Dynamic campaign: The game features a ""free-form"" campaign where you make decisions during missions that affect the outcome of character arcs and stories. This is great because it adds a role-playing element to things, and characters that survive in missions will remain active as the story progresses. All of your units level up, they remain consistent as the game goes forward (assuming they survive) and you can equip them with different weapons, and upgrade your vehicles with various modules. It's very cool.
The issue however is the resource mechanic: Supplies and ""Goodwill Points."" Goodwill points act as your currency, and they're what you use to buy upgrades, supplies, and more men for your army. Supplies on the other hand are what you use to navigate the world map, and are by-far the most frustrating aspect of the game's campaign. You get supplies by doing missions, and these missions only ever give you enough supplies to go to the next mission location. This is frustrating simply because of the amount of locations there are to go and the ways you can interact with them. You can purchase supplies for Goodwill points, but the amount of supplies you get per point spent barely covers the cost of one day's trip in most cases, and that's after spending the maximum amount of supplies. Also, the size of your army and the vehicles in it play into the draw on your available supplies, so you are expected to maintain a small army at most times in order to keep from burning through your supplies. There are very few ways to organically earn supplies and goodwill points outside of the missions, none of which are randomly generated, and all follow a determined canonical path. It's frustrating at best, and very cumbersome at worst.

Gameplay: If you've played Syrian Warfare, then you know what to expect: The game is a ""realistic"" RTS where firefights result in high amounts of casualties extremely quickly, and there is no way to reinforce lost squad members to a unit while it is still in the mission. The main issue I had with Syrian Warfare is that the game's UI simply did not compliment the speed at which the game happened, which meant that I was constantly slapping space-bar ever second or so just so I could make sure that every squad I had was doing exactly what I needed it to do at any given moment, and what was worse was the fact that the game did not even have a unit quick-select bar like Company of Heroes. Fortunately, not only does Terminator: Dark Fate - Defiance keep the active pause mechanic, but it also added a unit hot-bar, so managing your soldiers during high-lethality situations is a lot less frustrating, but not entirely curbed.

Mission Design: I give the mission design props for being incredibly ballsy, most of the time they play out more like a session from a tabletop campaign than a typical RTS mission (please for the love of god I want RTS games to add more tools to turn them into tabletop role-playing modules I'm begging you), with various decisions you can make, optional objectives that can help or hinder you in one way or the other, and even faction politics that you can juggle around before the mission ends. The execution of these missions can range from inspiring to absolutely mind-meltingly confusing, the most notable example being the first mission you do against ""The Cartel,"" where you infiltrate one of their main settlements in order to start a slave uprising. An entire portion of this mission is dedicated to save-scumming until you can RNG the outcome of a pitched battle between one of your squads and an enemy's squad, of which you don't get to control your squad, and if your squad dies then it's a game over. It's ludicrous, and my squad died 5 out of 6 attempts on Normal mode, and that was with all the possible weapon upgrades I could've gotten for them before the fight; I can't imagine how many attempts it'd take on the harder difficulties.",1708817645,1708817785,True,1,0,0.523809552192687988,0,True,False,False
1839950,159194103,76561198248747868,0,2,2722,2722,2218,1708892955,,1708817084,1708817084,True,0,0,0,0,True,False,False
1839950,159193137,76561198046565259,0,42,889,889,555,1708900322,"Legitimately a good time.

The game is fun, easy to pick up, and is very user friendly. Voice acting is on point and the story line has been engaging.

It's the kind of game that you want to boot up and play some more. 

Clear that calendar if you buy it!",1708816125,1708816125,True,1,0,0.510086476802825928,0,True,False,False
1839950,159191625,76561198113953843,1148,582,108,108,81,1708822519,We already have a war for centuries. Its called the rich vs the poor.,1708814838,1708814838,True,2,0,0.449801087379455566,0,True,False,False
1839950,159191551,76561199114196932,0,4,1343,1343,538,1708925103,"Great story, features and mechanics. Think about this game at work all the time. 9/10 if rts is your style of games.",1708814779,1708814779,True,0,0,0,0,True,False,False
1839950,159190350,76561198020282579,0,39,665,665,126,1708925915,gud,1708813696,1708813696,True,0,0,0,0,True,False,False
1839950,159190014,76561198352979960,61,2,1199,1199,357,1708923716,Game feels life it came out 5-10 years ago. Similar to Warno and Company of Heroes. Cant recommend yet. Needs more maps and better visuals.,1708813397,1708813397,False,1,0,0.46569177508354187,0,True,False,False
1839950,159187406,76561198012234150,0,35,1730,1730,1282,1708908887,"The amount of love put into this game can really be felt.

Attention to detail is everywhere.

Fantastic and brutal tactics combined with good story, army management and atmosphere.",1708811076,1708811076,True,0,0,0,0,True,False,False
1839950,159184264,76561197994087837,0,33,1208,1208,685,1708896949,Its good if you have the brains to play.,1708808398,1708808398,True,0,0,0,0,True,False,False
