1839950,159112787,76561197971124277,1286,33,3022,3022,1509,1708936518,"Let me start off by saying that I actually really like this game, however I cannot recommend it in the current state.

I love many of the game concepts surrounding building and supplying your own squad, including salvaging abandoned vehicles (some of which I forced the crew to run away because I set it on fire) but it is quite disheartening to see it immediately explode in the next mission from literally nowhere.

You could order your vehicle into an open field approximately 10 k's from the nearest building and see it destroyed by a 100% accurate recoiless or ATGM shot from someone you can't even see, probably while you were trying to micro your soldiers who are too dumb to prone when the first two members of their squad got killed by, one again, 100% accuracy single guy with an AK.

I like that it's hard. I enjoy challenging. However what I can't stand is a game that relies on constant save scumming to avoid catastrophic casualties that are game ending.

Case in point, there is a mission 7 or 8 against human enemies where my small squad, upon entering the mission, lost 1/3rd of their members including a recoiless fully armored van and the two hero snipers next to it because the devs saw fit to place a humvee with a gatling and a rocket armed infantry squad right in front of them. So the mission starts, I pause, and have a lovely view of the explosion and my hero squad bleeding to death.

Reload. Might assault that ATGM squad with my rangers in tha building over there, ATGM kills my whole ranger squad in hand to hand combat. Reload. Might put some snipers in the building opposite and shoot the ATGM, Artillery from half the map away destroys the building before I can get my snipers out of it. Reload.

Reload. Reload. Reload. Reload. Reload. Reload. Reload.",1708744747,1708745124,False,8,0,0.548581779003143311,0,True,False,False
1839950,159112826,76561198006579226,0,1,1442,1442,616,1708924191,Hard as Nails!,1708744785,1708744785,True,1,0,0.496117353439331055,0,True,False,False
1839950,158951776,76561198139945603,0,166,1137,1137,301,1708855518,"i give this games gameplay and campaign and diffierent factions style very good evaluate , but : 【 you need to watch this】and some issues ~

yes for : 

1. a dynamic and detailed manual battlefield map

2. super detailed troops and vehicles with highly customizable

3. super good battlefield expressive

4. interesting campaign story mission 

5. good gameplay 

=================================================================

no for : 

1. skirmish mode have very less games mode options

2. skirmish mode have time limits , only have 40 minutes max 【i dont like this design】

3. 4K performance was very terrible , fps drop everywhere 

4. skirmish maps are too few , only 4 maps 

【if you wanna play campaign you can buy this game , if you dont want play campaign story , dont buy for now , just wait】

5. mission part : in the campaign , every chapter map area , when enter it and start a mission , there are many side missions option and location , you need trigger those things by yourself , but this is the problem : many side missions only have dialogue , you cant trigger those things most of time , because you dont know trigger conditions , so many times just waste your time for that , the side mission trigger condition is confused make players dont understand about it .",1708585150,1708743701,True,1,0,0.449685513973236084,0,True,False,False
1839950,159110350,76561198047146920,260,12,622,622,203,1708830265,"Claims in the settings to support 3440x1440 resolution but then doesn't.
When used in windowed mode you cannot move the window as it locks you into the game if you click the game window.

Game play from the little I actually played has potential and is exciting to see.  Hopefully they fix the resolution issue so I can play it.",1708742214,1708742214,False,5,0,0.52133488655090332,0,True,False,False
1839950,158934861,76561198070616040,495,265,725,725,265,1708909274,"Game looks great and play decent but it feels a little off. You have units(humans or robots) that have a huge range wich makes it hard to plan properly since when you see the enemy, they will shot at you. The difficulty balance also feels off, especially since hardest difficulty is so deadly everything melts away. https://www.youtube.com/watch?v=tFBJPTxAjhQ

If Slitherine updates the game a lot to turn it into a more tactical game they could have a Company of Heroes 3 contender
Pro: looks great, a lot of details of units of both sides, you feel in danger, bestiary, squads have loadouts and different guns
Cons: a bit lackluster since the range of some units is so big and combat is so deadly, not fighting terminators in a game called terminator, some weird and horrible design choices like shooting a javeling and it hits a tree, too linear
Weird: You are fighting legion, i don't care about the lore of Dark Fate but why buy the rights for the game and use the worst movie?

Note: this is not an rts game, it's a glorified tactical game with infinite enemy hoardes while you are struggling to understand your objectives.
You will have to play the mission on lowest difficulty, restart the mission and play it again on the difficulty you like.
You recive multiple objectives but your goal,reward and how it affects the mission is not mentioned.
The artwork is great but the gameplay is pure crap filled with mint chocolate and sprinkled with sugar glazed cut fruit. Looks great but wait until you play it... oh boy, its one of those games that insults your intelligence",1708564030,1708740725,True,22,3,0.62830352783203125,0,True,False,False
1839950,158926490,76561198030733406,266,108,1029,1029,706,1708901927,"initially had a positive review, but the difficulty is so absurdly broken, that either no one actually balanced the missions or someone who knows exactly how they planned the missions to be completed.  Either way sad it was interesting.",1708554852,1708737254,False,1,0,0.385504215955734253,0,True,False,False
1839950,159105566,76561198139609108,0,5,401,401,276,1708810999,"It is a pretty good RTS game, but skirmishes lack customisbility, especially in PVP. the ability to remove reserve restrictions and fuel/ammo constraints would be neat, as that's what holds it back a lot here.
also, factions do feel unbalanced, with legion being pretty OP, and movement being pretty under-powered to use.",1708737090,1708737090,True,0,0,0.496117353439331055,0,True,False,False
1839950,159105484,76561198096120801,0,24,248,248,248,1708736734,"I really want to like this game. I don't think it's hard. That being said, I've barely played it. The missions just last forever. Do this, do that, now leave, WAIT, defend the area, now leave, WAIT, escort these civilians, etc. I spent 2 hours playing 1 mission and just exited the game. I wasn't having trouble with it it's just that I couldn't be bothered with finishing that singular mission. I was ready to move on and head back to camp and proceed with the next mission. I've heard people complaining that this game is extremely difficult and I just don't see that. It does seem to constantly move the goal post when it comes to actually finishing a mission. 

TLDR: I'm not a fan of how ungodly long the missions are. The game isn't hard (to me) but I've heard people say it's one of the hardest games they've played. If you like seemingly endless singular missions, this is the game for you. If not, I would advise against it unless you just want to play skirmish or multiplayer.",1708736993,1708736993,False,0,1,0,1,True,False,False
1839950,159101725,76561198058176322,217,37,84,84,84,1708709205,"Its got great bones and it still needs to be worked on. My biggest issue is not being able to queue orders unless they're simple move orders. Also, the UI doesn't work well on ultrawide monitors, which is the straw that broke the camel's back so I refunded the game.",1708732929,1708732929,False,20,1,0.547023773193359375,0,True,False,False
1839950,159101621,76561198001672673,265,4,529,529,376,1708892241,"Great Game, RTS without Base Building but the Ressource Management and Action is great",1708732835,1708732835,True,0,0,0,0,True,False,False
1839950,159100805,76561198140429277,0,3,1660,1660,455,1708909444,Really enjoyable and punishing!,1708731938,1708731938,True,0,0,0,0,True,False,False
1839950,159100519,76561198387905108,151,106,194,194,188,1708732042,,1708731637,1708731637,True,0,0,0,0,True,False,False
1839950,159100477,76561197974192051,0,20,1145,1145,591,1708937612,"Fun game, good RTS
haven't experienced any bugs",1708731589,1708731589,True,0,0,0,0,True,False,False
1839950,159099755,76561198077887239,0,6,1799,1799,85,1708921136,"It's not StarShip Troopers Terran Command, but that's okay. 

This is a true RTS game and I am enjoying it.

8/10

Rearming and refueling is a little annoying at times, but what is a game without a little inconvenience?",1708730862,1708730862,True,0,0,0,0,True,False,False
1839950,159099361,76561198038816654,162,76,1210,1210,819,1708904615,"Too hard
Too slow
Braindead AI of units",1708730475,1708730475,False,1,0,0.39682537317276001,0,True,False,False
1839950,159098926,76561198965387585,0,3,1426,1426,226,1708922288,"the gameplay i've had so far has been pretty enjoyable although simple, and the storyline is somewhat cliche. i'm on the mission just after the base defense and i'm completely locked behind a persistent game crash. no matter what i do the game crashes in the same exact spot preventing me from progressing further. i've had several crashes before this point which is tolerable but being prevented from playing the game at all because of a crash is infuriating.",1708730049,1708730049,False,1,0,0.509199559688568115,0,True,False,False
1839950,159097960,76561197970689545,0,23,22,22,22,1708670044,"Controls are not great, game looks fairly average. An overall disappointment.",1708729138,1708729138,False,1,0,0.483389407396316528,0,True,False,False
1839950,159097156,76561198104137427,0,1,4365,4365,2207,1708938236,I love this game so far I'm just messing around testing to see if there's any bugs I haven't run into any game breaking bugs as of yet tho and I know of a way you can save you from losing a squad  member in the dual from skulls,1708728334,1708728334,True,0,0,0,0,True,False,False
1839950,159096170,76561198025544566,0,95,15,15,15,1708644653,Ive never refunded a game so fast.,1708727410,1708727410,False,3,1,0.420258611440658569,0,True,False,False
1839950,159095646,76561198026457292,0,17,414,422,98,1708820600,"Great Game! definitely Recommend even at full price. Do yourself a  favour and watch a play through on Youtube. Seeing what this game had to offer, i jumped on it head first. 
",1708726925,1708726925,True,0,0,0,0,True,False,False
1839950,159091943,76561197985997606,0,22,166,166,166,1708717037,"Initial impressions and thought:

- camera controls are unintuitive. too far to get to controls, need to reach all across keyboard or let go of mouse - poor design. I'v reassigned the turn-right/turn-left controls to Q and E, like how pretty much any RTS does it.
- game should take note of UI options of other successful RTS games: Starcraft 2, Fallout: Tactics
- player should be able to designate movement waypoints & unit path should be displayed or toggleable
- speed of world time progression should be adjustable. ie. x0.5, x.75, x1, x1.25, x1.5, x1.75, x2
- text and subtitle size and color should be adjustable
- mouse scroll wheel sensitivity should be adjustable. Too much scrolling to completely zoom in or out.
- gamma and brightness should be adjustable
- game should have more graphics and VFX options.
- game should have depth-of-field and fog of war options - see Starcraft for war of fog example.
- game should take advantage of DLSS and texture sharpening.
- game should have keyboard profile for Logitech G915 keyboard with pre-set actions/commands for macro keys
- should be able to save the game without needing to type anything. game should auto-name saves if player doesn't enter custom names. Saves frequently end up as useless names like ""a"" ""b"" ""aa"" ""as"" ""asd,"" etc. that tell the player nothing, just so the player can save the game.
- the unit AI can be somewhat dumb sometimes
- player should be able to play game without using keyboard; mouse-only.
- game should have subtitle and accessibility options
- game feels uncompleted/not fully tested, like the players are being used as guinea-pigs to test out the gameplay and UI, and I'm offended I was made to pay $40 for it like a dumb sucker to help out doing the Devs job for them.

PS I definitely have NOT played the game for 2.8 hours, and am currently considering requesting a refund. I'd rather not, but the game should have been more polished, and you don't use your customers as your test-dummies!",1708723479,1708723479,False,3,0,0.46673622727394104,0,True,False,False
1839950,159090495,76561198051091437,411,10,1731,1731,1501,1708893797,"I finished the game and on content alone i would not recommend the game, the price tag of 38,00eu is very overpriced for the amount of content you are getting.

On top of that the game is pretty broken with its main problem being pathfinding issues, units will get stuck on terrain and lag behind their squads and getting killed in the progress, not move around cover and shoot all of their ammo into a wall and much more little problems.",1708722129,1708722129,False,1,1,0,0,True,False,False
1839950,159090016,76561198050479594,980,21,1791,1791,1062,1708907138,"Was really looking forward to this game because I saw a lot of videos before release and was a bit disappointed again.

However, after 17 hours of playing I again experience that the creator again did not hit the difficulty levels well.

At least in my opinion the game is not balanced. And the same thing happens as with other games of the publisher, that you experience a series of failures.

The game is beautiful. The modeling is complex, the injuries are realistic.
However, there are never enough resources, no ammo, and if you do have some, you have to give up because of the resource management mechanics.

I've played the story mode for 17 hours, restarted twice and always get one step further. The game gives you choices on each level and I chose the wrong one most of the time. I could start over. The only problem with this is that the maps with triggered events and scripts become very boring after 2-3 replayings.

So I would only recommend it to someone who has endless time to spend watching youtube videos, stealing from other people's games, or likes to constantly load saves. By the way, the loading is quite slow.",1708721691,1708721691,True,0,0,0,0,True,False,False
1839950,159087576,76561198011500241,0,9,217,217,217,1708719392,"The mechanics are all over the place and the performance is awful. I don't think I've got above 30 frames even with all graphics to low. Objectives get thrown at you constantly with minimal resources and ammo, its almost impossible to complete them all. Infantry in buildings are so overpowered it will take all 15 of my squads firing at them all at once if I want them killed in less than a minute. It's a slog of a game with horrible pacing.",1708719533,1708719533,False,4,1,0.543053150177001953,0,True,False,False
1839950,159083582,76561198031425172,335,6,406,406,332,1708719356,"I enjoy this game, it definitely is one of the few post apocalyptic rts games that actually feel like a post apocalyptic game. The campaign is structured in a way that feels like you are a faction attempting to grow and you really learn to cherish your hard earned units. 
My only complaint is that in multiplayer 1v1's i always lose against legion, those bastards are an absolute menace. So I'd really like a setting so that me and my brother can lay together in multiplayer against the ai, not only so that I can practice, but so that we can co-operate against the legion without needing other friends who own the game.",1708716354,1708716354,True,2,0,0.520756065845489502,0,True,False,False
1839950,159082762,76561198014849189,431,55,1450,1450,1450,1708714063,"Stupid level of difficulty, very buggy but I loved it. 8/10",1708715666,1708715666,True,0,0,0,0,True,False,False
1839950,159078811,76561198070397443,1799,29,286,286,286,1708654991,"Is a toss up for me its not bad, but its not amazing. It has a lot of great mechanics like the army building and supply system, but on the other side it suffers from poor pathfinding and really awkward camera movement systems coupled with maps that feel waaaaay to big for the amount of control you have.",1708712472,1708712472,True,0,0,0,0,True,False,False
1839950,159078429,76561197970940291,0,41,56,56,51,1708770341,"It's such a shame.... I have an ultrawide monitor and can't get the game to run properly. The Beta option allows the game to run, but you can't adjust any settings as the menu is not completely visible. I'm not going to refund, because I believe this will be fixed in the coming weeks. If this aspect is fixed, I'm sure this review will change to a positive because it looks like a fantastic game. Just wish I could play it...!!!",1708712149,1708712149,False,2,0,0.478803008794784546,0,True,False,False
1839950,159076547,76561198008552199,418,7,36,36,36,1708710419,"Ultrawide (and widescreen) support is still lacking in this game. Their work around is to play it in windowed mode on half your monitor, I can't recommend until it is fixed. Note that most of these issues were present last year and noted during the demo with multiple reports.",1708710596,1708710596,False,4,2,0.496274173259735107,0,True,False,False
1839950,159074504,76561198066424964,110,3,2020,2021,851,1708883616,"1. This is not a Terminator.
2. Integrators are piece of you know what. They are always located in the middle of the war. One shot - and you are the enemy of all integrators. The main goal is not to hit them.

what a shame...",1708708953,1708708953,False,2,0,0.393689453601837158,0,True,False,False
1839950,159072584,76561198012069640,0,17,1089,1089,694,1708878811,"does the game have one of the dumbest-ass stories ever written, and engage in a huge amount of copsucking and otherwise deepthroating the boot of American Authority through its representatives: Good, Hard, Men in coyote plate carriers? yes. did anyone ask for a Terminator: Dark Fate videogame? no. do I even know what Terminator: Dark Fate is? also no!

but the game is pretty good! it's like a mix of a Company of Heroes and, perhaps, a Wargame: Red Dragon. It's incredibly systems-rich. You manage and shape your army through persistent units, which can suffer persistent deaths, across missions - and they WILL suffer persistent deaths, because (playing on Hard, at least), the game is DIFFICULT. Not to the point of complete failure, but to the point where (even using frequent quickloads and quicksaves), you WILL take casualties unless you're some sort of perfect brain genius RTS god. I think that's a very fine line of balance to walk, and it's really impressive to see it walked here. Missions are large, long, girthy, etc, and objectives typically evolve several times over the course of one. If you played Last Train Home recently and were disappointed at that game's simplicity and easiness, this is a good one for you.

I am left with only one, probably unanswerable question; why is it Terminator: Dark Fate branded? There was obviously a huge amount of work, and even passion, that went into this game. Does Terminator: Dark Fate still have shooters? Are the devs all diehard Terminator: Dark Fate fans? Did they achieve some sort of monetary reward for branding their game after a 2019 movie with 6.2/10 on imdb that I literally did not know existed until five seconds ago, when I finally googled it to see what it was?

Actually, probably that last one.

Anyway, the game's pretty good.",1708707382,1708707382,True,12,3,0.550106227397918701,0,True,False,False
1839950,159072153,76561198006524973,0,11,376,376,288,1708712324,"It is 100% worth it! Maybe it is not perfect, but if you are a RTS player that enjoys a RTS story driven game that has skirmish, this will bring you right back to Skynet!",1708707022,1708707022,True,2,0,0.521988272666931152,0,True,False,False
1839950,159070072,76561197995466071,499,89,58,58,58,1708626568,"Really over-rated. First mission after the tutorial one my vehicles get blown up in a few seconds by one enemy unit as I'm still trying to figure out what I'm doing. The only unit that can fire back doesn't. Enemies spawn endlessly. Controls feel clunky, units move sluggishly. This genre has never advanced. I'll pass.",1708705273,1708705273,False,4,2,0.424823492765426636,0,True,False,False
1839950,159065038,76561198007300804,384,7,602,602,355,1708817606,"I've played the first 3 levels and so far I found I had a lot of fun with this game. There is just enough squad and ammo management to add an extra layer of strategery 😜 to the game without it being a quagmire of resource management. The relentless nature of the Terminators fits perfectly in the universe. The story and somewhat branching nature of choices is appreciated also. Reminds me of World in Conflict and Company of Heros in many ways. If you like those, you'll probably appreythis game also.",1708701296,1708701296,True,0,0,0,0,True,False,False
1839950,159061345,76561198281712707,0,14,3471,3471,1537,1708926070,"Great game with a interesting twist to the rts genre. You really have to look out for your troops cause when the squad dies they die PERMANENTLY. ammo fuel damage they all carry on to the next mission.

Good Luck fighting skynet and others!
",1708699250,1708699250,True,2,0,0.521988272666931152,0,True,False,False
1839950,159060454,76561198005049265,0,1,444,444,44,1708892597,"i had super high hopes for this game and the latest reviews had me really stoked up. i wish i would be able to play the game, but it does not even start for me due to the widescreen-issue. i will revisit this game when the devs fixed it and will update my review accordingly.",1708698547,1708698547,False,2,0,0.50638049840927124,0,True,False,False
1839950,159052268,76561198006499563,1288,7,250,250,217,1708787338,"If you check most of the reviews given they are all close to over 2 hours or just a shade above.  In the current state, I would not recommend the game.  In the very first 'real' mission you are not really given time to do anything but one option even though some are dubbed as 'sides'.  Not going to go into spoilers but yeah, it says choices but when you have 5, 2 main and 3 'sides', and then bam soon as you do a side everything else is locked out.

On top of that is the whole 'RTS' aspect.  Enemies are not really balanced, one unit can basically shoot you from across the map if you just happen to be in the open.  (I know this is where the git gud crowd comes in, but really I never understood why people defend faulty products for free.  I mean if you bought food that literally gave you cancer next day, would you defend that for free?)  Either way, I would wait on this one.  They claim they are going to support it for years but that promise has been made and broken by devs several times over.  All of the concepts seem half thought out and not tested at all.  If you're tired of being a $40-$70 'beta' tester for a 'completed' game, save your money.  If I wasn't over the 2 hour mark I would refund this product and not think twice.  (Nice that most devs are now locking things until you are past the 2 hour mark to get a refund so you're locked in, meanwhile steam just allows this unethical and non-consumer friendly policy.)

The positive I will give is that the game can be played, unlock another game which people will mass clown award you for if you speak about any of the faults it has, like infinite loading screen etc.  Haven't experienced that.  Game works as intended.  It's just not very good.",1708691282,1708691282,False,37,6,0.529667377471923828,0,True,False,False
1839950,159010893,76561198069734794,0,10,25,25,25,1708558099,"no widescreen fix for 21:9
poor menu setting

game is unifinished",1708642854,1708688901,False,4,0,0.529203534126281738,0,True,False,False
1839950,159048172,76561197971977215,0,22,149,149,149,1708559086,"Need a lot of work. I'm holding on the refund but this game have issues at all levels.
Too bad it was promising. If you have a windscreen, you wont be able to play the campaign.

let see if they can tune that up good or if it's another money garbing developer/publisher
",1708687100,1708687100,False,8,0,0.433721244335174561,0,True,False,False
1839950,159047152,76561198983251277,0,3,264,264,235,1708746959,"its actually a really good game, takes a round to get used to but its all pretty basic strategy,they need to speed up moment of all units, they need alot more maps there's currently 4 which is pretty poor, but game play units i think they've done well the graphics are good, i just cant find people to play, other then that its a good game i hope they continue to add to it",1708686027,1708686027,True,2,0,0.515503883361816406,0,True,False,False
