1839950,159017014,76561198064119083,0,55,320,320,320,1708649583,"There's no base building, gameplay is like company of heroes. It has a world-map thing like XCOM with places you can go to, to buy stuff, but you can't go anywhere cause you will be limited by supplies (note: I'm on medium difficulty, and I have to disband a lot of my awarded units cause supply upkeeps are high). The tank you can acquire after a certain mission? It will drive your supply costs that it feels more like a punishment than a reward, so you would rather disassemble it...

I can't recommend it because of this artificial nuisance of a gimmick, where the game wants you to only have a very small force of squads and vehicles, just limit it already (like add a maximum of 10 squads only) instead of doing it in this roundabout way please.",1708650006,1708650006,False,1,1,0.477450460195541382,0,True,False,False
1839950,159016638,76561198072787142,0,6,444,444,444,1708649281,"Multiple bugs requiring mission restarts in the few hours and poor overall playtesting. Open strategic layer design also pairs very poorly with a linear, heavily scripted campaign, providing plenty of opportunities to soft-lock but little depth or replay value.",1708649577,1708649577,False,2,0,0.476190477609634399,0,True,False,False
1839950,159016480,76561198028680992,0,23,267,267,267,1708649328,The game will be benched till ultra wide screen is supported.,1708649391,1708649391,False,2,0,0.502617835998535156,0,True,False,False
1839950,159016423,76561197992248146,73,5,54,54,54,1708644645,"Doesn’t work with (3440x1440)  resolution, so not good for my monitor. Refund requested. Also seems quite unpolished in terms of general unit movement and graphics.",1708649333,1708649333,False,5,0,0.549589872360229492,0,True,False,False
1839950,159014490,76561198043485831,0,5,1796,1796,559,1708923164,"One of the best RTS games I've ever played, and I've played hundreds of them. This is an improvement upon the Russian propaganda game Syrian Warfare (which btw is still incredibly fun). Dont wait and get this ASAP. I only pray that the devs plan on releasing expansions.",1708646915,1708646915,True,1,0,0,0,True,False,False
1839950,159011803,76561198025972248,0,10,591,591,306,1708673617,"Way too hard. By the time you realize this its too late because you played pass 2 hours to get a refund. Easy setting does not make the game easier. Your dependent of not losing any units because if you do you will fail the next mission.

This is a quick save quick load game where you need to know when to save and what to load up.

Do not play like a RTS. You have to hit space bar every few seconds so it should play more like a turn base or you will lose.",1708643770,1708643770,False,6,3,0.540547490119934082,0,True,False,False
1839950,159011571,76561198023175271,400,75,527,527,204,1708897833,"where to begin the campaign is just so annoying the devs want to constantly pause the game or it pan the camera to a part of the map and it CONSTANT is so annoying with the constant interruption just to say OH hey there is a enemy coming in from the west or what ever its SUCKS the worst part is it could have added in something that wouldn't have the game doing this every 2 seconds and why the hell have it doing it in the middle of a battle like WTF if it wasn't so constant I think I would actually enjoy it but no they just have a text in the middle of the screen way lame action and annoying because you can'ts set up you're units will this is happening this littery the first mission or training so what the rest of the game going to be like 

so is the game fun when its not like that well yes it acually is but for me its had to so much I don't get to experience the FUN 

so skirmish ect is prop where its all at with mp other than that I dunno what else to say about the game",1708643514,1708643514,False,0,0,0.459363967180252075,0,True,False,False
1839950,158989681,76561198072929249,763,69,1850,1850,314,1708902621,"mission 4 bugged so it fails at the beginning.. nothing changes this.
but there is many more bugs i have already experienced.
why you sell this ""at best early access game"" as full release??",1708623824,1708642294,False,3,0,0.347805976867675781,0,True,False,False
1839950,159009809,76561197961778750,544,36,624,624,185,1708888612,Engaging story with some really spicy mission design and deep gameplay.,1708641752,1708641752,True,1,0,0.503803551197052002,0,True,False,False
1839950,159007801,76561197996210460,62,4,1917,1916,968,1708877907,"Wonderfull game!
Tactics.
Strategy.
Real-time.
Elements of survival managment.
This game reminds a lot old game - Soldiers of Anarchy and thats awsome!",1708639891,1708639891,True,1,0,0.527559041976928711,1,True,False,False
1839950,158978719,76561199477321195,0,15,266,266,204,1708699591,"GJ devs, now i can start my training to combat CGPT/Skynet AI overtake of humanity.",1708615253,1708639450,True,1,0,0.495381087064743042,0,True,False,False
1839950,159005426,76561198093427770,447,286,1567,1567,822,1708883965,"[h1]Arbitrary Difficulty[/h1]

Ever played a [b]Rogue-like or Survival[/b] game where all the mechanics are unfairly rigged against the player and in favor of the bots? Unfortunately that is the case for this game where you are punished for everything you do in this game because the balancing is rigged against you as the player.

Want to do the next mission? 

Sorry but it appears when you went to the store, you did not realize you were not given enough supplies to make it to the next location. Looks like you need to reload the game to an earlier save because you were suppose to spend your resources on supplies.

Want to save people or salvage vehicles?

Every person you save is going to cost you a fortune to keep in reserve, and salvaging doesn't remotely repay you for the cost of traveling with the vehicle. Don't worry though, those supplies are just thrown out the window since it's not spent on refueling, arming, or healing you at all.

Want to fight the enemy?

Well since you are the attacker, all enemies are invisible by default by the ""hidden"" mechanic so you won't see unmoving enemies until you are already being shot at or right in their face.

I heard you like fog of war, so we added fog of war to every enemy unit on top of your standard fog of war.

Want to enjoy the game?

No, this is a RTS where you play how they want you to play the game. All missions tell you what units you're allowed to bring, limit how many you can bring, or deny certain units for arbitrary reasons to make the game more difficult for you.",1708637638,1708638996,False,8,1,0.489379793405532837,0,True,False,False
1839950,159006814,76561197970705334,0,29,1226,1226,285,1708851748,"THIS IS THE RTS WE HAVE BEEN WAITING FOR!!

Seriously though its bloody great. the look and feel of gameplay is amazingly familiar but modern and sharp. Combat feels like combat without it being a click fest, thanks to the pause. As far as i have played its been a great spiritual expansion to the terminator franchise with strong story elements and meaningful decisions that impact your campaign.",1708638955,1708638955,True,1,0,0.509943187236785889,0,True,False,False
1839950,159006617,76561198856868803,83,28,312,312,312,1708638007,good,1708638755,1708638755,True,0,1,0,0,True,False,False
1839950,158940168,76561198108501937,0,29,3019,3019,808,1708935120,"Haven’t put in enough time yet to figure out if this is going to be a positive review for the long haul. For the time being I’m having a blast.
-----------------------------------------------------------------------------------------------------

Edit 1:
I have played up to Albuquerque and so far have enjoyed most of the mechanics of the game. At this time I DO NOT ENJOY the supply balancing you must do within the campaign.

There are plenty of toys to bring to the fight to play with yet I feel punished for doing so. I daily supply upkeep for a human but why must I need 5000 supplies a day for a tank on top of needing to give it parts, fuel and ammo. What is the arbitrary supply number going? Do tanks eat in this version of terminator? Is my bradley tank sentient? Jokes aside I am frustrated trying to balance what units I keep and how many. It seems like I need to run around with a group of like 3 vehicles and 5 infantry rather than the fleet of cars and tanks and infantry I have. Again I understand this is for balance but id be able to accept the balance more if it made sense to expend arbitrary supplies on daily upkeep for vehicles that already need tangible supplies.

TLDR campaign resources need balancing and maybe a tip to let you know what is a good daily supply number to be working with as to not soft lock oneself out of a playthrough.
-----------------------------------------------------------------------------------------------------

Edit 2:
I have made it to the Cartel, I do not want to spoil anything for any of my edits so ill do my best. The mission doesnt allow you to play as flexibly as some of the other missions. I am not sure if it is the route im picking, by route I mean my dialogue options, or the mission is just way too difficult. I have played tons of strategy to tactical to management games and I do believe playing on the medium difficulty may be jarring for players who do not enjoy reloading your campaign often. I have tried every tactic I know and I still struggle with the missions where I have no control over the units that need to be defended.",1708570068,1708637032,True,0,1,0,0,True,False,False
1839950,159003881,76561197972696273,191,84,2492,2492,469,1708907221,"Good Game.

Slightly upgraded Syrian Warfare with Terminator style.

The only thing what is average is the enemy AI.",1708636202,1708636279,True,1,0,0.503703951835632324,0,True,False,False
1839950,159003683,76561197994692758,774,130,126,126,126,1708632310,"I really wanted to like this, but I just can't recommend it currently and will be requesting a refund.

It feels like a beta / early access, very unpolished and basic UI, it's not clear what units do, or why a member of a squad died when they are full health or why they seem more vulnerable in buildings versus being prone outside, why an atgm sometimes 1shots an enemy vehicle and sometimes needs 6 hits, aspect ratios are fucked up, not ultrawide support, only the first 2 missions (the ones reviewers played) work properly....
The campaign also has weird balance, even on normal without ANY vehicles, after mission 2 you're already on 11k-12k upkeep and you start with like 1000 supplies.
Even the main menu feels very ""2010"", the menu makes command and conquer generals menu look ultra modern.

I feel that after another 6-12 months or so it should be a decent game if they continue to support it.

Slytherine games usually go on sale fast and regurarly, so I'll probably just wait for the 25-50% sale in 3-6 months from now, by then it should be properly patched.",1708636028,1708636028,False,7,0,0.510446429252624512,0,True,False,False
1839950,159003451,76561198123240114,0,76,100,100,85,1708735125,"This is a real tactical game. If you're expecting a game like Warno, look elsewhere. Every decision you make is going to be hard, and if you fck up, you will be punished, such is war. You're also a weak, fleshy species fighting against metal, and insane production capacity; of course you're going to struggle. It won't seem fair, and you will lose one on one. Such is war. This game is challenging, and with some patches, I think it'll be one of the best tactical RTS game that you can play",1708635825,1708635825,True,0,0,0.496117353439331055,0,True,False,False
1839950,159003272,76561198837125301,0,2,191,191,83,1708702653,"Not great, but worth its price.",1708635658,1708635658,True,0,0,0.496117353439331055,0,True,False,False
1839950,159001988,76561198151542226,331,31,486,486,258,1708881241,excellent game excellent price,1708634525,1708634525,True,0,0,0.496117353439331055,0,True,False,False
1839950,159001557,76561197982243402,0,13,125,125,125,1708545960,i duno man... this isnt a typical rts. its much more involved. like MUCH more. everything moves way to slow. i think it was the second or 3rd map and i maybe clicked my mouse 8 or 9 times...everything else just happened ...getting in and out of buildings seems to take eons. im sure this game will do welll. just not for me.,1708634112,1708634112,False,2,0,0.523809552192687988,0,True,False,False
1839950,159001344,76561198016258952,0,8,8,8,8,1708545997,"Feels rushed, unpolished and missing replayability.",1708633931,1708633931,False,2,1,0.503759443759918213,0,True,False,False
1839950,158996766,76561198072524942,167,3,3149,3149,985,1708913657,"I really want to give this game a positive review I really do but all the positives of the game are completely off set by the supply system, specifically how bloody crippling the upkeep cost is. Even when I disband dozens of units it's damn near impossible to keep even a semi decent sized force mobile. I've basically been forced to rely on the units and handouts you get during the missions as well as allied units rather then what I can bring to the field. And even then so much as a single day's detour will completely cripple my supplies. It's so bad that I almost never have any cash left over for upgrading my units because it all get's funnelled into the bottomless abyss of the upkeep cost.",1708629802,1708629802,False,46,2,0.710413098335266113,8,True,False,False
1839950,158996191,76561198356290270,0,81,276,276,198,1708782501,SOOO MUCH FUN RTS GAME,1708629272,1708629272,True,1,0,0.493060797452926636,0,True,False,False
1839950,158995532,76561198830840348,0,30,113,113,113,1708627386,"I love everything about this game BUT the resupply factor for fuel and ammo and the different drivers licenses. The resupply feature is just kinda a pain in the *** I don't think it adds to the game and the different drivers licenses for operating vehicles makes sense in real life but also just complicates things in the game. So would like to see them get rid of that and let players focus more on the combat.

The units all have abilities that makes them different and all are useful so I think they did a GREAT job with the unit choices. The story is good and the voice acting is good. So far I'm loving the game, just would like to see changes to the resupply and get rid of drivers license mechanics.

",1708628703,1708628703,True,0,0,0,0,True,False,False
1839950,158994366,76561198190997727,0,8,2295,2295,429,1708938047,good game great story good units hard but fair battles really good game play what i like most is the choices you make and them men you save and lose really matter this game makes me feel like im really a commander in a war for my right to live it really makes care about the men that follow you unlike other rts they are not just meat for the grinder they are you men and every trooper matters,1708627694,1708627694,True,2,0,0.510793805122375488,0,True,False,False
1839950,158993557,76561197986395197,0,10,3272,3272,494,1708909927,Very good,1708626979,1708626979,True,1,0,0.493060797452926636,0,True,False,False
1839950,158955015,76561198202500232,0,1,1671,1684,595,1708840903,Abrams doing a collateral is the single most satisfying thing,1708589908,1708626556,True,0,0,0.494117677211761475,0,True,False,False
1839950,158992835,76561198259930559,0,77,1501,1501,90,1708897135,"Tried the first few missions. There is quite a lot of complexity, but the game is not that hard to get into. Took me a few minutes to understand that only fuel truck drivers could also drive the ammo truck, but actually reading the tutorial messages could have solved that. The game is pretty decently optimized and runs perfectly fine in 4k with a RTX 4070 Ti on ultra settings. The game feels quite realistic given the setting. Realistic projectile paths and cover mechanics as well as destructible buildings. It's worth full price IMHO.",1708626338,1708626443,True,1,0,0.511389553546905518,0,True,False,False
1839950,158991384,76561198049356200,0,224,224,224,110,1708705730,"---Disclaimer, I primarily play skirmish and mp in these kinds of games. I poked around the campaign a little---

Another RTT from Slitherine, with a few twists. If you've played something like Steel Division or Wargame: Red Dragon it's similar but with killer robots instead.

Playable factions are The Founders (the humans), The Movement (the scuffed humans), and sky- I MEAN Legion(the robots).

As this is an RTT, rather than build a base, you select your starting units and capture locations, then you call in select reinforcements. Pew pew until all are dead.

Humans have a neat little feature where they can man different vehicles based on a unit's driving skill. This means private Joe Shmo can drive the Humvee if the original driver gets killed. This makes human game-play pretty adaptive and on the fly. Units also need resupplying from time to time. Vehicles take modular damage at varying degrees of severity.

By contrast, as legion you stomp and swarm. Swarm your weak bots and mop up whats left with more specialized heavy bots. I love the little bot dogs, absolute favorites.

The Movement is a more ""ay papi let's kill those facistas!"" flavor of human, yet they sound pretty american. So, fairly standard really. They have a wide variety of engineers and light vehicles. I haven't used them much.

The game at time of writing only has a handful of mp maps whereas the campaign has some variety.

Voice Acting is OK and does it's job, nothing really stands out.

Music is great!

Overall, not a bad game, does what it set out to do. It's a bit overpriced at $40 though, pick it up on a sale.",1708625137,1708625137,True,3,0,0.537341177463531494,0,True,False,False
1839950,158990628,76561198100822404,0,55,253,253,220,1708628273,Hard Like Me.,1708624529,1708624529,True,1,1,0.505264818668365479,0,True,False,False
1839950,158989948,76561198122360770,0,12,1263,1263,245,1708899035,"As a veteran rts gamer i can freely say that after a long time we have a perfect succesor to the best rts game ever made c&c 3 tiberium wars but without the base building.
The intense battles you experience with large explosions, special effects and fully destructible enviroment, where everything that is destroyed stays on the battlefield so you can see the shear scale of destruction.
The battles are breathtaking, and each decision you make has deadly consequences.
This gem is the best Rts in decades.
Trully worth every cent.",1708623986,1708623986,True,1,0,0.511389553546905518,0,True,False,False
1839950,158988754,76561197989503302,78,3,532,532,114,1708919755,"I don't do a lot of reviews, but this game deserves your attention. For any kid who grew up watching T1/T2 and wanted to see more of the 'future war' scenes with Reese and John Connor leading the Resistance, here it is - and you're in control. So far, totally impressed. I've played C&C, CoH, SC, Warner, and this RTS is more engaging then anything I've played. There's a true sense of survival and wanting to protect your troops. They persist (or don't) from mission to mission, so you're constantly evaluating risk/reward choices on your tactics. Replay factor is already off the chart as I've restarted several missions to try and get better results. Active pause is pretty cool. When things get hectic you can pause to queue up move orders etc. to respond to the dynamic battle.

By the way, while set in the Dark Fate universe (which I despise, Terminator ended with T2), this really feels like the 'future war' that Reese told about. Loving it so far.",1708623127,1708623127,True,15,1,0.63599163293838501,0,True,False,False
1839950,158987651,76561198139801471,0,6,1660,1660,221,1708900814,love it,1708622276,1708622276,True,0,0,0,0,True,False,False
1839950,158986580,76561198025633221,404,38,146,146,146,1708614586,"This game is great, but please improve the performance.",1708621403,1708621403,True,1,0,0.519999980926513672,0,True,False,False
1839950,158985613,76561198010906605,0,33,2197,2197,910,1708886524,"The unknown future rolls toward us. I face it for the first time with a sense of hope, because if a small indie developer, a Slitherine, can learn the value of AA gaming, maybe we can too.

Come with me and buy this game if you want to live.",1708620653,1708620653,True,0,0,0,0,True,False,False
1839950,158984633,76561197989788166,0,1,736,736,246,1708908123,"A good, fun game.  The tutorials were nice.   However much to my dismay the game does not support Wide-Screen monitors as of yet and trying to play it on stretch resolution is just frankly awful.  

I'd recommend it once that's finished, and may change my review then.",1708619904,1708619904,False,6,3,0.436029314994812012,0,True,False,False
1839950,158981822,76561197973520734,1094,82,567,567,210,1708779529,I recommend however the game will punish you hard for mistakes.,1708617652,1708617652,True,0,0,0,0,True,False,False
1839950,158979514,76561197975902224,0,75,120,120,77,1708756595,"I'm an RTS fan, and Terminator spin is something I was waiting for a long time. So far, I'm having a blast!",1708615860,1708615860,True,4,0,0.542199850082397461,0,True,False,False
1839950,158975699,76561198206553031,581,82,21,21,21,1708571906,On foe nem,1708612874,1708612874,True,1,0,0.380511581897735596,0,True,False,False
1839950,158974180,76561198142032625,0,67,1343,1343,688,1708735311,"this needs proper multiplayer co-op as soon as possible. Men of war style if at all possible.

also you can barely hear trucks/tanks/vehicle engine sounds etc.",1708611545,1708611545,True,12,1,0.612517595291137695,0,True,False,False
1839950,158972708,76561198450220521,0,10,401,401,139,1708852133,"more polished than the beta , still needs a little work, we dont get many rts games anymore and im fine with delays if the game is polished. yet another great rts by slitherine at launch alongside Starship Troopers TC, for those people who are downvoting this game because of graphics issues like bluriness, i fixed everything by going into Nvidia control panel and just tweaking a few minor settings and the game looks MILES better, try it and then repost your negative reviews",1708610298,1708610424,True,0,1,0,0,True,False,False
1839950,158969724,76561197976525405,0,45,1376,1376,570,1708901475,"I really enjoy the campaign and mechanics of this game where you have persistent units that CAN go to the next campaign mission.   Between later missions, you can upgrade your units with new weapons and level them up and give them unique features.  The unit damage and other mechanics reminds me of Company of Heroes.   The difficulty level is pretty crazy, so I play on Easy and Survive mostly.   Great Great difficult RTS game with amazing features and good story.",1708607511,1708607511,True,5,1,0.546665191650390625,0,True,False,False
1839950,158969545,76561198095845271,0,19,1475,1475,244,1708870843,I like this game. Good tactical RTS.,1708607334,1708607334,True,1,0,0.484240680932998657,0,True,False,False
1839950,158969288,76561198044326135,0,11,17,17,17,1708606341,"Refund requested.

I'm playing at 3440 x 1440 and top quarter of screen is missing. 

The fix is to play in lower resolution, with a promised ""fix"" incoming.

I've heard these promises before.

Why would i buy a PC & monitor that can play in this resolution, to play games in a blurry lower resolution?",1708607068,1708607068,False,4,2,0.385537236928939819,0,True,False,False
1839950,158904073,76561198231433124,0,12,25,25,25,1708549521,"terrible optimization, I don't understand why so low frame in 4090",1708534997,1708606911,False,0,0,0,0,True,False,False
1839950,158968646,76561198886091799,0,39,20,20,20,1708596359,"Great gameplay, graphics and depth, Anyway reading most of the whiny negative reviews that are totally off-topic. I have to assume there is a world wide shortage on tampons",1708606349,1708606349,True,4,2,0.530263125896453857,0,True,False,False
1839950,158967269,76561197963236268,0,51,101,101,101,1708603434,The only good clanker is a dead clanker.,1708604773,1708604773,True,1,0,0.518716573715209961,0,True,False,False
1839950,158963968,76561198079374641,0,120,1001,1001,518,1708839574,I love it so far! Hope they come out with more content!,1708601611,1708601611,True,2,0,0.51196742057800293,0,True,False,False
1839950,158962639,76561199401155466,0,1,1144,1144,331,1708905009,"On the one hand: I am officially a better tactician than combat AI (trust me guys)
On the other hand: What do you mean my full head on rush consisting of only various technicals and a dozen militia squads against tanks and Bradleys isn't working?",1708599924,1708599924,True,1,1,0.51578134298324585,0,True,False,False
1839950,158960835,76561198278157481,0,64,2185,2185,428,1708885607,rawr,1708597722,1708597722,True,1,0,0.491959750652313232,0,True,False,False
1839950,158957324,76561197986564754,758,84,1010,1010,527,1708735665,"Very fun but very challenging. You have the freedom to annihlate your army and stunt your progress (or doom it)
The game throws secondary objectives at you that may or may not be worth it, keeping your crew alive should always be the priority though. 
This game is most like Syrian Warfare to the point the sound effects and engine feel like 1-1. I'm not complaining I loved that game so it's great to see here.",1708593150,1708593150,True,5,0,0.523127734661102295,0,True,False,False
1839950,158957316,76561198135047215,0,3,1287,1287,321,1708778633,"Path finding needs to majorly be worked on, 3 squads of rangers enter a building and don't know how to seek and destroy 1 squad of machines? I get that the humans are supposed to be out gunned and on the brink of annihilation, but seeing how the A.I works for the humans, im surprised they didnt just all die already.",1708593138,1708593138,False,70,17,0.74565809965133667,0,True,False,False
