2014780,159410512,76561199411700649,0,2,228,228,228,1708385612,"3.8 hrs last two weeks / 3.8 hrs on record I,m a certify commercial pilot and i can say that is good simulator  but the graphic need improvements compare to MS2020 which i think is better but Xplane is  more accurate on Airport information like taxi ways.",1709060646,1709060646,True,1,0,0.527559041976928711,0,True,False,False
2014780,159257901,76561197970500876,0,3,13731,247,13731,1708879161,"great controls, simulation is good, decent default vehicles",1708879194,1708879194,True,0,0,0,0,True,False,False
2014780,159242033,76561198361479573,0,2,519,519,290,1708994324,love it,1708867747,1708867747,True,0,0,0,0,True,False,False
2014780,159214292,76561198212346793,0,3,52351,2808,52078,1709048830,Been Flying X Plane for years,1708839299,1708839299,True,0,0,0,0,True,False,False
2014780,159163475,76561198356684260,52,6,5796,896,5573,1709074576,Really improved from initial version.,1708791974,1708791974,True,0,0,0,0,True,False,False
2014780,159132123,76561199487860143,0,1,436,79,356,1708802483,md-80 is my favorite plane. 10/10 would crash again.,1708766151,1708766151,True,0,0,0,0,True,False,False
2014780,159131379,76561198966807824,0,1,891,207,684,1708779094,very good,1708765281,1708765281,True,0,0,0,0,True,False,False
2014780,159059594,76561197984164180,0,5,2100,2100,362,1709077223,"Purchased over MFS2020 because the default planes have interior cabins. MFS2020 only has like the front and rear galley and a static camera looking over a wing (aside from the cockpit, of course). However, the only airliners XP12 comes with are the A330 and B737. Wish it had the 787, 777, 747. MFS2020 has the 787 and 747 but again, no interior cabins.",1708697856,1708697856,True,0,0,0,0,True,False,False
2014780,136358721,76561198288080382,56,11,5623,308,190,1708912228,So unfinished it's not even funny. At first it was good but over time you realize that it's actually just worse than X-Plane 11. I'd buy 11 over this anyday.,1680974493,1708670256,False,0,0,0,0,True,False,False
2014780,159034156,76561199248945693,0,1,2981,2246,2734,1708954754,a pretty fantastic simulator im having a lot of fun with the A330/laminar research. it can be made more realistic like TARA in nav display etc. appreciate the devs,1708670214,1708670214,True,0,0,0,0,True,False,False
2014780,159018178,76561199189063333,0,1,1045,1045,1045,1708651143,"I'm a private pilot with about a hundred hours and another 70 with simulators. This simulator has good-ish physics in the air but the landing physics are absolutely terrible. When transition to flare on landing the Cessna 172 just stall and falls flat onto the runway. Ground effect isn't being factored in landing and the stall physics happen too early for a full flap landing with a stable descent and calm winds. I should stuck to MSFS, even though the controls are way touchier.",1708651388,1708651388,False,3,0,0.550140619277954102,0,True,False,False
2014780,158944617,76561198452496468,0,1,842,842,815,1709077479,the best,1708575302,1708575302,True,0,0,0,0,True,False,False
2014780,158943667,76561199517599779,0,1,1527,42,1527,1708573585,"Superior flight model, no doubt about that. Excellent airport layouts as well. Very detailed aircraft and a good default collection of them with many more to add if you're so inclined.  The aircraft systems can be complicated in the modern jets and the fighters, yet if you just want to hop in and fly stick and rudder, there's always the Sentinel or the Piper. Highly customizable weather--if you want to take off in the rain and fog and burst out into the sunlight at FL30, you can do that. Highly recommended.",1708574025,1708574025,True,0,0,0,0,True,False,False
2014780,147727036,76561198347344788,0,7,41133,4541,39155,1709028443,good game,1696579314,1708560078,True,0,0,0.477744817733764648,0,True,False,False
2014780,158924543,76561199063071663,0,2,2226,3,2222,1708798215,"It is a fun game, more realistic than MSFS2020, but the graphics are meh. 4/5.",1708552905,1708552905,True,0,0,0.482758641242980957,0,True,False,False
2014780,158915693,76561199211831056,0,1,301,45,279,1708548268,Planes look amazing,1708544777,1708544777,True,0,0,0,0,True,False,False
2014780,158729125,76561199108550183,0,1,6782,919,6434,1708855386,"nice game, very realistic",1708360851,1708360851,True,0,0,0,0,True,False,False
2014780,158724406,76561198128800285,0,2,11408,1802,9708,1708787564,Good for training!,1708356524,1708356524,True,0,0,0,0,True,False,False
2014780,158533119,76561198017054997,0,11,50459,1421,49680,1709034615,"I started with flight simulators way back in the 90's when fs was delivered on a 7"" floppy disk.  The ""earth"" was a green expanse with white lines denoting runways.  I thought this was marvellous and sent my wire frame aircraft up over the green expanse below.
Since that time I had almost every version of MS Flight Simulator, Prepar 3D, FSX, FSX Acceleration, IL Sturmovik, World of Flight and some I can't even remember.  Even Combat Flight Simulator!
With the demise of FSX, I really thought that was the end of my flight simming days.  Then I discovered X-Plane.  OK, I only started on X-Plane 11 and immediately  loved it.  After doing thousands of hours I was satisfied with only loading Africa scenery.  I took the decision to stay only in Africa, and South Africa.  Not that I have anything against other parts of the world, but I spent many, many hours in Europe, the USA, Oceania and now at my age, i settled down to my own country.  And I love every moment of it!
The sheer pleasure of trying different aircraft, amazed at the time and energy developers put into it.  The precision of the avionics, the hours spent on perfecting the different aircraft was staggering! I did not even have to look at other flight simulator platforms.  X-Plane had it all.
Lastly.  Austin Meyer became a household name in the x-plane community.  I can't remember a senior developer exposing himself as much and putting in as much as Austin.  Something I did not experience with all the other available flight simulator platforms.
At 75 years of age, change does not come easy anymore.",1708179598,1708330947,True,4,0,0.577282547950744629,0,True,False,False
2014780,158604365,76561198417340261,13,9,4300,802,3743,1708875660,"Game rất hay, đáng chơi",1708241113,1708241113,True,0,1,0,0,True,False,False
2014780,158547119,76561199578337977,0,1,232,99,228,1708191061,"Real flight simulator. Every detailed is carefully taking care of in flight or look and feel. I'm a novice, but it is impressive.",1708191030,1708191030,True,0,0,0,0,True,False,False
2014780,158541073,76561198836527616,0,6,2257,1630,1419,1709053310,Works great on linux,1708186005,1708186005,True,2,0,0.54356849193572998,0,True,False,False
2014780,154094719,76561198007843491,0,25,4654,872,3830,1709076357,"1000+hours of MSFS, been flying since fs2004 days, 737 in depth enjoyer. Tried almost everything out there aside from P3D. Man, am I enjoying XP12. One thing the team needs to focus on is graphics now, and it will be even better. I love both MSFS and Xplane 12, they all have their pros and cons. I appreciate how intuitive the UI is to use, and how easy it is to install addons. Overall, a solid flight sim with great flight model. Currently rocking IXEG 733 (expected better, trash) and zibo (that one is a must have, blew me away in terms of quality, and its free. Chef's kiss)

Edit: since autoortho isn't installing for me no matter what I tried, expect a very low quality ground textures. Anti-aliasing in this game is abysmal and needs to be fixed. Updates are very scarce compared to MSFS",1703203300,1708143087,True,14,0,0.651243269443511963,0,True,False,False
2014780,158471395,76561198113710454,0,2,1551,631,927,1708833526,Just Amazing,1708113888,1708113888,True,0,0,0,0,True,False,False
2014780,157721605,76561199121321466,20,12,4696,2647,329,1709073502,pro game,1707234713,1708106073,True,0,0,0,0,True,False,False
2014780,158428571,76561198330850394,45,3,6414,0,6414,1707639872,"As someone with thousands of hours in flight sims, XP12 is laughable. All it is is XP11 with some minor visual improvements, it's completely unoptimized, and it's no wonder xplane is dying, when this is what we wait years for and we just get disappointed.",1708067995,1708067995,False,10,1,0.567370831966400146,0,True,False,False
2014780,140608522,76561198225710788,0,21,28544,977,27593,1708538297,"This game or ""sim"", whatever you want to call it, is extremely frustrating. The bugs seem infinite, the crashes are unpredictable, and is very underwhelming. The default Garmin avionics are atrocious and are genuinely shameful. 

Don't even get me started on the clouds or rain. I wish I could attach photos to this review to show how shitty they look. It also has this weird visual bug where around dawn and dusk, the clouds are blacker than midnight, but your plane is so bright it looks like it has a thousand suns on it. It's a real shame. 

I've dumped a lot of money into this game. The main planes I fly on here on the FF767, Rotate MD11, E175, and Phenom 300. It sucks because these are all genuinely good aircraft, but whats the point of them when you're sim is so unstable and trashy looking that you lose all immersion? When I should be worried about altitude constraints on an approach, I'm more worried about my PC blue screening (which has happened several times while playing XP12). I mean MSFS is a 100x better looking game than X-Plane, but X-Plane's FPS is about 5x lower. It's ridiculous. Speaking of MSFS which has full satellite imaging, this does not. You need to get Ortho, which will then knock your FPS down about another 15fps, and take up terabytes worth of storage. 

The literally only good thing I have to say about this game is the default airports and the physics engines. You can feel the wind gusts, you can anticipate the float or the sink with flap extension/retraction. The default airports look great and gate placement is on point nearly everytime. That's it though. If you want your money's worth, get MSFS 2020. My biggest complaint is just the clouds. I can put up with the 5 same repeating grids of farm fields over a thousand mile flight, but I mean the clouds gave like this glacier glitch where they look like literal glaciers and sometimes extend past like 42,000 feet which pretty much only happens in thunderstorms, but I mean these things are fucking everywhere it drives me nuts. 

Edit (7-28-23): There has been a recent update on the public beta that has greatly improved the clouds visuals (though they are still far from good.) The clouds no longer look black near dawn or dusk and lighting is improved in IMC conditions, but there is still tearing present when moving through clouds or fog. Will continue to update this thread as more updates are released.

Edit (2-15-24): This sim has earned an ""alright"" position in my view, and I would at this state in the game recommend it to some who are looking for a sim with a superior flight model and more aircraft available compared to MSFS 2020. I don't buy sims for the sims. I buy sims for the aircraft that utilize the sim. XPlane has by far the most study-level aircraft available for any flight sim, all produced by fantastic devs. While the sim is still far from perfect, it's gotten to a point where clouds and overall performance have noticeably improved. MSFS 2020 will always be my go to simply for the scenery, I have noticed that X-Plane has become my go-to sim for when I want a more realistic flight sim. ",1687604222,1708053399,True,0,0,0.484492868185043335,0,True,False,False
2014780,158342971,76561199588107595,0,2,1180,1224,223,1708873773,best game ever grafics are amazing,1707961246,1707961246,True,0,1,0,0,True,False,False
2014780,158340532,76561198008500094,0,4,109,9,109,1707957766,I would not wish this game on my worst enemy. It has done nothing but crash and frustrate me. I can firmly say this is one of the worst games ever made.,1707957876,1707957876,False,0,1,0,0,True,False,False
2014780,158254499,76561198881809982,0,20,17,0,17,1707809186,"Buggy, crashy mess.",1707855356,1707855356,False,0,1,0,0,True,False,False
2014780,158226597,76561199550118164,0,1,11395,11,11289,1708227118,Very good graphics,1707828797,1707828797,True,0,0,0,0,True,False,False
2014780,158225651,76561199245456454,32,5,2379,323,2031,1709041155,Shits goated fr fr no cap,1707827573,1707827573,True,0,0,0,0,True,False,False
2014780,158223714,76561199466725036,0,2,8802,3105,5020,1708790422,good,1707825135,1707825135,True,0,0,0,0,True,False,False
2014780,158211719,76561198328402667,67,30,1160,901,258,1709017956,X PLANE 11 BUT BETTER,1707807523,1707807523,True,0,0,0,0,True,False,False
2014780,158207274,76561199009365767,0,1,1645,188,1008,1708816617,Very good plane,1707800752,1707800752,True,0,0,0,0,True,True,False
2014780,158201567,76561198964038601,0,1,658,92,469,1708329267,"Only learning still, but enjoying it.",1707792942,1707792942,True,0,0,0,0,True,False,False
2014780,158166254,76561199634313667,0,1,925,668,230,1708771430,"Chers tous 
J’ai acheté x-plane 12 en date du …. Cependant ça crash avec comme message typique ci dessous:
………….",1707753328,1707753328,True,0,0,0,0,True,False,False
2014780,158124360,76561199526880023,0,2,1983,185,1743,1708899419,this shi a bop,1707699798,1707699798,True,0,0,0,0,True,False,False
2014780,158114396,76561199003442934,0,1,478,1,478,1708386586,THE GAROHIS A GREAT,1707687568,1707687568,True,0,0,0,0,True,True,False
2014780,158077684,76561198093415623,124,14,27821,491,26711,1708314910,"Some say this game looks and feels somewhat better than XP11 but honestly, it's not. 

Big things I've noticed
- The clouds don't look like clouds at all, blotched and spotty, huge square clouds, not good
- The windows bug out and can't be seen through in freezing, precipitous weather
- The turbulence simulation is absolutely overdone, I mean its absolutely severe in the lightest of cases
- An island was missing that I was trying to fly to... a whole island (ICAO: NIUE)
- No truly noticeable terrain visual or mesh upgrade since XP9 (really bad compared to MSFS)

I think if you're a casual simmer, just go for MSFS. I'm sure this sim will iron out its issues over the next year or two but I don't think it'll be anywhere near as good as MSFS visuals wise. The only reason I own or fly this sim is for Totoro's Challenger 650.... they should have to pay royalties to this dude because I spent the $60 on the sim just for this module.",1707657518,1707657518,False,0,0,0,0,True,False,False
2014780,157468455,76561199011449110,0,7,4260,1893,2171,1709071612,"El simulador con el comportamiento mas realista de una aeronave en un fluido en estado gaseoso como lo es el aire, ¿cuando picha vas a ver eso en Microsoft Flight Simulator?",1706941670,1707600918,True,0,0,0,0,True,False,False
2014780,158020314,76561199383283684,0,1,2769,255,1998,1708278523,.,1707591574,1707591574,True,1,0,0.471135944128036499,0,True,False,False
2014780,157997102,76561198840991343,0,1,159,0,31,1707659710,how to get more planes,1707570782,1707570782,True,0,0,0.476190477609634399,0,True,False,False
2014780,157989885,76561199422791504,0,13,1167,536,192,1708776865,great game it has RYANAIR in it!,1707562976,1707562976,True,0,0,0,0,True,False,False
2014780,157986449,76561198435952781,0,1,4232,0,4232,1707508019,"X-plane is one of those good sims that many simmers should try out. Graphics are acceptable, feel of flight is nicely done. The only downside is scenery (especially when compared to MSFS). Other than that this sim is pretty good overall. Before purchasing I recommend to try out demo first to check performance as this game is quite demanding on hardware.",1707558853,1707558853,True,0,0,0,0,True,False,False
2014780,157965922,76561199387187272,0,2,5996,706,5233,1708745873,great sim,1707532418,1707532418,True,0,0,0,0,True,False,False
2014780,157945833,76561199028892454,0,3,1494,0,1494,1700942662,gedagagegedago i've been married long time ago,1707508570,1707508570,True,0,0,0.476190477609634399,0,True,False,False
2014780,157929083,76561198153792168,30,5,28371,0,28371,1707491746,"Love the game and even better with mods. The game has amazing graphics, simulation of aircraft physics is also good models are detailed and the default airport scenery are OK. When moded this experience is enhanced and the feeling of flying with VR is just breathe taking hope others have the same experience.",1707491730,1707491730,True,0,0,0,1,True,False,False
2014780,157861246,76561199259842640,0,1,4825,1772,2662,1709038623,very nice and realistic!,1707408253,1707408253,True,3,0,0.555353879928588867,0,True,False,False
2014780,157757798,76561199465459756,0,6,553,34,404,1708224423,"Its a awsome game but pls add 777 and atr-72-600
pls commet if agreed",1707281519,1707281519,True,0,0,0.472440958023071289,0,True,False,False
2014780,157750987,76561198396911017,0,1,5826,156,5598,1708654918,"Overall it's an alright game. However, there are many factors that need improvement; the game is pricy, severely lacks optimisation, has poor scenery (especially compared to MSFS), offers no multiplayer flying shared cockpit or atc, lacks aftermarket aircraft's and other mod support, lacks flight lessons etc. For now X-Plane 11 or MSFS with modified physics are the sims to buy. Hopefully these issues get resolved and already offered in-game features (e.g. ai atc & flight lessons) are improved.",1707272618,1707272618,False,1,0,0,0,True,False,False
2014780,156990301,76561199582859100,0,2,1259,0,46,1707766137,"Great flying game, Just with a learning curve for the autistic dumbasses like me!",1706393141,1707263549,True,0,0,0.476190477609634399,0,True,False,False
2014780,157735960,76561198389143727,0,2,5226,0,4367,1707596186,"Getting to grips with flying a complex aircraft in XP12 takes a while. The depth of this flight simulator is truly breathtaking and XP12 looks much better than XP11 with good looking clouds and impressive rain effects on the windshield. Its a delight to fly in bad weather and at sun rise and sun sets. ATC is also very much improved and very useable and reliable. It does lack the ability to handle difference airspace procedures but does flight following, uses handovers, visual and instrument approaches, Use something like VATSIM on PilotEdge for fully realistic ATC with real controllers. A flight sim pays you back as much as you put it. Try and fly an aircraft properly using the proper approach and procedures and you will really test yourself. Treat it as a game and you wont get so much out of it. It might not look quite as good as MSFS but it will give you hours and hours of fun and feels incredibly realistic.",1707251206,1707251206,True,0,0,0,0,True,False,False
2014780,157684853,76561198824597609,42,4,3077,16,2961,1708206895,"longtime Xplane 11 Fan, i get the clouds and terrain is not as good as MSFS but there are add ons for this...",1707181142,1707181142,True,0,0,0,0,True,False,False
2014780,157677931,76561199499256313,0,2,791,59,320,1708296422,best game ever,1707171038,1707171038,True,0,0,0,0,True,False,False
2014780,154980065,76561198214495829,38,21,1942,0,549,1706568686,"Best sim right now, coming from somebody who regularly flies in real life.

If you want to make the sim look better, which most including me do, install AutoOrtho for MSFS-like scenery streaming and SimHeaven scenery for greatly improved objects in the scenery. Looks great.

Download the Zibo 737 for free and if you'd like a long hauler either the FF767 or the Toliss A340, XPRealistic is also a must in my opinion.

Edit: Wait for the FF777V2 for a long hauler now as its just around the corner and is in testing.",1704120594,1707170623,True,63,1,0.85578465461730957,0,True,False,False
2014780,157663398,76561199501460704,0,1,1741,0,559,1707847134,Cool simulator!!!,1707155526,1707155526,True,0,0,0,0,True,False,False
2014780,157608376,76561198354135778,0,4,35674,3022,29434,1708995776,A serious simulator. Great for someone looking to get as close to the real thing as possible at home. Blows Microsoft's flight sim out of the water in terms of realism and stability. Once I went to X Plane 12 I never went back.,1707082578,1707082578,True,0,0,0,0,True,False,False
2014780,157606190,76561199466986479,0,1,58520,4467,51802,1709071389,"What do I think about x-plane, well Laminar studios have F***** it up good last update 12.09 has csrewed up the navigational data, wonder how long they are gonna wait to fix this BS, get on it guys it isnt just me other people out there pissed off too.",1707080321,1707080321,False,1,0,0,0,True,False,False
2014780,154966042,76561199486428392,0,2,540,0,260,1707076705,"Even though X-Plane 11 might have more realistic mods, most of the mods can go to X-Plane 12 I'm guessing. It would be good vanilla if X-Plane 11 wasn't even on steam anymore, and was 10.98 on the steam store.In conclusion, get this if you want more rain physics and also wind physics.
Edit: It's hard to get the MCDU working if you're not a hardcore know all airbus fan but the tutorial is on the official X-Plane channel here: https://www.youtube.com/watch?v=uE4oU6OiPZ0&t=468s",1704106172,1707075992,True,0,0,0.495283037424087524,1,True,False,False
2014780,157570645,76561199158966676,0,1,180,0,180,1707048586,"Bad response, Crashes. 
Default keyboard shortcuts bizarre.",1707048655,1707048655,False,0,0,0,0,True,False,False
2014780,141953858,76561199205431482,0,8,5542,126,4794,1708893227,"Shot a missile at an airliner and when it fell and hit the ground my game crashed.
10/10 Game i love it",1689212428,1707015358,True,0,0,0,0,True,False,False
2014780,157495140,76561197965640871,45,13,639,0,634,1707587090,"bery bery good ,  runs on Linux, wouf !",1706970721,1706970721,True,0,0,0,0,True,False,False
2014780,155938105,76561198010481539,0,14,1670,0,1065,1707249054,"Edit: changing to NOT recommended. Bugged weather rendering (dark sandstorm at daytime etc) means it's not worth full price and XP11 is better option

Compared to MSFS:

MSFS is better at
- Scenery - unique technology which results in astonishing terrain out of the box
- More stable program (XP is still somewhat prone to bugs,  crashes as it is on much older technological platform -  addons and plugins contribute to this)
- I have limited experience with MSFS weather but XP's default weather is  terrible at the moment (differs from real life, some effects like rain are too extensively applied)

XP12 is better at
- Vivid ecosystem of addons, enhancements, plugins. What had been the strength of FSX, is on XP's side -  development studios with tradition.  Open ended, lots of tinkering to do,  you can even create your own python scripts if you feel inclined. MSFS is limited to a single marketplace.
- Therefore, a wider selections of payware aircrafts  to fly.
- More realistic aircraft systems and flight dynamics. Overall feel is simulation-like, not console game (although, I couldn't tell if in-flight dynamics  are more realistic).
- Clean UI optimized for PC, compared to the pain in the ass Xbox mess which MSFS offers
- Lower  requirements to run at high quality.
- More realistic feel in terms  of visuals, not as cartoonish as MSFS. Even though default scenery is not too high fidelity, it can be improved by ortho.

Overall, I'm very happy with XPlane series, probably the  best sim overall (compared to other flight, train, bus, truck titles). Get XP as your main sim and occasionally fly MSFS for VFR sightseeing.

(I have much more time playing with XP11 Non-steam).",1705204572,1706920247,False,1,0,0,0,True,False,False
2014780,157415995,76561198209507032,0,2,15421,601,14351,1709051352,the best flight platform by far,1706887695,1706887695,True,0,0,0,0,True,False,False
2014780,157379244,76561199147977064,0,11,791,137,616,1708824881,"
I was expecting superior graphics and I wasn't disappointed.  I am just now adding all the DLCs and I will add more later.",1706843257,1706843257,True,0,0,0,0,True,False,False
2014780,157344512,76561199244282124,0,1,4178,0,4086,1707128222,GOOD,1706805911,1706805911,True,0,0,0,0,True,True,False
2014780,157338491,76561198877521291,0,1,1627,0,1615,1706810640,good,1706800554,1706800554,True,0,0,0,0,True,False,False
2014780,157311786,76561199163575553,0,1,2510,529,608,1709014948,The Physics of the aircraft are soo much better than MSFS,1706770744,1706770744,True,0,0,0,0,True,False,False
2014780,157289740,76561199192541788,0,4,221,0,180,1706752154,"very realistic and good yay
p;gfdtrsfeadearfstgdfyhguj",1706741841,1706741841,True,6,2,0.58474576473236084,0,True,False,False
2014780,157275677,76561199187636840,78,23,420,0,417,1707142315,plane fly. pyongyang,1706726093,1706726093,True,0,0,0,0,True,False,False
2014780,157270934,76561199579740142,0,1,624,0,412,1707598556,It is very realistic. I have flown both gliders and general aviation planes in reality and they behave similarly.,1706721080,1706721080,True,0,0,0,0,True,False,False
2014780,157267399,76561198041934682,0,3,26,0,26,1706705951,"VR was appalling compared to X-Plane 11. Slow, stuttering and blurry textures on a relatively high end machine. 

Disregard 12 and acquire 11 for now if you're into VR.",1706717585,1706717585,False,9,1,0.59621739387512207,0,True,False,False
2014780,157250528,76561197973854629,0,9,874,4,777,1708337011,Simply incredible. Great work Laminar.,1706699509,1706699509,True,0,0,0,0,True,False,False
2014780,157216755,76561198335445683,20,10,1082,0,994,1707712488,"Playing X-Plane 12 really improved my knowledge in aviation itself. The simulation is almost the same as real life.
It can be quite laggy sometimes, for people who don't have a beefy pc, it will be a struggle.

Overall, I recommend, but they should add a 2001 Lower Manhattan DLC, so everyone can have a joy of circling the stunning area.",1706650599,1706650599,True,0,0,0,0,True,False,False
