218230,29422700,76561198017766328,0,15,137679,1211,9904,1708989826,"Iv changed my opinion on this game . 
Its has nice huge maps to play on and if you are in a good outfit it can be fun BUT 90% of the time no one works together or even follow waypoints they all just fight at one middle base to ""Farm"" exp which defeats the point of the game  , The Vanu (purple team) basicly have the advantage in most things eg  in hover vehicles and no bullet drop off . 
The Devs keep nerfing things in the game that people actually like and work hard at making it pointless to bother with anymore (construction).
If your a new player be prepared to be insta killed by literally everyone you meet because they all have asp lvl 100 Br weapons , your only hope is to join an outfit and try lvl up fast but then you have all the above to think about ! 
Countless times i get sniped or shot through walls and when i ask the player how? they all say its ""clientside "" meaning my connection to the server must be slower then theirs somehow ?
Devs took away the ability to revive Maxs making them a waste of resources to pull because engies rarly stay with them to heal them .

Thats just a few of the issues , Enjoy",1485094414,1684428770,False,0,0,0,0,True,False,False
218230,30040925,76561198205380855,0,10,13648,0,1871,1687758782,"literaly the best ftp fps on steam, its all good... you stop playing anything else on steam for awhile. you forget about it. then you remember that you have the game and it starts all over again.


EDIT: this game sucks dont play not worth it",1487527377,1679276560,False,0,0,0.499962121248245239,0,True,False,False
218230,29503130,76561198186907175,0,16,13999,0,6960,1658075028,this game is truely amazing is not pay to win you can however buy a premium subcribstion to lvl and get ii game money faster other than that there is no difference between having a sub and being f2p i highly recomend this game to play either by yourself or with as many friends as possible too many great battles and great times,1485443342,1678924372,True,0,0,0,0,True,False,False
218230,29973294,76561198189136646,0,31,7569,0,1755,1705194151,"Free, decent gunplay, big fights. Good game.",1487289077,1677195047,True,0,1,0,0,True,False,False
218230,29818981,76561198150353182,0,34,83015,0,11107,1672355392,"Game is fucking trash, abandoned by any real developers and handed over to a brainlet who's only qualification was making youtube videos.",1486715503,1672355518,False,0,0,0,0,True,False,False
218230,30093063,76561198237574076,0,8,23120,0,5643,1589852245,Gud,1487739845,1665026358,True,0,0,0,0,True,False,False
218230,29835927,76561198075695601,163,21,29735,0,7337,1701829551,"This game has its issues, but it's free and there's absolutely nothing else like it (now that PS1 official servers are shut down).

Play it while the population's still large enough for big fights. If the lifetime of PS1 is anything to go by, PS2 might not be around in another ten years.",1486774208,1659945730,True,0,0,0,0,True,False,False
218230,29886105,76561198093784772,0,108,4850,0,1662,1643502783,spandex,1486945428,1632695029,True,2,0,0.468743205070495605,0,True,False,False
218230,29737871,76561198021771875,467,7,1416,0,352,1612140857,"Somewhat better, community still has the same vibe and chaos is rampant in battle.",1486373377,1603846404,True,0,0,0.481751799583435059,0,True,False,False
218230,29967914,76561198125143346,135,12,112840,0,79313,1669936555,This game stimulates brain tumors!,1487268831,1596098158,True,1,2,0.43690955638885498,0,True,False,False
218230,29751058,76561198048610028,111,35,39812,0,27065,1625337609,"I recommended this game some years ago since it was very good but they somehow managed to make it bad, it's just a generic cash-grab ""free to play"" FPS now",1486422169,1586180156,False,0,0,0.504587173461914063,0,True,False,False
218230,29592531,76561198068375347,0,90,17542,0,9102,1706332352,"Planetside 2 has ESCALATED to a whole new level.

I'm not wrong though, it's pretty awesome.",1485809089,1584116420,True,13,0,0.601065516471862793,0,True,False,False
218230,29661525,76561198036329908,175,1,36755,0,35004,1560465859,"Edited review time: After spending way more hours than what Steam says I have, by a factor of almost 10. I can finally sit down and write a review for this wonderful, beautiful, like no other game. What makes this game so special? What separates it from Battlefield, or Call Of Duty. The quick answer, a combined arms game with anywhere from 80-90 bases. Each with its own unique layout, its own bias towards Defenders and Attackers. This is a procedurally generated nonstop battle. Is there ""meta"" to playing the map? Absolutely. However, no matter how good of a strategizer you think you are, there will always be moments when you lose control. 

This game provides you the tools to be apart of a much larger group known as a Squad, which consists of 2-12 players. From there you advance upwards to a platoon that consists of 13-48 players. All following their leader's instructions and working together towards a victory. When you grow tired of running in public squads and platoons, you join an outfit. This is where I would say the core of the game is centralized. Not to say you won't have a good time being a solo player, but playing with an outfit is a far different perspective. You see these people daily, you play with them daily, eventually, you begin to trust them, and coordinate with them, you know they've got your back, and you've got there. A level of trust is formed, now the entire squad trusts one another, they excel where others would have failed.

What makes this game great is the adrenaline of capturing a base with underwhelming odds. The taste of victory when all seemed lost. Drawing from the past, I can think of a moment where my squad (10 players) assaulted a contested base between 2 other factions, each brings 24-48 players. The enemy had vehicle superiority, air superiority, and outnumbered us 8 to 1. Under normal circumstances, this would have failed miserably. Due to the level of communication, trust, and to a degree skill, we were able to hold off this entire group, right down the moment the base captured in our favor. When that last second ticked over, we were all dead but 2 of us, and the enemy was right in our faces. That moment is what resonates in my brain. The pure adrenaline of battle.

This game is better with friends, yes. However, you will gain even more on this battlefield, some will be enemies, some will fight beside you. You will gain familiarity with everyone on the server. This game is a community. There's no other way of saying it. It has outliers sure, but it is a community-driven game that stands the tests of time. 

A closing note, I started this game back when it first launched in Beta. I am, to this day still playing, and in fact, alt-tabbed out of the game right now to write this review. There is no short explanation. This game is battle on a grand scheme, where movements of platoon and squads dictate the entire flow of the battle. Where solo players can make differences. Where outfits clash in all-out war. You will die. You will die a lot. This is Planetside.",1486091736,1581747944,True,4,3,0.535936415195465088,6,True,False,False
218230,29615987,76561198099965851,0,11,20289,0,887,1701911044,"02/09/2019

TLDR:  New player?  Talk, join a talkative friendly outfit, learn, profit.  Older vet?  Return, partake in battle, communicate with devs about issues, teach the youngsters to lead so you don't have to (as much), and satisfy your [REDACTED].

I finally got rid of my potato computer to play this game in high settings and it is great.  Where to start?  New player experience?  It think thats a good place:

What should I do when first loading into the game?

Take a few minutes to either go through the tutorial and learn the game.  If you don't you *will* miss out on basic mechanics of the roles, the weapons, and the team-play.  The jist of the game is that their are three factions fighting on a literal continent for control of territory and resources.  With that being said, it is three TEAMS, and there are no ""silent"" teams.  Learn to use the voice macros and text, if you don't have a mic and if you do, join an outfit.  Those guys have the ""salty vets"" with the knowledge and know how to sharpen and hone your skills even at the lowest level.

What about all the guns, and weapons that everyone has?  Are those guns OP and isn't it pay to win?

No and no.  The salty vets have unlocked very specific *SITUATIONALLY BASED* weapons.  Yes you CAN pay for the weapons, but you don't have to, especially if you learn to work with a platoon or a squad.  The cert currency is based more on how much you help your team.  Engineer and Medics are great for getting the first few thousand certs, especially at high pop fights.

Moreover, the starting weapons are the most among the most versatile.  If you can learn to shoot and move so that you are only taking on 1on1 or 1on2 fights (fights equally for or in your favor), you can actually outplay many weapons.

Performance and bugs, is the game buggy and what about content and community interaction with the devs?

The game is seven years old, so some of the textures show age, but the lighting system and the recently implemented Dx11 (""Aren't we on Dx12 now?"" Yes; little steps) give great lighting for cinematic and epic battles.  It is never completely bug free, but compared to some triple-A titles coming out, this is God-like.  The restructured Daybreak games have now officially designated a core team to take care of PS2 and have been doing a great job so far with the time that they have been given to resolve these issues.  As far as content goes, they just released a new ""capital ship"" that will have many, many functionalities at the platoon and outfit levels.  This also comes with a new arena for the outfits to compete in, so don't be surprised when we start to see a more ""pro-gamer"" level of play style come around.  I would say that there is plenty of content coming on the horizon.

H@X0rs?

They exist but are far from gamebreaking.

Overall review:
9/10


01/31/2017
The community that supports the teamplay make the game a fun and envigorating game.  The form of ""Instant Action"" play that drops you in the heat of battle makes it quite fun solo, but also nominates you a ""blueberry"".  This simply means that solo players tend to be harder to work with when it comes to strategy, but the community generally finds a way to handle this.  Another note:  This game is not for the faint of heart or faint of hardware.  This game, in order to have the best chances of fun and success, requires some $$$.  The huge PvP gameplay really stresses the system.  Nonetheless, the constant updates and the pretty good community, along with (generally) balanced gameplay, I would say:

8.5/10",1485902635,1581283337,True,0,0,0,0,True,True,False
218230,29577881,76561198087219241,0,4,250784,0,60403,1703664202,"This game is a BEAST and I would highly recommend it to anyone that enjoys FPS. Just try not to get Frustated when you die... and die and die. Just keep changing it up, trying new tactics, and playstyles until you find something that fits you and go from there. The game has a learning curve but it's worth it.",1485745070,1580809387,True,2,0,0.502074718475341797,0,True,False,False
218230,29828859,76561198158145315,0,11,673,0,52,1539360281,"Let me sum up this entire game with a single sentence: Its one of [i][b]those[/b][/i] games

Let me elaborate: You can pay for guns. Idc what your argument is, if you can pay for a weapon before another enemy can EARN it, thats pay to win (unless the weapons in question have the same specs, which they dont).
Theres a currency to use vehicles. If you know anything about Freemium games, you know EXACTLY how youre gonna get that currency, and any other; [i][b] grinding[/b][/i]

""This isnt a pay to win, you can win easily with skill. Its free so you have nothing to lose""
Time. I loss my time.",1486748871,1573946568,False,0,0,0.401145607233047485,0,True,False,False
218230,29566454,76561198317369682,99,9,14322,0,5865,1706386277,"It literally is a world war on the side of a planet, I love the mechanics and with all these new updates. The lighting and 3D modeling has really improved and I look forward to the future!",1485703237,1561987395,True,0,0,0.499341964721679688,0,True,True,False
218230,29692874,76561197984440686,0,181,21574,0,21197,1578596324,"Old review below.

Oh man, Planetside... Where do I even start with you?

Okay, let's start with the noticeable stuff first:
- The abyssmal performance:
The performance has been quite bad since launch. After years of patches, it still hasn't really gotten any better. The one trick they pulled was to label the old ""high"" settings to be the new ""ultra"" settings. I think you can see where this is going...
- The weapons:
A billion iterations of every weapon there is, with little to no differences between the guns themselves. Originally the factions were designed to have strengths and weaknesses. Now there are guns which every faction can use, which have no apparent weakness.
- The lags:
Oh god, the lags. Dying behind corners is pretty normal here. Also, other forms of glitching around, bad pop-in (like literally other players popping in 2 metres in front of you... yes, enemies aswell)

I could list several additional problems this game has, but I'm just tired. There is no hope here,



OLD REVIEW:

The game can be quite frustrating at the beginning until you get the ropes. Then it starts to be incerasingly more fun. I'd recommend getting into an outfit as soon as possible and participate in their squads, it will enhance your experience.",1486214167,1549400417,False,0,0,0.477941185235977173,5,True,False,False
218230,30217565,76561198256334129,143,8,21418,0,16615,1671855931,OK,1488194385,1543231606,True,1,1,0.502487540245056152,0,True,False,False
218230,29774020,76561198063040865,0,63,73138,33,46552,1708047190,"Planetside is a great game, but it's dying.  It may not be the most graphically stunning or on par with more modern FPS open battlefield shooters but it has it's own flavor with its varying fights. Although people whine and complain about P2W because it's a F2P game thats not true, all weapons are to be used in their own way and Environment. Cross faction balancing is pretty good, seems one faction has better weapons? They really don't, theres always a downfall between factions.

The NC are hard hitting and close quarters, weapons with a high damage but low rate of fire is their specialty. At distance they are weak but if they get close they hit like a truck. One MAX unit with dual shotguns can quickly make way for allied units behind it and clear out the most clustered of areas.

The TR are fast firing and large ammo capacity, their weapons fire faster and need to reload less, at medium range with controled fire these guys can easily become the lead flinging harbingers of death. One heavy can easily clear a room of unexpecting enemies in one long spray of fire.

The VS are fast reload and almost no bullet drop (Damage drops at range still), Their bullets travel straight so no need to compensate for drop and coupled with a fast reload to get that last needed round downrange, Watch out for Vanu snipers, they can easily drop a man from long distance without the need to take extra time to gauge how high they need to aim.

I've been on every faction and have heard the many complaints about other faction weapons being too overpowered, or their weapons too underpowered. They are just not using their weapons properly or don't know how to control them. Same with faction specific vehicles like Light Aircraft and Heavy Tanks.

Planetside is a good game to try and very fun to get into when you learn the game mechanics of bullet drop, bullet travel, Nanites, Weapon Effectiveness, and squad strategy. The devs were even nice enough to throw in koltyr which used to be a place for new people to get used to the game mechanics in, but now is a great place to test and understand new weapons.

The planetside community is still active, we just need new players to liven up the servers a bit more. Most of us are willing to help and there are plenty of open outfits for you to join. A lone wolf does not hunt as effectively as a pack.",1486523737,1524943169,True,2,0,0.535817980766296387,0,True,False,False
218230,29655427,76561198052776236,0,2,83201,161,38908,1707877303,"Really love this game! Its fun and entertaining... ESPECIALLY when you have a fun outfit who loves to pull jokes and pranks on eachother and enemys alike! 

Tips to new players:
1: Keep calm and respawn.
2: You WILL die ALOT!
3: Practice your aim, it gets better with time/experience.
4: Work Together! Its a TEAM game!
5: No weapon is the same as the other, they each have their own Strength's!
6: Black and gold weapons are EXACTLY the same as their standard variant! They also cost real money.
7: Learn your Keybindings! It Helps Alot!
8: Pick smaller fights untill your used to the game mechanics!
9: If you can see them you can kill them!
10: Be RESPECTFUL!!! If you are, others will be more willing to help you! Dont be afraid to ask for help, EVERYONE needs help!

These are the general tips/tricks/rules I live by! In any game! 
If your on faction VS (vanu) on server Emerald, My name is DrunkenVS
Please, Have a good day and Have fun!


2/18/2017 Edit: Some of my outfit/platoon mates gave me some ideas as to what to put for the 10 things as I could only think of about 4 on my own :P 
So thanks to them to make this review entirely possible!

3/1/2017 Edit 2: a few more tips for you are   
1) dont run infront of your allies that are shooting, go behind them so you stay out of their line of fire.   
2) use the terain around you for cover.  
3) if your a Heavy Assault turn you shield on when entering cover, even if your not being shot at. reason is this is a CLIENT side game if you can see them, you can shoot them. so if your in cover they may still see you out of cover for a short time after because they havent recieved the info from you yet. so use the addage of ""I can see you, I can shoot you"" the same goes for the other players aswell   
4) Don't go straight for the enemy UNLESS you have several teamates with you. Try your BEST to FLANK the enemy. don't attack them head on. come at them from the sides, above, or even behind them, if one tactic dosen't work... Try something else. the fight is dynamic, just like you!  5) Finally, LEARN the strengths and weaknesses of your weapons, it WILL take time.


P.S. Feel free to add my on steam or PS2 (ingame) the name i listed is my primary although if you want i can tell you the others via PM or steam chat.

P.P.S. I added some tips my teamates and friends gave me. some others on Youtube, like Wrel (Dev) Nico101, Joshino, and others have also said some of these tips. If you want to know more about the game look them up on youtube Especially Wrel, as he's a developer. Nico101 I'd recoment to Older audiences, as there is some ""Humor"" that younger audiences may find offensive or dont understand. (he and his team swear a bit aswell) i do squad ops with them and its mostly moments of WTF?! and general fun. Joshino and Wrel are a great choice to see if you want to Learn more about the game, its mechanics and also for general info/guides for weapons or tactics. 

Now all this is simply my PERSONAL opinion, while i agree that some others may not agree with me, i hold my opinions of the game and the players in fair judgment. 

Also, if you have any ideas for tips/tricks/unspoken rules/etc. post them in the comments. I will add them to the list and give you credit. feel free do discuss this game in comments below. Happy Gaming everyone!",1486064797,1524600864,True,93,3,0.861833751201629639,6,True,False,False
218230,29633242,76561198060327757,0,8,1055,0,1055,1521559564,"Spawn, go out, die , repeat.

EDIT: OK, FUN WITH FRIENDS.",1485972813,1522498966,True,0,0,0.454545468091964722,0,True,False,False
218230,29420373,76561198080691344,0,13,425,0,424,1546007424,"Great original game, GIANT BATTLES, always fighting
Game really makes u feel like ur part OFF a real war",1485087441,1521548424,True,1,0,0.505300343036651611,2,True,False,False
218230,29959682,76561198119766433,301,21,84168,0,67882,1679799162,"MMO pos. stupid shit like the entire infiltrator class, 1 hit kill knives, and radar make this game infuriating. Feel like im playing TF2 with all this stupid class shit.",1487242674,1520588053,False,0,0,0,0,True,False,False
218230,25166325,76561198220502525,0,10,8840,0,8213,1560039602,"This is pretty much If Halo and Battlefield had a baby and that baby grew up and married Overwatch with it's father Team Fortress's blessing and they also had a baby which became planetside 2 (yes i know how chronological orders work and no i dont care)
God this game is underrated do NOT pay attention to steams player count for they only count Steam users and not everyone else downloading off the daybreak site. This game is still alive and strong.
pros
Broke gunnies world record of over 11 thousand players participating in this MMO battlefield of a lifetime
3 different factions, i'll sort them by today's equivalent: russians, murica, and purple spandex
number of people on one map can reach max 2000 at once, battles for a base can have 48+ to many hundreds if its a techplant or bio station
4 continents to capture, faction captured ones give vehicle discounts to make vehicle spamming easier
can join outfits like the all so legendary P4LE (australian mostly) and FPS Korea (suspected aimhacks, always us purple spandex clan)
you have your different classes with different abilities to suit their role
bullet physics are similar in many ways and weapons include details about range/damage output
maps are large scale and there are 4 of them with varying terrain and bases to capture
use vehicles of different types providing their own benefit to your team
organized platoons and squads for better communication and objective completion
pay2win is not existant for every weapon/attachment can be earned free through ingame currency you earn as you play, and those that do cost money are just cosmetics for swagger and showboating.
premium account is cheap and gives you monthly premium currency you'd normally have to pay money for(for the swaggerous items or faster unlocking of weapon/attachments)
hackers are pretty rare and weeded out very quickly once spotted.
stock turrets are already pretty amazing
stock weapons still pretty effective
galaxy raids
c4 fairies (allahu snackbaring aircraft and atv's)
map is absolutely huge and there is no ""loading map"" like they do with guild wars, warframe, or WoW.
Platoon leadership is 85% competent

cons(just things you can easily adjust to mostly)
difference in servers can lead to difference in active player population depending on time of day so pay attention to location of your server and respective time zones. I use Connery server which has south korea/australia/ west coast america on it overnight and early morning. populations may seem tiny at first until you find the server that matches your daily schedule, in which case you'll start seeing over 300-400 people fighting on same map. mind you this is over small territory that they fight for so you won't be feeling lonely AT ALL.

runs on DX9 so don't be suprised if you have performance issues that would normally be unusual. It likes high clocked single core proccessing so your overclocked CPU like an i3/i7 series would run this amazingly butter smooth. currently using geforce NOW beta to circumvent any of this.

being an individual sucks, join a squad with high coercian (they actually act like team and have good leadership)
server merging now has some squads speaking foreign languages even on english servers :/
dark souls of fps, don't rage to hard over dying alot because everyone does, your all a bunch of well armed cannon fodder in the end.
lacks matchmaking so you will have absolutely skilled people on your server, though this means they can be on your side too so yeah :D
depending on your server it may be lacking in action in some parts of the day
people can act as moles and be helping the enemy through private messaging and 3rd party communication, watch out for these asshats.
takes a little while to earn the certs to unlock weapons free without taking out of your wallet.

being a pilot has a learning curve, just be very careful of how you move your mouse until you get the movements down. not very joystick friendly at first but can make a difference in a turnfight vs using a mouse.

infiltrators are assholes and so are anyone using magriders
being painted by 4x missile launchers tends to cause severe anxiety and happens often, so boom and zoom as a pilot don't linger ever. stealth and fire suppression coupled with increased agility is key for a good turnfighting and stealthy groundpound runs


overall it is an extremely good full scale war fps that takes off where box office game franchises like battlefield and call of duty have epically failed. 

oh and don't ever join chinese squads, they have absolutely no clue what they are doing half the time.
TR ftw",1472235113,1519286449,True,0,0,0,0,True,False,False
218230,29514869,76561198009301577,137,13,105248,0,70294,1550095339,"RE review

re reviewing the game since beta.. its nasty.. horrific.. dont even download this trash.
the publisher is allowing SWARMS of korean and chineese to flood US servers...and im ashamed of myself for backing this game when they scrwed it up this bad.. IT BECAME SOOO BAD HIGBY RESIGNED FROM HIS POSITION IN THE  COMPANY",1485492336,1514336011,False,0,0,0,3,True,False,False
