218230,29949275,76561197976597821,0,6,207627,91,86403,1707880927,"This is one of the most difficult FPS games I've ever played simply because of the sheer number or people who can end up shooting at you because of the smallest mistakes... This game puts the OP in ""Teamwork OP"" because a well oiled outfit that has its tactics down can storm a base and turn the tide of a battle even when outnumbered. This game is not pay 2 win but it WILL require you to grind to acquire the gear you want if you're not interested in investing some money for DB cash. There are many class unlocks that cannot be bought and must be earned. 

At this point of the game (like 4 years running now) there are many vets on both sides with lots of gear/weapons unlocked and it can seem daunting for a new player. However the unlockable weapons tend to be sidegrades rather than an outright upgrade, meaning that the stats of the new weapon won't necessarily be better than the last but it may be better for different circumstances i.e. CQC, or Long/mid range fights. Each weapon excels in its own area.

I Believe there is even an xp bonus for soldiers under BR (Battle Rank) 15 to help you get some quick Cert points. I suggest medic for new players as you can earn a TON of xp without having to kill anyone and medics are SUPER useful in big or small fights.",1487191466,1487191466,True,6,0,0.551330626010894775,0,True,False,False
218230,29948687,76561198119785393,0,10,59727,0,3239,1694799856,"Great game, msot fun I've had at 20 fps",1487189550,1487189550,True,0,2,0,0,True,False,False
218230,29943828,76561198282676459,0,1,61,0,61,1455474667,"hard game, like battlefield but laggier, very fun with multiple friends",1487173028,1487173028,False,1,0,0.472041606903076172,1,True,False,False
218230,29941507,76561198171887133,130,26,2159,0,1106,1657913340,sucks cock',1487165300,1487165300,False,0,0,0.431662768125534058,0,True,False,False
218230,29934569,76561198256739787,0,16,555,0,465,1551943826,"- Join with a 4 man squad
- over 2000 players in the game
- Uber realistic battle simulator
- Lose track of time
- Play until 1:00 AM for the first day and then continue to watch videos on it all night
- Love the game, especially dropping as roleplaying as airborne.

10/10, AMAZING OPEN WORLD BATTLE SIMULATOR",1487132048,1487132048,True,3,0,0.527869462966918945,1,True,False,False
218230,29934396,76561198027029138,0,17,27459,0,4631,1610860633,This game is pay2win. Those who say otherwise are paid trolls to say otherwise. The weapons and armor are insanely unbalance to favor those who pay to buy cash only weapons and unlock all five levels of your nano armor with cash. Recent updates added OP weapons that are cash only. You have literal neckbeards who live in their basement playing this game all day long and ruining the game for others. People who played this game know who I am talking about. Grinding to get your weapons will take you at least 2 weeks at best but at least a month for one good weapon or a few suit upgrades.,1487131107,1487131107,False,1,1,0.354487836360931396,4,True,False,False
218230,29934108,76561198005107792,562,20,8353,0,8353,1487129013,"I've had a hundred hours in the game when it first came out on steam. Massive fun. Everyone was the same level and had the same upgraded gear. Only people was massive hour sinks really outshined the rest of the playerbase.

Now four years later, I rejoin with a few friends. I only find that the balance I once new is comepletely gone. All of my foes are untouchable gods with one-hundred percented class builds. Where as my friends are literal cannon-fodder with no chance of having any infuence on the battle.



If Daybreak expect new players to join the game;
Study what builds and weapons they need to dedicate their certs to,
Grind experience through unconventional and unfun means,
All the while getting assfucked by their older playerbase.

Then Daybreak...
You're probably right. Because people are suckers who don't know what a toxic relationship is.

TL:DR Shoutout to anyone who reads this review, you have to either dedicate yourself to being hardcore at this game or go home. No casuals allowed.",1487129682,1487129682,False,4,0,0.491313517093658447,4,True,False,False
218230,29933365,76561198108611308,0,1,15030,0,5255,1687835283,Great game!,1487126600,1487126600,True,0,0,0.499687701463699341,0,True,False,False
218230,29933105,76561198155221859,0,7,1991,0,1921,1508543077,Awesome Sauce!!!!!!!!!!!,1487125540,1487125540,True,0,0,0.499687701463699341,0,True,False,False
218230,29931048,76561198234133092,0,3,2354,0,1123,1638848712,"This game is terrible. Im rank 12, but that only happened by luck. Why i hate this game is because when you walk outside, its about 1 second until you die. Also, i reccomend not giving ANY OF YOUR MONEY to these people. Everything is SO expensive. Plus, its literally IMPOSSIBLE to get DayBreak coins without buying them or buying a stupid membership. I wasnt planning buying anything anyways because all of the stuff is so dumb-looking. So i highly DONT RECCOMEND this game. So if this game is in your Queue, skip it.",1487116263,1487116337,False,0,0,0.39128410816192627,0,True,False,False
218230,29922478,76561198084743670,179,19,295,0,227,1487179994,"This game is amazing, my favorite part was when i got my first flying vehicle, took a bit to get used to flying but eventually i got the hang of it",1487085111,1487085111,True,1,0,0.503105580806732178,0,True,False,False
218230,29912318,76561198093681640,0,11,7064,0,2225,1682813244,icat play this game like,1487035929,1487035929,True,2,0,0.500773608684539795,2,True,False,False
218230,29911507,76561198292658887,0,12,1885,0,1471,1558890991,Some seriously impressive battles happen in this game. Nothing like this available anywhere else.,1487031326,1487031326,True,3,0,0.517075598239898682,0,True,False,False
218230,29907890,76561198119643995,0,23,14629,0,1623,1691506515,"In short: Amazing fast-paced, feels like part of a war.

In Long: So, this game has all the great elements from Battlefield, massive open world frak-ton of players and tons of vehicles in both air and land, and a nice assortment of classes and different weapons for varied playstyles.
Wanna camp the enemy base and be an annoyance to the enemy? you can!
Wanna snipe from across the map? you can!
Want to jump out of your galaxy, fire your rocket at the enemy craft and enter again, mid-air? you can!
Want to land and coordinate an assault with an actual platoon? you can!
That, and i got a soft spot for Sci-fi games, something battlefield games did only once, sold me to this game
My only shame is the fact that my computer cannot run this game at the moment, this easily the first thing i'll try out in a new PC.",1487015649,1487015649,True,1,0,0.503105580806732178,0,True,False,False
218230,29904693,76561198140503511,0,1,89520,20,32354,1708272710,Great game,1487006024,1487006024,True,1,0,0.503105580806732178,0,True,False,False
218230,29898452,76561197983304204,686,54,7044,0,2186,1650121418,"Level 2000 vs Level 1 = 1000$ account value vs 0$ account value = He kill you 100 times, you kill him 0 times.

Not exactly P2W, but, or you can pay, or you can die.

Dont hear people telling is not P2W because starter weapons are the best.

Skills, Accesories, Suit ... if you are new, you are fuck at so many levels.

Rape simulator.

Uninstall works decently.",1486989348,1486989348,False,0,1,0.38010057806968689,1,True,False,False
218230,29877611,76561198075820711,0,18,609,0,556,1486919344,"It's too difficult, i don't know to join a fight, i don't know where to go, i don't know who are my enemys or my mates, i don't know anything cause it's my first time and there's no one to teach me, the hints are very bad, this game is too complex, you will get angry...i really like the game but i ""can't play it""!!!!!!!!",1486918646,1486976036,False,0,0,0.39176979660987854,5,True,False,False
218230,29892960,76561198271753845,0,10,17606,68,5838,1708132647,"Awesome unique gameplay. Imagine battles with hundreds of people taking place in tightly packed corridors.
You can't see your targets because your view is being blocked by the sheer quantity of projectiles in the air. You are constantly dying to random grenades and fire, but that's okay, you just get revived. You throw a grenade and get 5 kills. You spray with your weapon and catch a few more kills. Then your faction takes the facility and overruns 50+ people in a mass scurry. You hear a bunch of people in the chat shouting out orders, you follow them because you want to be part of the group and join in on the farm. Rinse and repeat.

Please make Planetside 3. Thanks :)",1486968424,1486968424,True,0,0,0,0,True,False,False
218230,29882138,76561198006968183,0,1,6620,0,1330,1678572540,absolutly the biggest fps out there you can concentraite on small objectives or whole continents love this,1486931231,1486931231,True,0,0,0,0,True,False,False
218230,29881025,76561198033984863,476,47,17356,0,2659,1664138499,"ok this is the rundown of planetside 2

you want to kill that ship, well you have to buy a gun for that

want to kill that tank, need to buy a gun for that

want to have people spawn on the point you made, need to buy upgrades for it to live long enough to get noticed

dont want to buy these guns? THEN (EFF YOU SEE KAY) YOU CUZ YOUR GUNNA DIE A BUNCH

""but the game has ingame credits called certs you can use to buy these things""

 Ya as long as you get a 20 player killstreak without dying, revive your entire platoon, then have another entire platton spawn on your spawn and cap 3 to 4 bases you might get onely 5 or 6 certs when everything in the Duking store cust a minimum of 650 to 8000 certs and you might as well not buy the cheaper ones since they do nothing to improve your gameplay

also your life is shorter than a stormtrooper in a fire fight with the main character no matter how good your aim may be so dont think getting that killstreak is gunna be easy

So yeah in summary unless you have a high disposable income you aint gunna do well at this game and while it will have good moments and war stories they all can be ended ""well we lost cuz he had a better gun than me""",1486927966,1486927989,False,1,1,0.391346335411071777,4,True,False,False
218230,29879528,76561198131606720,208,17,4732,0,2918,1681673853,"Absolutely 100% reccommend this game. The combat is fantastic, once you figure out what you're doing. The best part is, its not just a run and gun game. Strategy matters. It's phenominal.",1486923947,1486923947,True,2,0,0.541666686534881592,0,True,False,False
218230,29879291,76561198115798383,612,28,219,0,117,1492828252,"(Played 1.8 hours) I like this game and for now I don't have much to say so I'll keep it brief.
This game has lot's of potential, It's a first person shooter. Basicly an open world type deal. From what I can see It's a one gamemode type deal, the game mode is fluid fast. The only real issue I have at the moment that it's sorta empty, it needs more people in the game. I'll update this review at 24h of playtime so I can have a better understanding of the game.
",1486923349,1486923349,True,0,1,0,0,True,False,False
218230,29866799,76561198330895259,221,29,1067,0,60,1658068350,"P2W (jk) love this game, i play it on ps4. level 57",1486885391,1486914341,True,0,0,0.475312203168869019,8,True,False,False
218230,29521418,76561198199872894,33,8,253,0,179,1517124683,"This is the best game I can find on Steam and its the second best game behind Battlefield.

Pros:
6 classes for you to choose from depends on your play style
There are 4 huge a** maps
There is a maximum of 2000 players in one game
Nearly endless matches
Graphics are not bad
Realistic vehicle physics
Free to play! :)

Cons:
The system requirement is a little bit high for a 4-year-old game
Not enough vehicles
No destructions
Pay to win :(

Conclusion:
If you like Sci-fi FPS games and you have a decent PC, definitely try it out and I'm giving this game a 9.2 out of 10",1485527214,1486903292,True,1,1,0.502487540245056152,0,True,False,False
218230,29868668,76561198126851698,0,2,449,0,356,1531127507,"I have 4 fps in the menu.
",1486892795,1486892795,True,2,1,0.54308772087097168,0,True,False,False
218230,29867271,76561198054398086,253,3,5371,0,3306,1659884657,P2W and launcher crashes every 10 seconds when trying to update the game,1486887265,1486887265,False,1,1,0.388320982456207275,0,True,False,False
218230,29862450,76561198014208637,0,2,450,0,207,1506285540,"It has some optimization problems, but the game itself is very advanced with massive battles and lots of players.",1486865842,1486865842,True,0,0,0,0,True,False,False
218230,29860179,76561198017426044,746,40,31506,0,24537,1598667412,"You thought Battlefield was war. You were wrong. 

This is war. 

Battles with hundreds of people fighting on each side in Combined arms battles with air and land vehicles across maps that are more than 100 square kilometres. Grab your 980ti and hold on tight, because you're in for a treat.",1486856147,1486856147,True,56,10,0.759764015674591064,2,True,False,False
218230,29860071,76561198038194365,273,64,834,0,834,1424430493,well,1486855809,1486855809,True,3,0,0.565217375755310059,0,True,False,False
218230,29857201,76561198195061985,116,16,17,0,17,1486845747,bag game graphic is like in 2005 :)),1486846375,1486846375,True,1,0,0.46528276801109314,0,True,False,False
218230,29853158,76561197961915793,0,13,66098,0,16183,1557083445,"Yea the battles get stupid intense sometimes, but just say fuck it and equip rocket launchers for arms.",1486834864,1486834864,True,1,0,0.519230782985687256,0,True,False,False
218230,29851606,76561197993401485,1787,116,9409,0,1335,1694900539,"***Please do not let the low hours retract from this statement | I have played it much longer on the non-Steam version***

PlanetSide 2 came out five years ago and much has changed. From the old SOE days to now DayBreak, PS2 has changed somewhat substantially. There has been good and bad with every update and I should know; I admit I have a founder account and even played in the Alpha and Beta. This game has slowly and lethargically evolved over the years. While there are many that show disdain for the DayBreak I do not find them to be that horrid. Sure it feels somedays that the server population for Emerald isn't what it used to be (Remember when Emerald wasn't a thing and there were about three other servers/player account that got merged into it, I do.) but that does not mean that the game is dying, I keep running into new players every time I log in. Many of them are great and many are little sniveling CoD kids. The main draws of this game are and will forever be:

-Massive maps
-Massive fights
-Coordination/Teamwork
-Forward Operating Base/ HIVE building

I hope that this game will last for many more years as there really isn't anything else like it right now. I give the game a rating of 8/10, it's solid and I have stuck with it but there are still some old issues from the SOE days that were never addressed.",1486830576,1486833141,True,1,0,0.525862038135528564,0,True,False,False
218230,29847991,76561198140758098,109,17,1172,0,301,1586818678,"This game is awesome,point blank
although you gotta be pro,not playin for fun...
or else you die alot...
and the mechanics are a little bit weird for flying and stuff...
but is a good damn game
considering its also free too!",1486820842,1486820842,True,0,0,0,0,True,False,False
218230,29847297,76561198205532647,43,3,2384,0,2019,1527419233,"Игра по задумке хорошая но вот исполнение....Просто ужасная балистика и баланс сторон и это я отношу к недостаткам в геймплее так-же ужасная оптимизация на gtx 1050ti я играю у меня 60 фпс,но если будет замес то он будет падать до 1-5 фпс,ОЗУ у меня 16гб  хотя нужно всего 6.Нравится задумка но игра сама кал полный 3/10",1486818903,1486818903,False,1,0,0.436924487352371216,0,True,False,False
218230,29843220,76561198134747566,35,3,20275,0,7009,1694464695,"All I would like  to be added is prices lowered just a smidge being able to name your squads what you want and being able to attack warp gates (best game ever doe ;)
",1486805950,1486805950,True,0,0,0,1,True,False,False
218230,29841304,76561198349228359,122,5,4788,0,1169,1588520222,it is so fun,1486798441,1486798441,True,0,0,0,0,True,False,False
218230,29839737,76561198274491278,0,3,3159,0,1517,1592534512,Very Fun Game I have played it it gets boring if you play it everyday but yeah its a pretty good game,1486791819,1486791819,True,7,2,0.585725724697113037,1,True,False,False
218230,29839539,76561198081154655,0,16,27505,513,1473,1708155551,nice game and large stage you must try once,1486790926,1486790926,True,1,0,0.508320748805999756,0,True,False,False
218230,29832314,76561198069745148,0,8,136,0,136,1486760077,"Horrid controls, confusing, pay to win it seems.",1486760156,1486760156,False,0,0,0.411025136709213257,0,True,False,False
218230,29828046,76561198344284190,0,15,15206,0,201,1688504529,"Ive been playing for a couple of years now (on ps4 and pc) i got to quite a high level on ps4 as vanu but i have only played a couple of hours on pc because i brought other games and got addicted to them for months. I recently had to restore my computer so iam gonna install it again right now and start playing again. Absolutely worth downloading it has everything you would want from a shooter and more. 3 empires fighting it out in one huge continent (huge fucking maps, not your call of duty or battlefield bullshit), Different terrains that suit different playstyles for example if you like playing pilot dont play on Hossin because its a dense jungle and you cant see infantry for shit. Hossin is more for infantry. Its pretty good for inflitrator because you can use the trees and stuff for cover. It has Exellent weapon customization and really gives you a veriety to choose from once you have enough certs (in game currency). By Level 10 you should have at least 1000 certs and that can get you one of the best weapons. Say for example you like playing inflitrator, by level 10 you can spend your 1k certs on the most powerful sniper for whatever faction you are playing as (each faction has different weapons with different capabilities). Each faction has different vehicles also. Last time i played there was atleast 500 players in the game and it was fucking mental. Its one of those games that just keeps on going. Huge attacks and defences, massive firefights, and just an all around great fps. one of the greatest i have ever played actually. idk if this happens on pc much because like i say, only having a few hours on record, but on ps4 there were a decent amount of team killers. They werent everywhere but they were numerous. In all the time i played on ps4 quite a few tried to purposely team kill me, some succeeded, but on pc it only happened once and it was an accident because he said sorry. So if you like a good firefight and you like big maps with many ways to play and contribute toward your empire, go and download it right now. start of in koltyr (the noob area, you are forced out at level 15 and cant go back) then when you are level 15 go and join everybody in one of the four massive continents and prepare to fight with and against hundreds if not thousands of people at a time. you can go to any continent at any level at any time as long as one of the opposing factions hasnt won and locked it down but it is better to start of in koltyr because it is smaller and there will be people of roughly the same level as you and you can gank some easy kills. (hossin, amerish, Esamir and indar are where the big boys play). Download, play and enjoy is all i can really say. If anyone Team kills you, i can assure you that he or she will get their comeuppance. Everybody is generally nice and play as a team really well. Every game has their knob heads, but on pc, i havent found any yet. just on ps4. You can also purchase helmets and cosmetics for vehicles and camos for your weapon or character using Daybreak cash or DBC (in game currency brought with real life money). But that is just cosmetics, The wapons and attachments are all obtainable in game with certs. (on ps4, by level 20 i had a damn good loudout, never spent a dime). And the vehicles are unlocked through levelling and you can use your spawn tokens to spawn them, the same as the max class (walking tank). These spawn tokens will recharge over time. So, there you have it, i could type more about the game but these are the basics, i dont have time to go into depth right now, i need to go play lol. Nothing bad i can think of apart from team killing noobs that i havent managed to find yet on pc but they will exist. Its a thumbs up from me and a solid 9/10 ( i would give it a 10 but the team killers drag that 1 percent down, ik its not the games fault but i refuse to lie). Like i said, havent found any on pc personally yet but i know they exist. But i gave the game a 9 because other than the team killing there is nothing bad i can think of right now. Its a really fun and addictive game and iam gonna get back into in and see what has been added since i last played. Gotta give credit where it is due and it is definitely due here.",1486746342,1486746342,True,1,0,0.523809552192687988,0,True,False,False
218230,29815170,76561197961413539,0,6,44046,0,35152,1518373234,"Very fun, totally worth your time, especially for tank battles.",1486696053,1486696053,True,0,0,0,0,True,False,False
218230,29812626,76561198312122394,0,1,85,0,85,1486685646,very very very laggy... could be fun if i could get smooth gameplay,1486684054,1486684054,False,0,0,0.413111716508865356,3,True,False,False
218230,29750989,76561198243422714,0,4,17069,0,16236,1492522868,"Really unique and fun experience some days, others not so much. Fundamentally flawed in that you can't always jump in and enjoy the game.",1486421837,1486657082,False,9,0,0.510669291019439697,1,True,False,False
218230,29803809,76561198116345328,0,2,92317,0,84065,1593116376,5/7,1486654721,1486654721,True,1,0,0.486111104488372803,0,True,False,False
218230,29802953,76561197997064668,1002,9,44192,0,12313,1665158215,"The most original FPS I have played in a long time, and probably my favourite.",1486652448,1486652448,True,2,0,0.525862038135528564,0,True,False,False
218230,29799692,76561198099964061,0,18,32,0,32,1486640837,so horrible i dont know how people enjoy this game it sucks so much,1486640889,1486640889,False,1,1,0.301890730857849121,0,True,False,False
218230,29795690,76561198134766422,0,4,64310,0,12096,1622075311,great game with tons of variety in ways to play. I do wish that the things you could buy in the game didn't cost so much for how old it is now though. Paying for guns is not necessary because the base guns for all frations are good compared to what could get.,1486620211,1486620211,True,4,0,0.52173912525177002,0,True,False,False
218230,29794498,76561198169703589,79,4,55271,295,366,1708483547,"This is a fast paced game to the fullest. One minute you'll be riding your flash, and next thing you know an Infiltrator picks you off or a tank blows you to bits.

I absolutely love it, but let me tell you one thing. NEVER run solo. This game can be overwhelming to lone wolves and new players. There are no spawn limits, so you might end up in a war zone with dozens of players, vehicles, and aircrafts swarming around you and you WILL die, no doubt about it. Yes, the graphics are a bit dated but that is ok, they need to be. There are multiple areas with over 2k players and it can bog even the best of systems down.

Pros:
- Multiple classes that stick to their purposes
- There is always action to jump into
- TONS of enemies to kill
- Buildable Platoon bases (completely destructable aswell)
- plenty of vehicles or aircrafts to ride in
- AMAZING dogfights
-Gives you a pretty good idea of what war used to look like (WW2 for instance) 

Cons:
- Sometimes to many people for some new players
- REALLY easy to die (can be considered a Pro aswell)
- Pay to Win (Better guns you otherwise couldn't get)
- Hard to keep good vantage points
- Platoon leaders tend to be easy to upset (at least from my experience)

I highly recommend this to any veteran or beginner FPS players as it works your reaction timing, distance judgement, and aim a lot more than other games.

I rate it 9.85/10 Would play again",1486613397,1486613397,True,2,0,0.52173912525177002,0,True,False,False
