218230,29793361,76561198333724437,0,6,155376,0,10961,1674264596,"I fell in love with this game, but it took time. At first this game seems overly complicated. However it does get better, by better I mean amazing. 

I've only ever played as Vanu so I'm biased but you can pick from two other unique factions. Each faction has strength and weaknesses. When you first log in you get a basic run down of the pros of that faction , so there is help in that regard. 

The customization is great, and you get six or seven player types (medic, infiltrator, etc) plus several ground and air vehicles to choose from (all can be customized). Plus your faction pays you certs every min so you can load out in a vehicle or Max about every 5 mins.

The game looks amazing and the immersion is excellent. From the sound of crickets at night to the roar of aircraft overhead, this game gets intense. 

Speaking of intense, the battles (good battles) can be down right nerve wrecking. Hundreds of fighters, tanks moving across the battle zone air craft raining bombs and bullets flashes of rounds from every direction, it can leave you exhausted after two or three long sessions. 

The game is also good about giving you good starter weapons. You earn certs for upgrades by kills, controlling points, overtaking bases etc. as you earn these certs (different from pay you get from your faction for vehicles and maxes) you can upgrade abilities, weapons. You can customize your character to excel at different things. Maybe you want to focus on taking out enemy vehicles, or you want to mow down hoards of other enemy - you choose... 

In my opinion this is the best mmo/fps out. Nothing compares to the massive maps (four or five continents) with snow, jungle, desert, and a multitude of bases. The mount of weapon and character customization options. The ranking system is fun and keeps you going, along with rankings and ribbons, and xp... Also it's free!!! I still can't believe it's free. 

So it took time but I love this game and have stopped playing anything else. This is however not a perfect game. There are log-on issues occasionally, glitches (after I play as a Max and go back to infiltrator my infiltrator no longer cloaks) but overall it is 100% worth the investment of time. Also spend time on watching videos about how to play. YouTube or in your player load-out screen they have basic training tutorials. So get out there, have fun and play with friends or just join a squad and work together ( this is key).",1486606969,1486606969,True,2,0,0,0,True,False,False
218230,29792357,76561198107246091,68,9,9085,0,1977,1648065385,"This is a great game i would recomend it to anyone that likes future themed fps games, it is very realistic and the way the teritory functions is very unique and i have never seen anything like it in another game, my one complaint is that certs (money) are very hard to get, but are obtainable",1486601459,1486601459,True,3,0,0.523809552192687988,0,True,False,False
218230,29749428,76561198004427256,802,85,6928,0,1203,1701641278,"The difference between pay2win and freemium is very big. In freemium, the game is provided for free, but certain features are locked behind a paywall. In pay2win you pay immediate money to get ahead, buy buying weapons or skills that non-paying members have to grind for a long time to get, or cannot get at all. This game falls under the pay2win model. 

Its not skill based, its a ""who can find and shoot an enemy before they can see you"" type of game. Or whos weapon does more damage than the others in an equally skilled engagement. The anti-vehcile weapons are GARBAGE. It takes 10 anti-vehicle hits to destroy a lightning, which is a light tank. A single engineer can repair a light tank through a single heavy infantry (anti-vehicle). 

I have over 100 hours logged on vanu, I have 40 hours logged on TR, I was in closed beta. My vanu has 1468 certs and several unlocks, as well as a kdr of 1.46... which is not great but its certainly not bad.

I tried to take on a light little buggy, a car with a tiny little machine gun attached to it, in a mosquito, a vtol with the same machine gun. The buggy won in that fight, despite both of us constantly hitting the target (it was a stationary battle for god knows what reason).

I have used the NS annihilator, which takes 6 hits to the front of a vehicle to kill and has a 4.7 second reload. The S1, which takes 6 hits from the front to kill and has a 5.2 second reload. I have used the ML7 and ASP-30 Grounder as well, both equivilents of the previous ones I have mentioned, respectively. A basic repair tool can easily repair 1800 damage in 10 seconds or less. So yes, a single heavy Assault could never take down a tank, as I said.

The only realistic way to take out vehicles is to get into an anti-tank emplacement. Have an armored column of equivilent or more tanks, focusing fire. Or have 6 to 10 heavy assaults hitting the tank at the same time, with minimal misses on weapons that are extremely inaccurate at the realistic range you will be fighting tanks (over 300 meters). 

The NS annihilator requires 1000 certs to purchase, while a single alert provides you with around 50 certs. Lets do a bit of math for how long it takes to get a weapon now. Each alert can take anywhere from 15 minutes to a couple of hours. On average its 40 minutes per alert, with a big battle. In order to be able to unlock a rocket launcher at 1000 certs, it would take 13.33 hours to purchase one, on average... This is not including the 10-20 minutes it takes to go to the alert location... So realisticly, for those who have a life, you will be looking at a weeks worth of a grind per cert, or 6 dollars. So yes, pay2win does exist.

The base weapons can do a decent job, but other weapons tend to do more damage or have better accuracy than the base weapons. The ones you can unlock with certs are more situational, but they are better in those situations.

I WILL NEVER RECOMMEND A PAY2WIN GAME, UNDER ANY CIRCUMSTANCE! The development of this game is so flawed, I will never give it a positive rating, nor a recommendation. The positive reviews are typically made by sheeple or fanboys who have not played better games. It is the only real mmofps on the market, but its set up in a way that is just piss poor. The original was slightly better than ps2, but not by much.

There is a reason this game has several low population servers and only one medium population server, the game simply sucks. Dont waste your time downloading it, go find better. Mind you the wepaon data is backed by the data from the planetside 2 website. This review was altered slightly to show that cistapade has very little data to back his statement up.",1486415485,1486583281,False,5,0,0.473737388849258423,7,True,False,False
218230,29786491,76561198070219195,100,61,1278,0,1151,1448811547,good game,1486577220,1486577220,True,0,0,0.496323555707931519,0,True,False,False
218230,29784257,76561198076676545,65,15,10325,0,9003,1538076459,Old game I used to play but gave up due to new games. I still like the game no matter what. However I may be f2p on this but it's still an amazing game. The war never ends and there's loads of players to fight everytime. The game is amazing still even though I left for a long time.,1486569700,1486569700,True,1,0,0.520140111446380615,0,True,False,False
218230,29779797,76561198335839174,0,3,502,0,192,1620194618,I think it is alot of fun,1486554502,1486554502,True,0,0,0.496323555707931519,0,True,False,False
218230,29775254,76561198050339615,0,22,38720,0,11882,1690943594,"Very fun tactical shooter. try it out, its free you have nothing to lose",1486530411,1486530411,True,0,0,0.496323555707931519,0,True,False,False
218230,29698320,76561198071760031,0,188,16489,0,13169,1585352448,"when you sign up for monthly membership... its not a 1 time thing like most games i know... it will be secretly set to ""auto-pay"" and its $14.99 a month. 

daybreak studios doesnt have in game chat customer service, so if you have a problem, they really dont want to hear about it

hackers are everywhere. do a quick search for planetside 2 hacks on a google search engine. you will come up with results... and for that matter they are WORKING hacks. ive been aim botted multiple time. steam forums doesnt want to hear it

you shouldnt do business with these idiots anymore. all they want is your money. if you have any complaints. they dont want to listen to it. just your money... thats all they care about.

the planetside 2 steam forums are no longer supervized... go ahead... talk all the trash you want. they dont care",1486228627,1486510931,False,2,3,0.426627010107040405,0,True,False,False
218230,29767386,76561198022606342,265,100,1404,0,1334,1511641402,One of the best free to play games out there!,1486493954,1486493954,True,0,0,0,0,True,False,False
218230,29756444,76561198030530724,195,36,3308,0,2944,1508064423,A lot of genuine fun.,1486451207,1486451207,True,1,0,0.52173912525177002,0,True,False,False
218230,29754459,76561198149713186,0,11,3307,0,1590,1663811779,"Great game, but runs like poop for everyone.",1486439651,1486439651,True,0,1,0.476190477609634399,0,True,False,False
218230,29754438,76561198026807413,190,1,61514,0,31891,1680637646,the best free to play game out there unlike most you dont even need to pay microtransactions to win its all based on your skill,1486439564,1486439564,True,0,0,0,0,True,False,False
218230,29745833,76561198007643775,88,50,35788,0,3478,1694201160,"Let me just start by saying im not a great pvp person i play for fun i have a job already , Fun is the key word here and boy is this game fun , Sure it has its pro players but pro players can die even with your shit starting gun and thats the beauty of this game everyone has a role to play.

So i complete my tutorial and join my first battle just a mere 100 each side , I decide very quickly im not a killer so i switch my char to an Engineer and start to fix stuff like tanks and gun implacments i also throw ammo packs down , Another great addition to this game is you can switch your char class mid battle.
The battle isnt going well and i jump into an anti aircraft gun and start firing , Before i know it ive shotdown over 12 enemy planes and my exp is shooting up , I then get on the ground with the rest of the grunts and start to fix tanks and guess what in the middle of the battle and people actually thank you for it.

By the time the battle was over which they seem never to finish i had enough exp to revamp my char give him more skills and abiltys so you actaully feel you have been rewarded.
In total i got 7 kills and 21 deaths and never had so much fun , A community that dosent roast you and is very polite and free to play at that.

In summary this game is amazing its not p2w as even your starting gear can kill a pro and while Daybreak do have a store in the game where you can by cosmetics and such none of it effects how you play really.

10/10 thx for the Fun.",1486403264,1486403264,True,1,1,0.422909379005432129,1,True,False,False
218230,29744557,76561198160861401,185,17,2146,0,1553,1493145604,Realy fun game,1486399283,1486399283,True,0,0,0.496323555707931519,0,True,False,False
218230,29740504,76561198051272131,176,3,65156,0,62039,1643129396,"By Far one of the best FPS's I hae ever played, as you can see by the hours spent playing this game!!",1486385686,1486385686,True,0,0,0,0,True,False,False
218230,29737619,76561198047683197,0,6,7521,0,6037,1569367940,"play this
",1486372097,1486372097,True,0,0,0.47413790225982666,0,True,False,False
218230,29735947,76561198291007744,0,5,409,0,69,1642493902,if u like crazy and fast fights this is the best game for u,1486362937,1486362937,True,0,0,0,0,True,False,False
218230,29733245,76561198114237544,285,10,585,0,265,1650158267,love this game <3,1486347030,1486347030,True,0,0,0.462962955236434937,0,True,False,False
218230,29731621,76561198219059337,0,4,16,0,16,1486338483,The minimum system requirement is BS. I know I can run the game just fine but it wont let me. IF YOU DON'T HAVE MEET THE MINIMUM REQUIREMENTS DON'T INSTALL !!!!!!,1486338580,1486338580,False,1,1,0.398448824882507324,4,True,False,False
218230,29731386,76561198081781591,0,24,756,0,756,1434016482,"Good game, but I play so many hours on non steam servers.",1486337403,1486337403,True,0,0,0,0,True,False,False
218230,29729939,76561198088258144,0,4,10133,0,517,1512496534,"I like to shoot things, but I'm terrible at these kind of games. Now I can play and not worry about screwing over my team.",1486331783,1486331783,True,0,0,0,0,True,False,False
218230,29724568,76561198085882369,0,5,21961,34,8757,1708721512,Probably THE best first person shooter ive ever played... do your self a favor and start the download right now.,1486316337,1486316337,True,0,0,0,0,True,False,False
218230,29723558,76561198156929995,68,14,1667,0,1315,1503461505,Doesn't work half of the time. I get on and then I see just a white screen for a few seconds until it crashes. I have a nice PC and that is not the problem.,1486313829,1486313829,False,1,0,0.456431567668914795,0,True,False,False
218230,29722126,76561198051190560,249,11,1707,0,631,1609693573,Everything was  great until daybreak took control now the fucking client crashes all the time and the game crashes so when i get back to the client the client crashes and doesnt let me get into the game its an infinite cycle of bullshit fuck these develpoers h1z1 is a shit game and you all fucking suck and all you've done to this game is make it annoying to play due to the problems with the client and the game crashing randomly I shouldnt have to fix your mistakes by looking it up on the internet you should fix your own mistake.,1486310252,1486310252,False,1,0,0.454545468091964722,0,True,False,False
218230,29720698,76561198190952346,0,2,385,0,345,1486306285,it is a shitty online computer game that doesnt do anything other than make you angry,1486306397,1486306397,False,1,1,0.41211363673210144,1,True,False,False
218230,29716025,76561198051432144,21,2,21018,0,14086,1647452423,Best game ever,1486293463,1486293463,True,0,1,0,0,True,False,False
218230,29711761,76561198158352735,0,50,5481,0,5190,1636050627,"looking for mass multiplayer?

bee carefull, its bad optimazed.",1486277728,1486277728,True,0,0,0,0,True,False,False
218230,29711108,76561198083335803,274,20,5228,0,2315,1699997631,Yes. This game is just yes. Everything can be accomplished free to play and it has much less of a grind than games of a similar caliber. (If they exist) The community is generally very welcoming and fun to play with. I have so many cool stories to tell about this game and I've only played about 60 hours. Would definitely recommend.,1486274632,1486274632,True,0,0,0,0,True,False,False
218230,29709077,76561198078226796,0,8,22637,0,19400,1604020175,FIRE,1486265277,1486265277,True,1,0,0.523809552192687988,0,True,False,False
218230,29708594,76561198057558546,0,46,15904,0,5076,1697173437,just dont,1486263237,1486263237,False,1,0,0.393476128578186035,0,True,False,False
218230,29708044,76561198008936476,990,20,3475,0,2904,1629430426,"You like Battlefield?

You like Starwars Battlefrount (The Orignals like 1 and 2 not that new shit show one)

Then get this game 3 sided warfair with 3 factions each with their own styles, weapons and other stuff only for them thats awesome

If you really want a good Review i would suggest you watch Angry Joes Video on planetside 2 while abit dated it gives the basic impressions on the game that still holds strong allthough things have changed like a new intro with new characters thats Highly Improved

But the Number one Reason you should get this game is for the Paid Member ship Now hear me out

Not only does the Paid Membership is worth it in my Opinion but here is the good part

One Membership like 14$ amonth = all of their Games as a Premium, Which are 

Planetside 2, Dc Universe Online, Ever Quest 1 and 2 and i beliave that Day-Z Game they have, and their Currancy that you need to pay for with real money, also connected to all games, so you gotta think ""Should i pay 50$ For a bunch of points and spend it on one of their games, or spread it out to their other games, it would be nice to run around as harley Quinn (Custome wise) in their DC Online Game and have a nice gun or two in Plantside""

So yeah if your planning of  getting this game which is free get the membership It was worth it for me and i will be for you",1486261094,1486261094,True,1,0,0.52173912525177002,0,True,False,False
218230,29706828,76561198010736774,110,1,158942,27,48879,1708860799,Played this game for around 4 years. Can't get enough of the thrilling carnage of futuristic war!!!,1486255456,1486255456,True,1,0,0.519774019718170166,0,True,False,False
218230,29705758,76561198152230252,215,6,6839,0,1906,1659199903,its been failing to log in and start all day since i played this morning,1486250980,1486250980,True,0,1,0,0,True,False,False
218230,29703130,76561197997849105,218,2,759,0,637,1501728732,Extremely rough and difficult game otherwise fun if you enjoy getting yourself spawncamped and enjoy space shooters in general ;),1486242379,1486242379,False,1,0,0.394433706998825073,0,True,False,False
218230,29702274,76561198171929258,117,38,281,0,281,1486251851,AMAZED THEY SHOULD MAKE MORE GAMES LIKE DIS,1486239813,1486240750,True,0,0,0.471864014863967896,0,True,False,False
218230,29700141,76561198213819997,17,14,84,0,84,1481683737,"Great game, if your looking for fun, here it is.
+1",1486233590,1486233590,True,1,0,0.495661914348602295,0,True,False,False
218230,29693788,76561198263326714,0,1,4064,0,3495,1486994894,"one of my favorites. huge open world a lot of options good community, good social courses with the options of squad and platoons",1486216949,1486216949,True,0,0,0,0,True,False,False
218230,29684825,76561198068451897,114,4,1539,0,1193,1688761099,"I love how it is open world...its great 10 out of 10
",1486184912,1486184912,True,0,1,0,0,True,False,False
218230,29684777,76561198288255223,429,23,97,0,97,1469196151,"It's way too slow getting in to the action and when you do get in the battlefield you kill 2.people and get killed by a tank
I do not recommend",1486184599,1486184599,False,1,1,0.438969910144805908,0,True,False,False
218230,29683107,76561198079371103,0,4,142,0,142,1486256626,best game ever hours of fun,1486176714,1486176714,True,2,0,0.492047727108001709,0,True,False,False
218230,29682996,76561197970669523,488,40,35098,0,15441,1653534472,"Epic firefights, intense feeling of combat taking place all around you.  Fun vehicles with unique traits.",1486176237,1486176237,True,0,0,0,0,True,False,False
218230,29682446,76561198161075722,187,3,533,0,262,1575083537,"hahaha 
idk life ummm t-e-e-n t-i-a-i-n-s
",1486173632,1486173632,True,0,0,0.450844287872314453,0,True,False,False
218230,29678242,76561198308174604,0,4,21,0,11,1487487045,"bfhvcngvdhafbgref
",1486157580,1486157580,True,1,1,0.459226280450820923,0,True,False,False
218230,29674546,76561198134537002,86,2,8918,0,3135,1557855811,"Honestly a one of a kind experience. There are no games out there to the public like this one, that set hundreds of people shooting at each other in order to take control of an area. Even though unfair to newcomers, since it puts you straight onto the battlefield where people with over 1000 hours are when you barely have 10 minutes and have no idea what you're doing, it's worth it to learn the basics and slowly get the hang of it. 
Frustrating, but fun.
11/10 would smash my computer again.",1486144971,1486144971,True,1,0,0.523809552192687988,0,True,False,False
218230,29673252,76561198348144864,65,14,43,0,21,1487056231,bad bad bad,1486140934,1486140934,False,1,0,0.380614697933197021,4,True,False,False
218230,29669967,76561198165915192,216,17,1742,0,601,1650295461,"Scifi? check. large scale war? check. vehicles? check, this game is pretty awesome, first time I played it I was blown away, this is as close to a full scale wargame you will get, fun upgrade and customitzation system too, had hours of fun with firends on this plus its free, ive seen games demand quite an exrtortionate amount of money and not even have a tenth of what this game has to offer, highly recommend it, cant find a fault.",1486130618,1486130618,True,1,0,0.501811623573303223,0,True,False,False
218230,29665650,76561197999391051,0,6,1163,0,1163,1486113414,"This game is awful. Physics are broken, gunplay broken, p2w elements creeping in more and more as desperate dev milks the title in its twilight years. You can shoot a guy like 6 times with a 50cal and he won't go down. It takes 5-8 missiles to kill a basic transport. Aircraft are broken and OP. Hypermaneuverable and spamming attacks non stop while hovering in mid air at 0 and pointing nose straight down. The final straw for me was today I shot a guy attacking my base in the face with an AT missile and he shrugged it off with HP to spare and killed me. I'm done. It's over. Don't play this terrible game.",1486113834,1486113834,False,1,0,0.397067934274673462,0,True,False,False
218230,29662808,76561198168012302,0,3,9906,0,8444,1563685221,"Amazing Large scale battles if they are coordinated very well
",1486098549,1486098549,True,0,1,0.455172419548034668,0,True,False,False
218230,29659934,76561198200666027,0,17,4749,0,376,1662943289,good game,1486083740,1486083740,True,0,1,0.474820137023925781,0,True,False,False
218230,29659470,76561198025679563,0,16,816,0,293,1581923593,Awful,1486081052,1486081052,False,0,0,0.363328665494918823,1,True,False,False
218230,29646149,76561197996098938,0,13,22242,0,15165,1524314007,"This game is absolute trash, unbalanced, unmoderated and full to the brim with hackers and 'lag wizards'. Don't waste your time on this cancer",1486032035,1486032035,False,2,0,0.520796060562133789,3,True,False,False
218230,29644189,76561198138761721,0,9,107257,0,58202,1706612347,Great game!    :),1486022614,1486022614,True,1,0,0.497942358255386353,0,True,False,False
218230,29642827,76561198053380818,0,2,1102,0,394,1586807792,"The Friendships from your buddies globally,  mine are mostly from Australia and I live in Alaska.",1486015256,1486015256,True,0,0,0,0,True,False,False
218230,29637812,76561198070905749,22,4,346,0,346,1482438693,cool massively action game but kinda messy!,1485989500,1485989500,True,0,0,0,0,True,False,False
218230,29631268,76561197987638191,0,15,626,0,78,1646932644,Created account - tried to verify email - encountered error - tried to enter account - encountered error - reseted password - made secret answer about my food- tried to verify this fucking email - says worng secret answer wich i just created - pressed contact support - it shows me tons of useless faqs - deleted this shit,1485966891,1485966891,False,1,0,0.449591279029846191,0,True,False,False
218230,29631074,76561198129878995,0,12,85,0,85,1485966043,"If you live in SA, stay away from this game. Latency, nuff said. I got me a nice 15mbps speed, but that cant handle this game. Unless we down south get a server, which I highly doubt cuz prejudice, and they'd be the first to give us SA gamers a server we can crowd on, then look elsewhere.",1485966241,1485966241,False,1,0,0.427163183689117432,0,True,False,False
218230,29629279,76561198097907013,0,6,1344,0,239,1559523761,i cant run it,1485960974,1485960974,True,0,1,0,0,True,False,False
218230,29627907,76561198129301334,54,5,53,0,53,1394809343,good,1485956731,1485956731,True,0,0,0,0,True,False,False
218230,29627484,76561198128026711,0,2,123926,0,118674,1450650366,"This game is insane. 

You have different type of classes which use different type of weapons. Nothing is pay to win as all other weapons can easily be got through playing the game. The only thing you need to buy with real cash is camo's helmets and other skins for vehicles. (which do not affect your stats in any way)

The vehicle play is amazing, you can go from footsoldier to tanker to pilot in mere seconds. I would like to recommend watching the youtube channels by Wrel (a dev of the game) and other players to see what it's like.

Even though bugs are be getting more common, you will only start to notice them after a few hundred hours of game play. 

The game has frequent updates where they tweak weapon stats, add new skins and features. The last big update was construction where you can build your own bases inside the game itself.

I would highly recommend giving it a try, it has a rather steap learning curve and if you join an open platoon they will help you out with most questions! (and it's free)",1485955328,1485955328,True,0,0,0,0,True,False,False
218230,29626751,76561198124829442,99,21,186,0,91,1499707646,Wow I barely got 3FPS before game crashed. Not worth it...,1485952746,1485952746,False,1,2,0.432220041751861572,0,True,False,False
218230,29625894,76561198062777590,118,23,5702,0,1310,1612599086,ITS LIKE THE WHOLE WORLD IN WAR BUT TRUMP DIDNT WON!,1485949681,1485949681,True,0,3,0.476190477609634399,0,True,False,False
218230,29625284,76561198173321410,129,4,2621,0,1061,1485946109,"[h1]Pros[/h1]
[list]
 [*] One fo the best F2P on steam.
 [*]Massive Muliplayer.
 [*]Massive Maps.
 [*]Huge Community.
[/list]

[h1]Cons[/h1]
[list]
 [*]Gets tiring.
 [*]Servers have performence issues.
 [*]The community is Big But can be really [b]TOXIC[/b].
[/list]",1485947349,1485947349,True,0,0,0,0,True,False,False
218230,29618550,76561198127730444,0,2,9607,0,7235,1587615040,Great game,1485914656,1485914656,True,0,0,0,0,True,False,False
218230,29617314,76561198025356411,0,6,641643,1123,327855,1708831877,"I have a few hours logged and it is by far my favorite game.  I may drift away for a bit but I always come back.  This is everything you want in a war game.   You can change a battle by yourself or roll over your enemies in a 40 man platoon.  I grinded almost everything out f2p but ended up buying some camos so I could look sexy when I killed people.   
",1485908783,1485908783,True,2,0,0.545454561710357666,2,True,False,False
