218230,30214042,76561198354101648,0,50,766,0,285,1532625244,i happen to like this game you fight for control and dominate your opponents plus its a fun game if you like these sort of games,1488176180,1488176180,True,0,0,0,0,True,False,False
218230,30212186,76561198043363198,0,29,3218,0,1098,1563682614,"Some background, 

I played Planetside and then played this right when it first came out.  I quit playing it because I wasn't a fan of how they had everything set up. Now though, its well rounded I can give it my recommendation.",1488166315,1488166315,True,0,0,0,0,True,False,False
218230,30211627,76561198172055451,346,145,40551,0,22,1509550954,lol,1488163684,1488163684,False,0,0,0.373777955770492554,4,True,False,False
218230,30207572,76561197962974066,0,1,36459,0,35108,1380172621,"It's been five years since release.  I still play this game with the same outfit every week, and it's still great.  I have never seen any other game come close to it as a massively-multiplayer first-person combined-arms simulation.  It's excellent, and I highly recommend it.",1488147201,1488147201,True,0,0,0,0,True,False,False
218230,30200481,76561198001591678,225,64,4493,0,3022,1668722692,"So, Empires in this game automatically capture every base on a continent without needing to fight for them... this game fucking blows",1488127504,1488127504,False,1,0,0.464384168386459351,1,True,False,False
218230,30198172,76561198216024211,0,10,23,0,19,1479532798,better than cod,1488121681,1488121681,True,0,0,0.490196079015731812,0,True,False,False
218230,30192396,76561198065958314,173,32,1519,0,1470,1517607407,"Unique complex massive multiplayer shooter which struggles with lack of the players and bad optimalization. Do not let it die and give Planetside 2 a try, its free after all.",1488106046,1488106046,True,3,0,0.531694650650024414,0,True,False,False
218230,30186726,76561198095280447,408,7,14757,0,1424,1684467443,"you can be ant, but an ant that has an impact.
once you fight, it seems useless, but once you stop. you lose",1488086371,1488086371,True,0,1,0,0,True,False,False
218230,30186065,76561198319208278,0,1,25,0,25,1488079937,fun,1488083900,1488083900,True,0,0,0,0,True,False,False
218230,30185044,76561198074333477,270,161,460,0,373,1642541290,"open world full of nothing
",1488080721,1488080721,False,3,0,0.44609755277633667,2,True,False,False
218230,30182467,76561198084359946,95,1,3718,0,1478,1663630104,Das gut,1488070806,1488070806,True,1,0,0.501845002174377441,0,True,False,False
218230,30181107,76561198329183034,0,3,61,0,61,1481769148,awful,1488066263,1488066263,False,1,0,0.346265852451324463,0,True,False,False
218230,30175774,76561198350819043,0,8,8,0,8,1488050676,if you try to create a account if you don't have one you will not be able to creat one.,1488050985,1488050985,False,1,1,0.374346822500228882,1,True,False,False
218230,30174773,76561198044638142,0,7,2726,0,2514,1530252935,"A great fast paced action packed MMOFPS. As close to future-space-3 sided-war as anyone wants to get. 
Absolutely worth a try for any FPS fan",1488048374,1488048374,True,0,0,0,0,True,False,False
218230,30165248,76561198360585394,0,3,85,0,85,1488023864,One of the best free to play games by far!!!,1488023899,1488023899,True,0,0,0,0,True,False,False
218230,30162909,76561198084212163,192,4,27908,0,20699,1696679541,"Joins squad, 
10pm ""I'll have to hed off soon guys and get some sleep.""
3am ""Ohhh Sh*t, i got work in 3 hours.""

Great game, only advice is join a squad, game becomes 10x better with a good bunch of guys. Everyone is friendly and keen to help out in anyway they can.",1488017225,1488017225,True,0,0,0.481481492519378662,0,True,False,False
218230,30162245,76561198094178351,249,40,358,0,226,1578775977,"Fun free to play Battlefield. If you are short on money, get this one. If not, get this one awell.

(I have played around 300 Hours without having it on steam so i don't only have like those 4 hours xD)",1488015010,1488015010,True,0,0,0,0,True,False,False
218230,30150979,76561198046316468,0,1,11620,0,10106,1652763051,Meh,1487971924,1487971924,True,0,0,0.475328207015991211,0,True,False,False
218230,30150776,76561198036293277,0,8,1030,0,951,1487971175,"This game is not recommended at all! You have to do a 15 minutes tutorial, and if you create another character you have to do it again. I played this game alot before, but that was then! Nowadays its thrash! DONT FUUCKING PLAY THIS SHIT GAME.",1487971257,1487971257,False,1,2,0.312173396348953247,3,True,False,False
218230,30149292,76561198035184499,0,6,174642,0,24743,1707266452,"Abandon all hope. You're a noob and you'll die 1000 times without even knowing what hit you.

Then you're no longer a noob and you found a good outfit. Suddenly it becomes a different game. It's early evening and the alert starts. Your platoon lead takes the mic and you get your orders - spawn at the gate, maxes, medics, engineers, board the gal (that's a galaxy air transport for you, noob!). Nobody knows yet where to.. 2 minutes later 4 gals are in the air - 48 real players anxious to fight. The waypoint is set. Biolab. Platoon lead tells you the other platoon from your outfit will join. 8 gals arrive within 10 secs. 96 players drop from the gals. 96+ waiting for you down there. You're sweating already. Is it the game or your CPU maxed out? Mayhem! And the alert has just started..  1h45' to go...",1487966719,1487966719,True,1,0,0.497607678174972534,0,True,False,False
218230,30149111,76561198103657129,0,18,126710,0,44199,1679861786,LIVE FREE IN THE NC!!!,1487966203,1487966203,True,0,0,0,0,True,False,False
218230,30146981,76561198269105383,17,6,594,0,132,1542996431,"This is a pretty good game i have to say, but there are moments where you will rage like when your in the war with other people, im going to recomend this game to people who are good at shooting fps mmo's like call of duty gamers as its basically a never ending futurustic version of cod.",1487960003,1487960047,True,1,0,0.523809552192687988,0,True,False,False
218230,30145948,76561198210027757,71,11,1990,0,967,1538311929,ok game,1487956928,1487956928,True,0,0,0.47826087474822998,0,True,False,False
218230,30145635,76561198016406303,0,35,478,0,387,1583005806,"So i didnt play this much, i rarely give review foro F2P games if i didnt play it over 40-60 h, but this is exception.

Game is in general good, massive fighting on large maps, lots of weapons, vehicles, but of course there is always a catch

first, you get basic weapons and you need to grind like hell to unlock others. There is lots, if not tons of stuff that you can buy only with real money, which is dissapointing, you cannot customize your armor, color of armor or weapons, that you must buy. Yes i know its F2P game, naturally there will be stuff to buy for real money, but come on, almost everything. 

If there is more weapons we can have on start, and that we can customize stuff without paying that would be nice, this game is big enough for both free stuff and premium ones. 

Now to say about each thing in game:

Weapons: You have large selection of Assault rifles, snipers, shotguns, machineguns, side arms(pistols), weapons can be customized, optics, grips..., you can even repaint them but you must pay for that, there is also cold weapons at least i saw knife.
Vehicles: There is several ground and several air vehicles in this game. Like for the weapons, they can be customized with different weapon packs, which you need to unlock. You can even repaint them, but again you must pay
While ground vehicle controls are more or less good, moving is clunky. Air controls are terrible, at least to me, i crash every time, well maybe i didnt add controls right, however in these few hours i spend i only play once or twice with air
It is shame that there is no mechas, walkers, that would be interesting.

Armor: several types for each of main classes but you must pay for them to unlock and customize them.
There is serveral classes in game, light inf, heavy inf, medics, engineers, inflitrators (basicly snipers), each of them having its own good and bad points and each of them having its own equipment. 
Maps: well i cannot say anything bad about maps, they are huge, but there is huge amount of players, but even with large number of players some maps are pritty empty, i love smaller ones, but it become crowdy if all thre factions are present. 
General: I like this game, its fast, intense, i could say real war. However you will get pissed really fast, there is lots of campers, snipers that love sniping from a far with advance equipment while you that just start marching around with basic weaponary. (there is a weapon trial every 2h or so, i recommend you use it when in game, every weapon (or most of them) are capable to try, actually only one every 2 h.), that is not so bad. 

I didnt saw any cheater, that is good. But lack of classes or mods make differences. You are thrown into the fry from beginning, with beginners like yourself and with people who have hundreds of hours in it, advance armors, equipment, weapons, in 70% you stand no chance. 

This game have lots of good things and again lots of bad ones. I first try to play this game when it was released two years ago, my pc was crappy then and i couldnt play it. Now i can, but do i like the game. no, not in this state. Game works fine, there is very little or no lags. Ok sometimes there is, but there are servers, for all regions, so chose the one that is closest. If you are from EU chose EU, not NA or Asian, otherwise you will experience lots of lags. 

Game lacks in dedicated mods. Everything in this game is simply capture that, defend this. Take enough points and your team wins. 
You cannot chose teams. Your character belongs to one of three factions, since i didnt really bother to remember the names, simply Blue, Red or Purple. Each with its own differences and unique weapons and equipment and story. So faction you chose at beginning will be with you as long as you play or until you decide to make another character. I dont know if you can change character Factions, doesn't really matter.

PlanetSide 2 have lots of players, so you would  never have problems with lack of players. and target:):), but game is rather difficult, you will die in it, a lot, but you will learn to play it if you really want to.

Do i recommended it or not. It is shame that Steam didn't introduce neutral option for reviews, i guess they will one day.

It would be unfair for me not to recommend t his game, and brag how its bad how it lack this, how it lack that, but if you like grinding, if you like fast pace shooters, with lots of people on maps, this is game for you, i personally wouldnt recommended this game, not in the current look. but il add yes for all those who actually like it. I play it simply for fun, as i didnt play shooters in years, but again, expect lots of hours in this game if you want to unlock something, and lots of money(real one) if you want better stuff.",1487956025,1487956025,True,0,0,0,0,True,False,False
218230,30142447,76561198305033257,59,2,6842,1,1024,1707850667,It's a little on the pay to win side. But it's still a great game overall.,1487947132,1487947132,True,2,0,0.53620535135269165,0,True,False,False
218230,30137765,76561198137059378,0,15,2459,0,1577,1491765713,"First of all, I haven't played any FPS games in quite a while and somehow felt the urge to do so again and remembered Planetside 2. I made an account a couple of years back and tried it on a friends computer but didn't have the specs on my own to continue (I know that's pretty sad).

And frankly, I am very glad that I rediscovered this game! It doesn't have the ""arena-batlle"" feel that most online FPS games have, which I personally find to be very positive. You are a soldier in a futuristic sci-fi setting on very large maps and are participating in not just a battle but a war! Just remember one thing... you will die and you will die very often. Don't let that get you down.

 As I am quite unexperienced in FPS games I think it is a very good testimony to the game when I say I'm having fun playing this despite having a K/D of around 0.15... Yeah I know I'm a noob :D

Another few positive aspects are:

- I'ts free! Who doesn't love great free games?! I may or may not consider buying a temporary membership sometime just 
   to throw some money in the devs' faces to let them know I like their game.

- 6 soldier classes with special abilities. Have to get used to that fact that the abilities can be used very frequently!

- Lots of customization. You can choose between many upgrades in almost all apects of the game.

- Surprisingly large variety of vehicles that play a big part in the wars. Very fun to share vehicles with your squad. 

- Starting weapons are good and it is very possible to compete with players that have better equipment. So I wouldn't say 
   it's P2W

- Last but not least: a very friendly community. It is after all, a game built on teamwork.

As of now, I can't really complain about anything because the only thing that sucks about this game is my lacking skill but I'm working on it ;) 
So I definitely recommend this game. I already got 4 of my friends to play it with me and I hope to have more fun!

",1487930819,1487930819,True,0,0,0,0,True,False,False
218230,30136847,76561198321394849,140,16,40,0,40,1487926906,very bad game. boring af lol,1487926949,1487926949,False,1,0,0.445229679346084595,0,True,False,False
218230,30131827,76561198217062993,71,10,15188,0,5100,1587162804,"Since most new people like me start as the NC, let me write down what your first battle will be like.

How you think it will go: You spawn in, with the sundy smoking. There are over 30 spandex cultists on the other side of hill. Equipped as a light assault, you use that jetpack to good use, taking out 5 vanu scum with c-4 and mowing the rest down with your carbine.

What really happens: You spawn in from the sundy, and see a bunch of bullets whizzing past and your screen is shaking from explosions. The vanu decided to zerg you with either 20 magriders, or a shitstorm of ESFs and liberators. Within 10 seconds, that precious van that you spawned out of is know a burning frame. You decide to take cover behind the wreckage but then a green glow engulfs it, eventually leaving no trace of evidence that anything happened. You stand there, knowing what the fuck to do, the sheer chaos overwhelming you until a harasser TK's you by running you over.",1487902527,1487902547,True,1,3,0.502074718475341797,2,True,False,False
218230,30131158,76561198267944369,373,9,9712,0,4783,1669885531,"great game, hands down the best simulation of war on a massive scale there is.  There needs to be more of an objective than just lock continents though.  Give us a global objective! like raiding vanu archives, killing the new conglomerate rebellion leader, or destroying a terran superweapon.  Give us more!",1487899367,1487899367,True,0,0,0.476190477609634399,0,True,False,False
218230,30130070,76561198151417106,0,44,232,0,34,1506179010,"This is such an Amazing and Fun Sci-Fi Shooting Game. It's Almost Like Call of Duty: Infinite Warfare, Only... This Game is Worth Playing.",1487894262,1487894262,True,0,0,0,0,True,False,False
218230,30129618,76561198075994876,27,5,1449,0,659,1576498743,Better than infinite warfare,1487892388,1487892388,True,1,1,0.507542133331298828,1,True,False,False
218230,30127965,76561197995862962,117,5,323,0,296,1635953667,"lovely game but graphic engine still needs some upgrade. i do have fps lagg on i5, gtx770oc, 6gb ram (win10) when I play the game on ultra.",1487886234,1487886234,True,0,0,0.454545468091964722,1,True,False,False
218230,30122926,76561198114989411,0,16,745,0,615,1488722886,Baguette Baguette Oui Oui. Appart from that this game is good.,1487869652,1487869652,True,0,0,0,0,True,False,False
218230,30122854,76561197998654204,0,5,97,0,26,1494613596,64 bit only,1487869425,1487869425,False,0,0,0.390995264053344727,0,True,False,False
218230,30121600,76561198264499166,102,11,210,0,158,1497381835,"This game. Works. On my computer.
And its a massive server full of 100+ people.

10/10 would be mindblown again",1487865278,1487865278,True,0,0,0,0,True,False,False
218230,30120769,76561198298974726,19,12,65,0,65,1485519545,FREE,1487862638,1487862638,True,0,0,0,0,True,False,False
218230,30111156,76561198166548664,0,29,4005,0,1751,1684969708,Great game. Gets ridiculously intense at times.,1487817274,1487817274,True,0,0,0,0,True,False,False
218230,30110906,76561198011194269,0,14,14228,0,13993,1444968567,wehen u rp as soldier ur commander get angry and tell u to shut the fuck up. 0/10,1487816053,1487816053,False,0,1,0.347368806600570679,0,True,False,False
218230,30107697,76561198083310375,110,10,5313,0,2935,1694153747,"This game is extremely addictive. It will kill ALOT of your time. But in my opinion its 9/10 would play to win again. 
MUST PLAY W FRIENDS TO EXPIERIENCE FULL ENJOYMENT",1487799901,1487799901,True,0,0,0,0,True,False,False
218230,30103675,76561198337740603,0,29,8962,0,1852,1658359624,"I have played this game few a little while now. Its a fun game to play with friends. I will says its definitly a fps game, but once you get about 20 - 30 fps you should be good to go (thats what I get on low). I would say its a GREAT game. I play witha friend and when we work together we can get some outpost taken and get a lot of kills. I will say this game will involve a lot of team work to win a game.",1487785131,1487785131,True,0,0,0,0,True,False,False
218230,30103466,76561198011608490,134,14,52962,0,49499,1646496727,"First off I love and hate this game!

- The concept
- The factions 
- The possibilities
- The pew pew of lasers
- The vehicles
and so on...

But I did quit playing it because of several gamebreaking issues for me
I cant play competitive or without rage because of:
- The lag compensation 
here a really good video about the problem: https://www.youtube.com/watch?v=n3fUok2AoaU

- High ping players everywhere who make the above even worse

- Server performance

- Still many fucking hackers

I was hoping for years now that they will fix it.
But all got even worse...
So good bye Planetside 2!",1487784413,1487784413,False,8,2,0.513554275035858154,0,True,False,False
218230,30103012,76561198071145275,0,5,3375,0,3072,1462249262,SUPER PAID TO WIN........,1487782916,1487782916,False,12,1,0.532791495323181152,2,True,False,False
218230,30099672,76561198043200778,88,20,15282,0,3148,1584139593,"Wonderful game! VERY immersive.
Pros:
- Free
- After a short, but detailed tutorial you get deplouyed straight into the action
- Great community
- Extremely epic large scale warfare across miles and miles of land

Cons:
- Little bit of a learing curve, but after you set your keybinds it's pretty simple
- The older community makes the people that have played for 2 - 3 years gods among newer players
- They ask for you to purchase credits and memberships a lot because this is an older game and they need the community to help keep it up and running",1487771888,1487771888,True,0,0,0,0,True,False,False
218230,30097675,76561198061946273,0,2,7706,0,4173,1602180811,No local servers for South Africa but such great gameplay.,1487764372,1487764372,True,1,0,0.499092549085617065,0,True,False,False
218230,30095994,76561198061471790,246,17,83,0,62,1462952082,i would def recommand this to anyone looking for a free shooter.. this game has such a long range of diff things,1487756451,1487756451,True,0,0,0,0,True,False,False
218230,30095442,76561198137829326,209,95,62,0,62,1486636033,Woah alot of map space and crazy combat and awesome vehicles,1487753854,1487753854,True,0,0,0,0,True,False,False
218230,30094216,76561198118870838,43,20,523,0,523,1468915294,"If you came here looking for a review, you have come to the wrong place, but if you want some very ♥♥♥♥ing good brownies, you have come to the right place. You're welcome for an actual recipe, not a ♥♥♥♥♥♥ copy and paste pie recipe. Trust me nothing goes wrong with nutella.

INGREDIENTS:

1 c. unsalted butter
2 c. sugar
1/2 tsp. salt
1 c. flour
1 c. cocoa powder
4 eggs
1 (13-oz.) jar Nutella
5 Ferrero Rocher candies, unwrapped and crumbled


DIRECTIONS:

1. Preheat oven to 350 degrees F.
2. Melt butter in a medium-sized saucepan over medium heat. Add sugar, stirring until combined. 3. Remove from heat and add salt, flour, and cocoa powder, stirring to combine. Whisk in eggs, stirring just until the mixture is combined into a batter. Set aside.
4. Spray an 8""-x-8"" pan with cooking spray. Pour half of the batter into the pan. Spoon or lightly drizzle most of the Nutella on top of the batter, forming an even layer over the brownie batter. 5. 5. Use a spoon or silicone spatula to cover the Nutella with the remaining brownie batter. (If you pour the batter straight on top of the Nutella, it will sink into the Nutella and combine into one marbled—yet delicious—mess.)
6. Bake until the top layer of brownies has browned and set, 28 to 30 minutes. It shouldn’t jiggle when you remove it from the oven. (The toothpick test doesn’t work here, since the toothpick will hit the Nutella layer, making the brownies seem uncooked.)
7. Let cool for 15 to 20 minutes, then top with a drizzle of Nutella and crumbled Ferrero Rocher chocolates. Cut into squares and serve.



Credits: ★ Billy",1487746806,1487746806,True,1,2,0.460216820240020752,1,True,False,False
218230,30093622,76561197973922828,332,8,29249,0,17732,1665789507,"This is one of the most entertaining shooters I've ever played. It is free and worth a try if you're into team based shooters. 

Despite what some people are saying in their reviews, It is not pay to win. The guns that all classes start with are very good and in some cases, the best overall guyou can have. 

You can purchase in game currency to buy new guns, but they are side grades to what you currently have. The trick is finding the gun that suits your style. You can also purchase skins, camo, helmets and even voice packs (Arnold Schwarzenegger ftw) as well. They are all purely cosmetic/for show. 

The ""camouflage"" you can buy is also purely for looks and really doesn't help you hide, you just look cool. 

I've played both in outfits and solo and both can be fun. It's easy to get into the action quickly by using the map or you could just hop into a vehicle and drive wherever the hell you want. 

",1487743004,1487743004,True,0,0,0,0,True,False,False
218230,30092966,76561198349897458,0,7,197,0,140,1486712641,"I feel as if I won't get much more out of this game so I'll write a review now... It's your average shooter with, campers, jerks, good team mates, guns, endless grinding and more guns... It's okay though... it's still better than Call of duty. what a load of garbage that's become, sorry that was off topic. PS2 was okay, it's free so it's worth giving a shot... you can always uninstall it if it's not your cupa, Overall...
5/10 compared with most games and AAA shooters.
Sorry guys, not that thrilled :/",1487739216,1487739216,True,0,0,0,0,True,False,False
218230,30082571,76561198293176914,0,3,437,0,273,1546724870,its gud,1487696127,1487696127,True,0,0,0,0,True,False,False
218230,30080166,76561198105111709,357,70,3011,0,2894,1514855418,"Fun to play with friends, not fun to play alone. This game is amazing if you wanna go mess around in a huge world with friends. Fly planes into other planes, ride a car into a tree, go stealthy as a huge squad and mess with one guy. Do whatever you want in this game. Great game",1487688493,1487688493,True,0,0,0,0,True,False,False
218230,30078626,76561198022720571,0,11,45313,0,43003,1439151928,is pretty good,1487683311,1487683311,True,3,0,0.493831425905227661,0,True,False,False
218230,30077485,76561198336016771,0,2,2078,0,1493,1513896440,"i love this game ÄLSKAR DET i say 





it means LOVE IT",1487679006,1487679006,True,0,0,0,0,True,False,False
218230,30076589,76561198056577532,0,7,347,0,347,1356940800,Pay to Play...,1487675147,1487675147,False,4,0,0.429979115724563599,0,True,False,False
218230,30075895,76561198077690826,1040,30,713,0,535,1653552735,The Grind is real!,1487672039,1487672039,True,2,0,0.530642151832580566,0,True,False,False
