304050,29597148,76561198307142544,57,44,45130,0,,1698892315,"a great online time killer, however there's way too many updates regarding topics irrelevant to the game or for minor events, and not enough content that spices gameplay up, a skill tree system unique to each class, a new skill point currency unique to said skill trees and some unique upgrades that augument, enhance, and/or alter class abilities would be really great, or simply adding new classes more often, a miner-esque class that is focused on mining and gains power from ores would be a great idea to start off with, or maybe a class that has a cumbersome, heavy hitting melee attack, good defensive abilities, and damage that scales up with max hp for something that's worth making a tank build with

but I'm upholding my negative review due to the neo nazi problem in the discord",1485831076,1695081610,False,1,1,0.492307692766189575,0,True,False,False
304050,142301110,76561198327141180,0,3,1704,0,1663,1689712112,just game to start of with with new friends or old friends really chill game and dosent make u rage and is really fun to start if u just got a pc,1689641395,1689641395,True,0,0,0,0,True,True,False
304050,118237676,76561198823403264,0,3,5844,0,1728,1704163656,so awesome,1656994637,1670692683,True,0,0,0,0,True,False,False
304050,29708559,76561198260317820,0,2,825,0,763,1497467721,"this game is shit

",1486263132,1659393151,False,0,0,0,0,True,False,False
304050,29532995,76561198286955764,0,1,95264,0,24199,1688527961,"If you are here after watching Josh Strife Hayes' video, this review should give a brief idea of the history and current state of the game. 

First of all, if you are looking for a heavily story-based game such as FF14, WOW, Dragonborn, etc., this is not what you will be expecting.

At its core, Trove is a light-hearted game that's based on character power leveling. Every system and mechanics contribute to your character getting stronger, and the gaming style is, putting it in a bad way: ""Endless Grind."" 
However (Here is a beauty of Trove), unlike running dungeons and raids like ""WOW,"" farming anything in this game is really easy and non-hardcore. You don't need to know any fights beforehand, there are no required classes until you hit the end game, and overall, you can yaba daba do anything with ZERO stress.

Trove also relies heavily on playing with people/friends. 
Because the gaming style itself is really hollow, the game is more like a social platform to play with random people and friends, especially your in-game Club members.
Benefiting from its super openworldness, you can ""Team up"" with anyone you want in maps (The game even offers you a teleportation stone that can teleport you to a random player in the world) 
The most important and attention-grabbing of this game is that it is primarily a tool for you to hang out with other people, almost like a party. 

Ok, let's talk about some hostries and some of the current problems with the game.

You probably have seen a lot of reviews and comments that this game was so awesome back in 2015 to 2017.
This is because of three factors.

First is the end game power cap and balance. 
Unlike games that reset your power levels, Trove constantly updates its end-game cap. (If you upgrade everything to the maximum, collect every collectible, and complete every in-game achievement, you will hit a power level cap.)
One of the biggest reasons the game was enjoyable back in 2016 is because there are fewer near-end-game players. I know you probably wonder why this is a bad thing. The bad thing about this is that there is no power level balancing in dungeons and raids, therefore people with higher power rankings can just one shot and carry the rest of the players.
The game was good back then is because you can't just find a random end game player in the open world therefore you must find people to work together to fight dungeons and bosses. The process of it is very enjoyable and fun (Because there is almost no punishment if you constantly die) 
Nowadays, you just queue up with a group and sit to wait for your Club members to carry you, which is exactly what Josh experienced in the public Delve. Plus, you can trade mid-end-game items with other players, and they are effortless to farm.
I will give you a picture of what it is like. In order to enter the higher world, you must hit the required power levels, like 250, 500, 750, 1000, 2500, 5000, etc. You must fight dungeons and upgrade your gears. min-maxing stats and watching your character grow and entering higher zones are SUPER FUN. 
But now, you get a set of gear from other people like your club members that just get you to 5000+ power levels in 1 second, and you just skip the entire first part of the game, diving straight in the grind. 

The second is the so-called pay-to-win system and in-game shop.
One of the biggest reasons people say there are way more things you have to pay for now is that most of the stuff you buy are collectibles, which increases your secondary stat: ""Mastery."" Mastery does not really affect your character power level therefore it is easier to make and it won't affect the players as much. Because tweaking power levels is a very frustrating thing to do and can cause a major disaster for the end-game players. 
However, there are still many things you can buy in shops that can help boost your character's power levels, so it is essentially a pay-to-win game.

The third is the content update.
For the past few months, the devs are a lot better at updating and reworking classes and content. But still, because there isn't much content, the end-game players have figured everything out and are just feeding the information to the new players thus there is no process of learning the systems and mechanics of the game.

That's about it, in general, if you have always been a solo player or story game based player, then Trove is probably not the game for you, but if you have friends or looking to meet new people, just have fun and feel good to kill and level up, then Trove is a great game that you can enjoy for a long, long time.",1485573491,1647160404,True,1,0,0.519230782985687256,0,True,False,False
304050,106949267,76561198252295444,141,85,1387,0,1385,1677645752,Meh,1640914544,1640914544,False,0,0,0,0,True,False,False
304050,29947372,76561198010254843,0,4,7996,0,7154,1630513706,"GOD do i miss the old days back then, where the game was not available through steam. The community was nice, everyone was helpful, and the ones in end-game were helpful in every way. Then, the game released on steam... -.- 
Cancer community, just like League of Legends. Salty kids everywhere, the end-gamers insult everyone. But thats not the worst...

The game got a free add-on (expansion) named ""Mantle of Power"", in which gems were introduced. This killed the game for me and many others. Since then, the game is brainless grinding for resources. Only the early game is fun, the leveling and gearing. But when you enter the mid game, to improve your gear and ""wealth"", you have to turn off your brain.
Everyday, every session the same grinding, over and over and over again. Grinding resources is the keyword of the game.
Did I mention the heavy pay-to-win aspect since the introduction of gems? Since there is a PVP-Mode, you have a heavy advantage if you just buy powerful gems for real money in the ingame shop. Why grind for a powerful gem if you can just buy it for 20â‚¬, AMIRITE?!

With all the beautiful memories with my friends and new cool people I met in this game (who of course don't play this game anymore), I do NOT recommend this game. I used to love this game, i was addicted. But TrionWorlds and especially the Steam release killed the game, making it less and less fun to play.",1487184935,1639479018,False,2,0,0.486322194337844849,0,True,False,False
304050,30206472,76561198085239694,46,2,95232,0,45344,1701474065,"This game is great. For anyone that loves to become more and more powerful by leveling up and playing with friends, this is the game for you. For anyone that loves to get endless loot and strive to become one of the most powerful players, this game is for you. But there's a small problem. 

This game has devolved over time into being more money sided than it should be. There are some things things you cannot do without spending money at some point, or by spending literally hundreds of hours doing something in comparison to doing something in a few seconds with some funds. I think the game is built very well and I very much so enjoy it, but free-to-play players are at an immediate disadvantage. 

That and the community for the game is very toxic, so I advice disabling chat to avoid yourself a headache.",1488143812,1637775729,True,0,0,0.546827793121337891,0,True,False,False
304050,29844498,76561198293001151,0,10,33293,0,2086,1632029403,I HAVE MURDRED 3 CHILDREN BUT STILL FIND THAT THIS GAME IS FUN,1486810385,1632103540,True,1,0,0.502074718475341797,0,True,False,False
304050,29943968,76561198245883396,247,63,8286,0,2737,1627510245,"lacks in clear goals to achieve, but its fine for being free and is far from the worst out there. the cornerstone feature is a good addition, allowing you to build your own house is a neat idea.

generally the gameplay loop consists of travelling to different dungeons where you jump down and kill the boss in ~5 seconds on average, then do the same thing over and over until you see slight stat boosts.",1487173539,1628544148,True,1,0,0.502487540245056152,0,True,False,False
304050,88726562,76561198296938014,0,46,2938,0,1871,1651658944,gd,1616186028,1616186028,True,0,0,0,0,True,False,False
304050,30090834,76561198055828671,209,8,5819,0,268,1570136855,eh,1487727874,1611862349,False,0,0,0,0,True,False,False
304050,29971643,76561198131049295,217,14,62645,0,41500,1699416846,bad,1487281874,1610302844,False,0,0,0,0,True,True,False
304050,82625943,76561198948339292,39,7,2355,0,2263,1674068969,fcking sick game,1608300351,1608300351,True,0,0,0,0,True,True,False
304050,29559095,76561198197796537,0,6,3263,0,2168,1647152602,well it's fun. if you want something that can kill time just do it,1485678152,1602302944,True,1,0,0.513888895511627197,0,True,False,False
304050,76140977,76561199042693494,9,2,423,0,359,1600383326,good game,1600379368,1600379368,True,0,0,0,0,True,True,False
304050,30167082,76561198237121348,102,33,14482,0,8568,1541609716,cringe,1488029245,1598509587,False,0,0,0.502141833305358887,2,True,False,False
304050,29429031,76561198218014717,35,12,3577,0,2263,1592736222,Well i love trove. I used to play it a lot (not that much 35 hrs). Now im starting again and its better than ever!,1485112471,1597234602,True,0,0,0,0,True,False,False
304050,30066463,76561198199784245,114,7,329,0,329,1454528609,Did not work.,1487625413,1593703319,False,1,1,0.502074718475341797,0,True,False,False
304050,29640768,76561198202216091,52,14,25001,0,3236,1594191516,"You will only have a decent time if your connection is very good and if you have a good computer, otherwise the servers are laggy pieces of shit and the devs are somewhat incompetent.",1486004196,1592947396,False,2,0,0.510144948959350586,0,True,False,False
304050,29772581,76561198171884091,160,14,8327,0,4685,1689792955,gud,1486516245,1590689569,True,2,1,0.486310631036758423,1,True,False,False
304050,69769834,76561198327725302,46,8,10052,0,9134,1680431819,gud,1590396318,1590396318,True,0,0,0,0,True,False,False
304050,29969740,76561198044849755,278,51,168,0,149,1587937692,"I only played for 2.5 hours and all I have to say is: It's a good and fun MMORPG game for kids to play. Mostly age of 8-18.
So if you're older than that, there's a pretty high chance that you won't enjoy it and I would suggest that you look for something else.

But if you like cartoony things and stuff or are in that age range then this might be fun for you to play. 

Best played with friends because you have to spend a lot of time behind the game to farm and doing it alone will really bore you and make you feel lonely. So try to play with at least one friend beside you.",1487274970,1583692006,True,3,0,0.549987912178039551,0,True,False,False
304050,62890183,76561198800439686,0,12,985,0,307,1696306556,yes,1580694238,1580694238,True,0,0,0,0,True,False,False
304050,59650809,76561198810429799,0,2,5243,0,4604,1613531346,"Its mad
",1576052106,1576052106,True,0,0,0,0,True,True,False
304050,29905802,76561198284762518,0,12,25699,0,13840,1646105274,Dungeons and dragons in a blocky world,1487009148,1574740972,True,0,0,0.548550069332122803,0,True,False,False
304050,29863920,76561198118778489,98,2,424653,0,202311,1619537327,"Cool game, really fun to play specially with friend but as always with true things has their bad side, trove is unoptimized which makes players go away from. Next thing is the grind factor which many player doesn't like but as free to play player, you need to grind for hours to get rewards but thats another feeling. Anyways i do recommend this game if you are looking to make some friends , do some building ah talking about building, you can make flawless builds like freaking castle or beautiful club. Welcome to Trove also at first this game may seems hard but its not but theres a lot of maths involve if u are getting serious about specially about trading. :)",1486872531,1561776825,True,0,0,0,0,True,False,False
304050,29494498,76561198275008676,0,1,51537,0,39053,1658714862,"""I legit spent so long on this game.Its pretty good if you want a MMO RPG version of Minecraft."" The game treats its new players way better than its old players. If you want to pay to win then you'll be sure to pass those that have put hundreds of hours into this game. I played this game because i was addicted, the next everyone i knew along with me quit. The game is a cash grab made for those with deep pockets and quick to be pleased with virtual items.",1485400573,1555483931,False,2,1,0.545454561710357666,1,True,False,False
304050,46474594,76561198388080746,0,7,66,0,66,1542928034,"Trove is a great game to play when I want to have some fun. I am an enthusiastic builder so I love the fact I can build a house of almost no limit. I also love the adventures and the event what I play with much joy. 
The fact also that I can chose among so many mounts what I have been lucky to get is also a plus. 
Something I enjoy is when there is an challenge adventure I try to be so fast I am trying my own limites and skills. 
Awesome game <3",1542927616,1542927616,True,0,0,0,0,True,False,False
304050,30116354,76561198151279708,100,13,171734,5,123483,1708931638,"2k hours and i have to say everything on this game is good but there is some negative things for this game

- super lag game 
- ultra pay to win game ( if you want to go higher mastery rank level you need to buy pack that give you mastery rank xp like 20$ to 50$ to get that pack  there is no free to play on this game if you are rich preson and you don't know where you put your money this game is right place for you. You will be come poor on 2 days)  i have spent like 300$ to this game so may i help devs to fix lag on this game but nothing change. Not only me who spend like that there is some players spend more and more to help devs but nothing change.

i regret play this game , if spend my money to buy new PC better from this S*i*

sorry for my bad English and have good day who ever read this",1487845867,1541048430,False,5,0,0.576271176338195801,1,True,False,False
304050,29834390,76561198253550825,467,14,3217,0,2932,1575800548,A cool game with blocks.,1486767693,1535213886,True,0,1,0,0,True,False,False
304050,29697147,76561198041795427,96,19,93838,0,42408,1690903189,"I'm changing my review, because as of right now, it's not a game that I can recommend. It's very hard for beginners to reach high level, and it's almost impossible to reach end-game if you dont spend countless amounts of money in the game. If you're a free to play player, you're going to need litterally thousands of hours to grind the different resources needed to advance to higher levels, better gear. The gem system is AWFUL, and it needs you to grind time gated resources which obligate you to log in each week and do your weekly quests and challenges. The game gives you no incentive to continue playing, because of the ridiculously useless rewards you're given for being in the higher tiers.

Dont get me started on the Geode update, which is boring, way, wayyy too long to grind all your materials to get to the geode end-game. This update feels like it has nothing to do with trove, as it has absolutely nothing in common with the regular Trove gameplay, and that it's rewards only concern Geode gameplay.

The game is known for it's ""one step forward two steps back"" policy, which means that everytime they add something the community wanted, they find a way to make it fucked up. Trove is heavily relying on RNG instead of relying on pure time spent on the game. A newbie can win super rare stuff that they dont care about when a HL player can spend countless hours of the game getting that item.

According to the wiki, there is 136 different kinds of lootboxes.136. Really? I know a good lot of these are just different tiers of the same boxes but still, it's completely stupid.

When the devs actually start playing the game and start to listen to it's players, and when they decide that the game's code's architechture has to be reworked, I might give the game a second chance.",1486225694,1533122630,False,0,0,0.523809552192687988,0,True,False,False
304050,30021764,76561198182726850,0,21,3685,0,3469,1564016134,"Let me tell an amazing story about what trove what once was compared to what trove is now.

EDIT3: HERE IS A COUNTUP FOR THE TIME THE DEVELOPERS STILL HAVE NOT RESPONDED TO THIS REVIEW.
https://www.tickcounter.com/countup/22961/time-since-no-developer-reponse-for-my-top-review-on-trove-with-various-complaints

[h1]What was:[/h1]
An amazing sandbox/RPG style game that existed when I was in 8th grade(around 2 years ago). I would log in with one of my best friends and play, level, and build. Classes cost in game currency, so it only took around ~2 months for me of playing an hour a day to obtain every single class. Leveling was not difficult, mounts were not hard to get, and reaching max level was only a matter of time and not that far from people who spent money on this game. Market was somewhat balanced, item mall did not give too many OP items, and it was possible to see people reach max level without spending a single cent. Streamers were nice, loved the game(I was part of a streamer's guild and watched 20+ hours of his stream), and had massive giveaways that simply made every minute of this game fun to play. Grinding was not that annoying since drop rates were not unreasonable, and crafting materials were not so difficult to find or buy from others. When I would happen to get bored(very rarely), it would be a 'why not' to just go ahead and play some soccer from a stadium one of the guild members created. Toxicity and scammers were uncommon, since many people were flourishing and being quite successful both economically and emotionally. I was mastery 60/100 at that time after only about ~150 hours(before steam release obviously).
[h1]After Steam Release:[/h1]
Trove created a ""Patron Pass"", basically a premium subscription based system that when activated, gave double drop rate, double exp, and multiple other benefits. This seemed miniscule at first, since not only was this given out two weeks for free, the buffs do not look that overpowered at first. However, at a deeper glance, trove seemed to slowly lower drop rates for rare items, and people would have to rely on Patron benefits to simply live like the old life of the f2p player BEFORE the steam release. However, this by itself was not bad, since trove gained more populrity, Trion struggeld to keep servers up. Level cap increased to 200. I only pushed myself for another 40-50 hours to make myself readch around level 90/200. Many systems were added to late game characters that seemed to break the economy, as late game players were the ones with 99% of the money. Imagine the game's economy going into a elitist form of economy, that's how it became. Materials became 20x more expensive(Going from 1 flux to 20) and some items were downright impossible to afford. I realized even though I spend more than 150 hours on this game before steam release, I was no poorer than a brand new player who spent 10 hours after steam realease.
[h1]After the ""Cancer Patch"":[/h1]
This. This is the patch that ruined the game. Trion made it so classes could no longer be purchased with in game currency.  Trion claimed that this was to increase the variety among the classes and make people feel more individualized. However, nothing was actually done TO the classes to make them feel more different. In fact, besides a few unnoticable buffs/nerfs, classes remained virtually the same, so Trion failed to communicate that to the people. Although I had every single class(they released a class later that I obviously cannot get without giving them my cash), it seemed like a horrendously stupid move as more people started to actually play this game. 
The classes problem was only the beginning. They added flying mounts later(Dragons). At first this sounds like an amazing idea, as these flying mounts were faster than wings. However, you'd have to do daily quests every day for around a month to obtain one. That system was cancer, since logging in every day to do the same thing just to log out was monotonous and boring, Trion decided to scrap that system too. Since players were actually obtaining these mounts(How horrible right? /s), Trion decided to nerf this system and make a convoluted system where getting these dragons was near impossible and you would literally have to spend x3 the time getting these materials(since they divided the item into a 3 part item that needed to be crafted, hence x3 the time), getting these mounts was a fruitless endeavor.
As stated before, the economy was in ruin, so there was no way to be able to recover without buying items to sell in the item mall, or buying mounts directly that increased your level. I gave up at level 100/300, dirt broke even after grinding in the beta and doing 50 hours of grinding after steam release. Streamers have quit, even the streamer's guild I mentioned before had dissipated(LegendaryStudios). All my friends quit and think of this only as a 'meme game'. After Trion added more and more to the item mall that made this game completely pay2win, this game became a generic f2p that lost all originality that this game once was.  This game had a lot of history with me, and now that simply is just a memory.

Beta:
9/10
Steam Release:
5/10
""Cancer"" Patch:
1/10

EDIT1:I have recently read other reviews and I have noticed a common pattern. Devs seem to ignore and lock threads that have expressed concerns for the huge amount of bugs(since I did not mention these in my original review), huge gameplay downsides, and obvious player distaste for the cancer patch. When the players showed their absolute animosity towards changing a major system in the game(such as the classes costing real money), Trion did NOTHING to calm down the players or change this horrible system.

EDIT2:I never knew this review would actually gain a lot of support from the steam community, so thanks for the support. However, I will say be wary of this review and if it gets taken down, you know what happened.",1487462882,1531691672,False,862,13,0.961073815822601318,104,True,False,False
304050,29414694,76561198263132871,22,10,30032,0,24034,1526476256,Trove is a grind heavy game that requires a lot of time unless you pay money. It is definately possible to get to the end game completely F2P style but it will take a long time and also some help from friends to get to the end game. Also RnG plays a huge role especially in the end-game like the gem systems which Trion should try to make the gems less RnG based,1485065022,1525124601,True,0,0,0,0,True,False,False
304050,40992658,76561198171754102,0,1,185386,0,113839,1609827391,"Great time sink game, has its flaws but in my thoughts it more than makes up for them. Great community, solid gameplay, always something to grind towards. Servers could use some work, but the last couple patches have helped. 9/10 game",1521808524,1521808524,True,0,0,0,0,True,False,False
304050,30169390,76561198364764178,22,27,140,0,140,1520755226,"I am sad to say that this game is not what it used to be, It used to be a fun game were people all ages could play,but now, if you take a glance at chat there will be peple trash talking!I The pros  are that the graphics are good and the storyline is good but it's changed....",1488034947,1520694681,False,0,0,0,0,True,False,False
304050,29684751,76561198316172806,0,20,26909,0,18647,1568687205,"Sword Art Online: Can't log out.



Trove: Can't log in.",1486184479,1519183372,True,0,1,0,0,True,False,False
304050,29943528,76561198261890327,92,21,32730,0,5174,1624802995,"I love this game, it's simple but good. The enemies are balanced (usually) The classes are pretty good.",1487172010,1518208866,True,1,0,0.522058844566345215,0,True,False,False
304050,38315928,76561198296277248,0,2,3220,0,2323,1535167837,"Money hungry, laggy af, earned the nickname grind. Im able to run tf2 lowest settings 60 fps, why not this game? People should also be able to buy full DRAGONS THAT ARE IN FULL FORM for relatively low price, like buy this 20$ for 1 full dragon!",1513311294,1518059918,False,1,0,0.491869926452636719,0,True,False,False
304050,29822001,76561198295103983,0,8,9071,0,4643,1518208949,"Great game, don't understand all the hate (i'm not too far in, so may begin to understand though)",1486728289,1518025469,True,0,1,0,0,True,False,False
