304050,29734904,76561198094510912,328,38,1325,0,1294,1486360823,"I love the game but at times it can seem grindy and repetitive. Plenty of characters to play as, once you unlock or buy them, you can swap between them at any time. You get two free classes without much effort, more if you decide to refer a friend and use their class coin, but you must reach a high level to finally get it. The characters that are more advanced cost actual money but can be crafted if you're willing to put the time into it. Trove is essentially a grind game where you raid dungeons endlessly in open worlds and collect loot. When you reach a certain power level that increases with better loot, you can move onto a new world where you repeat the looting process, an endless loop of looting. If you like a game that feels rewarding, I can recommend this to you. Personally, this is my type of game. Despite the repetition, I enjoy putting time into it because it feels rewarding and your appearance changes with different loot so you don't always look the same. If you love what anything looks like, you can save its appearance and apply it to something different and keep its stats, I really enjoy that option. Plenty of interaction, each world has its own chat and there is a main hub where you can talk to people or find your friends and play together. You can also build your own home but within a limited square, the great part about this is you can transport your house anywhere you go for free. You can only spawn the home within squares that are randomly placed around every world. Only you can edit or destroy them. All interactable furniture placed inside of your home is usable by everyone, but it's personalized for them. Only you can access anything you have stored. There are trading stations but you have to be a very high level to use them, as for the player market.",1486356484,1486357022,True,0,0,0,0,True,False,False
304050,29731447,76561198081781591,0,24,151,0,151,1436485849,MEH.,1486337677,1486337677,False,0,0,0,0,True,False,False
304050,29730890,76561198142216258,0,5,3515,0,2391,1613178798,"It is a nice game to play with your friends, or just yourself! It is kinda a Pay-to-win, but it is still fun.
Highly recommend it.",1486335297,1486335297,True,0,0,0.499643117189407349,0,True,False,False
304050,29728675,76561198155587754,0,1,1235,0,296,1560632946,Great game,1486327843,1486327843,True,0,0,0.499643117189407349,0,True,False,False
304050,29728348,76561198257085760,0,1,5138,0,622,1562823041,"this game h elped me get through touygh times xD
",1486326914,1486326914,True,1,0,0.523809552192687988,0,True,False,False
304050,29724850,76561198169948165,232,4,9625,0,7688,1496668720,kill me btw devun likes boys,1486317097,1486317097,False,0,0,0.443686008453369141,0,True,False,False
304050,29722771,76561198160766391,0,4,6855,0,3771,1601134537,GREAT GAME,1486311909,1486311909,True,0,0,0.499643117189407349,0,True,False,False
304050,29717815,76561198338258032,0,2,745,0,486,1487412505,"THIS GAME IS TERRIBLE. SURE IT MAY BE FUN THE FIRST FEW MINUETS BUT ALL OF A SUDDEN YOU REALIZE, YOU HAVE TO BUY EVERYTHING! All the good stuff you have to buy for mountains of dollars and the thing you can get without money really really stink. Everything is terrible bad game don't get forget the whole Idea of getting it. The makers are moneyhungry, the controls on computers are stiff and you have to buy anything that is good.
DON'T GET IT UNLESS YOU ARE PREPARED FOR PAYING EVERY CENT IN YOUR WALLET. ZERO STARS!",1486298856,1486298856,False,0,0,0.499168068170547485,1,True,False,False
304050,29716128,76561198207682356,0,15,53,0,,1592851004,This is a fun adventure game you can really enjoy =) go around in different worlds and fight spiders and bees,1486293795,1486293795,True,0,0,0,0,True,False,False
304050,29714712,76561198128933482,327,28,355,0,240,1690696577,I want to play this game but I keep getting an error anyone know how to fix this problem,1486289281,1486289281,True,0,0,0.47413790225982666,0,True,False,False
304050,29712749,76561198122026484,0,4,26,0,12,1519587215,"one of thr best games outhar
",1486281993,1486281993,True,0,0,0,0,True,False,False
304050,29711511,76561198240711160,148,11,1004,0,915,1466470445,no,1486276677,1486276677,True,0,0,0.49751242995262146,0,True,False,False
304050,29710790,76561198062809482,286,64,236,0,92,1702310258,the glyph can't launch,1486273202,1486273202,False,0,0,0.498826295137405396,0,True,False,False
304050,29709887,76561198075803391,0,18,2241,0,1658,1451020443,"Just like in australia, everything will try to kill you",1486269057,1486269057,True,0,1,0,0,True,False,False
304050,29708787,76561198134838428,0,13,13246,0,4299,1683703231,"I do recommend the game it is really fun sadly i cant really make you believe me because of my 75 hours on the game but the thing is that i recomend this because i have played the game for a long and i mean a long time probably about 2 weeks it after it came out AKA when it wawsnt on steam so it doesnt show how much i know.

But to begin with if you are reading this thank you for taking your time and if you are one of my creators i know you have been to my guild called mega freedom but i dont remember who and just wanted to say hai. So in general this game is really amazing. I have played this game for a long time a previously said but the game has changed a lot. Some of it in a cool/good waybut some if it in a really bad way. 

To begin with, the market was really cool because it gave people an easier way to get  some good stuff like instead of farming sunlight bulbs for an hour or 2 you can jsut go to the market and spend some flux and get some that way. But if you are like me who has shit loads of flux you can get even more money from it which is a downside and i say this becuase i am a victum of it and now say you wanted to buy sun light bulbs usually there like 10-15 flux a peice which isnt bad so thumbs up for that. NOW the down side is like i said if you like me and have a lot flux you can buy all of the sulight bulbs and then sell them for way more like 100 a peice because no one has it and wants it so they will buy some which you can miake big profit from this which now the rich get only richer and you can do this stuff for materials that are harder to obtain like a penta forge soul and then boost the price to 40k flux and people will buy it because some are desprate enough to buy them because they want a radient which is where i usually make money like that but differ items. 

On a good note though i like how they have added radient and stellar items becuase i thought they were really cool.  Now the bad note is if your new its going to be harder to get them because you need at least 600 magic find and thats the lowest to where if you're farming for about and hour you will get one radient and if lucky a stellar. On that note though lets talk about one of the biggest parts of trove.

Power Rank, this is what gets you almost every where only for the reason of the the places you can go with 15k power rank or more becuase with out power rank you can get no good items like shadows and resplendent if you want to count those. But i only said that power rank takes you almost every where because you also need mastery rank just for some bonus items it can get you and i highly recommend that you take the time to learn about gems because a lot of new players miss out on gems and then wonder how to get power rank because in this game gems wil give you the most power rank and if you really want get to lvl at least 20 so you can use the special gems (forgot their names so sry people) and then spend money to get gem booster packs so the n you can get some good gems for your person and get some power rank. or farm up and just get the gems when you reach 550 power rank because at that pr you can do a shodow tower. With that if you kill daughter of the moon then you get some lunar souls which then you can make a gem booster and get a good gem(s).

More down sides; 
-you have to pay for classes or just farm chaos chest for chaos cores
-if your new then you will have a rough start (you can message me  if you need help but ill be playing with differ acount because its a good excuse to lvl up my oter chars on my other account)
-carful of scammers when you trade best bet is to look in market and then from that see the normal pricing for the item then buy the cheapest ;]
-farming flux can be really annoying for new people because they cant go in ubers 8/9 for good items to deconstruct
-PvP is a little effy (my opion) love the banner idea though (nother note: it is really fun if you do guild PvP i do it a lot and it's really fun)

Upsides
-game is very fun in general
-community is nice (most of the time)
-there are some cool dragons now (sadly though getting dragon coin are a lil annoying)
-getting to level 30 and having it said to everyone online feels great 
-the farming is really fun with friends and alone (biased a little)
-the graphics are good


Some Tips
try to find a good and nice guild and make friends and they can help you get good
start learning hot to garden in the game because it will help you a lot to get to mastery 20
buy a boat so you can get over water fast
another good/easy way to get mastery points is to fish
DO NOT DO SCROOL CRAFTING THING i say this because that is something you want to do whe n you get to mastery 200-299 because it will help you a lot when you get that far
carful where you go because say you have 5000 pwoer rank it will let you go to uber 8 which you are only level 13 or something you will die so stay in areas where your lvl is like uber 2/3 if you're lvl 13 
make friends on the game because if you do it will only get funner



Stuff I miss 
is when glim was actually useful i cry now becuase of it 
cant trade/sell chaos chest
a big one is the old shadow towers!!!!!!!!!!!!!!!!!!  these were the best because shadow towers used to be where you have to find them in the worlds of uber+ and have a shadow key and this made the game really fun becuase of when you found them you had a chance to get differ bossed. now sadly all you have to do is just get flux and boom you get a shadow tower and you can choose your boss. (but i do love that there are random mini dungeons that lead to the main boss)



I could go on about this game but i've spent some time typing this and now my hands hurt so i hope you liked this and found this helpful and i also hope you arent a grammer nazi ;] just saying ehehehe 


if you dont like the game im not here to force feed it down your throat you probably have other friends to do that ;P hope you have a good day and c ya",1486263980,1486263980,True,0,0,0.470852047204971313,0,True,False,False
304050,29708669,76561198168081109,0,12,7816,0,4922,1649390487,"This is going to look like a lot of other reviews i'm seeing on Trove nowadays, but i'm going to say my thoughts anyways.
I played this a bunch in like 2015, but i got FINALLY got on and updated the game, and what i saw, i hated.
Literally everything good, you have to pay for, there was tons of lag, and the community was not very impressive.
1/10 would not recommend.",1486263552,1486263552,False,1,0,0.497925341129302979,0,True,False,False
304050,29706036,76561198325550791,12,3,221,0,95,1550295335,"this game is cool,but it wont let me do a password to log me in -_-",1486252128,1486252128,True,0,1,0,0,True,False,False
304050,29705554,76561198184571035,0,39,8175,0,244,1667433372,its good its like minecraft cooler updated,1486250241,1486250241,True,0,0,0,0,True,False,False
304050,29704857,76561198039830847,142,2,35,0,35,1438292859,alter richtig schlecht digga. schlimmste 3 minuten meines lebens.,1486247823,1486247823,False,0,1,0.47413790225982666,0,True,False,False
304050,29703739,76561198058919046,0,3,10515,0,9400,1506008413,minecraft mixed with dungeon crawls.,1486244120,1486244120,True,0,0,0,0,True,False,False
304050,29696293,76561198357341142,0,1,5293,0,3603,1487092696,Fun and Challenging! 10/10,1486223543,1486223543,True,0,0,0,0,True,False,False
304050,29694516,76561198103393812,98,26,68705,0,6881,1669706047,Love how the community and people do daily,1486219057,1486219057,True,0,0,0,0,True,False,False
304050,29693115,76561198327076512,58,6,118,0,46,1553483231,"nice game
",1486214834,1486214834,True,0,0,0.499583661556243896,0,True,False,False
304050,29685531,76561198241920594,0,1,6997,0,5442,1513331127,i played trove a lot and i need to say it was fun but it gets boring over time,1486188316,1486188316,True,1,0,0.504587173461914063,0,True,False,False
304050,29685051,76561198260683124,0,5,2938,0,987,1652413111,"very,very,very good free game",1486186004,1486186004,True,0,0,0,0,True,False,False
304050,29679902,76561198149569611,41,6,168939,0,12147,1676866128,"this game is seriously broken.
this game's rng is seriously broken.
this game's market is seriously broken.
this game's lag is seriously broken.
this game's mounts are seriously broken.
this game's devs are seriously broken.
this game's gems are seriously broken.
this game's packs are seriously broken.
this game's ideas are seriously broken.
this game's p2w is seriously broken.
this game's chaos chests are seriously broken.
this game's worlds are seriously broken.
this game's youtubers are serioulsy broken.
this game's dungeons are seriously broken.
this game's bosses are seriously broken.
this game's enemies are seriously broken.
this game's classes are seriously broken.
this game's flux is seriously broken.
this game's ships are seriously broken.
this game's dev decision are seriously broken.
this game's updates are seriously broken.
this game's patch notes are seriously broken.
this game's download time is seriously broken.
this game's vfx are seriously broken.
this game's loading screen is seriously broken.
this game's shadow dungeons are seriously broken.
this game's wings are seriously broken.
this game's soundtracks are seriously broken.
this game's time i have is seriously broken.
this game's grind is seriously broken.
this game's fun is seriously broken.
this game's logic is seriously broken.
this game's honesty is seriously broken.
this game's way of life is seriously broken.
this game's dragons are seriously broken.
this game's dragon coins are seriously broken.
this game's glim is seriously broken.
this game's resources are seriously broken.
this game's community chest is seriously broken.
this game's sound whenever you deconstruct things on the loot collecter is seriously broken.
this game's way of handling beginners is seriously broken.
this game's just bad in general.


this game is so...





































is so trash.",1486163132,1486163132,False,0,5,0.49751242995262146,2,True,False,False
304050,29677672,76561198362625354,0,2,11773,0,750,1664926611,It amazing keep it up,1486155930,1486155930,True,0,0,0.490463197231292725,0,True,False,False
304050,29673860,76561198061449032,0,78,1266,0,775,1560546933,somday the launcher will work. FUCKING FIX IT F,1486142725,1486142725,False,0,0,0.490463197231292725,1,True,False,False
304050,29673544,76561198134651694,91,27,6329,0,858,1691955464,"its very much pay to play but yo ucan get by without paying. very hard though. i would reccomend this for anyone whos bored and just want to hav fun with endless boss fights, but otherwise its ntot that great. wish there was a meh button",1486141808,1486141808,True,0,1,0.490463197231292725,0,True,False,False
304050,29665980,76561198188998451,0,24,1247,0,890,1584168549,This game has a unique perspective to it. now thats my own opinion. all my friends play this and its a really fun game slaying mobs and teaming with friends to take over places and kill bosses and all that. i highly recomment this game to those people who just stopped by to see this game.,1486115302,1486115302,True,1,0,0.516129076480865479,0,True,False,False
304050,29662660,76561198086447238,321,86,834,0,595,1486258725,Great game but very grindey. Would be better with friends and possibly other servers or home worlds to minimize the crazy lagg you get loading in.,1486097642,1486097642,True,0,0,0,0,True,False,False
304050,29659640,76561198232540116,68,18,1717,0,321,1577389677,"this game is fun and addicting and i can just sit here playing it for hours nonstop

I think this game was a success and its pretty dank my dudes would recommend downloading if you are deciding to
",1486082048,1486082048,True,0,0,0,0,True,False,False
304050,29656033,76561198105096122,248,55,14775,0,13223,1500208861,Good game,1486066812,1486066812,True,0,0,0.467382669448852539,0,True,False,False
304050,29652729,76561198048065446,216,16,21660,0,19709,1581107432,It's good.,1486055600,1486055600,True,1,0,0.523809552192687988,0,True,False,False
304050,29651857,76561198298240957,0,4,2407,0,1743,1607262861,"it s a good game i recomanded to you
",1486052772,1486052772,True,1,0,0.539007067680358887,0,True,False,False
304050,29650877,76561198254980193,0,2,2618,0,1419,1486481401,ÐµÑ‚Ð¾ very yleoba game,1486049471,1486049471,False,0,0,0,0,True,False,False
304050,29650444,76561198190149281,0,7,4488,0,1782,1500124272,Awesome! I love it! For all those years i searched for a game like that! Its cool and it's not boring! I loooveeee it <3,1486048020,1486048020,True,0,0,0,0,True,False,False
304050,29650078,76561198226503284,54,11,7479,0,5933,1589187555,i love this game but it gets boring if you play alone :P,1486046820,1486046820,True,0,0,0,0,True,False,False
304050,29649851,76561198149728923,0,2,6584,0,2005,1486376061,"hey Ive been having troubles when I sell things, if I chose to take it off the market or if i buy something Im simply not raciving it/getting it back. I dont know what to do and was wonder if you had a salution.
",1486046052,1486046052,True,0,0,0,0,True,False,False
304050,29644646,76561198311134782,84,18,1950,0,567,1543477855,"lol its da best for people who like leveling up and adventure games
",1486024652,1486024652,True,0,0,0,0,True,False,False
304050,29643992,76561197984636266,0,62,75478,0,45459,1525499976,"Top selling DLC on steam for a long looong time. No content generated beyond user made content that you could have gotten in mods for months before being ""officially"" ""accepted"" by trion.",1486021707,1486021707,False,0,0,0,1,True,False,False
304050,29643693,76561198286382338,341,39,50,0,50,1469565325,Just no,1486020250,1486020250,False,0,1,0,0,True,False,False
304050,29642623,76561198115855310,0,2,6329,0,5591,1592198491,"At first, Trove seems like a world full of adventure with cool classes and modes. You see people with dragons, mounts, cool weapons and shit. Then you pour some hours into it. Then you get SOME cool gear and start getting to a decent level. Then levelling up becomes slower... and slower... and slower... and slower... you get it. The grinding in this game is brutal, and it doesnÂ´t give you any rewards. When you try to clear a dungeon that is your level, every enemy DESTROYS you. The game tells you ""you are this level, so you should do this"", and then you find out you canÂ´t because itÂ´s extremely unbalanced. This game is impossible to play if you go solo, someone has to carry you. Or, you can pay... I'm not talking pay to win, cause its main mode is pve. ItÂ´s more like pay if you want to get ANY basic enjoyment out of the game. Not worth your time.",1486014108,1486014108,False,1,0,0.523809552192687988,0,True,False,False
304050,29639320,76561198210231751,0,2,1416,0,478,1596273409,"Spent half an hour trying to climb a dungeon only to be repeatedly teleported back to the ground and killed.

Wasted time level: 9001. Unless you have the absolute best connection humanly possible, dont bother.",1485996591,1485996591,False,0,0,0.484111219644546509,0,True,False,False
304050,29637293,76561198328249006,0,1,19,0,18,1487813126,"Its not working for me, it is taking forever to open the game",1485987487,1485987487,True,0,0,0,0,True,False,False
304050,29629150,76561198065009070,215,13,162,0,87,1486306410,"Coudn't accept the ""END USER LICENSE AGREEMENT""
10/10
best game ever",1485960592,1485960592,False,9,10,0.467793881893157959,4,True,False,False
304050,29626441,76561198258676712,0,3,845,0,783,1510455577,THIS GAME IS INCREDIBLE FOR A FREE GAME! but after hours.. of gameplay you get bored after a moment... (still I had a good time playing Trove with my friends).,1485951761,1485951761,True,0,0,0.499168068170547485,0,True,False,False
304050,29617856,76561198159266575,0,4,12537,0,234,1679085156,"Its awesome! You can be a pirate, I like the pirate class and also theres ships and the crytsal of power, note the crystal of power is in the expansion pack",1485911466,1485911466,True,0,0,0,0,True,False,False
304050,29617405,76561198089539671,0,15,109,0,109,1485909423,"Everytime I try to play, it crashes, when I do get a chance to even type a name in, it's used and crashes me. WTF is this shit?",1485909384,1485909384,False,0,0,0.471293926239013672,0,True,False,False
304050,29617139,76561198245735130,0,2,23,0,23,1485758282,"I do recommend this game, it has loads of content and tons of different dungeons to explore, literally. But I can't seem to play it on my PC, everytime I attempt to start it from the launcher, the screen is too large, it shows me the upper left of the loading screen, and I can see the words ""EndyUseryLicenseyAyreement"" all in one. This game is good, and I do enjoy it just from playing it on console, I've heard it was even better on PC since some content wasn't on console, but this error had occurred, and yes, I tried uninstalling and reinstalling, but it didn't change anything, I even tried making a new account but still no dice. I looked on the site/forums for help as well, but no one had troubles with my issue.

If anyone could help me that would be amazingly appreciative",1485907829,1485907829,True,0,0,0.49751242995262146,0,True,False,False
304050,29612442,76561198202268178,282,26,5707,0,3154,1518046987,"[h1] 09/10[/h1]

Good Game!many bugs but good playability and good for playing with friends",1485890556,1485890556,True,0,0,0,0,True,False,False
304050,29609777,76561198265701733,245,16,164,0,164,1483963182,a kids game that adults play. i can respect it.. it is quiet fun though. atleast give it a shot.,1485882384,1485882384,True,0,0,0,0,True,False,False
304050,29608507,76561198127567961,96,7,2127,0,489,1693693676,"love this game
",1485878807,1485878807,True,0,0,0,0,True,False,False
304050,29605337,76561198230647780,206,17,14795,0,11451,1585821658,good game but enoght stuff to do,1485868888,1485868888,True,0,0,0,0,True,False,False
304050,29598705,76561197992618115,0,8,1736,0,1698,1487475887,"Awesome game, but it gets boring quick. After you unlock characters you want to play as, you notice that there isn't many things to do. You notice players who are much stronger than you because it's pay to win game. It's awesome that a free mmorpg game but it's not really ""free"". It's not worth your time.",1485839402,1485839402,False,1,0,0.506041467189788818,0,True,False,False
304050,29597816,76561198259641762,20,4,53,0,14,1501938321,"I have just started playing this game on my Xbox one and it is a longer time for lvling but I still love the game on both PC and console I have found alot of good friends with this game and I recommend you try to play it it is fun and you don't have to pay to winðŸ˜ƒ
",1485834831,1485834831,True,0,0,0,0,True,False,False
304050,29597066,76561198147274147,87,11,2774,0,1590,1580701179,goodgame really fun,1485830625,1485830625,True,0,0,0,0,True,False,False
304050,29593879,76561198271990015,0,1,52,0,52,1479678284,"Hi

",1485814086,1485814086,True,0,0,0.476190477609634399,0,True,False,False
304050,29593602,76561198144226620,241,7,16204,0,1691,1648503907,It is a really fun game but you must be patient if you don't want to spend real money in this game.,1485812933,1485812933,True,0,1,0,0,True,False,False
304050,29589478,76561198309315779,611,226,101,0,101,1485539605,"It's like minecraft but with a lot of mods.


10/10",1485798127,1485798127,True,0,1,0.461538463830947876,0,True,False,False
304050,29588405,76561198071702431,0,71,9017,0,5234,1559161484,iv had this game only for abit and its fun with frends but its an mmo so its super grindy so it wont be for everyone and it does encerige pay to win but it doesnt force anyone the ones that do it are the ones that are without patients but any how the games grafixs or blocky some blocks are mine able and ever sell/trade able i just wish thy would lower the make requred lvl so of a skill called mastery so it would be easyer for new players to lurn  and get items thy would need in the neer future but other then that its more or less what i ecpected and neerly every way and i play it now and then for some frends and items,1485794620,1485794620,True,0,0,0,0,True,False,False
304050,29585993,76561198219844371,7,1,11842,0,7194,1522444992,"Amazing Gamee
",1485786096,1485786096,True,0,0,0,0,True,False,False
304050,29585783,76561198168025058,271,29,17980,0,2768,1571365264,"Epic Game,low quality perfect, and so funny and hard :D",1485785325,1485785325,True,1,0,0.523809552192687988,0,True,False,False
304050,29584930,76561198104739107,400,4,63615,0,11803,1707458514,"I love this game, due to i can do anything, go anywhere and specially, i can build a lot of things what is in my dream when i was young. 
Love it to much
This is another my life.",1485782184,1485782184,True,0,0,0,0,True,False,False
304050,29581652,76561198096625364,0,32,31,0,31,1485766490,"I went through the installation for the game, but the game kept refusing to install the last 88 MB. Needs to be fixed..",1485766565,1485766565,False,0,0,0.476190477609634399,1,True,False,False
304050,29578527,76561198161152168,35,6,5380,0,4293,1550946127,"this game turns me on
would recommend",1485748488,1485748488,True,3,3,0.515748023986816406,0,True,False,False
