698780,36588996,76561198036600324,0,5,626,0,514,1516009035,"I adored this game - while I'm not personally into visual novels, horror, or things of a jumpscare-y nature, I found this game to be just unsettling and disturbing enough that I could actually enjoy the intense thrills, and the ending after 100% completion gave me the resolution I needed. It's not without criticisms (which I'll go into), but for me it's a solid 9/10, definitely worth playing and paying for if you like an unsettling emotional roller coaster. Also a definite purchase if you, say, enjoyed Undertale or games of a similar creepy/wall-breaking nature.

Pros:
- I really cared about the characters
- Was scary/unsettling without going overboard and destroying my faith in the game.
- Pacing is generally solid throughout.
- Made me genuinely think about some things in life
- I actually want to go write some poetry now, huh.

Cons:
- Anime waifus aren't for everyone, though this game is *relatively* decent
- I could see the music getting old for some, though to me it was fine
- I wanted just a *little* bit more out of it... but not much!

Now there's a lot I'm willing to forgive because I enjoyed the storytelling and cared about the characters so much. But here are my criticisms in more detail (maybe if the devs see this):

- Wanted a more emotional, in-depth resolution to one particular, important character arc - was good, but I wanted much more.
- There's a dialogue-skipping feature, but I was unsure if using it would cause me to miss subtle differences between decision paths - I found there wasn't much if any, but that's not communicated anywhere. Iow, there were times I could have skipped but was afraid to.
- I got 100% completion in the minimal number of playthroughs to my knowledge, but if you don't know what you're doing going in (which ideally you shouldn't), then you might require additional playthroughs... skip feature is nice for that, though.
- Some ""scare"" art/animation could have been executed better imo. Also I think the still non-cutscene poses of the characters could have been drawn/proportioned better, but I can forgive that.
- Probably just me, but I found myself too high-strung/defensive to really let the unexpected hit me sometimes. But I normally can't even tolerate scary movies, so the fact that I 100% completed this is saying something. (I.e. I really cared about the characters.)
- There were some things that I suspected would reward my efforts if I tried them, but didn't result in anything and wouldn't have been too hard to throw in, imo.
- Couldn't change the selected monitor/display for fullscreen, only possible by changing Windows primary monitor, I believe.

I'll probably be exploring this game more over the next few days... definitely recommended! And I don't say that easily.",1510985906,1510985906,True,1,0,0,0,True,False,False
698780,36522251,76561198130338733,405,9,1334,0,342,1584772805,no option to change name? wow.,1510708092,1510708092,False,0,1,0.284929841756820679,0,True,False,False
698780,36501877,76561198078202981,0,1,926,0,565,1558510076,"My hart is hurting

My mind is blown

What ever this game is

It changed...

My expirience of preception

p.s.
My pc too XD , but still, the game is awesome. Still sad thou, (SPOYLER)   Sayori T-T and others...",1510618255,1510618255,True,0,0,0,0,True,False,False
698780,36335447,76561198360288904,0,2,202,0,125,1689382077,"Great twist. Loved all the aesthetics and the overall narrative. When I reached the credits, I went to look up about the game and was stunned that it had such a cult following even being a fairly new game. But I understand how it gained such popularity. Lulling unsuspecting players in with the usual tropes, and ensnaring them (or should I say, us) in a much richer story than the surface displays. Nicely done. 

I guessed early on that something was up with Monika, however. Not being able to pursue the ""pretty, popular, athletic girl"" in a dating sim/ VN shot a big red flag up, but it was all planned that way anyway.

Very well executed all around.",1510027803,1510027803,True,0,0,0,0,True,False,False
698780,36247758,76561198069054871,5117,93,556,0,556,1509742457,[Strike]Yuri best girl[/strike]Monika best girl. Just Monika.,1509730572,1509730572,True,0,0,0,0,True,False,False
698780,36204223,76561198068247722,0,2,207,0,70,1577498750,"I wanted cute anime girls. Instead I got clinical depression. 10/10, would slit my wrists again.",1509577705,1509577705,True,8,9,0.563208281993865967,0,True,False,False
698780,36042761,76561198028267787,0,13,261,0,261,1509050494,"Sit down with cupcakes, some tea, and a razor sharp knife. It's time to delve into a perfectly normal visual novel dating sim.",1509108493,1509108493,True,1,0,0.504043102264404297,0,True,False,False
698780,36039796,76561197984668262,0,4,135,0,135,1509182803,"This game is amazing!  It starts off a little slow, but once it gets going...   just...   wow.",1509101485,1509101485,True,0,0,0,0,True,False,False
698780,36010311,76561198081968003,145,4,260,0,260,1509017277,"Just got to mention, quite seriously, if you cannot handle scary stuff or have anxiety issues, then do not play this game. It's  a great experience, and I do highly recommend playing it, but it could literally be bad for your health if you can't handle this sort of thing.

But if you do actually start this game, DO NOT QUIT. Trust me.",1509016846,1509016846,True,1,0,0.523809552192687988,0,True,False,False
698780,35995807,76561198023658184,397,12,214,0,214,1509041031,Best VN I've played since Katawa Shoujo.,1508958843,1508958843,True,0,1,0,0,True,False,False
698780,35954364,76561198061508147,704,15,424,0,353,1511496073,"I looked at the tags and thought lol nice joke

The joke was on me",1508795618,1508795618,True,17,8,0.630803406238555908,0,True,False,False
698780,35953183,76561198022902198,0,3,8,0,8,1509070389,Is there support for this game? The support@teamsalvato.com email doesn't work and I can't even get the game to start. No virus protection interaction issues.,1508790993,1508790993,False,0,1,0.433171182870864868,0,True,False,False
698780,35907127,76561198335433000,0,24,134,0,98,1520953415,"If you think about it, this game is about waifus trying to enter our reality. If only I could enter their reality...each of them girls deserve love and hugs. Anyway, the game really plays with your emotions, especially when you get the good ending.

I wished there will be another version of DDLC where it's like a normal VN, you know.",1508635909,1508636766,True,0,0,0,0,True,False,False
698780,35866911,76561198152058494,0,4,249,0,249,1508500321,"Great game, loved the happy atmosphere. Had some weird glitches towards the end there, but there were some files missing on my system which were deleted somehow. Had to get rid of another file of the same kind for it to work afterwards. Fun game, fun characters and Natsuki is best girl. Fight me.",1508514888,1508514888,True,1,0,0.50437319278717041,0,True,False,False
698780,35805646,76561197961746036,0,1,202,0,202,1508279454,Amazingly good,1508277986,1508277986,True,0,0,0,0,True,False,False
698780,35659443,76561198127142426,383,12,22,0,5,1645582431,I never write a review for a game. But this one made me weep at the end. playing this blind was a wonderful idea. I feel so attach to a character in this game. It was worth getting the fan pack and reaching the end of the game. I am not crying.,1507816234,1507816234,True,1,0,0.500499486923217773,0,True,False,False
698780,35570608,76561198148019245,316,24,6002,0,6002,1508011669,"It's a great game with a plot that thickens so unpredictably in such a short period of time. Definitely would recommend playing this game without spoiling yourself first. Actually, even if you do happen to be spoiled some plot points, the [spoiler]spooks[/spoiler] may still get you most of the times.

God I want to be natsuki's [spoiler]dad[/spoiler]",1507463803,1507471785,True,4,1,0.546805739402770996,3,True,False,False
698780,35513369,76561198025021742,0,1,608,0,608,1507357763,"Play this game. Stop reading reviews. Stop looking stuff up. You're only going to spoil yourself. It's about five hours long. It's free. Even if this isn't the type of game you'd normally play, just play it.",1507279027,1507358132,True,96,1,0.696194648742675781,0,True,False,False
698780,35524874,76561198044460369,0,1,9,0,9,1507419449,"Yes, first ever VN I've played",1507314697,1507314697,True,0,0,0,2,True,False,False
