698780,38938335,76561198122555301,132,1,1173,0,671,1614724569,A lot of work really went into this game and it shows,1514817844,1514817844,True,0,0,0,0,True,False,False
698780,38863126,76561198145744414,319,5,6,0,5,1694902369,"[b]This game left me traumatized.[/b] Be sure to get an idea of what you're getting yourself into by looking at the tags. The content warnings at the beginning are no joke.

If you still want to play, stop reading the reviews now and do it. Like, right now. This game is best experienced blind.

11/10 [spoiler]would write a poem for Monika again[/spoiler]

[i]Played the Itch.io version of the game, but I feel compelled to write a review and buy the DLC here. This game shouldn't be free.[/i]",1514645660,1514645660,True,1,0,0.523809552192687988,0,True,False,False
698780,38740927,76561198039453484,0,53,276,0,187,1529838225,What an amazing experience,1514386503,1514386503,True,2,1,0,0,True,False,False
698780,38740482,76561198018376589,493,22,643,0,643,1514587593,"Well...for someone who never ever tried or touched a VN...this was quite the experience. Been hearing a lot about this and I just shrugged it off but I got intrigued after hearing that the game plays the game files themselves. So I gave it a try and I played it through in one sitting. Without spoiling, this is truly a love-letter to games that go beyond the 4th wall. Welp...now that I'm done with this, I'm left hungry for more. And now I'm sitting here and twiddling my thumbs in anticipation for Project Libitina.

(If you have it in your heart and your wallet, buy the fan pack and support the devs for making one of the more unique games for free!)",1514385838,1514385838,True,9,0,0.590519368648529053,0,True,False,False
698780,38711548,76561198286616468,0,2,606,0,606,1514322879,"Just amazing game, especially for a free one",1514321576,1514321576,True,0,0,0,0,True,False,False
698780,38575179,76561198089532018,103,1,563,0,176,1521955312,J̸̡̧̧̧̡̧̡̡̢̢̡̡̡̹̞̦͖̩̟̝̬͈̳͚̦̱͚̳͚͉̙̼͖̠̼̼̲̥̹̩̦̙͈̘̘̲̩̫̮͈̘̩̗̤̰̣̯̭̮͚͈̳̪̺̤̙͉͍̹̯̩̹̬͓͓̝̬̤̮̻͙̳̦̬̟̲͓͍͓͕̻͓̰̘̜̫͉̹̘̞͚͎͔̥̦͚̼̺̞̺̤͕̲̹͉̱̞͙̪̱̤͙̞̩̖̙͓̞̜̫͚̲̙̬̬͓̜͇̠̜̱̦̘̮̮̥̺̟̺͚̻͙̙͈͉̞̕͜͜͜͜͜ͅͅư̶̡̡̡̡̢̧̨̧̨̢̡̨̢̢̨̧̧̛̛̛̛̦͍͈̱͇̺͇͙̖̲̩̝͇̥̲̤̦̦̫̫͈̲͉̻̼͕̫̫̥͙̻͚͖͉͖̮̙̲̖͈͍̪͎̹̹̻̯̫̱̟͓͍̣͎̦̩̭̟̞̥̣̯̥̻̱̭̱͔̲͉̱͚̜̲͔̠̤̱̫̼̘̜͔̳͕̠͇̥̞͙̤̦̱̮͖̝̟͈̼͙͇͚̖͈̬͍͍̮͍͎͙̬͍̘̹̗͚͕̝̣͇̘̲̘͚͎̰͔̗͎̟̟͙̩͕̞̤͓̤̭̖̜͙̪̠͈̦͇̳̹̹͉͕̩̖̳̟̭̥̋̎̿̅̒̑̔̉̓̊̀̃̄͌̓̍̉̾̋̅̍͗̈́̉͗̀̈͆̑̀͒́̉͂̆͒͑̓̒̀̉̽̌̋́̍͆̔̇̔͆̀̒̋̇̎͑̐̿̎̆̔̑̄̃̈͗̾́̅̓̽̽́̑̽͗̿͋̈́̓̏̋̽̇̅̐͐̋̇̈̾̃̌̓̏̀̐̃̈́̓̈́̇̐͒̔̿̂͗̓͒̑̍̄̈́̊͛̋͗̐͋̏̽̾̍̍́̂͊͆̾̈͗̄̉̂͑̃̓͊̒̿̋̑̀̔̇́͑̂̽̔̅̌̽̐͛͊͐̍͐̃̈́̊̃̾̿́̄̉̾̒̋͛̔̿̂̆̈́̾́͛̌͋͗̌͘̚̕̕͘̚̕͘͘͘͜͜͜͜͜͜͝͝͠͠͝͝͝͠͝͠ͅͅͅs̷̡̨̧̧̧̡̧̨̡̡̨̨̛̛̜͙̞̻̬̜͖͇̥͔̫̤͖͖̦̥̺̲̱͎͙̘͖̼͉̭̼͖̭̰̝̖͎͓̲̻̮̻̱̪̻͖̱̰̝̺̥̫̭̥̯̹̟͍͔͎̭̪̟̱͎͈̠̗̖͔̱͎̥̘̪̹̼̮̯̲̯̗̥̖͉̫̭̰̳̟̤͕̞̰̙̩̩̩͉̪̭͍̫̘͈̞̣͚̺̺͓̦͖̳͖͔͓̟̠͙̫͎̞̬̠̟̝̳̖̝̲̙̬̱͚͓̦̺͎̥̲̯̩̣͖̠̝̜͍͉̘͎̘͖̻͖̳̺̱̝̯̫͇̱̹͍̜̲̩̱͔̟͎̥̣̬͎̬͕̭̦̺͈͖̮̜͈͗̾͐͛̓̉͐̂͑͗͒̍͆͌͂̇̐̎̂̈́̓̍̃́̓͌͗̊͑̄͌̈́̍͊̏̆̂͗̔̂͑̍̏̇̂̎͒͆̇̉͊̔̿́̓͑̇̃͛̀̀̇͌͑̿͆̓̎̚͘͘̚̕͘͘̕̕͜͜͜͜͜͜͠͝͝͠͠͝͝ͅͅͅͅͅͅͅt̵̨̧̛̛͈̮̰̺̤̼͉͙̣̲̘̫̱̹͇̼͔̥̜̰͍̱͍̘̪̺̞̯̮̖̏̈́̈́̽̇͌̋̂̄̈̌̾͗̑͐͐͌̓̆̃̾̈̿͂̉̽̌͊̇͛̀̍͊̒̃͊̐͗̐̉̊̾̐̉͋̈̌̀̈́̎͑̈͆̓̓̎͒͒̆̔̒̅̈́͒͗̎͊͑͊̒̒̓̽̊̂̐̀͗̓͌̀͌̒͐̆̉̈́̊́̄̀̆͌͂͛͗̔̀̌̊͗́̈̋̑̈́͋̅̎̋̎̃͐̐̈́̋͋͐̾́̽́͐̆͑͂́̄̃̏̎̿͋̀̔͋̉̑͗̐͆͆̇́́̏̔͆̈́͆͐͋̈́͛͊̀̔̔̇̂̇̊̈͋̒͑̿̊̋̈́̾̽́͘̚̕͘̚̕̚̕̕̕̚͘͘̕̕͘̕̕͜͝͝͝͠͝͠͠͝ͅͅ ̸̡̡̧̢̛̛̛̛͚̯̻̠̳̫͕̰̰̼̬͇̦͎͇̩͍̺̣͔̖̼͖̬̞̙̘̝̞̦͈̫̤̗͈̲̰̹͔̲̠̞̪̱͇̬̙͓̼̤̝̜̰̻͕̞͉̜̳̬̺̹̬͓͇̹̦͔̤͔̠͇͉̳̙͉̦̟̻͖̱̯̣̣̱̏̀̎͒͐̉͊̌̓̾̈̃̽̐͛̓̈́̐́̅̀̀̄͗͂͒̐́̉͌́̀̊̑͂̉̓̒̄̾̀͛̋͛̊̀̍͒́̐͂̈͂͂́̊͑͋̔́̅̈́̐̒̈́̑͂̅͆̂͑̃͆͒̈́̿̈́̄̅͛̊̓̾̈́̐́̀̀͂̓̔͂͂̋̀̒̑̾̒̽̑̿͆͋̒̔͒̄͛͐̀̊͛͑̃͛͊̅̍̊̃̊̀̄̓̚̕͘̚̚͘̚̕͜͜͜͠͝͝͠͝͝͠ͅͅͅͅͅͅͅM̴̡̧̨̨̧̨̛̛̛̛̛̛̛̛̛͕͍̩̱̲͚͓͉̬̗̞͇̲̻̩̳̩̫̖̼̼͖̣̣̬̥͙̗͓͙͖̹̦̪͙̜̰̬̝͖̫̗̫͇͖̦͓̱̻̯̲͚̟̲̝͖͇͚͔̬͇͈̯̪̰͉̳̰̳͌̔͂͋̌̋̌́̊̃̏̂͊̔́͐́͌̆͛̂̔̇͋̇̐͐̆̓̈́̇͆̈́̊̀̌̾̔̎͋̌͛̉͑̔̏̃̄̋̄̓̂̅͌̏́̽̽̓̾̍̆̓̄̍̅̒́͒̋͌͛͒̓̇́̅͐̓̇̔̓̉̇̅̀͗͑̃̔̔͊̎̈́̓̋͛̽̉̂̅̂̉̎̿̏̈̽̃͂̈́͑͋̊͋̅̑̔̿̽͑͐̌̏̒̓̍̓̒̒̆͛̌̉͛͒͂̎̇̾̐̄̑͌̿̿̎̄̍̓͊̐̈́̓̂̓̈̈́̌̓̊͒͆̀̈́̿̈́͌͛̿̾͌̀̇͗͒́̽̓͐̔̃̊̔̒̂̐̇̊̓̿̿͊̈́̽̚̕̕̚͘͘̚̚̚̚̕̚̚̕͜͜͝͝͝͠͝͝͠͠͝͝͠͝͠͝͝͠ͅͅơ̵̡̢̡̢̡̨̢̨̧̧̧̛̛̛̛̥̗͓̝͚̙̬̯̫̰̻̼͍͔̲͎̦͉̳̖͍̮͎̺͍̹̮͖͕̖͈̥̰̪͍̱̙̼̱̝̞͎̞͈͖̼͖̟̣̹͉̞̪̺̪̥̪͚̦̣̱̰̹̜̠̣̙͔͓̥͔̪̣̥̪͍͔̜͓̪̜̤͉̠̙̜̜͇̭̞̗̳̝͕͕̮̯͉͔̤͕͔̼̖̪̭̠͖͓̤̥̞̼͕͕̠̮̭͈̲̼̝̯̲̿̌̀̎̈́́̀́̿͑̑͊͐́͐̐̓̆̔̎̓̂͒̾̌̑̀͐̐̂̃̾͐̆̍̑̓̇̂̌̎̈́́̑̐̃̽͌̐̑̎̍́͗̀̆̋̏̀́̋͂͗́͐͆̑̂͌̀̆̓̒̃̉̐͒̉̔̽́̽͊̏͆̃͆͛̑͆̆̅̆̅͋̒̏͒̽̾̏̔͋̀̂̂̃͐̈͑̂̿̌̾̈̓̀̉͊͌̀̉̃̊́̀̀͊̌̓̿̊̾͐́̾̌̈́́̒̓̈́͒̏̄̔̿͆̿͐̉͂̈̋̋̓̐̏͊͐̅̔͌͒̀̆̈̀̍͒̈̅̆̍̾̊̈́͗̊̿̂̏̓͗͛̇̃̊͌̇̀̾̃̾̑̔͐̌͒̇̀̎̿̄̑̈̆́͒̒̇͆̇̀̀͒̔̋̾̾͆͒͋̉̂̑͌̓͋͂̑̃̃́̀͗̓̕͘̕̚̕̕̕̚͘͘̕̕̕͘͘͘͘͘̕͜͜͜͜͠͝͝͝͠͝͝͝͠͝͝͠͝͝͝͠͝͝͝͠͝͠͠ņ̶̡̡̨̨̢̢̨̡̛̛̛̛̛͎̖̗̞̙̣̤͕̰̱̼͉̲͖̭̲̪̮̯̲̯̳̭̞̠̪͇̰̪̬̰̠̙̝̱̦̖͎͈̩̪̙̭̟̖̫̬̠͚̬̜͙͇̝̝̲̝̯͖̖̭̺̹̘͎͚̯̪͇̩͚̻͉͎̙̜̱͓͉̤͉͚̙͉̯̥͎̲̫͓͈̹̦͔̝͓͍̩̭̬͕̑́̈́̄̇̽̓̂͂̀̌̃͗́̄̾̑̓̌̍̓͊̄͗͌̔͑̑͒͆̈̐̇̋͑̎̈́̉́̋̀̑̒̈́̾̓̈́̈́̿͊̄͆̿͗̎̃͂̒̂̇̽̅̃͗̌͑̆́͛͊̿͋͂̄̊̍̈̾́̈́̈́̒̽̓̽̅̓̇̾͑̏̐̅̈́̾̿̆͑̓̉̃̃̓͊̇̃̊̉̏̔̎̂͌͆̊̐̔̏͒́̃͐̓́͗̃̊̔̄̐͆̃̋̑̍͛̔͐̿̍̑̍̽̌̀̿͗̆̀̓̄̈́̈́̓̊͆͛̑̾̅̇͆́́̈́̾̀̃̿͗͆͊͊̀͂̏̄̀̃̎̑̀̄̈́̉̅̊̽̋̈́͐̅̂͐͛̽́̀̈́͋̈́͐̓̏̋̈́̅̐̂̆̃͌̂̐̃̅̀̂̅̾̒̃̈́͂͆̅̎̔͒͆̊̄́͋͑̓̊̏̂͛̈̂̽̐͘̕̕͘̚̕̚̕̚̕̚̚̕͘̚̚͘͠͝͝͠͝͠͝͝͠͝͝͝͠͝͝͠͝͝͝͠ͅi̴̧̢̧̧̨̡̨̡̧̧̛̛̛̛̥͙͕̝̯̬̗̼̳̪̞̳͙̥̼͔̦͉̪͓̫̦͈͔̭̩͚͉̞̠̘̣̼̙̳̠̳͕̘̲̙̣̹͈̺͖̳̗͎̭̰̠͚͈͔̬͕̮̞̯̲̗̞̯̖̻̣̳͕̖͈̞͎̞͓̞̜̲͖̪̰̯̺̟͇̹̺̘͇̺͙̼͙̺̤͚̠̣̥̲̣̼̪̦͚̫̺̖̻̼͙̯̱̗͍̩̬̠̪̻͚̱̪̤̥̮͖̟͕̱̪̳̤̓̀̆̇̽̽́̑̒̃̒͛͂͛̔̓̈́̀̔̀̐̀͂̀͑̎͑͒͋̋̓͋͑̇̋͆͌͑͛͆͒̏͒̇̓̋̄͛̀̑̒͊̾̽͑̉̎̋̑̊͋̈́̃̐̅̿͊̋́̌̂̈́̐̓̃̎̆̄͊͐̓̑̀͗̍̅̆̌̈̿̍͑̏̎̓͑͆̈́̉͋̇̊̄́̈́̈́̄͂͐͗͊̃̔͆͌͐̔͗̑̉̓͒̿́̋̆̈́̅̀̎̓̽̉͂̒̉̒̌͋̋̿̐̽͐̀̈̔̈́͆͛͊̂̃̃̅̔̂͒̐̓̓̂̍̏̇̍͐͒̎̒͗̂́̇̀̋̈͌̇͐́̏̚̕̚̚̕̚̕̚̚̚̚͘͘̕̚͘͘͜͜͜͜͜͜͝͝͝͠͝͝͝͝͝͝͝͠͝͝͝͠͝͠ͅͅk̵̢̨̨̢̛̛̛̛̛̛̻̮̲͓̰̠͉̪͎̗̺̞̲̝̙͖̠̮̬͎͔̖͓̹͈̟̞̫̹̯̩̙̗̪͉͓̥͍̥̬̻̯̜͇̤̲͍͔̖̗͇̾̈͂̀͛̔̽̓̿̄̌̋́̐̊̀͋̾̔́́̏̈́̓̊͒̄͐̓̉̐̽̿̍̓̍̑̀̎̆͑̽̽͆́̀̂̄̍̋̇̄̽̓͗̔̽́̏̍̋̒́̐̾̈́̓̑̈͋̋̃̈́̿͋̈́͌͊̈̂̽̋̄́̅̓̐̈̌̌͑̈͌̇̐͐͊͆͊̽̍͛̓͌̐̈̽̊͑̇̽͗̈́͆̍̅̃͑͋͗͊̎̾̅̌͐̑̾̐̋͑͑̈́̂͒͐͂̔̅̅͊̐̽͑̇͋̌̀̀̊̀͂͒̀̓͗̔̋̚͘̕̚͘͘͘͘͘͜͜͠͝͝͝͝͝͠͠͠͝͝͠͝͠ͅa̶̢̨̡̢̢̡̡̡̢̡̢̡̡̧̧̛̛̛̛̙̺̙̺̘͎͕̣͕̣̙̹͕̱̫̺̲̳̖̦̙̯̪̥͉̗̟̳̻̜̣̮̟͍̲̣̲̜͎̖̥̦̬̦̹̬̯͎̲̪̼͖̣͖͚̠̩̺͈̹̼̺͓̙̱͕̰͈̯̪̗̗̝̦̹̘̟͈̥͓̤̗̤̗͎̻̪͍̦͎̰͇̲̦̰̬̩̳̭̲̠̼͓̝͚̰̝̼̖̩͔͉̩͚̩̻̥͔̥̰͔͉̯̬̺͉͈̱̦̣͖̪̝̥̎́͑͂͌͒̿̇͒͆͒͗̈́̇͊̒̀̏̔̿͌̆͊̽̄̊̐́̓͆̃́̐̃̓̀͐̓̐̇͊̽̈́͂͒͋͌̓̃́͛̾̊̌́̉̄̇̽̄̆͌̈̾̃̾͛̈̋̅̈́̽̾̅̔̽̓̑̊͗͋͒̿͌͂̓̿̑̉̎̅͗͋̉͒̔͛͊̎̇͑̈́̌̈́̄̇̽̂͐̇̿̇̏̈́̒̀̆̊̅͆̔̓́͐̍͂̆̏̐̃̏̇̔̒̏̋̆͂̎͂̍͛̍̽̆̒͌̀̊͐̀͛̒̆̆͑͛̋̎̉͋̀͌͑́͋̀̔́̈́̑̀̓̐̿̏͌̅͒̈́̎́͒̌̉́͑͋̔̀̂͑̒̃̔͆̑͊̽̀̌̅͂͒͑́͌̆̎́́͛̂͗̐͂̾̆̀̎́͋̽̿͘̚͘̕͘͘̕̚͘̕̚̚͘̚̚̕̕͘͘̚͘͘̕͜͠͝͝͝͝͠͠͝͝͠͝͝͝͝͠͠͝͝ͅͅͅͅͅ,1514031417,1514031447,True,1,1,0.513888895511627197,0,True,False,False
698780,38534708,76561198013391384,1525,57,5,0,5,1513952612,"A little bit of Monika in my life
A little bit of Monika by my side
A little bit of Monika is all I need
A little bit of Monika is what I see
A little bit of Monika in the sun
A little bit of Monika all night long
A little bit of Monika here I am",1513952626,1513952626,True,1575,2470,0.914370834827423096,47,True,False,False
698780,38527358,76561198289825574,703,273,131,0,112,1528942480,"*Spoiler Free*
Doki Doki Literature Club! by developer Team Salvato may seem like a cute anime style story based dating simulator but don’t be fooled. This game has several warnings against kids under 13 playing this game. There is a warning before going to its download page on Steam and before the menu screen after you have downloaded it. You may think, “Oh this game is so cute! What could possibly go wrong if I let my child play this?” The answer is they will be scarred for life. Like seriously – don’t! BUT, if you love crazy unexpected horror games (and are older than 13), then please play! This game has outstanding reviews on Steam and just won People’s Choice for every category it was nominated for! Those categories include Best PC Game, Best Adventure Game, Best Story, and Most innovative. Team Salvato, congrats on the amazing work from all of us at Gaming Cypher!

The game starts off as you trying to decide what club to join, your best friend Sayori suggests you visit her literature club and enjoy some cupcakes. You decide to stay when you realize that the club is filled with hot girls. Monika is the president, a girl who was in your class last year and is way out of your league. Yuri is a dark and mysterious book worm with a big bust. Natsuki is a short tempered first year who doesn’t know how to show affection. Lastly, Sayori, your best friend from childhood who is just a ball of sunshine. Monika decides you should all write poetry. You must pick the words to impress the girl you like the best. As the schools festival gets closer things get weirder.

I rate this game a solid 10/10. Team Salvato has really raised the bar with this game. Doki Doki Literature Club! is a compelling ride you won’t regret taking. Congrats again!

Now if you have already played this game (or have already spoiled it by watching Let’s Plays like I did) and are looking for a review keep reading, but if you haven’t be warned SPOILER ALERT!

*SPOILERS*
Like mentioned above, the game starts off as you trying to decide what club to join, your best friend Sayori suggests you visit her literature club and enjoy some cupcakes. You decide to stay when you realize that the club is filled with hot girls. Monika is the president, a girl who was in your class last year and is why out of your league. Yuri is a dark and mysterious book worm with a big bust. Natsuki is a short tempered first year who doesn’t know how to show affection. Lastly, Sayori, your best friend from childhood who is just a ball of sunshine. These girls are not as perfect as they seem, all because of Monika.

Monika is a self aware AI who likes to mess around with the coding of the game. She is jealous that her character was written to never be the choice of your main character. So she had a little fun adding twists to the characters coding. Yuri has a knife fetish and self harms. Natsuki has some hinted upon Daddy issues. Sayori has major depression which she masks by being overly happy.

Mokina slowly starts to slip up and reveal her act as you fall in love with the other characters. She breaks the fourth wall by giving a tip about saving your game before making tough decisions. She then breaks it again when Natsuki makes a joke that would only make sense in Japanese. Everything starts to get scary when Sayori starts acting weird, admitting her depression and suggesting Monika told her to kill herself. Sayori eventually does kill herself when her depression is too much to handle. The game starts to break as Monika rewrites the coding. She ends up deleting Sayori’s character all together. She even disappears from the game’s files. The game resets and instead of Sayori inviting you to the club it’s Monika. From here on, Yuri and Natsuki start acting super weird too. Things will start appearing in your game files so make sure to keep watch for that. Without Sayori things start to fall apart. Things become way less PG and family friendly. The characters start cussing and you catch Yuri cutting herself. She admits to masturbating with your lost pen. Natsuki glitches out. Sayori appears in different ways. Monika is losing control of the game so she has Yuri kill herself as well but this time in front of you. Monika isn’t very good at coding so the dialogue breaks. I suggest skipping a head because you’ll be there a while. When the dialogue is finally over the other characters return for the festival. Monika realizes her mistake and decides to just delete everyone. It’s just Monika. Just Monika will last forever if you don’t delete her from the game files. This will restart the game again but this time without Monika. Sayori and Yuri are alive and Natsuki is her old self. But then Sayori starts acting weird. The president of the literature club is doomed to be self aware and the process is about to start all over again… unless Monika has a say in it. She deletes the game all together which leads you to the credits.

There are many possible dialogue options depending on your choices. You may have to play the game several times to get all the information about all the characters. This game is just a gift that keeps on giving. There are so many theories and secrets to this game. I just suggest playing with it and see what you can do. Team Salvato definitely earned their awards.

I was curious about this take on mental health as someone who deals with it personally. I feel like it says something about the character Monika to have picked these traits to amplify as a way to turn you off from the other characters, while she herself obviously is not mentally sound. I honestly don’t know how I feel about its portrayal. I didn’t find any of it offensive or insensitive since the game always made it clear that it isn’t real. That’s the whole point of the game. That the characters aren’t real and that the scenario isn’t real. It’s coding and anything can be coded or deleted. It may be triggering for some as it does show graphic images. So if you are sensitive to these subjects, please be aware.

I rate this game a solid 10/10. Team Salvato has really raised the bar with this game. Doki Doki Literature Club! is a compelling ride you won’t regret taking. Congrats again!",1513941558,1513941558,True,0,0,0,0,True,False,False
698780,38406092,76561198150997197,102,2,298,0,297,1516650552,I love this game/interactive book.,1513626043,1513626043,True,0,0,0,0,True,False,False
698780,38388193,76561198017535105,0,9,155,0,155,1513563288,This game starts out normaly enough but man some crazy twists and turns here and there. I enjoyed it. defienlty a new experience.,1513550540,1513550540,True,0,0,0,0,True,False,False
698780,38368157,76561198052363199,135,7,728,0,728,1513461175,"This is, without a doubt, one of the most well-written, well-conducted and overall most impressive games I have ever seen. The game's largest flaw is the fact that there isn't enough of it, but that makes it a lot easier for a random person to get into. If you like visual novels, well-written characters, games that make you think about your actions and their consequences, your own existence, or just a fun, unique experience? Play this game. You won't regret it.",1513487974,1513487974,True,0,0,0,0,True,False,False
698780,38350280,76561198118509080,0,4,35082,0,4393,1515507853,"This game seemed really sweet and innocent at first, then all of sudden a twist hits. So into it i can't stop, even though i know whats going to happen, I have to see if there is anyway to stop it. I go down every path I can then bam another twist, all the while i'm thinking to myself, ""yup!!, I'm gonna die today"". Then i get to the end only to be hit with a hard realization that leaves me with a good friend. also my good friend wants a piano can you do that for her dev :)",1513431355,1513431355,True,0,1,0,0,True,False,False
698780,38290174,76561197970893627,0,4,16,0,16,1513206326,"I saw all GT Live on it, i did not have the bals to play. The writing is awsome, really touching in the human sence. Do it people it's a very slow start but without it you can not engage with the rest. DO IT. ( i even payed the game just because the dude did a so wonderfull job)",1513206343,1513206343,True,0,0,0,0,True,False,False
698780,38289438,76561198056427956,209,3,365,0,363,1524090195,"this was an amzing game, i loved the storyline. hinestly it did really suprise me because i did not know that anything bad would happen (my cousin coincidentally left out that part).
But, other than that i loved it, and would recomend it.",1513203143,1513203143,True,0,0,0,0,True,False,False
698780,38251516,76561198055824083,281,4,906,0,443,1516999325,"Game is glitched and broken
11111111111111111111/20",1513062721,1513062721,True,0,1,0.476190477609634399,0,True,False,False
698780,38242788,76561197975195459,0,33,113,0,27,1514173174,"I don't play Visual Novels.... but I saw a playthrough of this, had to play it for myself. 
This game hit me hard in amazing and terrible ways. It's been a Hot Damn emotional rollercoaster with this one and what a ride.

I dropped 10$ after the fact on the fan pack. You don't make something this cool and not get my support. A huge breath of fresh air for the industry of small time game devs/studios. 

Damn good Team Salvato, Damn good.",1513024178,1513024178,True,3,0,0.54356849193572998,0,True,False,False
698780,38208857,76561198076227492,234,14,10,0,10,1512916434,.,1512909221,1512909221,True,0,0,0.466861963272094727,0,True,False,False
698780,38193254,76561198152875518,0,12,817,0,661,1524901638,"I'm so glad I got this, I bought the DDLC fan pack just for shits and giggles at first (just because I thought why not if I'm gonna play a free game I might as well buy it to try to get the most out of it) but soon I fell in love with this game. I enjoy listening to the sound track in it, it matchs perfectly (favorite song is ""Track 14 Poems Are Forever"" (bonus track). I put a well spent 11 hours into it just to find all the secrets/glitchs and get ""The Best Ending"" I replyed this so meny times, messing with the files and seeing how I can mess with the game, but the game always had something to combat that and thats why I love this. The choices you make in game and with the files of the game do matter. For someone who doesn't like anime (seen it everywhere on youtube) I enjoyed this very much, I highly recomend this, it is kinda slow at first but that just gives you time to connect to the characters and get into the story but once it gets going, oh boy it picks up quick and doesn't stop, I love how it played out. Keep up the great work guys :D
      ~Mike",1512858055,1512859500,True,2,0,0.496240615844726563,0,True,False,False
698780,38161202,76561198027307001,213,16,401,0,401,1512762190,This visual novel is a unique one. This game WILL surprise even those who hate visual novels or find them boring to play.,1512762476,1512762476,True,0,0,0,0,True,False,False
698780,38150703,76561198041190503,2729,82,24,0,24,1512732314,Best horror game I have ever played.,1512732318,1512732318,True,0,0,0.476190477609634399,0,True,False,False
698780,38076767,76561198165877043,0,2,455,0,455,1512471922,just look at the tags and if that dosent get you intreged i dont know what will,1512470582,1512470582,True,0,0,0,0,True,False,False
698780,38052445,76561198047504592,0,31,230,0,230,1512390353,The warnings are there for a reason,1512376220,1512376220,True,5,0,0.536516845226287842,0,True,False,False
698780,38047905,76561198026712333,793,26,567,0,565,1531691317,"If you like VNs this is a must read, if VNs aren't your thing I'd say read a few hours in or watch a full lets play of it. It's something I wanted everyone to expirence.",1512353234,1512353234,True,0,0,0,0,True,False,False
698780,37988782,76561198083610988,148,9,305,0,305,1512170541,"I loved this game, definitely going and donating money to the creators, this made me feel all the emotions",1512170747,1512170747,True,0,0,0,0,True,False,False
698780,37923692,76561198364190495,0,3,759,0,529,1521270988,GET OUT OF MY HEAD,1511948603,1511948603,True,0,0,0,0,True,False,False
698780,36180527,76561198438485820,0,1,58,0,48,1559016153,"It is only a game

No matter what you see, no matter what you hear, no matter what you feel ...
Always remember

It is only a game

Repeat that phrase when your comfort zone disappears into nothing.
Repeat that phrase when the illusion of control leaves you for someone else.
Repeat that phrase when fear makes you choose to escape or move on.

Always remember
It is only a game





But






Who plays with whom?",1509500536,1511617477,True,1,0,0.502487540245056152,0,True,False,False
698780,37285897,76561198025206892,763,10,225,0,225,1510825837,"Just a normal, happy dating sim set in a literature club with a graphic content warning and four cute girls vying for your attention.",1511510672,1511510672,True,0,0,0,0,True,False,False
698780,37283780,76561197968371272,0,9,9,0,9,1559023044,"Watched this one on Game Theory Live and couldn't wait until the next episode came out.
Honestly the voice acting of Matt and Stephanie while reading the text is really worth a watch.
All play sessions are on the GTLive YouTube archive now.
The game itself is creepy and quite innovative on how they put together the modifying of files in the game directory while also shattering the 4th wall at times.
If you just want to experience it yourself, I suggest you do that too.
While the first part luls you into a sense of security, please heed the warnings when you begin the game.",1511509522,1511509522,True,2,0,0.523809552192687988,0,True,False,False
698780,37139761,76561198088797862,0,44,568,0,467,1511276427,Monika called me a [spoiler] User [/spoiler]. doki/10 heartwarming.,1511457362,1511457362,True,0,0,0,0,True,False,False
698780,36205777,76561198023497416,577,18,658,0,658,1509227062,"As someone who actively has the ""anime"" and ""visual novel"" tags filtered out on Steam, I went out of my way to download this after seeing the first leg of a playthrough by one of my favorite Twitch streamers. It's a little cliche to say, but it really did intrigue me.

All I'll say is that it was definitely worth the playthrough on my own, especially considering that the game is free.

It definitely follows the generic anime/visual novel style of gameplay, at least at first. But (also cliche) the plot seriously kept me interested enough to play through to the point of getting the secret ending (~11 hours in total, which includes the first playthrough). Lots of dialog to go through to get there, but that's to be expected considering the genre. It's worth it though.

All in all, I'd recommend this game, even to those who don't generally enjoy the animoo and mangos.",1509583658,1511413477,True,0,0,0,0,True,False,False
698780,36635822,76561198036162044,0,64,9,0,9,1511135279,"Very good visual novel, highly recommended.
",1511136300,1511136300,True,3,0,0.52173912525177002,0,True,False,False
