698780,158685733,76561198440426881,189,9,514,0,514,1527282342,shoutout to that one time i left this playing in the background for 2 days and had ppl asking if i was okay in my discord dms,1708309841,1708309887,True,4,2,0.569228112697601318,0,True,False,False
698780,121278673,76561198397621283,0,20,1383,0,1383,1702931995,perfect,1661537225,1707861661,True,0,0,0,0,True,False,False
698780,157080969,76561199555680625,0,3,608,0,456,1706654265,This Game Is Amazing,1706482903,1706482903,True,0,0,0,0,True,False,False
698780,155033685,76561199203693856,0,1,430,0,430,1704170879,I've never played a game like it! It was great and terrifying at the same time. Well done.,1704170539,1704170539,True,0,0,0,0,True,False,False
698780,154703435,76561199153369361,0,2,305,0,277,1707222474,"Great game, a bit scary though.",1703846934,1703846934,True,0,0,0,0,True,False,False
698780,152921611,76561198856531400,0,5,746,0,746,1701441705,very cute,1701779033,1701779033,True,0,0,0,0,True,False,False
698780,37711872,76561197995717167,459,24,272,0,272,1511657177,If you have depression this game might stick with you for a while,1511725713,1699368533,True,8,2,0.560688138008117676,0,True,True,False
698780,64442407,76561199013350764,0,15,8054,0,8054,1676082623,HELP,1583219877,1690176301,True,0,0,0,0,True,False,False
698780,141012854,76561198164179324,114,25,475,0,303,1689135823,muy bueno,1688172444,1688172444,True,0,0,0,0,True,False,False
698780,140916116,76561199065994043,27,2,7211,0,61,1689350126,its okay i guess the fan pack is not worth it though (i bought it),1688059538,1688059538,True,0,0,0,1,True,False,False
698780,140744290,76561199054876255,126,14,95,0,95,1679098344,Monika. Just Monika.,1687800266,1687800266,True,0,1,0,0,True,False,False
698780,133398299,76561199336667570,0,1,571,0,570,1677131084,crazy game and 4 wall breaking,1677128833,1677128833,True,0,0,0,0,True,True,False
698780,37883196,76561198129368144,350,87,363,0,363,1512167439,among us!,1511877702,1674168117,True,0,0,0.523809552192687988,0,True,False,False
698780,121355324,76561198022036768,74,3,3874,0,3463,1702441413,"Without getting into any spoilers, DDLC is an amazing story that will stay on your mind well after you finish it. The modding community is fantastic, still active and presented through the game with their own take on the story for hours of additional gameplay value.

I used to think ""waifus"" were a joke, but then Monika stole my heart! <3",1661665310,1661665310,True,3,0,0.541984736919403076,0,True,False,False
698780,120685452,76561199382888061,0,1,465,0,465,1660076543,"The best game i had ever played, a true masterpiece.",1660585799,1660585799,True,0,0,0,0,True,False,False
698780,119445607,76561198865344583,0,1,863,0,651,1658787128,very interactive!!!,1658760227,1658760227,True,0,0,0,0,True,True,False
698780,38065993,76561198090123125,0,2,640,0,640,1512352550,I have one thing to say about this game. Amazing. I absolutely have to say that Sayori was easily my favorite character in the whole thing. It was really surprising how much I really liked this game. It is definitely worth playing more than once.,1512424065,1658274113,True,3,0,0.542483627796173096,0,True,False,False
698780,117877832,76561198339404844,0,1,666,0,665,1699676748,"This does have traumatic events happen, but if you can pull through till the end I promise it an amazing Game!",1656528432,1656528432,True,0,0,0,0,True,False,False
698780,41510923,76561198250357154,155,16,66127,0,55262,1538086710,"Lemme just say: I don't want to leave this room,  leave me be, I can die here happy. One part of my brain says that it's just a game. Another part of my brain (about 95% of it) is happy and complete with this. So let me just die happy

EDIT: I left the room a little over 2 years ago. Still a great experience, and I recommend it. Just thought i'd let everyone know I'm alive, well, and no longer in the room.",1523823680,1650556622,True,0,0,0,0,True,False,False
698780,113744187,76561198072233882,0,2,454,0,262,1677195294,"I have emotional damage, good game though",1649776438,1649776438,True,0,0,0,0,True,False,False
698780,113117020,76561198983979703,0,6,230,0,226,1649777399,Doki Doki Literature Clube is scary  &  it has poems  + anime 4 highscool girls : ),1648734840,1648734840,True,0,0,0,0,True,False,False
698780,111781476,76561199228153952,0,1,671,0,299,1646868967,best game iv ever played brought tears to a grown man,1646709511,1646709511,True,0,0,0,0,True,False,False
698780,106591308,76561199026477919,0,8,4480,0,493,1661288524,holy shit,1640539516,1640539516,True,0,0,0,0,True,False,False
698780,104634565,76561199161250335,0,1,369,0,368,1701226950,"The art style is amazing, it has likable characters, the game is made very well, and its just overall enjoyable.",1638146551,1638146551,True,0,0,0,0,True,False,False
698780,101517531,76561198999054380,0,8,3171,0,1339,1640711220,fun entertaining spooky for haloween,1635024263,1635024263,True,0,0,0.495449930429458618,0,True,False,False
698780,99023947,76561199151752860,0,1,456,0,368,1636939608,just monika.,1631144493,1631144493,True,1,0,0,0,True,False,False
698780,98055752,76561199173987635,0,2,916,0,579,1648333261,swaggg,1629662548,1629662548,True,0,0,0,0,True,False,False
698780,96300923,76561198059494424,467,28,553,0,353,1647643460,What a cute game.,1627144063,1627144063,True,0,2,0,0,True,False,False
698780,95810886,76561198799397802,85,12,8864,0,8751,1626397711,"good game. did not give me 2 years of attachment issues, convert me to atheism, and a deep hatred of all organisms.",1626391247,1626391247,True,0,0,0,0,True,False,False
698780,95574683,76561198073928758,0,5,406,0,336,1626140523,Yes,1626055918,1626055918,True,1,0,0.523809552192687988,0,True,False,False
698780,95224065,76561199152510305,0,1,404,0,401,1625627318,i.. il ove this,1625626840,1625626840,True,0,0,0,0,True,False,False
698780,79708075,76561199040000437,17,3,52326,0,6380,1625244201,"meh, playable",1606138031,1625243992,True,0,1,0,0,True,False,False
698780,94792480,76561199020224617,0,39,154,0,23,1655080200,boring piece of shit game for beta males who are too scared to talk to 3d women.,1625126528,1625126528,False,1,3,0.34518665075302124,0,True,True,False
698780,94763442,76561198096045422,0,1,2648,0,2435,1625812811,"I literally obsessed over this game for a full year straight when it first came out. Everytime I meet someone new I ask if they've heard of it. if they have, immediate friends and we swap doki fan art. If not, I force them to play it at least thru the first two acts. It is a true test of the type of person they are and if they are able to with stand my friendship.",1625087660,1625087660,True,0,0,0,0,True,True,False
698780,94538313,76561198311799533,0,3,492,0,492,1618857864,my favorite psychological horror of all time i love the atmosphere and the characters this game is very good i think yes yes,1624832040,1624832040,True,0,0,0,0,True,False,False
698780,93784478,76561198314967200,0,4,435,0,435,1623732484,good game,1623732687,1623732687,True,0,0,0,0,True,False,False
698780,92620029,76561199097054706,0,2,2606,0,429,1657016312,its fun lol,1622031169,1622031169,True,0,0,0,0,True,False,False
698780,92547505,76561198358938969,47,11,426,0,161,1623924121,Play it without researching it at all,1621902392,1621902392,True,0,0,0,0,True,False,False
698780,92277332,76561199165645353,0,4,240,0,234,1660224094,a beautifully designed game that takes you on a trip you wont forget! definitely heed the warning at start up because this game can come at you hard so play when you're ready and support the devs <3,1621461183,1621461183,True,0,0,0,0,True,False,False
698780,91143220,76561199158090244,0,2,659,0,364,1624724086,aaaaaaaaaaaaaaaaaaaaaaaa so guuuuuuuuuuud,1619742529,1619742529,True,0,0,0,0,True,True,False
698780,90633709,76561199148848382,0,9,863,0,488,1707331772,"its so good , gotta give it a big thumbs up!",1618932000,1618932000,True,0,0,0,0,True,False,False
698780,89677948,76561199106106038,0,10,263,0,263,1627076451,i want monika to step on my throat and degrade me. good game fat honkers,1617508205,1617508205,True,1,1,0.497088611125946045,0,True,False,False
698780,89474850,76561198422300510,0,6,269,0,269,1587627352,Well this game was definitely a departure from the typical anime style game,1617248993,1617248993,True,0,0,0,0,True,False,False
698780,89389472,76561198103219170,0,5,349,0,349,1605579451,Monika was reasonable I give her a 10/10 and will be seeing her in purgatory again.,1617132413,1617132413,True,0,0,0,0,True,False,False
698780,89278041,76561198355255876,127,15,554,0,452,1654660053,Anime Waifu Go BRRRRRRRRRRRRRR,1616967054,1616967054,True,0,0,0,0,True,False,False
698780,84982264,76561198141479670,29,4,975,0,231,1611145172,"as someone who suffers from depression and anxiety to be abandoned, yet wanting to be alone, i can only recommend the game.

i had no clue about the game, i only heard you shouldnt be trusting....
and the first time i saw a specific person i, AND i'M NOT JOKING, suddenly felt uneasy, no, more like scared.
i know it may sound weird, but i knew it the first second i saw her... 

i have, in my 28 years, never felt that scared about a girl like this...

i hate myself... i hate the world... i hate you... i hate the tears... i hate the smiles... i hate the sadness... i hate the happiness...
i hate nothing and all.",1611070837,1611070837,True,0,0,0,0,True,False,False
698780,83971394,76561199122400391,0,4,706,0,522,1678425516,good,1609747677,1609747677,True,1,0,0.523809552192687988,0,True,False,False
698780,83406458,76561198078541715,0,9,2625,0,1205,1609683394,Absolutely amazing game! The replayability is astounding.,1609177187,1609177187,True,0,0,0,0,True,False,False
698780,83088016,76561198397549305,0,1,536,0,507,1608882852,Amazing game!! It's so cool!!,1608871436,1608871436,True,0,0,0,0,True,False,False
698780,82684134,76561198164985702,0,1,699,0,699,1608378606,Do I recommend this game? NO but Yes.,1608378676,1608378676,True,1,0,0,0,True,False,False
698780,82598048,76561198972576794,158,12,1922,0,1901,1694538754,By far one of my favorite games. Mods keep it fresh as well.,1608259566,1608259566,True,0,0,0,0,True,False,False
698780,75307641,76561198799733922,132,32,2862,0,659,1662598928,"ha ha so much fun, I love my sanity
",1599018392,1607110892,True,2,1,0.523809552192687988,0,True,False,False
698780,79596392,76561198984002831,0,6,138,0,138,1605950395,"I loved this, and I never liked visual novel-type stuff. There's such an attention to detail that you really can't get the full experience with only one playthrough. No matter how many times I see it, I always jump during the scene where Sayori - - - anyways, this is a very good game and it's at the very least worth checking out. Do be warned, it takes a solid hour to get to the fun parts if you're not a visual novel guy",1605951581,1605951581,True,0,0,0,0,True,False,False
698780,78787427,76561198025290409,0,7,331,0,214,1605312247,Beautiful unique experience that is not regretted. I loved this journey!,1604611557,1604611557,True,0,0,0,0,True,False,False
698780,78414093,76561198270937532,0,2,94531,0,89283,1614538399,"Great game that really grips you and makes you care about the girls as well as think about the state of your own life and reality. I also just really love Monika. Make an update or something where she's a romance option, damnit!",1604084267,1604084267,True,1,0,0.501335680484771729,0,True,False,False
698780,76943710,76561198131966505,0,61,226,0,142,1601696379,"Huh, I finally did it. I found the game that broke me.",1601691887,1601691887,True,0,0,0,0,True,False,False
698780,76696035,76561198201872485,0,5,603,0,282,1604101304,I'll just say this is a great game with great programming.,1601270305,1601270305,True,1,0,0,0,True,False,False
698780,76241997,76561199034695819,0,1,333,0,184,1664548677,good game.,1600545385,1600545385,True,0,0,0,0,True,True,False
698780,75365420,76561198834245582,5,2,600,0,78,1599367312,"Well, you know what they say, "" The ink flows into dark big puddle, so why won't you write your way into their hearts?"" Try out this, it's *fun*",1599123800,1599123800,True,0,0,0,0,True,False,False
698780,73938629,76561198868807768,0,23,4557,0,247,1697229292,n i c e,1596836117,1596836117,True,2,0,0,0,True,False,False
698780,73191357,76561198338190643,0,11,770,0,765,1595562585,AMAZINGGGGGGGGGGGGGGG UWU,1595562297,1595562297,True,0,0,0,0,True,False,False
698780,72799429,76561198150744188,0,67,208,0,208,1594922674,WTF/10,1594922843,1594922843,True,0,0,0.476190477609634399,0,True,False,False
698780,69914453,76561198025625270,0,141,291,0,291,1538846137,The only thing I can say is that the game is not about what it seems to be about.,1590622252,1590622252,True,0,0,0,0,True,False,False
698780,69498252,76561198068199439,0,2,806,0,806,1532462229,"Gives your sadness depression. 10/10

WHY THE FUCK HAS DAN NOT MADE ANOTHER GAME FFS. 

AIDS

But good game play it. Its free so why not fam.",1590011711,1590011711,True,0,0,0.440705150365829468,0,True,False,False
698780,66804732,76561198131377136,181,13,284,0,284,1586321388,yes it make me cry but play is good,1586245549,1586245549,True,1,0,0.523809552192687988,0,True,False,False
698780,66592820,76561198095454333,0,1,337,0,337,1531320376,Worth every second,1586009417,1586009417,True,0,0,0,0,True,False,False
698780,66475165,76561198302863451,0,3,267,0,196,1585979457,"I recommend focusing your attention on either Yuri or Natsuki, I'm getting cut scenes and jump scares I didn't see in the play throughs I watched as our gamers on YouTube generally don't have time to delve into all the fun lore bits. But yeah, definitely in the realm of psychological horror.",1585891532,1585891532,True,0,0,0,0,True,True,False
698780,65906767,76561198068178209,0,2,522,0,313,1585331188,I love this game.,1585283395,1585283395,True,3,0,0.548387110233306885,0,True,False,False
698780,65368203,76561198093496800,688,4,925,0,925,1531440905,Play this game,1584672411,1584672411,True,0,0,0,0,True,False,False
698780,64936372,76561198105067404,0,1,4502,0,4466,1701572640,"Yeah, fine, sure... It DOES start off as a visual novel and if you are not really big on Anime, that will deter you. But PLEASE hear me out... It is without a doubt a horror game and it will feel like it about a good 2 hours into the game. Give it time and trust me, you will be excited for what comes next!

IF it comes...",1584058193,1584058193,True,0,0,0,0,True,False,False
698780,64688124,76561198102741123,0,7,639,0,639,1583643432,"JUST 10/10

Ps.[spoiler]Monika, you're my best girl..

Always.[/spoiler]",1583644494,1583644591,True,1,0,0.508599519729614258,0,True,False,False
698780,64620923,76561198412883929,0,1,1099,0,737,1618775341,Super cute yet can be very creepy if you play to much or get to attached to characters....,1583541209,1583541209,True,0,1,0,0,True,False,False
698780,63525796,76561198920646682,0,2,524,0,521,1597859036,is nice,1581745411,1581745411,True,0,0,0,0,True,False,False
698780,63382179,76561198841093031,0,6,15,0,15,1533991084,Ah yes depression is fun,1581505728,1581505728,True,0,0,0,0,True,False,False
698780,63322649,76561198033889287,0,4,10427,0,1547,1592679719,"this was a AMAZING game I loved it the music, scares, and how some are unknown we can get other scares other people don't get I recommend this 100%",1581398310,1581398310,True,0,0,0,0,True,False,False
698780,62307520,76561198417371474,0,4,2246,1,244,1707937424,ITS AMAZING PLEASE PLAY sure it has some over age stuff but WHATEVER ITS SOO GOOD EVEN FOR A 9 YEAR OLD LIKE ME,1579839881,1579839881,True,0,1,0,0,True,False,False
698780,62251040,76561198944959912,0,5,2054,0,373,1680311643,amazing game,1579733734,1579733734,True,0,0,0,0,True,True,False
698780,61916995,76561198166255281,0,11,184,0,184,1578616873,"Doki Doki is one of those pinnacle games that is so in tune with it's medium there is no other way it could be realized.  I didn't go for visual novel games before, but the style is lax enough to play in any setting and the story reels you in like a dang old catfish.  10/10, wouldaadaaaaaaaaaaaaaaaaaaaaaaaaaaaa-aaaaaa-aaa",1579149270,1579149270,True,0,0,0,0,True,False,False
698780,61449681,76561198279027597,144,2,2468,0,2258,1596161384,scarry,1578363315,1578363315,True,0,0,0,0,True,False,False
698780,61165381,76561198854553236,0,5,588,0,104,1626078142,ima try reinstalling the game to see what happens,1577996849,1577996849,True,0,0,0,0,True,False,False
698780,60979971,76561198066795404,0,2,873,0,667,1577828699,Highly recommend!,1577789246,1577789246,True,0,0,0.479797959327697754,0,True,False,False
698780,44327416,76561198076813554,0,10,5096,0,1166,1620873669,The girl I likeę̵̡̧̗̲̮̥̗̹͓͎̝̰̹̫̏̚e̸͖̊ the most? S̷̢̛͚̥͓̻͗́̎̀̔͗̎͒͗̋̅̉͌ͅȃ̷̡̻̫̟̩͕̅̓̑̊̿̈́̀͛̈́̚͝y̸͔͔̹̯̩͒̒͐̾͘o̸͉͚͓̊̅̆̈́̈́̂r̷̞̟͍͕̩̔̋͝ͅi̷̡̧̗̘̙̖͗̀̅́̄́͗̅Ỳ̶̨͓̲̟́̽̎͆̀̀̓̕͜͝͠͠͝͝u̷̮͈̭̝̫̹͍̩̠̺̖͓̓̍̕̕͝ͅř̸̠͚̘̩̼͓̳̝̞͐̉̐̾͗̍̾̄̑̾́̉͘̕͜i̷̘̮̳̒̐̈̇̍͂̔͆̓N̴̗͇̙̩͎͚̼͈͕̐́ȃ̴̛͉̠̹̝̖̼̺͉̦͊͆̓̾́͆̎̕̚͜t̸̳͋͂̈́̽̈́́̔̿̍̓s̴̨̨̜͇͓̫͖̍͐̌͆͗͝ͅǔ̷͇̬̙̄͘͝k̴̜͉̅́͌͐͐̈́̆̔͊̆͛̊̚̚i̵̡̡̳̬̱͇͔̳̩͎̐͂͐͛͝ Monika of course!,1535013893,1574922680,True,1,1,0.523809552192687988,1,True,False,False
698780,57686591,76561198840291012,0,2,521,0,130,1633487991,"I freaking love it!Good graphics, awesome multiple endings. Definitely recommending this to my friends",1574501498,1574501498,True,0,0,0,0,True,False,False
698780,56745034,76561198977632165,0,4,4011,0,1343,1635745440,10/10 great game should play,1573202162,1573202162,True,0,0,0,0,True,False,False
698780,56241876,76561198187425627,0,35,408,0,393,1572678759,It's like Kojima made a VN,1572677230,1572677230,True,0,0,0,0,True,False,False
698780,55025225,76561198040980239,0,69,35,0,35,1567977745,"A surprise to be sure, but a welcome one!

Please support the team and purchase the Fan Pack- it was amazing work!",1567978468,1567978468,True,0,0,0,0,True,False,False
698780,39296731,76561198129112181,287,10,328,0,324,1531015114,good memes,1515810441,1565557336,True,0,0,0,0,True,False,False
698780,52460996,76561198393970191,0,164,392,0,341,1561910633,"It's a truly unique VN. I love the fact that Monika can scare you when when you're only in the game, because it proves you that she know your real name if you use a fake name in the game.",1561907487,1561907487,True,2,1,0.543859660625457764,0,True,False,False
698780,51266893,76561198412667591,0,2,204,0,180,1574789636,this game was an emotional rollercoaster. I absolutely loved this game and hope we get to see more from Team Salvato!! 8 stars!!!,1560738406,1560738406,True,0,0,0,0,True,False,False
698780,49219834,76561198067928871,0,3,134,0,134,1516585971,Would I replay this game? Likely not. Would I play a slice of life version with these characters and have warm moments that fill the void in my miserable life? Yes.,1551045632,1551045632,True,1,0,0.520547926425933838,0,True,False,False
698780,45732997,76561198795933235,475,140,564,0,564,1531459290,Just Monika.,1541821931,1547621508,True,0,1,0,0,True,False,False
698780,45068953,76561198036385268,0,33,535,0,535,1538546637,"You kind of left her hanging this morning, you know?",1538548590,1538548590,True,1,2,0.523809552192687988,0,True,False,False
698780,45066386,76561198118704767,0,18,273,0,273,1537472797,"This game is worth the download! You can knock out a full play through in about 4 to 5 hours and that time really goes by fast.
Love the characters and music too so I’ve downloaded the DLC for this game as well. Worth it!!",1538533478,1538533478,True,1,0,0.506172835826873779,0,True,False,False
698780,44521976,76561198122752684,0,8,950,0,275,1592282433,"I know it starts slow, but it's free and actually fantastic... 10/10 (particularly given the price).",1535860917,1535860917,True,1,0,0.507773518562316895,0,True,False,False
698780,44358286,76561198041996979,522,17,240052,0,169140,1619780319,I don't know how I feel about this game yet. I need to play some more to find out...,1535148235,1535148235,True,7,16,0.619421064853668213,0,True,False,False
698780,43973986,76561198400062440,0,5,135,0,135,1533600573,My brain got pulled through my kneecaps and I will have nightmares.,1533600698,1533600698,True,0,2,0,0,True,False,False
698780,43821906,76561197968978091,0,4,294,0,256,1533478725,"I'll keep it short - I loved this.

Have only played a handful of visual novel games before, but nothing like this. And despite the number of disclaimers regarding how disturbing the game is - it still got under my skin. Addictive, distubing, clever, original and entertaining. 

Again, loved it!!",1532893833,1532893833,True,1,0,0,0,True,False,False
698780,43690064,76561198079470968,0,54,133,0,132,1570738059,I liked it,1532306609,1532306609,True,0,0,0,0,True,False,False
698780,43566690,76561198066235624,0,1,109,0,109,1531541250,Why wouldn't anyone play this?,1531753424,1531753424,True,1,0,0.497925341129302979,0,True,False,False
698780,43301281,76561198344415636,0,5,166,0,166,1530718773,"My first experience with a visual novel game, and it hasn't been topped since. If it is at all possible to play now spoiler free then I can't recommend it enough. It won't take too much of your time but boy what a ride.",1530722020,1530722020,True,0,0,0,0,True,False,False
698780,42153582,76561198226719200,0,17,2294,0,1482,1529710674,"This one is going down as one of my favorite videogames that I have ever played, steam or otherwise. I'm still blown away that the developed made this a free game and strongly encourage you to purchase the fan DLC. 

Complex, original, and well written from start to finish. Probably the most replayable game I've ever played.

Play this game and fall in love in more ways than one.",1526875927,1526875927,True,0,0,0,0,True,False,False
698780,42001524,76561198213359933,0,80,1688,0,270,1613741873,It's revolutionary and certainly wortwhile playing. Not all appears as it seems ...,1526144554,1526144554,True,2,1,0.509900987148284912,0,True,False,False
698780,41975169,76561198013931409,0,5,50609,0,,1579607776,"I bought this game, Beacuse of Monika!!! :)",1526026357,1526026357,True,0,0,0,0,True,False,False
