698780,41810731,76561198139328230,2324,260,418,0,388,1525217517,"[b]""A hole of infinite choices. 
I realize now, that I wasn't looking in. 
I was looking out. 
And he, on the other side, was looking in."" - from Monika's [i]Hole in Wall[/i][/b]

[h1]DISCLAIMER! THIS REVIEW CONTAINS SPOILERS, EVEN THOUGH I TRIED MY VERY BEST TO BE VAGUE ABOUT THEM![/h1]

If you are even remotely interested in the visual novel genre, I know you have heard of this game at least once. So, what is so special, or interesting about it? Before telling anything about it, I must warn that this review will contain spoilers. So, if you haven't played the game, go ahead and do so. It is completely free and will take 3-4 hours out of your life to complete it blind. Oh, and be warned: even though, it seems cheerful and innocent, the game bears meta-horror elements. Played it at least once? Please keep on reading, so we can talk about the depth of a spectacularly eerie work.

[i]Doki Doki Literature Club![/i] is Dan Salvato's only game so far, and it is one of those games that you can benefit from most if you play without knowing anything about it. As you give it a start, it seems like an ordinary dating game: we have four girls, a high school setting, a reason that brings people together... and romance emerges, right? Well... you are both right, and completely wrong. You sure take on the role of a teenager male student, who's been attending a high school with four girls: Sayori is your cheerful childhood friend, Natsuki is a classic tsundere, Yuri is the sophisticated literature nerd, and Monika is the level-headed, patient and knowledgeable president of the Literature Club. As Sayori drags you to the meeting of the club, you meet all the rest; and after a heartfelt pity-pitch, you join the club. From there on, you will attend meetings and write poems to the girl that you are interested in to win her heart. Depending on the girl you wish to romance, you have to pick words befitting her character to use in your poem. If you have done it right, you'll be rewarded with a new experience with the girl you like. This is practically it.

[spoiler]Nope, it isn't. It all goes generic, and even boringly peaceful until the Club Festival event. As the event approaches, things start to change for the darker and eerier. People fight more, and a certain someone gets depressed out of nowhere. At the end of the said event - no, even though I'm writing this as a spoiler, I won't spoil everything: you gotta play this on your own! - there comes a point of no return; and after that... that's when everything you have previously experienced as a cute little slice of life, becomes psychotically dark, uncanny and disturbing. As you keep playing, narrative, characters, environment, timeline... they all begin to get corrupted in one way or the other. If you persist in playing, you will soon discover that this game has a villain. A villain you have to deal with if you wish the save others.[/spoiler] Oh, and as Monika recommends: save frequently!

No, I won’t speak of jump scares, easter eggs and fan theories. What I would particularly like to draw attention to in this game is: [spoiler]a)the quality and content of the poetry written by girls; and b)the kind of skill that was put into portray an AI which is aware of and responding to the player beyond the avatar. It is all fascinatingly creepy. Poems coming from our girls during the first chapter bear deeper meanings and even foreshadowing for the remainder of the game. Especially Monika and Yuri's poems are spectacular readings for that. When you eventually reach the end of chapter 2, and get stuck with Monika, the amount of monologue she may share with you, and the depth of various topics that she chooses are downright spooky. Also, you'll need to tamper with the game files if you wish to continue properly, as someone has been doing so far. [/spoiler] As you can see, this is not a common visual novel. It is an interactive horror game that questions the content and nature of sentience.

Well, there is no need to speak about it more, since I cannot keep writing about it without giving direct spoilers - as if I haven't been doing so far! Please stop reading and go ahead for your first run. If you can bear the first 2 hours or so - which is kind of boring - you'll be pleasantly and creepily surprised.

Please also check out Lady Storyteller's Curator page [url=http://store.steampowered.com/curator/11672469/]here[/url] - follow for regular updates on reviews for other games!",1525261737,1525340865,True,188,9,0.914829134941101074,9,True,False,False
698780,41794044,76561198164920974,13,1,973,0,869,1525591891,Good game! got me good im able to relate to the characters until i got in the story.,1525178831,1525178831,True,1,0,0.523809552192687988,0,True,False,False
698780,41589307,76561198355286630,0,2,1023,0,379,1624731496,when i thought i was getting a natural rpg turned out to be like the wonderful everyday  down the rabit whole,1524240202,1524240202,True,0,0,0,0,True,False,False
698780,41471140,76561198163089045,0,4,997,0,271,1679443357,"Doki Doki Literature Club - 

Umm...play this for your self,this game is just..so well made and it really got me going, I watched some people play it ( Markiplier and Nathan Sharp ) And I was blown away, I loved this game and I loved the thrills and everything about it, trying not to spoil it!",1523665865,1523665865,True,0,0,0,2,True,False,False
698780,41391695,76561198006407653,0,1,559,0,559,1523274585,"The best story I've ever had the misfortune of experiencing. 
10/10. If I could pay for this game, I would.
Bought the Fan pack instead.",1523332333,1523332333,True,0,0,0,0,True,False,False
698780,41321162,76561198411517436,0,9,328,0,328,1523112315,"Well, that was brilliant. One of the best games I've ever played.",1523029735,1523029735,True,0,0,0,0,True,False,False
698780,41260381,76561198162956266,0,3,469,0,468,1525724480,"I don't really know what I can say about it. I love it. I hate it. I wish it didn't exist yet at the same time, I'm glad it exists. It's brilliantly horrific and amazingly detailed to the point where every line of dialogue, every poem, every little thing feels so important in the grand scheme of the game. I have a hard time recommending this or even bringing it up in conversation. But if you have played it, and want to talk about it... then let's
There is a scene in this game that is pretty heart wrenching especially if you had a friend that has gone through the same thing so please PLEASE thake the warnings seriously. This game will screw with you.",1522805312,1522805312,True,0,0,0,0,True,False,False
698780,41250292,76561198374338169,0,34,207,0,194,1528968818,I Forgot To Write A Review FFS... Ahh Good Game 10/10 Recommend Unless You're Actually 10,1522765576,1522765576,True,0,0,0.478723406791687012,2,True,False,False
698780,41090276,76561198215112549,0,22,104,0,80,1523300358,"I was very upset at first cuz there is never an option to be with Monika
Then I found the after story mod 
My life is whole now

Thank you dark sauls",1522172512,1522172512,True,1,0,0.522900760173797607,0,True,False,False
698780,40742261,76561198219452693,0,18,67,0,67,1521123241,"Other petty visual novels:

You pick from a number of waifus


DDLC:

You BECOME the waifu",1520777802,1520777802,True,0,0,0,0,True,False,False
698780,40483285,76561198057525257,0,20,2303,0,1052,1544690678,"play this. just do it. then go play the mods. 
right now im playing DDLC mods. holy fuck. its like 100000% more content then i was expecting and all the feels :tsundere: :feeling: :gem~1: the current one im playing is basicily a talltale game as it has like 30 hours of content with severe branching paths. very much a "" x will remeber that "" situation and you will deal with that bad decision you made later(edited)
https://www.reddit.com/r/DDLCMods/comments/7pfeye/demo_monika_route_mod/",1519899895,1519899895,True,2,0,0.545454561710357666,0,True,False,False
698780,40450615,76561198116961493,58,6,1104,0,429,1707097562,"I really ENJOYED playing this very encryptic and logical game. while I was growing with the game the game was growing with me.
Even brought back some childhood experiances some good some very very bad...",1519781257,1519781257,True,0,0,0,0,True,False,False
698780,40415464,76561198144287318,0,5,14,0,14,1519653822,"I buy DLC just beg you do not abuse these cute girl and add new story to give this game a happy end.
I don't want Natsuki be starved any more!
I don't want Yuri self-harm any more!
I don't want Sayori depress any more!
I don’t want monika be alone!
I will buy the new DLC, new game  or something else , if i know these cute girls have a happy life.
求求你们别虐妹了，我买，我买还不行吗",1519653915,1519653915,True,0,0,0,0,True,False,False
698780,40377648,76561198045821980,0,74,6,0,5,1559050418,"First of all... [b]!!!AVOID ANY SPOILERS BEFORE YOU PLAYED DOKI DOKI LITERATURE CLUB EVEN YOU HAVE NO PLANS TO PLAY THIS GAME!!![/b]

Visual novels... Worthless and absolutely nonsense genre... How tiny player's brain must be to play THESE subgames! That was my opinion before i played Doki Doki Literature Club. This is more that just a visual novel. This is truly immersive game made with attention to smaller details. But how visual novel can be immersive? An exciting story? Awesome in-game environment? Live characters? No. Its not enough for visual novel. Team Salvato made much more. [spoiler]Doki Doki Literature Club don't immerse player into the game - this game immerse itself into player's reality bringing philosophical questions.[/spoiler]

Community gathered around Doki Doki Literature Club is also interesting. The most important part of community are not dumb weeaboos. Instead of fapping on characters community made a number of different mods (mods for ""another visual novel"" - i am serious): from useless to very funny and unusual. For example, in one of mods i've found a reference to Planescape: Torment.

In total: one of the best games ever. The unique and best game in own genre and style. 10/10

P.S.
I've changed my opinion on visual novel genre but i am still sure most of visual novels still worthless and nonsense. And i still don't understand those who play (or read?) these visual novels. I hope Team Salvato will make something good in this genre. I dont care if the next game will not utilize all potential unleashed by Doki Doki Literature Club. I'l be glad to see just a good game.",1519535491,1519535636,True,2,0,0.509054303169250488,1,True,False,False
698780,40293203,76561198115872149,0,140,213,0,213,1559004235,"Downloaded this game not knowing what it was about or what the stroy was about, but let me tell you finished it and am not disapointed very good game.",1519280828,1519280828,True,3,0,0.563492059707641602,0,True,False,False
698780,40250875,76561198114687137,0,2,13,0,13,1519133231,"I'm frugal as F***, but $10 just to support this developer has never felt more justified.",1519132555,1519132555,True,9,0,0.563180923461914063,0,True,False,False
698780,39923408,76561198334903725,0,2,306,0,272,1569377836,"this was a very well made game; kind of dark, but becomes lighter in the end. I especially liked the song at the end, it made me happy as i listened to it, i hope the singer/writer are/is happy about it.",1518068643,1518068643,True,2,0,0.507462680339813232,0,True,False,False
698780,39777080,76561198242539212,0,2,981,0,331,1641763831,MONIKA,1517520412,1517520412,True,2,0,0.511627912521362305,0,True,False,False
698780,39693587,76561198247210616,0,3,724,0,666,1525936221,Everytime i have to close the game a little raincloud forms over my head and i get sad feelings,1517176874,1517176874,True,0,0,0.47826087474822998,0,True,False,False
698780,38222850,76561198002928563,0,7,311,0,311,1512802255,"Game of the year, no question here.
At the very least in the indy/VN category, but overall for me.
The amount of love poured into this game is really something. Something to be proud of.
I lost hope to ever experience anything like this in my lifetime, but Dan Salvato made it a reality.
Thank you for starting this Literature Club for us, Dan. We love it. We really love it.

W̟̥it͍̪̫̹͔͓ḥ̲ ͕̭̹e̢̫v̀e̵̦r͝l̙͔̣͞a̺̖͜s̨̼̦̺͚͓̣͇t̫͡i͉̻̻͉̬̮̭n̰̙͔̦̖̜̹g͎̺̘͔̻ ͇̫̪͇̝́l̹̖o͇͚͓̣v̲̱͍̕e̹̦͖̻̘̬̦,̷̠͔̱̺̱̩
M̶̵̛̩̪̟̯̦͙̰͍̤͞o҉̵̬̜̣͉̝͕n̵̡̬̫̻̮̞͕̮ị̡͉̪̥͙̥̜͈̟̗͇͖̣̥̠̗͖̀͞ͅk͏̵̷̧̤̟̩͖̲̀a̢̡͉̙̜̱̮̲̣̦̝͢͞.̶̲̹̤̟͍̣̫̗̹͇̼̣̜͇̣̫͎͜͢͟͠",1512945864,1516864985,True,0,1,0,0,True,False,False
698780,39588278,76561198073215411,0,4,895,0,895,1516820855,Took a few tries before someone told me how to get the best ending. <3 'Your Reality',1516822329,1516822329,True,0,0,0,0,True,False,False
698780,39509774,76561198009249098,581,33,8603,0,16,1644429899,"Wow! DDLC is an incredible game. Normally I'm not a fan of anime visual novels at all, but I heard some really good things about this one. And since it's free I thought why not? 

Warning. Spoilers ahead!

[spoiler]Get out of my head. Get out of my head. Get out of my head. Get out of my head. Get
out of my head. Get out of my head. Get out of my head. Get out of my head. Get out
of my head. Get out of my head. Get out of my head. Get out of my head. Get out of my
head. Get out of my head. Get out of my head. Get out of my head. Get out of my head.
Get out of my head. Get out of my head. Get out of my head. Get out of my head. Get
out of my head. Get out of my head. Get out of my head. Get out of my head. Get out
of my head. Ǵ̴̼̮͝e̶̯̔̚ẗ̸͓́ ̸̗̀ọ̷̖̀͛u̶͔̼̾͌t̶̢̿͆ ̷͍͇̈ó̷̼͍f̶̧̤̈́̅ ̶̘̆̑m̵̙͠y̸̲̾̆͜ ̵̢͎̍h̵̻̽e̸̛͈̾a̸͓̭̔d̸͎͖̓͂.̴͍͊̈ ̵̝̓̋Ǧ̴͉ȩ̶̛̪̓t̶̤̻͛ ̷̢͛o̵̬̺͒̒ū̸̢̃t̴̘̠̂ ̴̗́͛ő̸̥͈f̸̙̈́ ̸̫͘ṁ̸̞͈y̶̭͕͝ ̵͒ͅh̸̺̙̓͘ë̶͈́ȁ̶͔͈̚d̸̘̖̎.̷̲̝̌͑ ̸̜̮́Ḡ̵̘̗e̶͕͛͝t̵̖̭͋̎ ̸̛̮͝ͅō̸̼u̷̳̔͝ṯ̸̛̗͋ ̸̻͎̿̚o̷̼͖̐́f̵͈̹̒̅ ̴̬͆m̸͉͗y̴̙̽ ̵̠̽̊h̶͈͆e̶͉͆͂ă̶̗d̴̝̱̾.̴̮̃ ̶̡̱̾͘G̶̲̞̈́ḙ̵́͝t̷̹͆̍ ̴͇͇͐ǫ̴̟͌͗u̸͕̙͂ẗ̶̤ ̷̙̌͘ơ̴̡̥f̵͙̟͝ ̵̤͒̚m̶̠̆̄y̶̳̩̆ ̷͙͉̒̈́h̷͈̅e̵̯̾à̴̡̧̓d̵͎̻̃̂.̷̥̆ ̴͇̖͗G̷̜̋ẽ̵͜͝ț̸̈́ ̴̘̤̓o̵̬͛̈́ù̸̩͌t̴̢̥͊ ̸͉͆̊o̵̳̫̓͒f̷̦̊ ̶̗̂̍m̵̻̃̕y̵̺̱̾ ̴̫͔̔̎h̴̯̲͝é̸̝a̸̳̞͗̂d̵̰͔͌.̷̨̛͓ ̸̝̀ ̷̞̈́̅G̸̬̳̿ę̷͔̒̅t̵̢̀͝ ̴̗͋̊o̷͎͕̐u̸͓͛̾t̵̝̩̏ ̸͂͊͜ǫ̴̒f̶̠͝ ̵͕̙̌ḿ̷̯̔ͅy̴͔̔͠ ̵̙̐h̷͎͍̿͊e̸̝̟͘͠ȧ̸̗͔̊d̴͍̹̂͊.̵̧̱͛ ̸͖̭̅̐G̴̼̝̀e̵̥̚t̵̨͘ ̴̮̀ő̶͇ǘ̸͙̳̚t̴͖̣̓ ̴̧͛͜o̷̘͌f̶̢͖̍͝ ̴̨̍m̴̡͂y̵̟̋ ̸̰́h̸̉̒͜ë̴ͅa̵̢̔̂d̷͔̯͒̒.̵̜̜̋̕ ̸̗̤͒G̴̺̱̿̾e̷̪̅t̵̰̤̔͝ ̶̳̿o̷͈͛ú̴͚̗t̷̼͜͝ ̸͈̊͘ơ̴̧͎f̷̮͠ ̷̮̺̉͊m̸̥̀̊ȳ̸̛̲ ̸̡̲͑h̴̼̟͒̕e̷̦̮͗à̵̞d̸͓̏.̸͖̽͘͜ ̵̫͓̿Ḡ̴̡e̴͈͕͒ṫ̷̡͘ ̸͕͊o̸̞͂ų̴̞̆ṯ̶͒ ̷̩̠̒ő̵̲̣f̶̨̞̿ ̶̤̼̀m̸̖̜̄y̴̪͑̅ ̶̥̓h̷̩̹͛e̷̹͂a̵̭̱̐d̶̫͖̉͗.̶͔͐̓ ̶̭͘G̸̹̥̎e̸̦͌t̸̩̗͑ ̵̙̏͗ǒ̷͚ų̷̥́t̸̘̽͑ ̷͖͖̔̚o̴̼̯̚f̶̨̢̽ ̷̨͎͆̕m̸̡̌y̵̼͆ ̷̝͊͜h̶̼͒̆e̶̛̬͔ą̸̋d̴̀͌ͅ.̴̛̝̝ ̷̣͙͌Ǵ̶͇̚ẽ̸̻̗͂t̵̝͇̐ ̸̙͊ô̵̙͠u̷̯̓ͅț̸̢̒ ̵͚͑̿o̷̯̓͝f̶͘̕͜ ̸̞̉̎m̵͈̗̊͝y̷̩͚̑̾ ̵̝̅ȟ̴̯̎͜e̶̢͔̍͝ä̵̡ď̴̯͈.̷̆̃͜
G̷̨̢̢̗͎̯͓͙̘̻̥͙͓̱̞̪̼̯̪̮͕̻̣̰͈̺̩̱̻͕͇͖͓̟̯͖̜̖͇̖͚̏͆́̀͗͋̊̂̌̏̂̌̽̎̈́͑̃͗̉̈́̊̃́̽̒̇̂̍̽̈͒̀̕̚͝͝͠͝͝ȩ̴̛͉̮̜͙̱̩͔̻̻͔̘̭̠̤̝̻̮̭̭̜͚͕͉͖̪̳̞̯̺̜͍̬̝̊̓͌͌̓̀̂͋̿̊͒̕͘͜t̸̡̡̨̢̨̧̢̮͉̝͇̦̼̝͔̼͚͓̫̯̝͎̩̻͂͒̾̎̃̀̑͗̃͗̍̑̓͗̈́̿̾̃͂̒̎͛͊̀̊͑͗͒̚͝͝ͅ.̶̢͍̩̦͖͎̣̭̖͉̦̝̤̦̯̠̝͉̞̬̺̦͓̩̓̈ ̵̴̢͖͔̫͓̱͈̻͈̙̯̼̮̣̣̳̭̯̩̮̩̭͈̯͙͗̋̄́̎̉͒̌̈́͗̏̈́̉͐̽͌̆͆͌̽̐͌̈́̍̿̇͂̓̊̂̐͂̐̆͊̽̓͐̒̎͌̎̇̍͑͛̌͒̂̈́͂̈́̚̚̕͘͘̚̚̚͜͝Ơ̸͕̰͂͒͛͊̈͊̒̑͒̓ṷ̵̢̨͍͍̘̼͇̮̦͉̩͔͖̬͈͎̱̥̥̱͙̯̣̟̪̗͉̞̈́͑̍̎͝ͅͅͅt̸̛̻̺̰̤͚͍̣̮̬̤͙̻̮͇̩̹͓͙̻̮̪͙͈̿̽̒̆̉̇̒̄̌̿̓̂͐͗̇̀́͑̔̕͜͜.̵̶̡̛̛͔̼̹̥̺͎̫̣̦̠͎̟̜̤͓̬̰̼̯̼̝̪̣̞̳̫̝̯̮̥̯̭͖̫̞̮̤͎͕̯̺̼͚̳̫̭̬̣͙̯͕̯̯̲̗̥̗̹́͗̍͒̔̐̅̂͛͛̅̂͂̈̈́̈̎̏̊̑̒̈͐̒̿̾̑̃͒̇͗́̄́̄̊̔̈́͊̃͗͋͗̑͑̂̋̎̚̚̚͘͜͝͝͝Ö̸̡͕̪̭̖͕̰͖̮̰̤̻̤̮̗̺̹̜͚̗͕̫͓̟̙͇̦͍̩̞̯́̄̿̑͑̑̂̾̽̿̈̓̈̾̕͜͜f̷̛͕̈́̅͑͒̿͋̌̆̃̏͊̆̆͌͐̌̀̕͘.̶̡̛̘̖̝̬͕̎̌̇̅̔̊͒̽̒̽̄̉̈́̾̈̈́̆̌̈́͗̏͑̀̊̅͘͠͝ ̶̴̢̡̧̧̛̪͉̫̲̻̥̦͕̝͎̞̩̮͕̠̟̰̜̥̗̟͙͉͉͔̬̥̱̖̦͍̗̮̘̖͔̱̗̤̰̊̀̓͑̓̾̓̀̆͑̔̂̋͛͆́͋͗̽̄́͛̊̾̍͆̒̏̊͋͐͋̅͑́̄̆͗̓̂̀̽̓̓̅͆̿̎̽̄͐̌͋̋͛̍̆̈́̏̿̚͘̚͜͜͜͝ͅM̴̡̨̛̫̟͔͇̭̪̫̠̝̜͚͙̪͍͎͔̦̰̤͚̤̭̯̀̔̆̈́̃͋͂̑̈͜ŷ̷̧̛̫̯̱͓͔̫̜̮̆͒̒͋͑͂̊̂̉͐̓̓̃̌̃̏̓́͑̚̚.̶̷̢̢̡̡̨̖̲̱̮͚̙̙̗̗͍̝̙̦͙̭͉͖̻̥̱̪̫͚͇͖̩̲̻͉̱̼͓̦̠̖̺̹̟͇͚̣̖͓͉̱̖̦̙͓̖̤̲͍͕̙̭̗̘͒͋̅͋̋̈̄̾̄̀̾͒̃̾̀̏̍̈́́̽̒̽̑̆͑̅̀̐̄͋̈́͑͒͋́̈́́͋̒́̈̌̈̏̀̆͑͂̍̕̚̕͜͜͠͠͝ͅH̷̢̨̯͖̖̺̲̦̮̦̞͔̦̜̻͕̦͔͈̪̱̟͙͎̬̤̬͓̘͍͇̤̣͚̱͈̞̥̯̦͙̠̅͜e̸̢̧̜̟͉͍͓̜͔͚̦̖̎̀̾͗̑̈́́̋̔̅̒͑̅͒̏̎̆͌̕͘a̴̡̧̨̛̺̩̪̙̙̹̲̼̘͎̘̖̞̖͎͉͚̗̦̬̭̹̖̟̣̻̘̰͙̩͍̹̤̍͌͑̀͑̾̉̆̑̉͊͛͌̍̌͐͑̅̋̕̕͜͜͝͠͠ͅḑ̴̧͓̪͖̹̜̞̔͆̅̋̍̓́͑͂̈́̋̈͊̍̕̕͝͝͝ͅ.̴̢̢͎̪̥͇̙̱̳̤̺̩̲̭̰̳̫̤̼̹̮̖̻͉̻̯̲̫̤̯͉͓͊̊̅̉̾͆́̈́̀͂́̈́̇̀͆̉͋̉̓͋́̎̒̅̏̌̅͆͘͘͜͝ͅ ̷̢̧̪̮͔̜͖̗̜̪́ [/spoiler]",1516539094,1516565969,True,3,1,0.497175127267837524,0,True,False,False
698780,39426073,76561198007606072,0,7,187,0,187,1516247218,"Like most visual novels, this isn't a game for someone looking for tons of gameplay or a zillion branching story choices. What it does offer is a story experience that will mess with your expectations and stick with you, which is high praise for this type of game.",1516237439,1516237439,True,1,0,0.507462680339813232,0,True,False,False
698780,39407665,76561198001516236,0,48,3646,0,2207,1688903288,"It is hard to me, 
to know what I want to do.
When all I want is to see is you, 
And to be like any one of us. 

It is too hard to be, 
so filled with need, with greed.
When that feeling can't be feed, 
I can feel happy yet it is never enough. 

So I just have to read, 
to play music and this game. 
When the world is so lame, 
I have to trick myself to get out.",1516173525,1516173525,True,0,0,0,0,True,False,False
698780,39294622,76561198088615116,244,21,448,0,448,1515851516,"And that amber light...

Never flickered again.

10/10",1515802917,1515802917,True,0,0,0,0,True,False,False
698780,39294203,76561198169239845,0,1,65,0,65,1515801004,"I love this game from the bottom of my soul. It is exactly what it claims to be : a psychological horror. I am so proud to have played this, as I purchased the DLC as well! I wish to support the developers and the team behind this game as much as I can, because this game is a piece of art. It brings awareness and light to issues that are often avoided, and not only that but it has its own horror twist to it. I loved the poems as well, I could relate to Bottles by Sayori so much!",1515801363,1515801363,True,1,0,0.523809552192687988,0,True,False,False
698780,39213013,76561197995628830,0,4,511,0,182,1537904664,An enjoyable and well written visual novel. Has much less player interaction than i expected at least in the first several hours and the player interactions that are there are very much in a format that came as a welcomed and fresh surprise for me. I wish there was a bit more player interaction in what ive played so far but the lack of it has not lessened my enjoyment of the game. Hoping there is more for me to do in the game as i get further but even if there isnt much more interactivity than what has already been introduced id still be satisfied with my time spent in game. I even bought the fan pack dlc to support the devsand while it was a bit liught for the price i think the quality of this VN and of all the stuff in the fan pack makes up for the smaller quantity than i expected.,1515520922,1515520922,True,0,0,0,0,True,False,False
698780,39178082,76561198028576572,0,6,778,0,729,1523833450,Yuri Best Girl,1515408087,1515408087,True,9,1,0.563223421573638916,0,True,False,False
698780,39169870,76561198049323500,1232,11,341,0,341,1515373449,"Amazing game, and it's free, so you don't really have any excuse to not give it a go. First full playthrough maybe only took me a few hours, and then another playthrough later for the ""good"" ending. Don't be put off by the game's appearance if you're not the cutesy-VN type, since there's a reason that the game opens with a warning; not all is as it appears. (And if you are the type well then you'll probably enjoy it just the same).

All-in-all though this is really just the kind of game that is best played blind, so stop reading reviews and just go play the damn thing, it'll be a fun handful of hours at the worst.",1515376051,1515376051,True,2,0,0.550215601921081543,0,True,False,False
698780,39140734,76561198065325697,0,6,9981,0,372,1561500386,"Huge fan of the game, even got the fan pack because it's such a great game. But a huge con is that some parts of the game feels slow and boring. Some parts I have to push myself to get through but overall it's a great game, just a slow ""plot"". Personally I haven't found a game like this that got me so connected since ""The Last of Us"", so pushing that one con away results in a fabulous game that plays with your emotions.",1515300630,1515300630,True,2,0,0.530973434448242188,0,True,False,False
698780,39068950,76561198298814695,0,1,307,0,286,1585708358,good,1515115426,1515115426,True,0,0,0,0,True,False,False
698780,39028180,76561198271952574,78,10,596,0,596,1515022464,"D͔ͧͨo̞̓͝k̷͚̕i-̂ͬ̿ͅD̛̽ͬo̎̎k͜i ̻̊͊L̦̥ͣ͠iẗ̲̼́̓er̈́ͯatu͇͉ͪ͌͘r̶e̬̻ͫͅ ̟̇͛Ċl͎ͬ͡u̶͈͓̓̏bͫͧͪͬ is a master crafted VN, filed with cute girls!
Like

[*] M̢͚̮̦͈̝ͣ́̔͊̆͋͂ͫ̏́͘̕Õ̺̖̏ͥN͖͇̥ͯͭ̀ͩ̉͜͢͡I̵̡̞̗͂̋͑̈́ͤͤ͗̉ͯ͐͢Ḳ̦̌A̵̡̹̲̦̱͕͙͕̭̣̼̘ͭͮ̀͌ͧͬ̔
[*] M̢͚̮̦͈̝ͣ́̔͊̆͋͂ͫ̏́͘̕Õ̺̖̏ͥN͖͇̥ͯͭ̀ͩ̉͜͢͡I̵̡̞̗͂̋͑̈́ͤͤ͗̉ͯ͐͢Ḳ̦̌A̵̡̹̲̦̱͕͙͕̭̣̼̘ͭͮ̀͌ͧͬ̔
[*] M̢͚̮̦͈̝ͣ́̔͊̆͋͂ͫ̏́͘̕Õ̺̖̏ͥN͖͇̥ͯͭ̀ͩ̉͜͢͡I̵̡̞̗͂̋͑̈́ͤͤ͗̉ͯ͐͢Ḳ̦̌A̵̡̹̲̦̱͕͙͕̭̣̼̘ͭͮ̀͌ͧͬ̔
[*] M̢͚̮̦͈̝ͣ́̔͊̆͋͂ͫ̏́͘̕Õ̺̖̏ͥN͖͇̥ͯͭ̀ͩ̉͜͢͡I̵̡̞̗͂̋͑̈́ͤͤ͗̉ͯ͐͢Ḳ̦̌A̵̡̹̲̦̱͕͙͕̭̣̼̘ͭͮ̀͌ͧͬ̔

Compare it to things like Hunipop and it makes Hunipop look like A̞̣̹̽ͣ̾͟͞N ̦̾UT̰͉͢͜҉̘̭̏̎T̛̠̤̋͢͡E̤R ͋͒ͥ͠͏̅̌D̿͡U̷̓Ḿ̷ͮ̉̾ͅP̛ͣS̷̶̺̤͑͑̐͂̃̍T̛̝͆́ͣ͌̒ͩÉ̗̞͛̑̃R͏͞ ̬̱̈́͐͠F̤ͬǏ͡R̶̛̻̘̈́̐́̊Ȩ͍̂ͮ̓̒͘.
However it should be noted that this game is a Ț͚͞͏O̓͞҉T̖̻̞̻̄͊̆ͤ͊Ą̳̘͋̃̑̄ͬ̽Ļ̵̗͎̊ͬ̇͘̕͢LỴ̵̗̾ͨ̿ͥ̆̇͛NO̷̦͇̫̼̪͔ͨ̑͌R͖̟͚̃ͬ͐͜M̹̮̹̩̅̓̕A̔Lͮ̂҉͋ͪ ҉̱̚D͆A̶̠̱T̜̥̗̀ͭ́͝I̡̱̪͜͏ͯ͏͒N͕̙͈͍ͪ̆̇ͨ̂Ĝ̵̢͇̦̊ͫ̚ ̆S͔̝̀ͨ̈́ͥ͗ͨ̓̚I҉̛̗͙̀ͤM͐̒͏ͥ͘

So because of mͫͩ͑́̀̑͗͠y̗͛́͠ ̴̷̼̞͎̀͛͜ơ͓̅ͧͧẁ̧̹̗ͫ͜ṇ̹͚̟̊́͘͡ ̵̃̀̎̃̀f̥̩͇̞̐̍ͮrͮ́̔eͮ҉̏e̶̫͈͠ͅ҉̧̒̊ ̷̨̓w̹i͍l̯͕l͕͙̗̍̎ͩ̎͘.

I give DDLC a

M̵̸̸͑̈̏̀O͓͓̙N̛̩̱̘ͬͪͯ͐̅̆̃̇͞I̬̳̬̤̬̪̞̹͈ͮ̈́̅̉͂̑ͧ̈͝K̨̠̰̣͕̥̲͖̎͛̌̌̐̆̕A̷͓͖͉͒͛ͧͮͮ͟/҉ͩ1̢̠̪̣̗͎̏̿̑͂̈͆͒̀͝0́


s̮͔̗̾̎̾̈́ͭ͜҉͓͓͌̕͏̶͇̱e̟n̤̗̳͕͇̂̆͛͆͒̈́ͬ̌̽̚͟͢͞͞͠ḓ̠̯̻̱̫̓̾ͧ́͋̋̓̔ͣͭ ҉̬͐̒́h̿ė̞̈́l̪ͫp̧̧̡̼̩̲̙̈͞ ̴̛̠̥̱̲́̾ͥ̅̐ͫͭ̽̆ͭ̑p̹̰͎̊͊ļ̛̗̭̣̼̌͆͌̈́ͮͧͫ̈ͨ̐͡e̵͓̻̹̼̺͍ͧ̽̇͂̓͌ͨ̚͟a̶̶̴̧̧͔̖̫̠͍̙̰͓̲͛̀̃́̅̒s̙̞̎́̈́͜e̼̣͇̻̦̿̾̓̍͒̅͞ ̴̜̠͙̾̾҉̙͕̪̟ͧ͒͘s̵̫͊̾͘҉̧̧̛̙̺̺̝̒ͮͧ̄ͤ͝h̰̀ͣê̽ ̡̻̦͈̯̓̎̋̾͌̚͜͡ͅḣ̖͙̞͓͚̙̈̽̓̓ͮͭa̸̳̞̞̺͚̟̙̰͂̔̑̾͒ͤ̀͞s̡̫̦͎̝̲̀ ̥t͖̽́͞a͎̬̤̮ͭ͋ͬͦ́ͧ͞k̷͚҉̧̨͔̠̺̫̻̫̐͊͆̄͛̓̎̚͢e͜ņ̡̗̠̖͖̞̗̼̘͂́͛̊ͮ͂͒̚͟ ̳̤̺̮ͩ̉o̴̸͍̭̠̦̞̐͌̔̍̽̉̀v̼͛ě̶̱̇ͦ̀̎͌̆͢͠r̨̢̳͖̦̍ͮ̾̃ͭ̐ͯ̉͞ ̷̢̢̦̱͕̍̑͛̀̊͋ͭ́ͅḿ̵̨͙̤͔͓̻̱̔̎ͨ͑͋͡͝͝y ̶͉͔͎̱̦̭̓̅ͪͧ̑̌ͨ̅̉â̵͉̺̗̹̿̎́c̖̭̞̾͑́̉̍c̨̜̮̪͎͓̰̻̎̎͋͛ͤ̀̎ͦ͋̒̎͘ő̰̫̆͐ͤ͠ṷ̸̡̡̡̥̬̹̩ͬ̾ͭ̑ͧͪͮͣ͢ń̨͖͇͎ͩ͆̀̊ͪ̀ͥ̕͡͡͞ẗ̢̠̦͖̩͇̃͊̔̅̓ͦͧ́̀",1515018988,1515018988,True,12,11,0.611883759498596191,0,True,False,False
698780,35960224,76561198119703411,99,7,508,0,508,1508985741,"This is an amazing game, hands down. From story, to music, to characters, this game is fantastic. The way the game is so light on the surface until later (won't spoil), makes it addicting and have you wanting to click to the next batch of text. Please, do yourself a favor and not only download this game, but download the DLC to support Team Salvato, this game is too perfect to be free.",1508824206,1515006318,True,2,0,0.54356849193572998,0,True,False,False
698780,38998317,76561198047580188,0,4,387,0,387,1514951617,"Too good to be free, bought DLC just to support devs. Yuri is best girl.",1514952051,1514952051,True,0,0,0,0,True,False,False
