707010,50132671,76561198039031648,0,4,40,0,40,1555260689,This game is poorly made and is not fun,1555260885,1555260885,False,2,1,0.486452609300613403,0,True,False,True
707010,50119674,76561198154713398,0,97,396,0,396,1555199169,Killed 2 rats died killed 5 rats died killed 2 more rats died . renamed my character to sir dies alot and clicked on uninstall game.,1555199260,1555199260,False,2,9,0.397547215223312378,0,True,False,True
707010,50049134,76561197977550827,0,155,10266,0,2630,1682544986,it has that rustic apoco feel and it holds its own well against others in the genre. i enjoy it and will put more hours into it. The game deserves the time to play it.,1554825426,1554825426,True,7,1,0.515908539295196533,0,True,False,True
707010,49887118,76561198006729790,0,34,49,0,37,1554100754,Please add FOV slider. I can't play at such a small FOV it makes me ill.,1554091706,1554091706,True,46,2,0.704033493995666504,1,True,False,False
707010,49691553,76561198856393090,0,1,195,0,23,1554722796,Game keeps crashing when i try to open it feels like i could have wasted my money can someone please help me,1553250716,1553250716,True,3,2,0.420231819152832031,1,True,False,False
707010,49652883,76561197975730347,0,16,586,0,586,1551580267,"Wanted S.T.A.L.K.E.R.
Got grind.
Would not buy again.",1553032404,1553032404,False,9,6,0.548526883125305176,0,True,False,False
707010,45509277,76561198156776848,814,190,1199,0,1022,1582804445,"Yes lets make skins before trying to finish the game.
Lets put a picture of fire on a gun and charge $30 for it.

Finish the game = more people buy the game = more game and skin sales.
But you guys choose to kill the game with lazy and greedy decisions.
You would make alot more money if you finished the game.",1540865398,1551763399,True,0,0,0.472959578037261963,0,True,False,True
707010,49357856,76561198254159306,0,18,620,0,593,1598929227,An up to date fun stalker copy with a leveling system,1551718397,1551718397,True,1,0,0.476190477609634399,0,True,False,True
707010,48135438,76561197970615077,0,121,15519,0,1226,1640480023,"Bestes Stalker MMO, macht riesen Spass alles zu erforschen.
Das Tutorial in der Hauptstadt scheint ein wenig langweilig, aber nachher kommen die knackigen quests.
Ingame shop nicht notwendig ausser man will die devs unterstützen.

Improved alot, PVP and PVE Servers :-)
Its more player friendly now ! 
Best Stalker MMO so far, and yes i tested alot stalker clones.",1546736353,1551487380,True,1,0,0.497680306434631348,0,True,False,True
707010,48549503,76561197978988394,0,78,14865,0,13322,1701792437,"Games got me hooked :)

For the price you can't go wrong !

Developer is always updating :)",1548444401,1551440483,True,1,0,0,0,True,False,True
707010,49269079,76561197981999577,0,45,20591,0,2743,1705731046,It is a lot of fun. And i cant wait to see it done. Dev i hope you get this done and with new explansions and even we be able to build towns buildings. i hope so. i Do recomend it.,1551303783,1551303783,True,1,0,0.45606696605682373,0,True,False,True
707010,49118276,76561198003732359,0,11,19166,0,5246,1642602338,The closest stalker experience you`ll find.,1550663650,1550663650,True,15,4,0.569604873657226563,0,True,False,True
707010,48762147,76561197981274554,0,2,511,0,511,1533489146,"This is the closest thing to STALKER online that is available. The last time I played, maybe a year ago the game was VERY buggy and janky but the devs seem to be updating the game pretty frequently. This is a true early access game, you will be paying for a very unfinished game. I don't know if I could recommend this in it's current state as I have not played it in over a year but if you are a fan of the STALKER series I would recommend buying it now and waiting for it to get better.",1549319720,1549319720,True,6,0,0.574751496315002441,0,True,False,True
707010,48748753,76561197970706388,0,11,36,0,36,1535860479,"DUMB!! Choppy graphics, struggling gameplay, slow-paced action...in other words, NOT FUN.",1549259123,1549259123,False,2,1,0.427274882793426514,0,True,False,True
707010,48746323,76561198144204466,275,25,1587,0,1567,1556292192,Amazing game. It just sucks there are so few people on the US server. However me and 3 friends bought the game and we are loving it!!!!,1549244487,1549244487,True,3,0,0.503420472145080566,0,True,False,True
707010,48729633,76561198288385229,94,34,11197,0,7173,1577051355,Its Fallout 76 done right,1549185066,1549185066,True,17,17,0.553579330444335938,0,True,False,True
707010,48689909,76561198031423417,198,16,1594,0,1239,1580155334,"It's actually fun and has in-depth mechanics and interesting mobs. It does need a general UI rework with better translation though, and I can't say I love the instanced world. Other than those though, it's a blast, especially with friends.",1549028838,1549028838,True,2,0,0.523809552192687988,0,True,False,True
707010,48635661,76561198279902993,0,44,23,0,23,1548798616,"I bought this game for $13.49 CAD on Steam. It is a complex science fiction based first-person shooter. There is a lot of text dialogue that gets boring while completing quests. The gameplay is very smooth and the menus are very clean and easy to use.

I am not interested in the storyline of this game and I couldn’t find anyone playing in North America. I did not enjoy playing this game and I do not recommend it.",1548801680,1548801680,False,1,1,0.387495040893554688,1,True,False,True
707010,48520454,76561198060649717,796,12,5969,0,3992,1689350356,"The game is decent for what it is in early access and can improve with time and hard work from the dev's.

But there are sometimes where i feel the monster's near you're quest or objective are a bit too hard in the sense that my bullets are plastic pellets no matter which ammo type.

I have high hopes for this game in the long run and i hope to still be playing when full release.",1548326459,1548326459,True,2,0,0.523809552192687988,0,True,False,True
707010,48447819,76561198128463968,311,33,1843,0,1052,1586547536,best at what it does (my wife took the kids),1548011058,1548011058,True,19,42,0.51782989501953125,0,True,False,True
707010,48431113,76561198070115945,297,26,1264,0,1120,1547942032,Like S.T.A.L.K.E.R but without any of the good parts,1547942098,1547942098,False,47,26,0.701307237148284912,0,True,False,True
707010,47868261,76561198022255289,0,92,6957,0,6957,1547323756,"amazing gunplay and gameplay also the community is very welcoming and on top of that the servers are top notch i have a ping of 15 if you liked stalker buy this now. EPIC game wow especially for the value and we get acheivements!? BUY IT NOW

enemy ragdolls-check
addicting world and gunplay-check
amazing and friendly community-check
steam acheivements-check
i could easily sink a few hundred hours into this game its fucking amazing we just need more guns and enemy types

BUT sadly the game is dead as fuck on the American servers, but if you live in russia your in luck the servers have plenty of people there im kinda worried about the game and sense it will get shut down soon due to no one playing which sucks cause the gam,e is fucking amazing but no one plays it :(",1545924171,1547618005,True,9,0,0.54971003532409668,0,True,False,True
707010,43884580,76561198009549547,336,15,2162,0,1624,1580767350,"Okay, I can't not reccommend this game. But I also can't fully reccommend it either. While you deal with your standard Early Access stuff in the game, thats not my problem. My problem is how misleading the advertising is.
The screenshots and videos make you think you have finally found a good online version S.T.A.L.K.E.R right?
Wrong. Will to live Online is nothing more than your bottom of the barrel walk over here, kill this, come back MMO storyline that you've been accustomed to. I Bought this game thinking I would be thrust out into the wasteland with a knife, a pistol, some bolts for anomalies and my own skill for survival, with hope of meeting players at a hub of some sort, grouping together, finding artifacts and so on. Instead, I've spent hours doing nothing grinding out experience points and money so I can get decent items from vendors. Yes. This game has a leveling system. 

Will To Live Online is nothing more than an MMO with light RPG elements wearing a S.T.A.L.K.E.R skin. And that's Dissappointing... Still gonna play it though cause it's as close to an online S.T.A.L.K.E.R feel i'm gonna get.",1533180349,1547080552,False,0,0,0.466618806123733521,2,True,False,True
707010,42788123,76561198044849755,278,51,727,0,727,1546471671,"Before I start, let me state that I only played the PVE and not PVP.

The game takes heavy influence from S.T.A.L.K.E.R Shadow of Chernobyl. With a Russian wasteland, mutants, player waking up with Amnesia and anomalies scattered across the map.
The game looks nice, there are varying enemies, most with different characteristics.

You decide between 4 classes of Hunter, Engineer, Miner and Military which all have different stats and different specialization in different weapons (Hunter works best with hunting/sniper rifles and pistols).

The game has a bigger looting system which comes from other games where  you can harvest plants, dead enemies and such to gather items which you can sell or craft with.

However, the game falls flat on one thing: Speed
The game is severely slow in pace. Mostly because of the fact that items require a specific level to use. Example: The first decent hunting rifle you can get for the Hunter can only be used at level 7. I've played 12 hours and I've only reached level 6 so far. This slow speed isn't like most RPG games, it is much much slower. Especially since the only good xp you can get is from the quests which are mostly just fetch quests. Run 3 miles, get this, then come back here. How fun!
And it doesn't help that different parts of the map are cut into different pieces, so entering them requires you to step into portals which are the game's loading mechanic, which also take [b]at least 1 minute[/b] to load (on Core i7-7700, Nvdia GTX 1060 6GB and 16GB DDR4 Ram).

The other problem goes back to the usage of items I hinted. Since every gear item (clothes and weapons) require a specific level, you can barely get your hands on anything good. There are no human enemies such as bandits to fight (maybe [b]some[/b] on the other side of the map) so you can never pick up weapons from a dead enemy. All the weapons you need can only be bought at the store which are freaking expensive. You need around 1,800 coins to get the first torso armor available and yet, quests only give you around 200 coins and selling loot such as mushrooms grant you from 1-20 (with 20 being a rare mushroom) so getting good gear can be a pain. And when you gather enough money to get one you do not meet the required level. Which is why I spent my whole time using a sawed off shotgun as a Hunter. Basically the opposite weapon I should be using.
And also because there is a store, weapons are limited in variety. The store's wall is full of awesome weapons that don't exist in the store itself.
If we saw some human enemies that dropped weapons that would be much more fun rather than to having to grind for every gun you want to find (I also have not been able to loot any weapons from the map). In STALKER, you could pickup whatever weapon your human enemy had, so there wasn't really that big problem of not having a good gun.

When I first got the game I really enjoyed it and thought I could spend some serious hours in it. But as time passed (and not that much time actually) the game became repetitive and boring. Mostly because you are sent into the same area 3 different times for 3 different quests (which cannot all be given at once because it's the same NPC telling you to go there).
I tried grinding money to at least have enough money for when I reach the required level of items but the grinding also became boring. Yes, I know grinding is repetitive and boring but I remember spending hours grinding in Fallen Earth and other games without getting too tired and actually enjoying the money I made. While here it's not one bit fun and the money you get for selling them is close to minimum wage.
After the 12 hours I spent in this game I quit and deleted the game simply because it felt too boring to go to the hub, take a quest, go fetch that quest and then come back to the hub, for a majority of the game. Yes, there are two camps on the map that can give you quests but they are faction based and getting to them requires you to have at least some good level.
Unlike S.T.A.L.K.E.R Shadow of Chernobyl where you would have to proceed to new areas each level with new base and camps to settle in for the while, WIll to Live offers 1 major camp (which will count as your main camp for a very very long time) and two small faction based camps for further out.


My experience doesn't cover everything the game has the offer but it shares with you the reason why I quit the game. I'm sure there are lots of better Online RPG games for you to play out there with MUCH more content to offer.


Also, for the frosting on the cake; the English in this game is just pathetic! From loading screen tips to character dialogs and item descriptions. They all look like they had been written by a 12 year old Russian kid who is trying his best to communicate in English and is failing miserably. (I said ""Russian kid"" cause the game is made by Russians, don't go ""That's offensive"" on me.",1529241881,1547054033,False,46,4,0.638272881507873535,1,True,False,True
707010,48206920,76561198162847929,158,100,329,0,259,1548861856,Its a good game so far i like to see how this game developes,1547044549,1547044549,True,2,0,0.496774196624755859,0,True,False,True
707010,48183267,76561198126127654,1071,204,86,0,86,1546858534,⠀,1546931103,1546931103,True,4,1,0.449518293142318726,0,True,False,True
707010,48064874,76561198046964802,649,70,23,0,23,1544962208,"Needs a lot of polish until can recommend.

The concept of the game is great.

From what I hear the quests are very uninspired, but I only played the first few which were ""normal"" mmo starting quests: kill rats and gather stuff like mushrooms.",1546508673,1546508673,False,3,2,0.522138237953186035,0,True,True,True
707010,47973475,76561198160983432,0,6,249,0,249,1546219948,"positive very: nice game ,gameplay isnt bad .not that many bugs 
its cheap u should try it.",1546220177,1546220177,True,3,0,0.516129076480865479,0,True,False,True
707010,47951383,76561197971166611,0,7,191,0,191,1546157642,"After a few hours playing I'm not able to recommend this game. It tries to be a modern S.T.A.L.K.E.R but it never reach this quality at the moment... and I'm not seeing this is future. 
Pro:
little S.T.A.L.K.E.R feeling (PDA looks very similar, Map Icons looks like Stalker, nature try to be similar, anomalys also similar)
nice little story telling at the beginning
Cons:
Quests guidance is crap. Some quests have no markers.
PDA is controls is anying (press ""J"" for journal but it opens the last open ""tab"" on your PDA, but not the journal)
Quest goal are boring.
Animals and Enemies respawn in one second. (you're in a ""big"" town, killing tones of stupied rats... you're reloading and all enemies are back on the same spot as you killed them before. WTF?)
No Skill Points within the first levels (maybe not implemented)
I will try to refund. Only paid 7€ but its not its not worth it.
",1546163073,1546163073,False,5,2,0.545791029930114746,0,True,False,True
707010,47797016,76561198236867484,0,10,9208,0,962,1663428319,"So, my review might be uplifted by the fact that nearly every other game at this time is unfiltered garbage stuffed into a teddybear that hates it's customers but, I really fucking love this game. Its nice and simple and has light RPG elements but doesn't make you scream for more like Fallout 4 did in contrast to Fallout New Vegan, and the multiplayer is stable unlike Fallout 69 Leet Leet Skeet Skeet. The level based progression is quick enough to keep a 17 year old with ADHD like me invested but not overwhelm my more normie paced brother with new things and new instructions. The bugs I've encountered are nowhere near game breaking and usually range from, ""alright you lil' furry fuck where'd you go"" to, ""This NPC really just killed me in 1 bullet"".  

Firstly my complaints: NPCs in PVP servers are too strong, and same goes for guards. Making their termination nearly impossible without high level gear I assume [because im a mere level 9]. And before the respawn rate of many enemies was just obsurd but it seems to have lowered so that doesn't mugh count. Item variety is pretty low, it is certainly servicable but having a few more guns or pieces of relatively crappy armor to begin with doesn't hurt- especially if you'd be able to pick it up from low level enemies like in many other RPGs. Lastly, this game doesn't take full advantage of it's RPG elements [as far as I know]. Having a begining section that actively displays the importance of your reputation meter or stats like in Fallout NV would be amazeballs but it would take a good amount of time and planning, so really it feels more like a missed opportunity rather than an actual flaw. But the good stuff is good: Server stability is really good. Dialogue with NPCs isn't painful. Enemies can have larger health pools the higher level they are but are still killable and make sense- like a level 5 rat only taking 2 more bullets to kill than a leel 2 or 3 rat. Gunplay is good and doesn't feel sluggish. Most items retain actual value whether it be sellable for a good amount of Tokems [the in game money] or end up being suplies. It looks good even at it's lowest settings. Runs well on a used $750 laptop. Has a story if you want to follow one but doesn't shove it up your rectum looking for your last meal. And because its near the holidays the devs gave everybody free stuff gatherable in the starting hub and its really nice.

Its worth your time, and worth the money, even though im a total cheapo and bought it on sale.

Recomendations for the game to implement [in case the devs are looking]:
-Make each character like you more based on how much stuff you do for them, this can lead to shortcuts in quests like the gun merchant selling you vodka for a heavy discount instead of base price on the quest where you gather 10 bottles of vodka, or the doctor giving you 1 free heal every 3 completed quests.
-Slightly more variety in low level gear.
-Add benefits to certain tasks based on your stats. Such as higher melee damaged based on strength, or faster gathering speed for another stat.
-Take more advantage of the RPG elements!!!

Either way, this game is good as it is now and good with pals, but is chalk full of potential. I give it a thumbs up.",1545715017,1545715017,True,5,2,0.547456264495849609,0,True,False,True
707010,47763625,76561198365980953,0,37,662,0,562,1538238207,This game is basically a post apocalyptic walking simulator,1545611608,1545611608,False,2,1,0.47624245285987854,0,True,False,True
707010,47738555,76561198024787224,0,15,37,0,37,1525158990,.,1545557656,1545557656,True,1,0,0.43326413631439209,0,True,False,True
707010,47605130,76561198068273937,0,101,6243,0,1486,1698930290,Do yourself a favor and give it a shot until at least level 7. Once I got the sks and put a scope on it the whole game changed. There is a big world to explore and has enough of a stalker feel to satisfy my nostalgia. For the price you really are getting  a great product. Server pops are low so if you have a few friends that are intersted even better!,1545134374,1545134667,True,1,0,0.497680306434631348,0,True,False,True
707010,47604129,76561197967241135,219,10,6450,0,5362,1601737592,"This game has really been great and is still improving within weeks time seeing updates constant feedback from the community is key to setting the bar and helping out developing team to create and help minimize bugs, Well with this dev team thats exactly what they are doing they even put that option in the game itself ""end"" button you press that and you can report a bug you see instantly. I've made a group of friends within this game and we play every single day literally hustling and doing missions together this game isn't for everyone do NOT play if you aren't prepared to lose some shit you worked hard to get or die the 5th time trying to finish a mission that you keep telling urself in ur head ""THIS CAN'T BE HAPPENING"" *X10 RAGE* because no matter the level or how much med kits you bring or extra ammunition...buddy one way or another that will happen! 10/10 Can't wait for more improvments me and my buddys on discord all 15 love ur game you have our support!",1545129570,1545129570,True,1,0,0,0,True,False,True
707010,47555228,76561198231482780,0,162,220,0,220,1544964132,It's decent.......fun cookie cutter with ur Russian Edge. Some fun,1544909950,1544909950,True,1,0,0,0,True,False,True
707010,47541288,76561198002183209,298,13,522,0,522,1543085722,"The game is super linear at the moment. You follow a quest line and upgrade your weapon as you level, theres maybe a handful of guns with each one unlocked after a bunch of levels. Technically the game runs great even on low end Pc's and the graphics are ""o.k.""/acceptable. The combat is pretty good, the guns feel good and the mutants/monsters you fight are pretty cool as well once you get to the point where you can actually fight them and the anomolies are pretty awesome.

 All in all its a really good ""Stalker Online"" game but it just lacks the population or content for it to actually be fun. The base game is there, and its good, but its seriously lacking in options for weaponry, items and missions.",1544867497,1544867497,False,2,0,0.458369702100753784,0,True,False,True
707010,47525054,76561198104632205,196,23,4705,0,3576,1601675592,"Really liking this game, But it has some downsides.
People who played Stalker will fall in love with this game for sure, highly recommending it to buy it right away!
Others tho, will find this game pretty hard to play, you will need to find yourself a partner to play with, Can be really challenging. It has some good graphics, natural movement, realistic in some ways. Reminds me of Fallen Earth a bit.
Devs. need to listen to players in order to make the game better.
Game is a bit content-less, So expect alot of grind :)
Overall rate: 7.5 / 10",1544800967,1544800967,True,2,0,0,0,True,False,True
707010,41970828,76561198222769968,272,26,1025,0,866,1573917851,I actually had a fucking seizure when i set my game to 1920 x 1080 resolution. I kept getting this stupid flashing green screen that made me pass out on the floor. Fix this bullshit,1525996382,1544065993,False,0,0,0,0,True,False,True
707010,47239227,76561197967081751,0,75,5653,0,3259,1654772341,"SUMMARY: It's pretty much what it looks like - an MMO server based Stalker-style fps/rpg game with a pinch of Fallout RPG stats/xp (without the bugs). Which isn't to say it's bad, far from it. I'd say it's the most feature and content complete STALKER clone there is, and by far the most fun to play besides the actual STALKER games. Obviously it's not as great as those classics but if you're really, REALLY fiending for a new hit of STALKER (like me), this will help with the shakes.

Be aware it's in early access, doesn't have the best translation, and enemies have levels which can result in you getting your ass kicked hard if you try to go too far too quickly. Far, Far better than sZone-online and actually features the open-world promised in Survarium.

FEATURES:

Ironsights! Bullet Drop! Armor Penetration! Shooting feels pretty good in this game, complete with a shooting range to experiment with.
PvE with PvP being opt-in. A couple locations can be conquered by PvP factions, encouraging a couple regular battlegrounds.
Character classes with unique skill trees and weapon proficiencies. Female characters are possible.
Respectable weapon selection with several types of ammo possible per weapon
Varied armor and equipment including armor plates.
Location based armor and damage - boots help against rats, vests help against bullets.
4 different armor location slots and 4 additional equipment (high-level stat boost) slots.
Anomalies! But no bolts. You have to keep your eyes and ears open.
No Fast Travel is implemented but you can find anomalies that function like portals. Just make sure you're facing the right way...
A diverse mix of weird mutant creatures that get stronger the more players they kill. Don't feed the crabs, please.
The knife is actually pretty useful which is quite nice and a great money saver.
A few AI human enemies/bandits whose guns are WAY more deadly than any animal claws.

And yes, drinking Vodka cures radiation. The true STALKER successor arrives at last.",1543690977,1543883198,True,4,0,0.48891785740852356,0,True,False,True
707010,47241127,76561198030069822,100,5,94,0,94,1543256381,There is no point playing a 'Massive Multiplayer Online RPG' when it's empty.,1543696396,1543696396,False,7,2,0.498068392276763916,3,True,False,True
