707010,41556871,76561198131585871,0,17,8799,0,5945,1543935369,"[b]UPDATE August 7th, 2018:[/b]

Dev has added:
[list]
[*]New mobs, including hostile human NPCs
[*]Mob balance changes
[*]New weapons for all classes
[*]Faction-specific gear (there was not a lot of incentive to join factions before, this helps fix that problem).
[*]Repeatable quests (particularly helpful for mid-game players lvls 13 - 16ish)
[*]Periodic bonus loot and XP on weekends
[/list]

Devs are definitely on the right track. For 100 hours I'd say it was worth $15 USD!

[i]Original Review[/i]:

I'm going to call this game a ""diamond in the rough"" - 

A variety of enemies (some with different attacks) but all use essentially the same AI - charge and attack.

Generally-nice looking maps (there are multiple for different locations, location interiors, etc.), however the main map you traverse to get to said locations feels fairly empty, with the exception of mob spawns and some plant life you can collect for cooking.

Oh yeah, you can cook! Buy a PDA module full of basic recipes and you can make steak from mutant meats, tea, distilled water, and omlettes if you manage to find and kill the rare chicken!

Something that sets this game apart from other post-apocalypse titles is a mining career - you can go to a coal/mineral mine on the map, buy a pickaxe, and dig for useful minerals, coal, etc. which can then be smelted into useful ingots. Haven't tried it yet but I look forward to giving it a go.

There are four classes: Miner, Hunter, Assault, and Engineer.
Miners are presumably the best for mining.
Hunters can use sniper rifles.
Assault are the bread-and-butter combat class.
Engineers can use demolition explosives. 

Each class has it's own stats and uses but I've only played Hunter so far. 

There are two factions you can join: Confederation and Black Sunset (ie, bandits).

[h1]If you are a [i]S.T.A.L.K.E.R.[/i] fan looking for something to fill the CHEEKI BREEKI-shaped hole in your heart:[/h1]

This is not a [i]S.T.A.L.K.E.R.[/i] clone but it feels close enough to the real thing. Think of it being multiplayer [i]S.T.A.L.K.E.R.[/i] but watered down while much better than [i]Survarium[/i]. There are a variety of guns (including the classic sawed-off and TOZ-34), different pieces of suits you can wear (ie, you no longer have one suit like the SEVA, you have headgear, chestpiece, pants and boots IIRC), and the atmosphere in some places reflects that of [i]S.T.A.L.K.E.R.[/i]'s nicely. There are anomalies, believe it or not, which can damage you just like [i]S.T.A.L.K.E.R.[/i], however these are generally very rarely found unless you visit more specific locations. There are also apparently artifacts you can loot from places but I haven't gotten any quests detailing how this works, nor have I stumbled across any thus-far. 

Dev is not a native english speaker but he speaks enough to understand questions on the Steam forum and answer them. Seems to pretty frequently interact/answer questions on the forums too. Game has been out less than two weeks and has already had its first update, with a couple patches/hotfixes on top.

There are other things the game has (skill trees, higher-tier enemies, bosses, etc.) but I haven't been able to seriously get into those yet. For $15, I'd definitely say the game is worth trying.",1524065881,1533691681,True,1,0,0.522058844566345215,0,True,False,True
707010,43990501,76561198114950044,0,3,123,0,123,1533319917,Did not Enjoy this game want my money back.,1533680531,1533680531,False,1,0,0.403361052274703979,0,True,False,True
707010,43974273,76561198113250514,0,16,116,0,114,1533599137,"Everything is in russian, the story, the posters, the game decorations, towns, names, the music..everything. The worst dialouge translations of all time. The worst user interface and jumbled up modeling with horrible textures. There is a reason why they show nothing but guns in the trailor. Because if you seen things i've mentioned you wouldn't buy it.

Do not buy this game. Save yourself...",1533602895,1533603415,False,19,8,0.445129543542861938,0,True,False,True
707010,43951511,76561198033979576,327,38,2760,0,2760,1533953102,Stalker mais en multi ;),1533492568,1533492568,True,0,0,0,0,True,False,True
707010,43909517,76561198031687674,0,40,633,0,633,1533299614,"Not a bad game, but not a great game either. The game play is very hard with most of it revolving around money. You kill stuff to get items to sell, buy ammo kill stuff. 

Pros
-Huge map
-Games hard
-Realistic crafting

Now the cons list might be a but longer, the game is in EA and I espect some of this will change in patches.

Cons
-Weight limit (With 2 guns, 75 ammo for both, 2-3 food/water I was over 50% of my weight limit. After looting 3 monsters I was over weight. It gets better with levels but after 10 hours I only hit level 7 and was still having a weight issue.)

-Quests (Bland burning cursade quests. Go kill 15 boars 30 min of walking, go get 15 boar meat 30 mins of walking, go get boar hide. This also goes back to the 1st con. I couldn't even carry 15 boar hides.)

-Resources (Rare and hard to see. It seems like large sections of the map are bare of lootable items. can take well over an hour to find firewood)

-ANOMALYS (I'm not sure what the point of them are beside to kill you. Their very hard to avoid sometimes. 1/4 of my play time is walking back to my death loot. only to be killed by the same thing not knowing what hit me. After walking back for the 5th time I saw this tornado. Fast, quite, large aoe. cutting thru this town.)

-Monster variety, respawn times (too fast), bullet sponges, damage. They all need adjusted,

In the current state, Its playable. Better with 2 people. Can only recommend to the most die hard survival fans. Its EA, and if your a survival fan. You know all about EA survival.",1533302488,1533302514,True,0,0,0.495495498180389404,0,True,False,True
707010,43852386,76561197972982892,0,6,357,0,357,1533069987,"2 hours in and it's definately captured my attention. Please, please, please don't fix the bad russian translations, particularly the bizarre Putin like metaphors. You'd have to have ""marmalade in your head"" to change this aspect of the game. Will to live online is one ""great gung-show"" as it is. Don't listen to all the moaners with ""big goose eggs in their napes."" I'll update as i progress, hopefully with more unintentionally hilarious gems.",1533034943,1533034943,True,5,2,0.526162385940551758,0,True,False,True
707010,43810739,76561197966921756,0,168,82,0,82,1525147944,"It's an MMO, but it's Stalkery.  If you can stand MMOs, go for it.",1532848031,1532848031,True,0,0,0.476190477609634399,0,True,False,True
707010,43807408,76561198039646736,0,6,3947,0,3947,1532829342,"The game overall is decent, but as it stands right now you really don't seem to progress much in terms of your character. The game also seems to be designed in a manner that tries to rely heavily on doing things with a team, which is a decent idea; however, with so few people playing the game that just means mobs your level are rather powerful. Accidentally have 2-3 of your level come at you at once and you're going to be in trouble.",1532829771,1532829771,False,5,0,0.461235195398330688,0,True,False,True
707010,43804546,76561198027846217,758,43,203,0,203,1532891807,Guut Guut,1532813950,1532813950,True,1,0,0.512235164642333984,0,True,False,True
707010,43804217,76561198028644241,0,21,135,0,135,1532812561,This is the worst game i have ever played,1532812610,1532812610,False,2,0,0.262987703084945679,0,True,False,True
707010,43796164,76561198215508787,30,1,65,0,65,1532782425,ResidentSleeper boiiiisss,1532782480,1532782480,False,1,1,0.316895902156829834,0,True,False,True
707010,43796161,76561198300841788,52,4,65,0,65,1532782439,Boring,1532782472,1532782472,False,0,0,0.321893841028213501,0,True,False,True
707010,43793439,76561197991702077,643,10,5236,0,1942,1692618302,"I love the fellowship of this game! The ""pay it forward attitude"" the players of this game have is very awesome. You build comrodory with players very fast because no one wants to go in the wasteland alone! You feel the struggle of post apocolyptic Russia. If you're an old school S.T.A.L.K.E.R. player just buy it. You will not regret it. It's everything you'd want and it's only ALPHA. Stalker-Online was a cool experience, but the microtransaction equating to only renting items was so off putting it was scary. 30 day rentals on superior weapons and armor. I played over 1000 hours in S-O, my name was APOCRYFY of LAST LIGHT clan so if you recognize me YOU KNOW MY WORD HOLDS VALUE! For 15$ this game is a STEAL.",1532771048,1532771048,True,35,3,0.690325379371643066,0,True,False,True
707010,43789144,76561198043903112,342,51,10629,0,4305,1601532950, Its a fun game but its very difficult. Its a grinding game but It would more enjoyable if you played with a mate. Not very populated but hopefully that changes in the future.  The dialogue isn't very good. The grammar is terrible and sometimes you can't understand what theyre even trying to say. Expect to die a lot at the start. Hoping for lots of good future updates as it has potential,1532749256,1532749256,True,0,0,0,0,True,False,True
707010,42362470,76561198118442728,362,26,19172,0,13000,1655221469,"As Early Access Game its really good.

Pros:
+Only 15 euro price.
+Dev team work on this game alot.
+Really big open world for Alfa.
+For stalker fan it can be really Welcoming game.
+Crafting (for example not all Armor plates can be bought  from NPC=Live ingame economy between players)

Negatives:
-At now is there something over 100 quests (Dev work on new so this will soon change for sure)
-Game need in overall more content but as Alfa its have really good start.


So in the end i for sure Recommend this game,for people who like post-apocalyptic games,with open world PVP/PVE.

For 15 euro price its really good buy.

At now have 56h in game and for sure will play much more.

Edit:
Also forget to say alot players will give it up on start,most because they will find it as boring,to make this clear in most game is start boring :P just dont give it up because first quests are maked for player to get little in game in overall from my perspective,they are in first town inside where is not PVP but after few Q you will start do Quest outside where is PVP.


Edit 2:
At now have 212 hours in game, and will be still more for sure :D

Must say again Dev team really work hard on this game and put updates and tuns of hotfixs really fast.

In overall dev team reply to all post what i saw overtime react on all bug reports and listening game community really alot.(Never saw any other dev team talk so much with players from their game,and i played alot Early access games)

Community in this game seems slowly grow up whats is really good.
But still will recomend if you want play PVP use servers 1 (EU 1,US 1....)

Still in most players are here friendly even if both of them are from opossite factions but soon have be in game ""Faction war: roadblocks capture"" so after it will be more pvp focused in overall and will be reason to fight.(Most pvp is now at low lv only when new players fight, higger lv players dont have reason kill small lv but from time to time its happend)",1527605142,1532606957,True,25,1,0.635506391525268555,9,True,False,True
707010,43700458,76561198055621691,0,40,58,0,58,1527565794,"Truth be told it is pretty meh and is a MMORPG with a twist, spent ages dying and reviving to get back my shit cause I died to rats, got back and gets killed by more of em, wouldn't recommend it unless you like MMORPGs that mainly uses guns/weakass low range knives.",1532360616,1532360616,False,0,2,0.361492365598678589,0,True,False,True
707010,43654162,76561198075093950,93,8,4544,0,4512,1552263687,Walking simulator,1532143501,1532143501,True,1,0,0.501068174839019775,0,True,False,True
707010,43603580,76561198066864307,566,29,126,0,,1532822304,Tried downloding it five times now. Each time a new problem as to why it wont work. Absurd russian robbery yet again.,1531915574,1531915574,False,0,4,0.380512118339538574,0,True,False,True
707010,43579885,76561198307734784,184,6,2110,0,2110,1531638891,"This game is super addicting and fun as hell. It's like Fallout, Stalker, Borderlands and maybe a bit of Elder Scrolls (Just exploration-wise) had a baby. The community is, for the most part, extremely helpful. Will it stay this way? It's still too early to tell. It's like the early times back in DayZ when not everyone KoS all the time and players actually communicated. This game isn't for everyone and I really appreciate the fact that it isn't. The devs aren't trying to please everyone and make some super simple and easy game. It's not incredibly hard or difficult, it just doesn't hold your hand and guide you every step of the way. So if you don't enjoy a grind and can't tolerate a learning curve, then I wouldn't recommend picking this up just yet. The first 10-13 levels are the hardest from what I've been told but I haven't had any real problems, minus the damn mushroom quest. If you can stand to actually ask someone for help or how to do things when you're stuck, someone will more often than not help you out as much as possible. So if the the game seems interesting at all to you, I would definitely recommend giving it a try. Especially at the price it is. The devs are also very active and so far have been very good with communication and letting players know what's going on and updates are rather frequent.",1531811646,1531811646,True,7,0,0.594369411468505859,0,True,False,True
707010,43575351,76561198253575448,0,1,17275,0,7978,1672861023,"This is a good game..So overlook all the--its just like { insert game name } crap--because no matter what u play,,its already been done a 100 times over..YES there are some problems as it stands now,nothing major though as the gameplay and quest system are pretty solid--no game breaking bugs I have found yet. I do not count --bad translation--slow lvling or money making--nor other things like that as a down for the game because its EA and an evolving work.and the devs are fixing and updating so can only get better...If you have been looking for a multiplayer shooter u can play with friends/solo and just PLAY to have FUN at ur own pace then this game is well worth the price.Not many open world PVE based shooter mmo,s out there so lets support the few we have.",1531786655,1531788769,True,5,0,0.563375473022460938,0,True,False,True
707010,43537090,76561198023608229,0,6,21937,0,7439,1615697961,"has issues, still fun",1531622254,1531622254,True,0,0,0.461538463830947876,0,True,False,True
707010,43498218,76561198170139773,155,21,50,0,50,1531465374,meh.,1531465849,1531465849,False,3,1,0.325687766075134277,0,True,False,True
707010,43465441,76561198067463230,274,7,7714,0,4510,1533154534,"I played this for 61 hours now, this game has alot potential, thefact this game is in russian and need some work on the translation ingame dont let this hold you back, yes its in early access but there is plenty to do, there is currently around 100 quests and plenty of more to do after that eg. mining, exploring, group up and do bosses, and if you are in a pvp server go pvp, yes pvp wich means there is PVE for the people that do not like PVP, there is factions you can join and some more but ill leave that for you to explore the team is pretty helpfull and are on top of their problems, the onlny minuspoint i would add is that cross fingers they said this week a new update would come but after having some reasearch they promised that update end of june. yet again not a big issue as their is plenty to do.",1531319008,1531319008,True,4,0,0.545743346214294434,1,True,False,True
707010,43402152,76561198115053299,0,19,1440,0,1440,1531064944,yum yum in my tum i get gun and shut up bum,1531061375,1531061375,True,0,0,0.418198525905609131,0,True,False,True
707010,43340635,76561198012846359,0,24,2875,0,2302,1531801070,"Not bad for a S.T.A.L.K.E.R. MMO. It does need alot of polish still. The graphics, items, surroundings and game play will remind you alot of S.T.A.L.K.E.R. but there are some good and bad differences.

GOOD
different unique anomalies 
multiplayer
crafting
Seperate levelable weapon stats (the more you use an item the better you get)

BAD
Every thing is based on player level. This is vindictive of early MMOs and forces your progress. This is a very bad thing. Not everyone has the same skill level on FPS games. There are some VERY BAD reasons for doing it by level. i noticed as you level, lower level mobs give you less and less loot. So if you dont startigize your money you can find yourself stuck in an area at a higher level with weaker guns or armor without a good place to grind for mob loot to sell for money. People have complained about the min level to use a new weapon or armor, you can grind mob kills instead of turning in quests to slowly gain XP so you cn sell mob loot to get ahead but this is a very lengthy process. You also can't ""get ahead early"". In other words, you cant save your money to try to get alot better weapon to give you a better advantage if you dont meet its level requirement.
The rats and dogs in the beginning are way too difficult, the starter area is to teach you game play and get you a few levels, here you may die quite often if your not careful.
Seperate levelable weapon stats are not earned at a good pace. With 35 hours on record between 2 different characters, i have yet to even hit 3% in any weapon stat. I also believe the higher your level the less it adds to your persentage for killing a mob. 
crafting... well not general crafting but smelting metal... what a pain!!! its not too hard to harvest what you need, however, they only have one furnace you can use witha max of 5 items you can out in the queue and it takes 1 minute to craft 1 iron bar. The time is too little for you to really run around to do anything while waiting for the bars to finish yet its too long to really stand there bored waiting for them to finish. If you have a good run ans want craft the 25+ bars you carried out at the time, expect about 1/3 to 1/2 of your food and wter meter to be gone.They really need to shorten the timer to about 20 seconds max.
No mail system implemented yet and no shared storage between your players. One of my characters uses a shotgun which i buy alot of ammo for yet my other character has over 200 shells i can't give to my first player. 

i do recommend this game if your a S.T.A.L.K.E.R. fan. Things are more spread out than in any of the origional games and you will do alot of running. So if you have plenty of time to kill. I acyually like the bad translation to  english, feels more like i am in actual russia. The whole ""Level"" thing is such a killer to me though.",1530845388,1530845388,True,6,2,0.59851914644241333,0,True,False,True
707010,43334543,76561197967843880,250,122,367,0,224,1633715021,It's neat and I hope it lives to see its potential. I recommend it because I want to see it succeed and I don't see anything that would make me avoid playing it. It has it's EA issues but it's mostly a game and is enjoyable. Needs improvements and Quality of Life additions.,1530823297,1530823297,True,0,0,0,0,True,False,True
707010,43301895,76561198093222782,0,4,435,0,435,1530679564,"I only have 8hrs in game but I like it so far.  A bit of a learning curve after playing Rust the past few years.
I'd like to see a decent guide since many things aren't explained.
It can only get better",1530723752,1530723752,True,0,0,0,0,True,False,True
707010,43251874,76561198027436724,0,11,164,0,164,1523140541,"Boring. Terrible performance issues outside of the main town/city (I was literally getting 12 fps while in an open field with nothing around me).

0/10 would recommend.",1530559029,1530559029,False,1,1,0.400153934955596924,0,True,False,True
707010,43234260,76561198017273212,0,21,1174,0,1052,1531440605,I really wish I could give this game a good review but sadly I can't. The basics are great. the combat system is decent though weapons are level restricted same as armor. Critters are over powered and the random annomolies kill you so fast and most of them you can't even see....not to mention the grind is horrendous. Played for several hours made level 5 and still can't use body armor of any kind. Just a dumb hat and shoes that don't even make a difference. The money you make from animal parts is so low you could never affodt the weapons and armor anyways. I would wait and see if they made some good changes to the game before puchasing.,1530504120,1530504120,False,8,5,0.540465593338012695,0,True,False,True
707010,43227922,76561198049487442,345,43,120,0,120,1530479809,"Bad graphics, bad translations, horrendous voice acting and animation, terrible loot system, awful quests that are impossible to complete, the list go on as to why this game should never have been on steam to start with. No tutorial either, and any wiki page you find, is bound to be outdated. 

I couldn't make it past the first couple of ""gathering"" missions, as the mushrooms i was supposed to collect, would not spawn at all. It's like there is a system implemented that lowers the spawn rate of what ever you need to collect at that moment. 
It soon changed its spawn rate again to accomodate another mission, where I had to collect a different set of mushrooms (how original, devs). 
Enemies respawn within 3 seconds, so you cannot clear an area to loot it properly, starter enemies do a laughable high damage so you have to spend every cent you earn on healing items. 
There are not enough options to change your controls and settings in game.
The game need UI optimizations, basic optimization, quest overhaul, basic QA and not rely on Early Access to do all the testing. It also needs heavy rebalance, as it really doesn't seem that the developers have ever played their own game. As many other Open world games, this one also had potential, but is lost among the others. Seriously, don't get this, you will only regret it.",1530480258,1530480258,False,3,1,0.44201311469078064,0,True,False,True
707010,43216620,76561198216554477,74,22,43,0,43,1530443231,honestly the most boring game i've played,1530451810,1530451810,False,2,1,0.418472081422805786,0,True,False,True
707010,43199800,76561198095716570,144,6,26782,0,16485,1601948879,"Easily the best 15 dollars I have spent on a video game in a long time. I have very much enjoyed the game, the community, the dev team, and the twist on an MMO and survival game. A friend and I were looking for a survival game that had a character progression and stumbled upon this gem. As the updates roll out the game improves and more and more is added. Its already worth the money I spent, but if they keep making the improvements that they have been so transparent about in development, I would have happily paid more for the game.",1530398753,1530398753,True,2,0,0.523809552192687988,0,True,False,True
707010,43033607,76561198188494195,0,17,25,0,25,1529912674,"I like how some games have good game trailers and turns out to be trashy when you actually play it. I'm well aware that it's early access but this game has no future. There are way more better MMORPG-shooter games out there, don't waste your time and money playing this one.  Like please no, this is worth of a refund. LMAO",1529927701,1530276605,False,1,0,0.479343533515930176,0,True,False,True
707010,43135167,76561198809447844,0,53,298,0,45,1554162860,this game can be so amazing if done right right now its just griefers everywhere it gets old. buuuut gameplay beyond that is pretty cool just by playing the game you can understand the aim for it in the long run. i personally like the survival filling after leaving the city its nice. i never ran into any friendly people but heyyy you might lol its a cool game hopefully it stays that way. I WISH IT WAS A MEDIUM GESURE BESIDES A THUMBS UP OR DOWN.,1530208396,1530208396,True,3,1,0.545454561710357666,0,True,False,True
707010,43119782,76561198056854802,0,14,1898,0,1898,1530338083,"Great game to pick up on the summer sale. Payed $9 and have gotten my money worth of entertainment easily.
The graphics themselves aren't the greatest and the NPC russian-english translation is terrible but it's still a great time shooting enemies, interacting with the community of players, and occasionally getting into a gun battle with them.
Way more fun to experience with friends, may feel empty for a solo player traveling the wilderness. (There is A LOT of running)
Excited to reach end game content and get some dedicated PVP time in.",1530163850,1530163850,True,1,1,0.529590308666229248,0,True,False,True
707010,43115758,76561198069353292,445,101,6447,0,1696,1596497984,"I dont normally give reviews this fast, but in favor of the current sale.
1 hour at time of sale.  See what my time is in a week, a moth.  I can tell you now, best $9 on steam summer sale.

Graphics 7/10  Nothing ground breaking but very nice looking.
Performance 10/10 120 + fps no lag
Enviorment.  E for engaging.  you will feel as if you are really in a post apocalyptic land.
Audio  10/10 The music is great.

The game feels like Fallen Earth MMO(back when it was good) and STALKER had a love child.  This game is easy to learn if you play mmos.  ANd engaging enough to enjoy for you gun nuts and Dayz Fans.  In terms of gunplay.  

The bad.  if you are not an avid mmo player you may be a bit lost.
Doesnt seem to be any real in game guides to help you, so if you are seeking a hand held mmo, this one isnt it.  You will find your own way, atleast until guides are made. 

Overall 10/10.",1530149179,1530149179,True,27,1,0.61476588249206543,11,True,False,True
