707010,41913322,76561198085205930,0,12,12880,0,3238,1704045579,You can buy gear with real money now... No thank you. Used to be a great game but now not so much. Had fun but time to move on,1525740154,1705190595,False,0,0,0,0,True,False,True
707010,45645235,76561198265045374,0,27,631,0,535,1703857623,it's still the same game lol,1541451476,1703857733,False,0,0,0,0,True,False,True
707010,42248417,76561198052817286,149,56,11980,0,2894,1699354210,best game ever,1527261950,1698665640,True,0,0,0.405797094106674194,0,True,False,True
707010,148904310,76561198037430231,0,1,117327,1387,94930,1708944074,"Well i preordered this game,
and after 6 years of game play the devs 
if you can call them devs still have done nothing about the cheating chinese players in the game,
they the devs think by either selling or giving these chinese players cheats 
and letting them get away with using them all this time
because they the devs seem to think 
that the chinese players keep the game alive with the ammount on servers
will make the game look good.
but beleive me all it has done is ruin the game for the honest players
and after 1 or 2 months the people leave the game because the chinese cheaters just dominate because of there aimbots and every other cheat they use and get away with, because the devs will not do any thing to them
even with reporting them with vidio evidence of them auto firing l96 and and every other gun in the game
and shooting into the air and killing every animale and person on the map erea
is funny,
all the devs care about are numbers on the servers and they think serverss like the australian server will die without the chinese cheateers on there
which is just BS,
these socalled devs do nothing to help the honest players just look after the 90% chinese cheaters and 8% russian cheaters and the other2% of cheaters will be banned but not chinese or russians,
this game is not a good game to play for any person who hates cheaters like myself and many others
so don,t bother with this game untill these socalled devs wake the f--k up and do the right thing and hardware ban these cheating chinese and russian players 1st,
we have lost over the 6 years 100s of players because they the socalled devs never ban the cheating chinese and russain players that are all through the server,
mainly on the australian server. and to the devs im not in any of the russian or chinese clans 
im an australian an 1 of many of the honest players that have shown you and reeported to you cheater like LBT1 ,LBT11, FREDOM ,LI9HT ,SNIPERK,Aouy,Raskas,nolimit and 100s more i can name and shame
on the australian server,these perthetice chinese cheaters are just ruined the game for 100s of players.
time for you socalled devs to wake up and get rid of these pest for good.
they can 1 shot anyone with shotguns rpg at 300 and 900 yards in the head any ware on the maps.
",1698319262,1698319262,False,28,4,0.704781711101531982,0,True,False,True
707010,147497147,76561198079196016,0,3,233915,0,233875,1703548094,"Тебе нравится играть против читеров и макросников? Тогда тебе сюда. Очень классный контент - тебе надо убивать одного и того же моба, пока тебя не выкрутит от блевоты. Кстати администрация поддерживает RMT и ты можешь до потери сознания продавать любую хуйню на фанпее. Кстати, если тебя забанят, то очень честная администрация избавится от этой проблемы за небольшое вознаграждение! Оценка: 1 хуета из 10. Кста в рот ебал разрабов (тупо покупающих текстуру и выдающих это за работу).",1696245414,1696245414,False,4,1,0.510546624660491943,0,True,False,True
707010,147312317,76561198352706965,0,23,1004,0,494,1697242758,"love it
",1696026021,1696026021,True,2,0,0.52173912525177002,0,True,False,True
707010,142259142,76561197978867559,400,8,1271,0,1271,1689589370,"Insanely unbalanced, quests sending you into areas with mobs much higher than your level, level 2 boars that take next to no damage and can throw you across the map...oh and they can toss boulders at you too.

Needs bicycles or something, not just motorbikes you have to pay real money for.",1689590565,1689590565,False,8,2,0.585082411766052246,0,True,False,True
707010,61292634,76561198056281656,341,30,261991,531,12413,1708734235,",",1578152985,1689258399,False,0,0,0.484972685575485229,0,True,False,True
707010,50731456,76561198097568310,0,79,93972,0,87801,1688009980,"Branded as stalker-ish; it's not at all really. They threw out a few anomolous areas, some useless ""Artifacts"" and warsaw weapons as a majority of the stockpile, sprinkles some booze and said look, stalkerish.

 start of the game, kill rats and little crabs
mid game, kill lizards and wasp
late game spiders.
 Anything else is a waste of time and gets you in debt, exploring is a waste of time, the quests are shitty, after getting to the canyon+ stages they are useless just switch to clan quests. This game is a low effort cash grab, a year+ and nothings to show really except reskinned guns/items for sell for real life money. Fuck it, I tried to love this game was here at release but enough holding out. This is shit, it had potential but the embers are dead and the coal is cold.",1558325371,1688011759,False,0,0,0,0,True,False,True
707010,139354675,76561198181893114,0,7,62481,0,62102,1705243655,This game used to be someone amazing good community good bunch of quests and things like that now it's a grindfest dealing with hackers that never get banned and the content you add can be finished in 30 minutes then we have to wait another 3 to 4 months for more if you come to this game it will be fun to you the new player experience is the only content in the game because after level 20 the way you grind xp stays exactly the same until 50. You also get camped at low level areas by level 40+ just because they can. I mainly blame this on lack of content and lack of keeping people around that can defend and help lower levels overall 2.5/10,1685595065,1685595065,False,37,8,0.778809726238250732,0,True,False,True
707010,137129384,76561197966895323,1000,1,7792,0,6124,1682713586,Is good da?!,1682190785,1682190785,True,0,0,0,3,True,False,True
707010,136534436,76561198170823047,267,11,6402,0,6402,1681233513,"AVOID AT ALL COSTS

Timesink with horrible progression wall if you do not join any PvP Faction.
",1681234171,1681234171,False,2,0,0.488501220941543579,0,True,False,True
707010,134096362,76561198034102026,0,88,337,0,337,1617807779,"I obviously haven't played this in a very long time, but 5 years and it's still in early access with very little progress is a red flag. Looking at the posts, not much has changed since I last played. I don't recommend it as it was so boring that I couldn't make it 6 hours total gametime--every time that I gave it a try, I'd get so bored that I would just end up looking for something better to do.",1677992897,1677992925,False,9,2,0.551724135875701904,0,True,False,True
707010,134045616,76561198099236347,0,1,93573,0,91078,1700461362,"good concept but disapointing delivery crancky outdated engine and punish free cheating game, cheaters everywhere no punish from devs no control. Not an RPG not a shooter as well very poor delivery indeed.",1677936678,1677936678,False,5,3,0.541666686534881592,0,True,False,True
707010,41509607,76561198365892855,53,10,30586,0,25513,1674771001,Chilled MMOFPS,1523819218,1673870227,True,0,0,0,0,True,False,True
707010,103948972,76561198804885460,159,1,11203,0,10508,1703957130,"[+] great survival atmosphere
[+] addictive gameplay
[–] it's still beta",1637875536,1669417778,True,0,0,0,0,True,False,True
707010,54659314,76561197962284980,454,178,86,0,86,1566025746,"Not it, chief.",1566026592,1666332236,False,2,0,0.509703755378723145,0,True,False,True
707010,122163315,76561198390079247,48,47,2639,0,2639,1620921983,i thought this game would give me a will to live but i dont feel any different.,1663028797,1663028797,False,0,1,0,0,True,False,True
707010,121460451,76561198119284234,0,5,12030,0,7973,1663993231,fun game! A little grindy at the beginning but definitely scales in what you are able to do fairly quick,1661843764,1661843764,True,0,0,0,0,True,False,True
707010,42796721,76561198275160666,93,10,118970,160,2616,1708810268,game good,1529266553,1661012664,True,3,1,0.508405089378356934,0,True,False,True
707010,52867138,76561198054903023,410,18,18839,0,4176,1703345506,"Support is dead or can't read. I sent a ticket 3 years ago and never got an answer. Boring gameplay and pay to win ""cosmetic"" events.",1561990305,1660985948,False,1,0,0.523809552192687988,0,True,False,True
707010,114658689,76561198042360618,0,7,64701,0,54561,1688707535,"It is a simple and fun game. If you want to use brain power, you can make yourself efficient, but you don't need to do that to have fun here. It's still in alpha, and has been for about 4 years now, but the team is making a lot of improvements over time.

Obvious down-sides are a lack of content outside of a handful of bosses and PvP, but every game runs into that. The worst part about the game is that you will run into cheaters on every server you play. You can even point out steam accounts made explicitly to play WTLO by their profile pictures.

My experience with co-op has been a lot of obviously non-US players taking up valuable space on the US servers. I'll hop in and see the server is 19% - 30% full, and nobody speaks English.

The game is not very pay-to-win, either. You can buy things with real money, but you're just saving yourself some time because you can really only buy guns and ammo, and there's nothing you can buy in the cash shop that you can't obtain in-game. They just have fancy colors to show that you didn't try as hard as anyone else. Like an emblem of support for the game. 
You can, however, pay for premium for minor exp and drop-rate bonuses. I've played with and without, and the difference is barely noticeable. As it should be.

Overall, the game is fun. Life-In-The-Containment-Zone Simulator.",1651229915,1651229915,True,6,1,0.569931566715240479,0,True,False,True
707010,114643301,76561197998327233,869,9,9857,0,9191,1651515358,Da.,1651199102,1651199102,True,0,0,0.489457845687866211,0,True,False,True
707010,44772653,76561198004524666,421,24,16887,0,7874,1626696456,"I have been following this game ever since i played szone I have been looking for another game like the stalekr series, lately they have been making a lto of adjsutmetns to the pvp system, before you could kill anyone on any non-Pve server, now they hav eti so you can choose to toggle pvp off if udner level 20, ultimately I think this is a good move becaus the game is super gear centered for pvp until about level when when everyone should be somewhat pvp capable.

I have been enjoying the pvp and the grind hasnt been that bad(a lot of my hours are me being AFK, following many of the guides and asking for help with quests is usually a pretty solid route for leveling to 20 in less then 30 hours.

I am pretty excited for the next update and would reccomend returning or giving the game a shot over the next month or two, and to check out the late game content.",1537129550,1650605485,False,0,0,0.523809552192687988,0,True,False,True
707010,114131855,76561198092090670,0,12,65845,1837,59201,1708900245,,1650383885,1650383885,True,0,0,0,0,True,False,True
707010,113133273,76561198333260182,0,12,5179,0,4859,1666762716,No other game like it. Only wish it had a bigger following.,1648757435,1648757435,True,0,0,0,0,True,False,True
707010,110375598,76561198009147631,663,140,719,0,719,1555668156,So many ads.,1645037601,1645037601,False,0,0,0.454545468091964722,0,True,False,True
707010,51189347,76561198140971506,0,8,2454,0,49,1644594307,slow madness,1560345737,1644241612,True,0,0,0.426504790782928467,0,True,False,True
707010,53471136,76561197981993270,0,8,10199,0,923,1657536896,"I read a lot of negative things about the game in reviews, i think most people bought it and thought it would be a lot more than what it is, so id like to clarify some things on a super basic level.

This is a a real case of expectations vs reality. 

The Reality:      this game is missing a lot of things, it has bugs and it has no real direction. It is essentially an unfinished project. There are a lot of shotty bits of half finished things sprinkled here and there.

 *BUT*

This game carries so many of the things that make stalker great, which is what this is, an attempt at making a stalker mmo. It has the great atmosphere, the exploration, and a sense of constant mystery. 

It shares many of its gameplay elements with its single player counter part, whilst also carrying over a mountain of jank. If you can look past said jank you will find a delightful stalker game that is best enjoyed with a friend.

A lot of people in the reviews have real gripes based around the game and the fact is its no triple A game that is life changing.  A lot of elements of it are mediocre at best, but when all is said and done, its the closest quality to a real stalker mmo that we have right now so if thats what you are looking for this is your best bet.

I love the game personally but understand what you are buying into and dont play 5 minutes and trash it, it is your fault if you dont ask questions and research a product before you purchase it.",1562219207,1643737568,True,13,3,0.59380263090133667,0,True,False,True
707010,109052834,76561198156050893,242,24,4845,0,4845,1612575767,"It's honestly just a grind fest, with no real survival mechanics or interesting gameplay besides grinding.",1643490690,1643490690,False,1,0,0,0,True,False,True
707010,108573086,76561198135260219,234,103,18,0,18,1533857992,"dont even know why it says i have 0.3hours on this game, anyway, long story short, i caught covid, THE END",1642893110,1642893110,True,0,0,0.465949833393096924,1,True,False,True
707010,107937815,76561199068179577,3,2,53166,0,10329,1693028282,"this is a great game its a game where you can actualy have fun and not get bored of it, i have more than 1000 hours in this game and there is still so much to learn, im surprised not a lot of people play it, overall it a great game i recommend you play it.",1642100366,1642100366,True,0,0,0,0,True,False,True
707010,71055900,76561198334410321,0,4,69692,0,68109,1660945386,Worst developer team ever been on and off this game for 5 years and hoped it would get better and it’s just gotten worse the devs don’t fix anything and when not if when you run into a hacker the devs turn a blind eye to it and refuse to do anything i would recommend anything other than this game,1592622076,1641733650,False,0,0,0,0,True,False,True
707010,107509688,76561198066728869,227,3,149341,0,98402,1698547986,Will make you rasict real quick 10/10,1641550567,1641550567,True,116,103,0.809484601020812988,0,True,False,True
707010,106965153,76561198131593588,265,41,108,0,108,1565737070,After I bought this game back then and played it for an hour+ on it. I can come to the conclusion that It has made me lost my will to live,1640934480,1640934480,False,3,0,0.480319589376449585,4,True,False,True
707010,106786417,76561198027515644,0,4,494,0,326,1652422425,this is crap,1640738806,1640738806,False,1,0,0.496240586042404175,0,True,False,True
707010,105893190,76561198374771888,0,7,22087,720,1962,1708641153,"it fun , very grinding & lots of challenges",1639608695,1639608695,True,0,0,0,0,True,False,True
707010,105500620,76561198001804177,0,5,1907,0,433,1645903846,"This game combines the best elements of S.T.A.L.K.E.R and Fallout. I definitely recommend this game, though player population is on the smaller side, I love this game",1639023292,1639023292,True,1,0,0,0,True,False,True
707010,103376705,76561198429437284,0,4,27718,0,13891,1691357331,it gud,1637740419,1637740419,True,0,0,0,0,True,False,True
707010,47220508,76561198131926054,991,269,16954,0,6846,1605309531,"Recensione completa: [url]https://www.tanadelcobra.com/will-to-live-online/[/url]

Dopo oltre 250 ore di gioco non posso che consigliare vivamente Will To Live Online a chi vuole provare un MMO post-apocalittico che non metta al centro il dover uccidere senza motivo altri esseri umani. Il gioco è sostanzioso ed anche se alcune quest possono sembrare ripetitive (quelle giornaliere, non quelle legate alla trama) in realtà il tempo viene speso con interesse e il mondo di gioco è davvero affascinante. WTL è una piccola gemma, ed è uno di quei titoli a cui, anche dopo tanto tempo, si ritorna di tanto in tanto con piacere.

Voto: 8.5

Visita la nostra [url=https://store.steampowered.com/curator/34194534-La-Tana-Del-Cobra/]Pagina Curatore di Steam[/url] per vedere altre recensioni!",1543622482,1636544344,True,10,0,0.636206150054931641,0,True,False,True
707010,56395160,76561198085365886,0,121,678,0,678,1565216054,"The game has strong vibe of Stalker series. Despite having some distinct mechanics, it is poorer implementation of the origin.",1572786975,1636451767,False,0,0,0.472440958023071289,0,True,False,True
707010,45744207,76561198045600731,237,38,1038,0,894,1635984451,hopped back on after a while. its been immensly improved. defenetly fun. defenetly worth the money now,1541867592,1635832326,True,0,0,0,1,True,False,True
707010,48925266,76561198083741901,122,9,46374,2382,2106,1708948193,"overall:this game sucks.
the games feels hard at the beginning,and start to become intresting while at level 20ish.and when you reach 30ish level,game become both cruel and boring:you fight because you need to kill sunspider again and again to get exp&money,and if you are underlevel(gear are level-gated),you are absloutely no match for the high-levels with high level gears.and with recent update introduced a random weapon stat system make it way more worse - if you dont rely on a strong clan,you are 100%  doomed as a new player.because everyone can stop you from playing.

game does have a relatively good vibe,with outdated graphic,it does give a lot of STALKER nostaliga.since its a small and casual dev group,dont looking forward much - have a try,and leave,dont stop there.",1549889705,1635688113,False,5,2,0.417942136526107788,0,True,False,True
707010,60752842,76561198041642108,128,13,8272,0,3304,1611602288,"Has Stalker game atmosphere and mmo ofc, super duper not bad",1577540863,1633768739,True,0,0,0,0,True,False,True
707010,99989790,76561198028263188,0,55,110,0,110,1538247499,"Be me :

Launch this game a couple years ago.

Everything is bad english - russianish. Have no idea where to go or what to do.

Hitboxes feel weird. the starting city confuses me.

Meet friend.

Friend says he'll help me find the way.

Friend tells me to go mushroom collecting with them.

Find mushrooms, pick them up as he asks.

Get killed by friend who laughs.

Unfriend them.

Uninstall game.
",1632659851,1632659851,True,18,27,0.6710929274559021,0,True,False,True
707010,99596073,76561198133619232,0,32,1560,0,1560,1585017381,"too many cheaters, try hards, and campers",1632019162,1632019162,False,0,0,0.394871801137924194,0,True,False,True
707010,99579809,76561198058145525,0,1,593,0,488,1632090583,I had fun with  it when it first came out so ya worth a try,1631994320,1631994320,True,0,0,0,0,True,False,True
707010,97636339,76561198055304799,0,9,22780,0,8052,1703943539,"Exciting game. It is free, early acess frequently updating! I enjoy every aspect of the game good job please make it perfect cause it needs some work and we want more content! I would recommend to remove the premium features and make it a game to buy again!",1629058578,1629058852,True,1,0,0.523809552192687988,0,True,False,True
707010,97591217,76561198045346551,0,6,343736,112,194042,1708909508,"will to live online.. your either going to like or hate it and if u like, it will scratch an itch like no other game out there.. there is a tone of stuff to do quests, story line, side jobs, clan leveling, crafting, boss runs and much more.. if your new i just wanna say the players will go where the power goes.. so if one faction dominates the other one most will end up swapping sides so i recommend u make a charactor/alt one on each faction so your (never left out).. as for the toxic players and behavior well its an online game if u cant handle toxic players i recommend u dont play this game.",1629002867,1629002867,True,11,0,0.628834366798400879,3,True,False,True
707010,96000044,76561198034582317,0,71,2297,0,1087,1661574774,"It's Great Runs Great, Not ptw",1626671239,1626671239,True,1,1,0,0,True,False,True
707010,43859116,76561198121795633,156,53,2180,0,2104,1625680493,Stalker Online: Bullets for Hire,1533061964,1626469710,True,0,0,0.490196079015731812,0,True,False,True
707010,95429544,76561198130807487,82,18,236,0,236,1569428735,"paid for it and it was trash then they make it free, missions cofuzzling af and i played wow xD",1625867812,1625867812,False,0,0,0,0,True,False,True
707010,94382260,76561198007637556,746,79,7256,0,3924,1625112516,Black Sunset on top. Don't talk to Confederation scum.,1624679018,1624679018,True,0,0,0,0,True,False,True
707010,94224256,76561198441284300,0,3,100872,0,61210,1701393425,Its not bad just different try it and if you dont like it by level 10 to 20 id say its not for you.,1624463391,1624463391,True,0,0,0.482103735208511353,0,True,False,True
707010,94099671,76561198162495166,0,36,3488,0,1165,1685166723,The game is pretty fun. I really do enjoy it. It does suck that a lot of the dialogue is broken English but you can generally understand what it is saying. Also its pretty good for a STALKER themed MMO. The maps are considerably big and the variety of enemies is nice. As of right now I have written this review with 19 hours of gameplay and have only scratched the surface of content within the game. All in all i am excited to keep playing and hope this game grows and only gets better with time.,1624255820,1624255820,True,0,0,0.482103735208511353,0,True,False,True
707010,41374175,76561198054428937,240,58,12143,0,3648,1623783232,"Had potential, kinda just not fun.",1523242050,1623783396,False,0,0,0.485223084688186646,0,True,False,True
707010,50577014,76561198215142779,0,24,31730,0,104,1705873759,lots of retards and funny guys,1557512224,1622587326,True,0,0,0.421473294496536255,0,True,True,True
707010,92590569,76561197976805286,453,53,2696,0,1111,1671567020,"If dayz, and WoW met in back parking lot for some forbidden nookie",1621975337,1621975337,True,19,13,0.697409152984619141,0,True,False,True
707010,62872617,76561198798161308,0,2,48643,1994,29080,1708885770,"Really nice game 👍
Maybe the developers could bring some identification and individual stuff into the game like Clan Tags to individualize the Clans which could be shown at the players Boxes or at Faction Armor like the Faction Tag.
Eventually make it possible to show which languages the players are able to speak with little Country flags or something, which are shown at the players box too.
",1580666712,1621514267,True,0,0,0,0,True,False,True
707010,43037229,76561198078207166,80,35,184208,0,97623,1629785633,"This game used to be fifteen bucks but steam cucked them hard. Advertised the game as a dlc. What bullshit right. The devs have been making solid progress and have made good on any bad decisions they have made in the past. 
 

There are four classes. Alotta guns. Boss gun drops. Crafting quests exploration. You can toggle pvp off till lv 15. The game has so much all the mmo and survivals have all in one. Plus its a fucking shooter. Hell yes.


You can buy ingame cash via cashshop.....but i feel sorry for the moron who does. Ingame currency is gained so fast lategame you wont know what to do.

Alot of people have a hard time at first but there are alot of good guides out there to help you out.

Ok that last parts a lie. There is only one. Mine.
https://steamcommunity.com/sharedfiles/filedetails/?id=2020002957

After playing for three years. They dont make fast progress.in any form. Wait for a better mmorpg fps survival. This one isnt going to go far. It had potential and that potentials going away quickly",1529935932,1618974643,False,0,0,0.545454561710357666,0,True,False,True
707010,90611213,76561197978959453,0,11,29852,0,25644,1622425354,"Grind Grind Grind
Run Run Run
Die Die Die

This is WTLO in a nutshell.  

The game itself offers a relaxing endeavor into the radioactive wasteland.  Mutated animals, anomalies, and roaming bandits await you (after your mind-numbing 20 minute run to get to them).   There are portals that can help you around the vast world.  However, some of them shoot you 100's of feet into the air, and you land in a heap, only to be spawned back at the previous safe zone.  Nothing about WTLO is quick, except death.  For me, the toil of smacking rocks in a dark cave for literal hours to unearth precious metals needed for armor, is somehow fulfilling and worth the time.  Its a great break from the ultra competitive shooters that are common place. 

 PVP can be frustrating, as players that are vastly more powerful than you, can kill you in an instant.  There is somewhat of a code towards new players, ""don't fire unless fired upon"".  Although, its not always upheld, its been mostly that way for my time in the zone.

Understand again, nothing about this game is quick.  But for me, its been a rewarding experience.

Join a clan as soon as your able. Strength in numbers,  and do some research on the class you wish to play; they vary vastly.

Hope you enjoy it as I have!",1618893937,1618893937,True,0,0,0,0,True,False,True
