707010,41998123,76561198167139199,0,10,161754,0,7184,1707307176,Great game.,1526133217,1526133217,True,3,0,0.469980776309967041,0,True,True,True
707010,41990727,76561198039440283,0,87,157,0,157,1526153006,alpha af,1526100363,1526100363,True,2,1,0.503816783428192139,0,True,False,True
707010,41980586,76561198015052188,0,6,1425,0,69,1601922345,Like it so far i'm a mmo fan and fps fan so best of both worlds,1526052564,1526052564,True,1,0,0,0,True,False,True
707010,41972183,76561198130362776,0,1,21743,0,8508,1531360449,"loving the game but 3 days ago my talk in game stopped working. i can see the icon of my mic symbol next to my PK symbol when i press the ''V"" key but it doesnt light up and nobody can hear me anymore. And no my mic isnt muted, it works perfectly with my Discord.",1526005836,1526005836,True,1,0,0,0,True,False,True
707010,41959891,76561198088609529,282,22,425,0,344,1527119808,"Will to Live online is a FUN game; if u enjoy games that make you take your time like stalker or escape from tarkov then you will enjoy this game. If not, move on.
TL;DR Its fun if u like stalker but in an mmo setting with localization of the server for damn near every location in the world, from Japan and New Zealand to USA and Europe

Pros;
Gunplay sounds and feels awesome, you feel the weight of the shot and it sounds like an actual gun when fired
Map is large and full of content to do
Community is fun to play with and against
PvP is rewarding and doesnt completely fuck when you die (some item/ammo at random is dropped and you get to keep the weapons you had equip)
Silly russian to english translation, that im sure they will rework, hell i'd be willing to rewrite the NPC logs to be more coherent and actually make sense
A story that they are very clearly working on and putting more effort into with each patch
A dev team that actually updates the game and punishes cheaters (if they are not so transparent about why cheaters get banned is a little upsetting but its their game and their rules so deal with it)
Great servers, there seems to be to many of em to pick from
4 Classes to choose from that operate completely different but compliment each other to a great extent
Good Character custimization
15 bucks? its a STEAL for the sheer amount of content this game has and will continue to have.
Its just been released and the popularity of this game is GROWING not FALLING
Just cause its so damn important ill say this again, The devs do not tolerate cheating of any type and ban cheating all the time (look at other reviews of cheaters shit talking the game; and when a dev/mod had something to add to the conversation they shat all over them and said ""looks like they do not like transparency"", but clearly the devs do if u look at how frequent the updates come and how content rich they are, but do not want to give away the details of the anticheat because you know its an ANTICHEAT system)

Cons:
Memory leak, gotta restart every couple of hours to maximize them frames
Optimization issues, if there is to much going on (a lot of ai fighting and player fighting) you will dip in frames unless you have a amazing system
Graphics are not the greatest for textures of buildings (guns look great)
The translation can be wonky sometimes and be misleading on quests, but the community 9 times out of 10 will help you if you have a question.
Graphically speaking, its dated all around (2010-2014 graphics)
Some consern that its a retextured Stalker Online, but its still vastly different in its own way.
Need some gun balancing that is for sure, though like ive stated they sound and look fantastic.",1525947113,1525947376,True,0,0,0,0,True,False,True
707010,41900588,76561198034283788,0,1,52790,0,15084,1649929022,fun game,1525674430,1525674430,True,2,0,0.512164115905761719,0,True,False,True
707010,41900000,76561198138277157,0,12,3052,0,2326,1540667669,"It's a little slow. But once you get over that you will find a community of (mostly) good players, a lot to explore and a S.T.A.L.K.E.R. type of atmosphere. So far I have gotten my money's worth, keep in mind I got it on sale for 15 dollars.  That is  less than a dollar/hour at this point and I plan on playing more.",1525670516,1525670516,True,1,0,0.495129883289337158,0,True,False,True
707010,41889197,76561198310477116,42,11,2957,0,1609,1697204339,"Great Community.
A good enjoyable grind.
Mutated Animals.
Anomalies.
S.T.A.L.K.E.R and Dayz with a pinch of Tarkov.
Recommend: +1

Bonus: You can buy Vodka. :D",1525619062,1525619062,True,0,0,0,0,True,False,True
707010,41874790,76561198172604211,436,47,477,0,456,1661558388,"The all the quests that i have seen are just go shoot this, go collect this. And repeat.",1525554135,1525554135,False,4,0,0.470929831266403198,0,True,False,True
707010,41868422,76561198004052126,96,4,30755,0,5129,1622407867,"The game is in alpha, however its (almost) without bugs. There are missing things like helmets, some weapons and so on... But the devs are working on it. 
As is the game is fun. They need to work on high-level stuff and maps but i believe it will only get better and better.
The playerbase is average, about 400 people online with peak about 1000. It's not that bad when you take into account the game is just one month old.
The devs are listening and responding which is always a good sigh.

The game has potential and i do reccommend it however, if you doesn't like waiting for updates and like games which are final or almost in final state then i would wait.
",1525530425,1525530425,True,0,0,0,0,True,False,True
707010,41868043,76561198141199833,0,6,4369,0,4369,1525732208,"after spending 61 hrs in this game I can safely say I'm satisfied with the purchase. PvP is good, PvE isn't great but it's better than most games at this stage. Dev's arn't just tossing in content they're actually perfecting it as they go. Game is worth the price and you'll get your moneys worth if you enjoy these types of games.",1525529358,1525529358,True,0,0,0,0,True,False,True
707010,41857177,76561198090518315,0,123,2619,0,632,1531686605,"Pros
Has a good FPS feel with bullet connecting
Fun to play with friends
Runs smooth

Cons
Extremely Grindy
Dated Graphics 
Extremely Unbalanced, expect to get 1 shot by snipers you cant see
To upgrade gear you must grind for level req and the grind is real..you will repetatively be shooting rats and dogs for this",1525481903,1525481903,False,2,0,0.475841879844665527,0,True,False,True
707010,41842394,76561198275798911,194,4,71,0,71,1525421179,"This Game is a Good Idea but I would hold on buying this for a while due to the MANY Bugs in it that mess up the gameplay 


6.5/10   To much Cheeki not enough Breeki :-/",1525421525,1525421525,True,0,0,0,0,True,False,True
707010,41837589,76561197970704717,0,57,31,0,31,1525362221,"Very rough, english translation is a bit shit, graphics from 2002 doesn't look like an UE4 engine game, couldn't get mouse aim sensitivity to feel right so not fun to play, boring fetch quests from the start.

Maybe give it a look after early access but we all know EA destroys games and player base early on.",1525390844,1525390844,False,1,0,0.469073832035064697,0,True,False,True
707010,41835248,76561198112981295,0,4,13092,0,3233,1625379188,"game is epic hope they finish it
",1525377799,1525377799,True,1,0,0.519003927707672119,0,True,False,True
707010,41824270,76561198146960299,0,5,43,0,43,1525321951,Its an unforgiving experience when you first begin it runs smooth enough (but could be smoother) the game does get boring pretty quickly.,1525331745,1525331745,True,0,0,0,0,True,False,True
707010,41823532,76561198028205786,330,33,270,0,237,1552283716,"Great game so far, hopefully there will be performance optimization for lower rigs too.
Looking forward to future content!",1525327010,1525327010,True,2,0,0.518518567085266113,0,True,False,True
707010,41780454,76561198125726658,170,10,3805,0,3715,1525381566,"i WOULD RECOMMEND THIS GAME. BUT, it is alpha and it shows. I've died countless times trying to climb down a ladder in a mob infested room. Sure, i could kill all the mobs but im a hunter.And hunters do not fare well in mines. So when i try to climb on such ladders, it boots me off and the mobs rape me. FIX THE LADDER MECHANIC!",1525117934,1525117934,False,6,11,0.514223873615264893,0,True,False,True
707010,41774999,76561198072257299,0,10,1845,0,1318,1674017716,"Good game, very STALKER-ish, but be warned it takes a WHILE to get off the ground. 100x better with friends, but certainly can be played alone. Worth enduring until self-sufficiency, just wish I had friends who had it.",1525097432,1525097432,True,16,0,0.673179090023040771,0,True,False,True
707010,41765124,76561198209670373,144,36,602,0,594,1573679998,"Kill this, collect that, complete quest. Im level 30 now what do i do?",1525047203,1525047203,False,4,0,0.460632026195526123,0,True,False,True
707010,41754324,76561198014741089,0,21,21,0,21,1525004974,"Very, very, very, veeeeery badly network optimizied.
Constantly playing with 12-15ms of ping (1 gbps fiber) but ennemies are warping all around, you get killed by a dog but you cant even hit it because the server struggle handling your inputs.

Otherwise looks fun, unplayable but looks fun.
Will play again when admins pay for real servers.
Not worth my 15€.",1525005128,1525005128,False,3,2,0.430509895086288452,0,True,False,True
707010,41747559,76561198065919605,0,3,17833,0,5589,1657307999,"[b]*Minor spoilers ahead*[/b]

For a game thats in Alpha, I see great fundamentals, visually beautiful and creative map designs, and an easy-to-get-lost-in world. The game start off [i]sorta[/i] slow, and there is some quest lines you can't even understand because the game is not fully translated into english yet. Don't let that shy you away from what is to come. [spoiler] Depending on your class, around level 8 the game really picks up and becomes addicting once you've unlocked better gear, weapons, and skills.
Some of the missions and quests are very puzzling and challenging when you are thrown into something unknown. [/spoiler] I am suprised in AlphaSoft LLC ability to create great atmospheres to play in, weither it be solo, with friends, or with strangers

Also, [spoiler]The end game content is great too, there are still tons of things to achieve and strive for. [/spoiler] And don't forget, you're in a ruthless radioactive MMO shooter, so making friends and enemies is encouraged.

I'm looking forward to see where they go next with the content updates [spoiler] because I picked the Black Sunset faction at the very end of the Alpha's 100 quests, and I want to sabotage, pillage, and destroy every Confederation player that steps outside of Solar City 👹 [/spoiler]",1524975351,1524975351,True,12,1,0.553589582443237305,0,True,False,True
707010,41747254,76561198060119278,0,13,1252,0,1250,1525569930,"Good game and it feels like an actually feels like an mmo, the tag isnt only for show",1524973643,1524973643,True,0,0,0.464516103267669678,0,True,False,True
707010,41730511,76561198080828817,0,4,8968,0,4954,1528139474,"Ignore the people who've played 0.4hrs of the game and given it a bad review. This game offers a lot for players looking for that post soviet Russian apocalypse feeling. If you can get past the first few mundane quests the game will begin to open up along with a map that was way bigger and detailed than I expected. Although most of the gameplay is quest related it's the interaction with other players that makes this game so much fun to play. Minning coal in a deep mine does not sound exiting, but when you do it with a random Polish guy you met and he has the tendency to screams like a girl at every sound he hears it makes it so much more fun. And I think that's what has kept me playing. The interaction with other players that I haven't experienced on a game like this since Dayz mod. There is always a chance of being shot, but there is also a chance of a good adventure if you take the chance to talk to someone. So to sum it up. Yes it's early access and a bit buggy. Yes it is quest orientated and that may not be everyones cup of tea. But the player interaction and a chance to explore a creepy post apocalypse world is great. If you enjoy dayz, escape from tarkov, Stalker this game is worth a look :)",1524901485,1524902918,True,27,2,0.686409473419189453,0,True,False,True
707010,41730519,76561198221413128,0,4,48205,0,7519,1701866121,"Great mechanism, but the some quests are undervalued (some quests are very hard but with limited return).",1524901516,1524901516,True,0,0,0.495185703039169312,0,True,False,True
707010,41725707,76561198106862971,84,5,10657,0,7739,1650349406,"Amazing Game! Great while playing solo or with friends. Watch out for some high levels camping low level areas, thats the only down side about this game. Everything else about this is AMAZING! best game played in long time. Cant wait for more updates to roll around. Very nice devs! :)",1524874765,1524874765,True,0,0,0,0,True,False,True
707010,41725525,76561198092542818,966,128,18,0,18,1524871562,"Translated badly to the point that most sentences either seem surreal or give the wrong idea of what's going on, Gunplay Is unsatisfying, It's a shitty MMO. Also even on maxed out settings at 2560x1440 the game looks worse than the original STALKER games from the mid 2000s",1524873706,1524873706,False,4,0,0.473190665245056152,0,True,False,True
707010,41722623,76561197972993372,469,40,3330,0,2970,1536729608,"40 hrs into a $15 dollar game that is basically Stalker Misery Mod the MMO. Having a blast with friends.

",1524858986,1524858986,True,9,0,0.569430410861968994,0,True,False,True
707010,41709780,76561198009390687,0,33,964,0,911,1616229656,"PVP is kinda crap, The higher level will usually win until you are like level 20+ then it comes down to skill.

Quests are mostly fetchy.

The framerate is good, i usually hover at 144 with a gtx 1080.

I didn't think I would enjoy this game as much as I am. 
It's definitely a fun game, but it's also only 15 dollars so don't expect AAA quality.
",1524800306,1524800306,True,2,0,0.483305037021636963,0,True,False,True
707010,41470221,76561197972661230,0,75,324,0,324,1523147707,yet another russian survival sim..,1523660982,1524796931,False,0,0,0,0,True,False,True
707010,41690639,76561198009621063,0,32,24,0,24,1523817114,this game felt like a trip back in time. not in a good way.,1524700518,1524700518,False,8,2,0.468645185232162476,0,True,False,True
707010,41690443,76561197983376417,0,21,8050,0,8050,1524698888,"Was a lot of fun the first week. Now the loot drop rates have been nerfed so hard that making money (tokens) is near impossible. Once you`ve bought meds, ammo and repaired your gear you break about even. The players that started playing before you got rich before the nerf and you will never catch up to them unless you don`t have a life. Stay away from this one and play a real game.

Walking simulator that feels like a minimum wage job.",1524699308,1524699308,False,152,40,0.808730185031890869,0,True,False,True
707010,41511888,76561197971570576,614,234,4269,0,4244,1565796726,"23 Hours In about 3 days... This game got me hooked.. 

Quick Review:

I don't know how to describe it.. It has shity mediocre graphic.. It has mundane repedetive fetch quest.. it has a slow grind to progression.. Yet The world got me hooked.. The feeling that anyone can kill me at any time.. Yet that they don't... A system that allows for freedom but made benefits to not just Kill anyone and all on sight..  I think If your a fan of the Stalker games.. Then you must give this a go..  But... If your easy to lose interest in grind.. Repedetiv combat.. And fetch quest.. then this is not for you. 

Full Review: 

I feel now with 70 Hours in the game I can make a review. Game has allot of stalker Feel to it.. A fan of S.T.A.L.K.E.R games will notice it instantly.. Game has fun gunplay.. It's simple but ok.. PVE is well, all i can say is they are trying.. Some enemies spit acide, some knock you down. some cripple your movement some knock you back.. They all got them small simple mechanics to them that makes it not completly braindead. I got allot of hours out of this. And I feel It was worth it.. Problem Now is that Im lvl 18.. At lvl 13 There was no more quest currently avaible in the game.. So since then It's been a total Monster grind.. And the PVE is not interest enough to make it fun.. PVP is really fun.. But the game punishes PK people allot.. Not just with big safe zones protected by Machine auto AIMbot turrets that kill people.. With a long distance to add.. But also by showing your name in the chat to who you killed.. Meaning just a bunch of kills and your name is marked by the community for extermination. And it happens that some people get so much heat they forced to make new characters.. And with the grind.. That is not fun..  

There's allot of wasted effort aswell.. There's no friend list or blacklist to keep track of people you like or dislike that you wish to kill or play with..  There's a pvp arena nobody uses and people abuse it to teleport around betwen safe zones. There's really no variation to quest other then kill that or go collect that or this many of that item..  Fetch quest.. 

What made the game for me was how it was community run.. People protected people and acted as guards and police. People try to robb people to get more items then just kill them and hope for a good drop.. People run the market and prices..  Still it falls short late game as there's no real reason to to do anything.. when you grinded materials for good armor and guns.. And your high lvl. There's no point anymore.. Either you see youself turn mad from grinding mobs.. or you become insane and PK everyone and get marked as a bad guy which no one likes then..  There's a whole lot of problems with system and management.. No real balance to it all. No clan function either..  I just feel a huge lack of content.. Sure 70 hours.. but It would probedly taken me 30 hours if i did not do so much pointless exploration. 

It's a 6/10 for me now..  I think with time.. this will be a great game.. but as of now.. If you hate grind.. then stay far away from this game. 

Putting down a youtube video of a guy that Deserves cred for he's excellent explenation of this game.. Awesome man.. 

https://www.youtube.com/watch?v=tqOKvdEbpwE",1523827299,1524689956,True,0,0,0.47826087474822998,0,True,False,True
707010,41683046,76561198038250300,0,13,9392,0,7856,1649548658,"With over 100 hours I can finally write a review about the good and bad of this ALPHA Game. 
--------------------------------------------
Let me start off by saying I believe this is worth every penny you pay for it. It runs great, has a great atmosphere and the community is developing into something finally. I have paid way more for other early access games, this one has a great price tag.  
Pro- They pump out updates about once a week and they are constantly adding new features to the list of things they are going to be adding.
Pro- The gameplay is fun and exciting, when not running to a mission or zone. There are quite a lot of mechanics in this 
game that can be developed into something very fun and competitive. 
Pro- Great dev team that tries to communicate with its audience even though they don't speak their native language. (they translate a lot of stuff for us and you know it, don't judge their translations unless you can read and write English and Russian. (If you can, message the devs, I bet you could land a job.)
This game is VERY EARLY ACCESS.  You have the chance to provide feedback and suggestions at this point because the game is so fresh and new, they don't even consider it close to being finished yet (and thats a good thing). 
That being said, here are the cons atm.
Con- Walking for 10 minutes at a time can get boring, we honestly could use motorbikes, or something to travel around a little faster, especially with the ever expanding map that is already quite large.
Con- There is a lack of content right now but that is only due to the fact that this game is in Alpha and is being produced as this teams first release. 
Con- The map can feel a bit empty at times, but like I said. They are adding more monsters, weapons, ect.",1524669183,1524669183,True,0,0,0.48827749490737915,0,True,False,True
707010,41682865,76561198113504787,0,27,23297,0,2289,1686693748,"This is a game you have to try, why? first because it's really cheap and if you like survival, exploring, shooting and running for your life, this is your kind of game, also, you help the devs make the game better, just imagine how awesome can be this game in the future.

The game don't have a month since it was released to steam, and it have really good comments and others are really poor and unfocused, why? because this is a ""starting game"" like warframe when it came out, how about now? Warframe is something else, this game have that potential, a lot of it, at least in my opinion. 

I have fun in this game like i didn't had in a longtime, why? because when you need to get into a house, full of hungry dogs and there's not a single car to jump to, that's adrenaline right there, is not a grinding game (i hate grinding, when i play, i want to play, not to work), yeah, you need money (tokens) but you can find them doing quest or going to a place and kill mobs to sell their pieces, but you don't need to be there the whole day, and there's so much to explore, the map is HUGE and there's a lot to explore caves, dungeons, bunkers, and another map i'm too noob to go, the history so far (i',m lvl 10) is different from the stalker or the Szone, i have played both of them, this game in my opinion, needs more anomalies, one feeling i hate and love from stalker or the Szone, was to watch my every step.

About the mods, we have normal ones and bosses, they have weak spots and abilities.

I like the weapon system, you can improve your guns with attachments and there are different types of bullets, plus the sounds of the guns, is great.

About graphics, i play in epic mode and the game looks great, is not a ""the witcher 3"" engine or a ""kingdom come deliverance"" engine, but it really makes the point of the environment and the enemies, and i know this will be improved, it doesn't affect the gameplay not even a bit.

There's a lot to improve, but this game have a great potential and that's what i really like of it, the different ways this can be an awesome game with a lot of ways to be played and even more ways to have fun with it.

We need to give it a chance, i'm sure it won't let you down.

NOTE: If you want, join the US-3 PVE Server and i'll give you a hand any time you need.  

",1524668593,1524668593,True,1,2,0.474598199129104614,0,True,False,True
707010,41455004,76561198124444691,0,26,1120,0,1120,1524026314,"Here, you start missions by quest givers.
They want you to go get some pointless object, return it, and repeat.
over, and over, and over...
The grind is not fun, but you have to do it.
or you cant pvp for crap, cant lvl up, cant hold any good gear.
I find myself desperately hoping for the fun to start, it must start after i do this next pointless mission, nope. 
just another mission to gather stuff.
I know its early access, but the whole game is built on giving npc questgivers everything they ask for.
Im already so burnt on this game, i have no motivation to be played by it any longer.
This game sucks, the best thing about it is the laughs you will have at the horrible translation.
I think everyone should see just how bad a english translated russian game can be, this takes that cake for sure.",1523592657,1524617642,False,1,0,0.523809552192687988,0,True,False,True
707010,41669146,76561198062596703,217,11,2457,0,1040,1556935203,"The game is not as toxic as people will tell you, at least not on the US servers. Fun post apocalyptic mmo with lots of walking.",1524604797,1524604797,True,0,0,0.495185703039169312,0,True,False,True
707010,41658884,76561198021827578,231,18,192,0,192,1524639802,good,1524569803,1524593334,True,0,0,0.439560443162918091,0,True,False,True
707010,41658943,76561198069824075,0,8,4258,0,3545,1630629328,What Nether failed to be,1524570079,1524570079,True,6,1,0.557524621486663818,0,True,False,True
707010,41654513,76561198062414780,0,5,2021,0,1347,1702795932,"Overall I really enjoy this game, and when it boils down to it thats the end goal of every game right? Be fun to play. Granted this is in very early access and the general gameplay is extremely farmy and often very rough around the edges. If you come into this expecting a full game you will have a bad experience and will be right in having so. Community is also generally really good as far as I have gotten, with most people being willing to converse and even help out one another. In all though, wait to purchase this game unless you are fond of games that have a very slow pace.",1524544033,1524544033,True,6,0,0.565036475658416748,0,True,False,True
707010,41637010,76561198126525056,72,37,1515,0,1397,1585017425,IN RUSSIA STRONG WOMEN FU{K YOU,1524455809,1524455809,True,1,2,0.358689934015274048,0,True,False,True
707010,41630539,76561197999216524,522,43,6,0,6,1524422284,"I really Don't like it, not worth the 20 had to put for 17. Graphics are bad and choppy, huds huds are complicated and cofunising. It needs so much work but i dont think it's ever going to get it. The Idea is not horrible but honestly just go play Day Z you'll probably have more fun.",1524422465,1524422465,False,5,3,0.426140576601028442,8,True,False,True
