773790,70107304,76561198047134587,0,222,630,0,146,1680631723,"Despite recent update, development still happens at glacial pace. That said, at least economic model makes sense. For comparison - the one in ""Lords and Villeins"" is totally broken, with many professions strictly unprofitable. And the one in ""Foundation"" doesn't exist - as long as your peasants are employed, they can be taxed, even if their workplace is not operating and doesn't consume any upkeep - so you can pay for imported goods by money conjured out of thin air.",1590947448,1679932005,True,0,0,0.450184494256973267,0,True,False,True
773790,135550842,76561198040421506,0,9,4957,0,3616,1685223903,Love this game,1679931186,1679931186,True,0,0,0,0,True,False,True
773790,135550048,76561198082841295,0,7,19608,0,8716,1704161836,"One of the best Colony Builders made, it's beautiful and the detail is truly amazing.  This dev has in my opinion created a classic that will last for ages.  They have raised the bar for other city and colony builders to aspire to.  All this for an Early Access game, wow.",1679930280,1679930280,True,1,0,0,0,True,False,True
773790,135546823,76561198044518835,0,2,1269,0,1269,1679815478,"I rarely write reviews on Steam, but this game really deserves to be praised. I'ts early access and it shows, but the game is already good and there's enough content for long hours. Almost every aspect of Ostriv shows developer's commitment to realism and attention to details.  Regarding gameplay the closest comparison would be Banished but instead of pseudo-medieval setting we get to build 18th century Ukrainian settlement. 
The developer behind this game is Ukrainian and despite being directly affected by the Russian invasion he continues to develop this game. Yesterday I encountered a bug and wrote about it here on Steam forums. The dev responded in the thread, but not only that, today the game got hotfix that adressed the bug. 
Slava Ukraini!",1679926716,1679926716,True,3,0,0.523809552192687988,0,True,False,True
773790,122840133,76561198102147201,256,94,1716,0,1475,1681088510,"I really like this game. It is still pretty unpolished, but has some really good mechanics despite its very steep learning curve. Unfortunately the game development was delayed due to the Russian invasion of the Ukraine.

Слава Україні!
Слава Украине!
Glory to the Ukraine!",1664147647,1679889702,True,10,2,0.550901055335998535,0,True,False,True
773790,135512627,76561198097842829,0,3,51691,0,17319,1703619600,"I did buy this game for two reasons, because I enjoy this genre and to encourage the creator. I have been really enjoying it so far, and am excited about future updates. It has a good amount of content for being in development. I have not checked out Alpha 5 yet (tried to stay spoiler free), but will do so after writing this comment :)
The only downside is that I get some visual glitches, but I think it is something in my settings that is doing it, since I have not seen anyone run into the same issues.",1679872162,1679873586,True,3,0,0.520264685153961182,0,True,False,True
773790,135506949,76561198037304087,38,2,721,0,721,1676917890,"Really beautiful and enjoyable sim. It is very much worth it. Prettier than banished, its economy mechanics are well thought out and no real performance issues (I play this remotely).

Also, supporting a developer at this stage with everything that is going on there is vital. Later stage game feels a little empty but this is to be expected and at early access this is amazing. Definitely support this if you can!

Things that help: I had a couple of death spirals in the beginning - there are some good guides but the economics guide is invaluable as it balances finances and economy (on steam somewhere by McSpudFace).

Really awesome!",1679865276,1679865276,True,1,0,0,0,True,False,True
773790,67316043,76561198165498661,0,17,5346,0,649,1687117082,"Exquisite, glorious.",1586891447,1679862729,True,1,0,0.523809552192687988,0,True,False,True
773790,135495440,76561198903620480,0,1,2212,0,1033,1703367377,"I can't really provide a single point of criticism outside of the context of game being in development and having its current issues tracked and fixed on the go, so my sentiment here is somewhere along the lines of ""What the **ck is not to like about this game??"". My personal favorite of a mechanic is the one that's probably considered cheating by some other city-builder players but is actually hella realistic - and that is those gardens attached to residences where inhabitants grow their own random food. This particular mechanic has been a sponsor for my increased appetite and trips down the memory lane. 12/10",1679854104,1679854104,True,2,0,0.523809552192687988,0,True,False,True
773790,93808443,76561198287966763,0,4,13660,0,2113,1698272103,"Ive had this for a while now, This game has taken over my obsession with Banished by being more in depth and more interactive, and there is so much more to do in this one. its an amazing game for medieval builders, and there arent many great ones to compete with. Absolutely in love, cant wait to see how much more it evolves.Edit for Alpha release: OMG GUYS BUY THIS GAME!this is one of the best colony sim games Ive played, and it holds my heart because of the style and progression not to mention how absoluitely beautiful and relaxing it is. You need this game. I'm telling you.",1623773295,1679849642,True,0,0,0,0,True,False,True
773790,133601374,76561197975224305,0,4,9842,538,3881,1708801936,"Absolutely Recommend!A freeform, relaxing and low stress city builder in idyllic and peaceful countryside setting. Choose from many maps with different terrain features and get to building. Build farms and house plots with farms as big or as small as you like. Build homes with farms and the people feed themselves. Export Charcoal (or anything!) to make cash, and you have a basic economy going! And from there, you grow!Even at alpha 4 the game is incredibly polished. A self sustaining city is attainable, and luckily you can trade for anything you can't find yourself on the map. Intuitive supply and production chains, wonderfully managed seasonal labor (you have to mod or micro manage this in other games) and a complex economy to manage.Building a town hall immediately is essential to manage money. Once you can figure out the best balance for your money, growth becomes very manageable. So excited for Alpha 5! Buy now though, because the game is already incredible and only getting better. And you can support Ukraine and help them return to the peaceful idyllic steppe land they deserve.-------EDIT AFTER ALPHA 5!!-------Major upgrade! So many quality of life improvements that I didn't even realize I wanted! Incredible update and very impressive considering the conditions! I am in awe, this game is great.",1677349830,1679845593,True,0,0,0,0,True,False,True
773790,135466372,76561198210916147,38,4,423,0,235,1686419000,glad to support you guys <3,1679827647,1679827647,True,0,0,0,0,True,False,True
773790,135453927,76561197984011343,361,6,3408,0,1913,1694861934,the best of its kind,1679812881,1679812897,True,0,0,0,0,True,False,True
773790,135443065,76561197979075553,385,54,2646,0,2646,1633558872,"Wow, these guys keep chugging away despite Russia.Nice job.",1679799385,1679799385,True,8,1,0.521818459033966064,0,True,False,True
773790,135427869,76561198058679900,423,5,2119,0,1636,1705148170,"Це одна з найпрекрасніших ігор, що я бачив! Надзвичайно красива музика, цікаве художнє оформлення та захоплюючий ігровий процес створюють неповторну атмосферу. Щоразу, заходячи у гру, радію, що такий шедевр було створено саме про Україну.  Дякую за прекрасну гру!",1679781761,1679781761,True,31,1,0.699719786643981934,0,True,False,True
773790,135427474,76561198308277555,0,1,1788,0,1784,1704038887,Unfinished and posting paid dlc. dont buy.,1679781346,1679781346,False,2,2,0.317944765090942383,0,True,False,True
773790,135421753,76561198046355486,0,2,23478,280,16472,1708999374,"Beautiful game, detailed, and well done. Easy to understand. Great job.",1679775866,1679775866,True,3,0,0.503020584583282471,0,True,True,True
773790,135417739,76561197984674127,0,7,5546,290,3563,1708820486,"Have not been back for over one year. Today, saw the update which is quite interesting. One of my favorite games, just got boring with little more to do. The update has brought me back to starting a new game, checking the new map and the many other new features. Looking forward to planning a new village. Thanks for the new update. I will be supporting you all.",1679772174,1679772174,True,0,0,0,0,True,False,True
773790,84880029,76561199003006575,0,20,10217,1,3277,1708688902,Love this game spent over 30 hours so far and keep coming back to it. for me its a 10/10.,1610925937,1679770904,True,0,0,0,0,True,False,True
773790,135413496,76561197970479700,1784,149,1560,0,1560,1588774531,"Good quality work, slow dev, but methodical and good updates. It is a nice city builder.",1679768398,1679768398,True,26,3,0.673247456550598145,0,True,False,True
773790,135412052,76561198318828123,0,21,1310,0,1265,1704480045,Based devs releasing a major update while in the middle of an active warzone.Buy the game to support them.,1679767194,1679767288,True,246,5,0.883775889873504639,4,True,False,True
773790,80202636,76561198168276308,236,30,3598,0,994,1689620146,Very relaxing.,1606381286,1679761783,True,0,0,0,0,True,False,True
773790,135401811,76561198403337457,165,5,4391,0,4210,1679943179,"solid 9.5/10. Overall the game is fun and pretty straight forward. Been following this game for a number of years now and happy to see the progress the team has achieved. Mad props to you guys during all the troublin times over there and still updating your game. Better than most AAA titles now days.Will say tho, late game some things do tend to bug out here and there. Nothing absolutely game breaking but some noticable things. Small white AI lines appear from certain buildings to another, not sure why. Maybe visually showing the AI path? IDK.Can't wait to see what is in store for this tittle. Easily better than AAA titles",1679758880,1679758880,True,19,0,0.600902259349822998,0,True,False,True
773790,135200144,76561198070549944,312,9,683,0,683,1679378371,"Дуже крутий сітібілдер, з купою дрібничок, котрих немає деінде :)",1679534250,1679534250,True,13,0,0.554276823997497559,0,True,False,True
773790,135021917,76561198034919133,447,27,2486,0,361,1692823296,"Simply a wonderful city builder! You can compare it with ""Banished"", but more beautiful with wonderful details (like the paths appear and disappear after a while, depending on how much the citizens uses them). Unbelievable, that this is ""just"" the Alpha Version, 'cause it feels finished, and I can't wait to see, what will come next in this game.

Absolutely recommended!",1679297827,1679297827,True,0,0,0,0,True,False,True
773790,134989406,76561198133259901,64,7,396,0,96,1686596372,I loved playing this game but every time I exit out of it and go to load the save it crashes,1679252286,1679286316,False,0,0,0.462108731269836426,0,True,False,True
773790,134917968,76561198012200324,558,12,219,0,219,1610217468,"A very atmospheric game, with some intricate mechanics already implemented and much more to be done in the future! Already playable and well done so, this will be enjoyable for any city builder enthusiast who wants some great flair to their game.",1679174201,1679174201,True,0,0,0,0,True,False,True
773790,134906640,76561198030803154,222,36,593,0,152,1679236107,"Even though the game is in early access, it seems polished and deep. The graphics are even nice. So far, I'm pleasantly surprised.",1679163512,1679163512,True,0,0,0,0,True,False,True
773790,134851166,76561198067243296,0,2,9765,681,2440,1708912885,I love Banished. I love this game.,1679101411,1679101411,True,0,0,0,0,True,False,True
773790,93898305,76561198180324814,0,7,7463,0,241,1707659851,"Cool progress for Alpha version, want more features from the road map ))",1623930635,1679049965,True,0,0,0,0,True,False,True
773790,134722941,76561198146041671,36,11,1841,316,359,1708979106,любов,1678918588,1678918588,True,0,0,0,0,True,False,True
773790,134606428,76561198005908847,0,15,71287,351,2007,1708616229,"banished on steroids
",1678725368,1678725368,True,0,0,0,0,True,False,True
773790,134522421,76561198045805268,0,20,119,0,119,1650381776,best game ever.,1678605886,1678605886,True,2,0,0.478097826242446899,0,True,False,True
773790,134455194,76561199339682050,0,1,49630,814,10725,1709000380, I think this game is great it keeps you thinking all the time  So keep up the good work,1678522528,1678522528,True,0,0,0,0,True,False,True
773790,134380938,76561198089154487,0,4,4580,95,658,1708921333,fun game definatly a challenge,1678412011,1678412011,True,0,0,0,0,True,False,True
773790,134343795,76561198849979529,0,1,770,0,410,1678387704,Love it! Can't wait for the next update.,1678361309,1678361309,True,0,0,0,0,True,False,True
773790,134327573,76561199218840703,0,7,2877,0,254,1703978163,it's amazing! can't wait for beta,1678327841,1678327841,True,0,0,0,0,True,False,True
773790,134289170,76561198813122514,593,53,4378,0,4378,1634391578,Good city builder game worth the purchase. Prepare for winter,1678273106,1678273106,True,0,0,0,0,True,False,True
773790,134142619,76561197964734018,0,28,433,0,433,1616366856,Strong management sim with a lot of potential,1678044002,1678044002,True,0,0,0,0,True,False,True
773790,134111127,76561199069783782,0,1,15784,62,1519,1708732508,very good an relaxing city building game and simple to use ideal for a beginner.,1678012811,1678012811,True,0,0,0,0,True,False,True
773790,133937160,76561199207174328,0,3,7785,1,7496,1708907863,"It is a very nice game.
You make the city the way you want and you try to make it beautiful.",1677789979,1677789979,True,2,0,0,0,True,False,True
773790,133935916,76561198007252043,0,10,91214,0,79542,1702868911,Great Game i love it,1677788439,1677788439,True,1,0,0,0,True,False,True
773790,133787713,76561198197730028,0,11,852,0,836,1703227372,"The game, even if it is not 100% finished, is one of the most fun games I have played in its category. The economy, trade, and even the changing environment (with its unique challenges)make it stand out from the rest. It has some bugs here and there but nothing more than a simple exit and load can fix that in secs. Although and After a point (because the game is in pre-release state)you feel that you have spent a lot of time building and managing everything to the maximum and now you have nothing new to do but from what I read the creators are preparing new things even in the middle of the war. I cannot wait for new content and the next day for this small gem!!! I wish them good luck and the war to come to an end soon.",1677570523,1677570523,True,0,0,0,0,True,False,True
773790,133786234,76561198449781464,0,4,11335,951,2690,1708782286,Ostriv is one of my fav games. It is such a detailed and satisfying game. Updates are a bit slow as the devs are Ukrainian <3 But the updates are still happening. If you like Banished and similar games this is a safe card! Please support!,1677567559,1677567559,True,1,0,0,0,True,False,True
773790,133628705,76561197989133702,0,9,3331,4,2154,1708815949,"Laid back yet detailed colony sim that will have you losing hours at a time while your little families build their incredibly detailed and organic looking towns.

Also it's fully possible to make your down a commune with a powerhouse economy, so extra points for that.",1677375864,1677375864,True,0,0,0,0,True,False,True
773790,133574749,76561198123972168,0,2,1878,0,513,1685218098,"After 8 hours of play and really enjoying it, the game now just crashes every time I try to play. No support available other than ""report a bug""",1677327749,1677327749,False,0,0,0,1,True,False,True
773790,133481527,76561197985340912,0,296,32868,470,89,1708944342,"Ostriv is an amazing game & a hidden gem!

🟦🟦🟦🟦🟦🟦🟦🟦🟦🟦🟦🟦🟦
🟦⭐️🟦🟦🟦🟦⭐️🟦🟦🟦🟦⭐️🟦
🟦⭐️⭐️🟦🟦⭐️⭐️⭐️🟦🟦⭐️⭐️🟦
🟦⭐️🟦⭐️🟦⭐️⭐️⭐️🟦⭐️🟦⭐️🟦
🟦⭐️🟦⭐️🟦⭐️⭐️⭐️🟦⭐️🟦⭐️🟦
🟦⭐️🟦⭐️🟦🟦⭐️🟦🟦⭐️🟦⭐️🟦
🟦⭐️🟦⭐️🟦🟦⭐️🟦🟦⭐️🟦⭐️🟦
🟦⭐️🟦⭐️🟦🟦⭐️🟦🟦⭐️🟦⭐️🟦
🟨⭐⭐🟨🟨⭐⭐⭐🟨🟨⭐⭐🟨
🟨⭐🟨⭐⭐🟨🟨🟨⭐⭐🟨⭐🟨
🟨⭐🟨🟨⭐⭐🟨⭐⭐🟨🟨⭐🟨
🟨⭐🟨🟨⭐🟨⭐🟨⭐🟨🟨⭐🟨
🟨⭐⭐⭐⭐⭐⭐⭐⭐⭐⭐⭐🟨
🟨🟨🟨🟨🟨⭐⭐⭐🟨🟨🟨🟨🟨
🟨🟨🟨🟨🟨🟨⭐🟨🟨🟨🟨🟨🟨
🟨🟨🟨🟨🟨🟨🟨🟨🟨🟨🟨🟨🟨",1677233335,1677233335,True,26,0,0.447543114423751831,1,True,False,True
773790,133449021,76561198241429708,0,21,182,0,182,1676527122,"Fun, different. I can't wait to see what the Devs do with this game as it continues to be developed. I hope they make steam achievements a  thing at game launch because no achievements would be pretty lame.",1677193470,1677193470,True,0,0,0,0,True,False,True
773790,107351195,76561198117496191,1470,113,5456,0,219,1686024850,"I am 42 years old, and throughout my life I have played many city builders and colony managers. This game is made with love and intelligence. The details prove it. Details such as being able to play it with the mouse only -like RimWorld- or the building construction animations. Just as intelligent are its inhabitants, who prefer to move rather than starve. Still, people die, so be prepared to plan a graveyard.

The pace of the game is very reminiscent of Banished. We will not receive attacks. So there are no defensive buildings, no weapons factories. Only useful buildings to develop and beautify the city. City that grows and expands organically. The music perfectly accompanies the leisurely and medievalesque rhythm.

The game is delayed in its development by the war in Ukraine, but it has enough content to be enjoyed. For examples, just check the screenshots of the community, where you will see cities of up to a thousand people.
I look forward to new content.",1641356058,1677178823,True,4,0,0.494873523712158203,1,True,False,True
773790,133384865,76561198071108192,0,19,749,0,749,1657657026,A very peaceful relaxing game without enemies),1677105792,1677105792,True,0,0,0,0,True,False,True
773790,133348176,76561198854179284,135,11,3723,2136,622,1709009594,hous,1677054071,1677054071,True,0,0,0,0,True,False,True
773790,133333643,76561198102942477,0,19,2085,0,1827,1684376405,"A great city builder. Can be tough at times, but has sucked hours of my time. 10/10 would recommend.

SLAVA UKRAINE!

",1677026911,1677026911,True,1,0,0,0,True,False,True
773790,133225332,76561198037374024,0,6,7356,0,3686,1690581435,"YES AND NO
YES: Buildings nice.
        Map seeds are neat and clean.
        Town layout customization.
NO:  POPULATION LAZY 
        NO INCREASE OF POPULATION AT ALL ; HOW U-TUBE PEOPLE DO IT?
        NO PEOPLE MIGRATE, ALL LEAVE AS THOUGH PANTS ON FIRE & NO RETURNS!

FIX POPULATION PROBLEM BY SIMPLER METHOD.  HAVE U-TUBE SHOW VIDEOS OR PUT OUT A GUIDE THAT GREAT IN EXPLANATIONS OF TO DO STEP BY STEP.

I know you have bugs fix the population bug and maybe I'll recommend this game great.  Untill then it's a piece of unfinshed property that I wasted money on.
",1676885486,1676885486,True,0,0,0.472079843282699585,0,True,False,True
773790,132904381,76561198035939238,0,1,13267,0,8604,1705363610,"This game is so beautifully designed and crafted with incredible detail. Although it isn't finished yet - the developer is from Kharkiv, Ukraine, and I have tremendous patience and understanding for the challenges of developing a game during a full-scale war where repeated attacks on civilian infrastructure lead to widespread and sustained power outages - everything that is in the game works beautifully. Eventually I get to a point where I feel like there are no more milestones to strive for - growing the town big enough for a tavern, etc. - but I love the game so much that I just start over with a new settlement. This game is really great comfort food for me while still being enough of a challenge to keep me interested. One thing that I especially enjoy that makes it stand out from other city management-type games is the very specific sense of time and place. This is a settlement/village/town in Ukraine in the 1720's, and that is infused throughout the whole game. Your townspeople all have individual names, and you can hover over and see their wholly Ukrainian names - Oleh Carpenko, Olena Kravchuk, Olha Simonenko, Dmytro Shevchenko, Mykhailo Kovalenko, etc. Along with the fairly standard and common potatoes, beef, milk, and wheat, products that can be produced, purchased, and/or traded include horilka and salo, along with sunflower oil, beetroot, cabbage, honey, buckwheat, and horseradish, which continually reminds you that we're specifically in Ukraine. 

Things I'd love to see or that I'm looking forward to being added as the game gets finalized:
- a brewery or distillery so that I can produce mead or horilka myself, rather than trading for horilka with other towns
- a creamery or similar dairy building where I can produce cheese, butter, and cream
- iron deposits so I can mine iron myself rather than trade for it
- apiary so I can produce honey in quantities rather than buying it from villagers or trading for it with other towns
- addition of the health buildings currently labeled ""coming soon"" in the buildings menu
- perhaps the ability to farm vegetables so that I can have a stock of carrots, cabbage, beets, etc. without being dependent on whatever extra the villagers with gardens are willing to sell me
- Steam achievements, because I love collecting them and having these little mini-goals to strive for in a game like this where it's just ongoing management

Mолодець to the developer and I can't wait to see how the game progresses!",1676477135,1676477200,True,15,0,0.652520596981048584,0,True,False,True
773790,132767886,76561198071170924,209,43,1451,0,568,1680189106,mmmmmm my cozy lil village <3,1676287051,1676287051,True,0,0,0,0,True,False,True
773790,132726273,76561198100832504,632,147,266,0,254,1688964894,"So after 3 years of waiting for development:

Nothing really changed, expect more buildings...

Bugged buildings which not working at all: 
Easy starter things like set up storage and fill up with special stuff, SIMPLY NOT WORKS, after 3 Years!

There is no logic or fluent resource chain process. 

You just build them, watch simulation, hire workers, wait 10 minutes, fill up the storage, set work off, REPEAT...

If you're expecting a fluent logic villager build simulator with an existing working economy process, this isn't the game you're looking for.

All what you get is kinda like Unity Assets you can plop down and watch, there is simply no real logic Village life behind.

It's more than a slow editor watching-the-construction Simulator, because you simply have nothing to do, nothing to worry about, everything is too easy and too fast to collect.

There is a reason why there is no ""cheat"" mode with endless starter resources, otherwise you would see and play everything in 2 hours refund time...

NO real gameplay lets you expand to improve production lines, new technologies, no adventures, just no difficulties at all.

I really would like to love this Game and build 1000+ Villager Town, but whole Game mechanic already bugging out with 20 Houses and 30 Villagers...

Simply nothing let me come back and play on, good we get !MANOR LORDS! soon.",1676227207,1676227675,False,3,0,0.301493942737579346,0,True,False,True
773790,132389104,76561199051053550,0,6,240,0,124,1693506653,Amazing game,1675802477,1675802477,True,1,0,0.512195110321044922,0,True,False,True
773790,132099209,76561198055971880,0,7,21309,2003,3201,1708462293,"A lot of work being put into this!

As it stands i've pretty much played all there is to play of this game, which is a shame, however i took a look at their twitter to see any updates and it appears they are very much still working on some big ideas for this game! (which is great to see when it seems almost all early access games simply stay in early access and never get finished).

I want to say it's like making your own little diorama of an old town, VERY detailed little models right down to small details on the tiny wooden beams that make up the buildings, very fun and creative idea! great ways to make your town look nice and I am very excited to see what else they release for this game!",1675391240,1675391240,True,1,0,0,0,True,False,True
773790,131804822,76561198016613850,0,3,10571,0,4533,1691701632,"A well put together citybuilding game, some things are missing still, but the stuff that is already there is amazing, no grids, cool production possibilities. Looking forward to more of this game <3",1675001797,1675001797,True,2,0,0,0,True,False,True
