773790,97822365,76561198259215810,0,18,1328,0,462,1686524294,"#1  I do not like the grid-less building in this game, with “natural” roads – it’s just a big mess!!  It’s nearly impossible to place a building straight, and the terrain doesn’t flatten, so you end up with a crooked building half buried in the ground.  Ugly.

#2 The game seems to be designed so you have to do exactly what the developer intended, or all of your people leave.  It’s much worse than Banished, in this regard.  There is a very short window of opportunity to build the houses before winter, or people leave and impossible to catch up after that.  
There are never enough people, and to make it even worse – some jobs can only be done by men!   Seriously, why this complication?  Then,  you run out of food and don’t have enough variety……
I have not been able to get very far – and I am sure that is in part me – but I’ve played Banished and been successful ….  And I didn’t have to start over a million times!
The building animation is pretty cool, but it seems to take a very long time to build things.  I like the building que, and the fact that you can put certain buildings on hold.  Graphics are decent and overall it seems to have potential.  It’s obviously a work in progress.

Jury is still out – I will try it a few more times and if I can’t get past the 2nd year – I’ll consider it a donation.  

",1629320938,1629320938,False,8,0,0.488139569759368896,0,True,False,True
773790,65818460,76561198895141322,0,29,9532,0,1764,1681326134,"Great game, I've got many many hours invested as I bought it as soon as it dropped. The dev is responsive to any issues you may have (I had one, but the game is bug free) It's a great city builder that leaves out the violence of attacks, raids, and warring factions - Thank God. If you're not into all the chaos of constant violence but just want to build your city AND manage the economy then this is the game for you. 

Only have one gripe, well two. I would like to see more maps to start with and for the love of God PUHLEEZ give us the ability to lay our own roads instead of the current pathing system. It really bothers me that the people make their own paths - my cities ALWAYS look terrible because of it.  I'm not saying do away with the current pathing system, I know that's a big part of the game, just give us the ability to ""over ride"" it with our own or something.",1585179346,1629315121,True,0,0,0.523809552192687988,0,True,False,True
773790,97815706,76561198112783478,25,10,4927,398,1376,1708698048,"First things first; attention to detail in this game is top notch. Especially the building process, takes my breath away, i feel like i can see every single plank placed and nailed. Well done.
Jobs and economy structure, population chart and the way people are distinctive, all are beautiful.
Patches and upgrades are spot on most of the time.

Then why am i downvoting?

The game in its current state lacks purpose and continuity / replayability.
It never feels like a genuine living community and soon you are out of options to add to your townfolk.
Updates take way too long, probably due to the number of devs working on this project. (is it just one?)
At this pace it will take years for this game to be completed, if the developer does not give up, before that of course. Steam cemetery is full of such games, unfortunately.


",1629311897,1629311897,False,147,11,0.637052416801452637,0,True,False,True
773790,97622192,76561198029013723,207,28,1905,0,1414,1688615263,"Totally immersive village builder  that is constantly improved by its very proactive developer. A true gem.  Ostriv is set in an eighteenth century eastern European world where you start small and expand into a multi-faceted rural economy. The first time you watch your people wear paths into the earth  as they go about their  work is an attention to minute detail typical of Ostriv. Over time you will grow your villages' population, trade with your neighbors,  develop forestry, fish, plant crops and grow farm stock. Manufacture a variety of foodstuffs dry goods and tools to warehouse for your people's needs or sell to others. The color palette is true to the natural world  of its era. Don't be put off by its simple beauty. This is a solidly fulfilling experience.",1629042576,1629042576,True,1,0,0,0,True,False,True
773790,97607253,76561198084990694,0,10,4540,0,2005,1705059938,very relaxed city builder.,1629025778,1629025778,True,0,0,0,0,True,False,True
773790,97595578,76561198166855893,0,2,1542,0,1373,1653477564,"can only get 1 builder to build at 1 time with the new update please fix 
cant even get the new builder completed",1629009370,1629009370,False,0,0,0.477941185235977173,0,True,False,True
773790,77939945,76561198053788912,0,7,11958,0,177,1649868803,"June 29 2021 I have tried every trick I could find and I still can't build more than 6 houses by end of Nov. Whatever changed has not been fixed.
I wait month after month and they still havent fixed the problem with houses not being built at the start of the game , everyone leaves and it isn't possible to catch up
",1603315861,1628792129,False,0,0,0.45364418625831604,9,True,False,True
773790,97414850,76561198097616203,0,10,7868,108,802,1708962968,"Great game, it's EA so some things might not work terribly well, but it's very innovative:
- house system: houses have gardens so they can grow their own food, giving you more flexibility in the winter months or until you grow enough to start farming.
- farming: very realistic, you need to worry about soil regeneration
- ox/horse system: I'm sure it will be developed further, for now you can add ox to your farms for better soil regeneration. Horses help transport things a LOT faster around your village.
- trade system: very well put together already

Beautiful graphics - sure, it's a medieval village, but the way buildings are being built, the actual gardens, farms - they look great. There's some tweaks to be considered (example - take the horses out on the field during summer, like with cows and sheep), but I see a very bright future for this game. Hopefully the dev hires a team to help him carry this forward.",1628769026,1628769026,True,0,0,0.476190477609634399,0,True,False,True
773790,97402644,76561198319264186,0,10,2898,0,910,1703269316,Really good game,1628752359,1628752359,True,0,0,0,0,True,False,True
773790,97364729,76561198041545357,0,18,4640,0,4442,1674380271,"I really enjoy this game, I've played it from time to time and seen the changes. 
This is really promising, and I'm exited to start over again and se the latest additions.",1628698486,1628698486,True,0,0,0,0,True,False,True
773790,97298162,76561198972042796,0,1,3883,0,2502,1703198493,love the game. havent been on for a long time. do i need to get all the patches or just the most recent?,1628607016,1628607016,True,0,0,0.473186135292053223,0,True,False,True
773790,97231982,76561198066531705,0,18,355,0,109,1696330032,"A solid, nicely themed village/town builder.",1628514310,1628514310,True,0,0,0,0,True,False,True
773790,97219651,76561198320074686,0,9,2128,0,284,1685811178,Great game,1628495760,1628495760,True,0,0,0,0,True,False,True
773790,65584639,76561198011090562,0,5,4087,202,2846,1708830256,ok,1584915238,1628490869,True,0,0,0,0,True,False,True
773790,97121634,76561199090450870,0,3,592,0,592,1628357977,Just great. Soothing for the heart type of game,1628358006,1628358006,True,0,0,0,0,True,False,True
773790,97095031,76561197998012882,0,1,2453,0,1454,1691195265,"Very well done game! 
Accurate and complex city builder, and is constantly improving with dev making regular updates and growing the game as well.

If you like a longer-term city builder, this game is for you. It is very slow paced, which has its ups and downs, but it's quite enjoyable.",1628324657,1628324657,True,0,0,0,0,True,False,True
773790,97063368,76561198017439890,351,14,17126,0,3585,1679884468,Very good city survival  game!!!,1628277034,1628277034,True,0,0,0,0,True,False,True
773790,96987309,76561198184713054,0,10,4373,0,1835,1697501695,"This game is awesome, and the dev is doing god work with this, you've never seen as much update and thing added in a game at that rate, the game is wonderfull enough to make you play for hours and hours without realising it, its fun, and its not too much easy!

If you didnt buy it already, if you're into city building, buy it!
the dev deserve more love for his work !",1628170883,1628170883,True,0,0,0,0,True,False,True
773790,96978628,76561198063600093,0,5,523,0,251,1694952555,"Really good game, relaxing and at the same time you need to focus, I bought the game before it came to steam when it still was in Alpha and decided to rebuy when it got  to steam.",1628158122,1628158122,True,0,0,0,0,True,False,True
773790,96973058,76561197999118670,151,53,1687,132,171,1708206579,"Practically properly made mix of Banished and Foundation. 

Not much to say beyond that, good graphics, not too hard to learn, there is some form of complexity in its systems, and after 3 hours I havent encountered any serious bugs. For early access quite well working program.

If you ever enjoyed Banished and Foundation, this title is Must Be",1628148803,1628148803,True,0,0,0,0,True,False,True
773790,96674919,76561198304349059,0,5,1811,0,574,1693721588,"Fun, As typical town build game. still not many topic and economic play. And it will steal many of your time due to speed-forward didn't make much quicker.",1627713394,1627713394,True,1,0,0.523809552192687988,0,True,False,True
773790,96567256,76561198866265490,0,3,29320,2399,4180,1709052226,"Its a good buy. Its a bit repetitive but still can eat lots of hours on your free days. Ostriv is a relax game with easy to understood game mechanics. Everyone can get to it after several hours. Ostriv is another name of fun, relax and tension free game.",1627555484,1627555484,True,2,0,0.527696549892425537,0,True,False,True
773790,96531863,76561198054974123,0,10,8922,0,3694,1635002143,I  in joy it very much,1627497506,1627497506,True,0,0,0,0,True,False,True
773790,96480374,76561198131970341,0,9,3698,0,874,1687035596,"[b] One of the best city building games out there, hands down. [/b]

Great stuff:
+ Fresh take on the genre. Never would I have thought that I´d spend hours building 18th century Ukrainian town from scratch. 

+ Music is fitting and very beautiful, a true pleasure to listen.

+ The management system is well thought and extensive, but not too complicated. Assigning jobs is easy, but it did take me a while to understand how laborer/worker system worked, and how seasons affected the village's workload. Assigning working seasons and hiring builders saved my village several times, so remember to build that construction office.

+ Watching the little villagers go through their daily duties is entertaining. They work hard but also take little breaks and go chill on benches if you remembered to build them around the village. After their long day they relax in tavern. Unhappy villagers will move away, so keep them clothed, fed and give them a roof over their heads. Little bit of money during hard times won´t hurt either, and you can decide to give your more unfortunate villagers some financial aid.

+ Attention to detail is amazing. I´ve never seen a crop rotation in a building game like this, and I was amazed how thoroughly it had been thought. You get to experience the whole chain from field to the table, and this applies to animals as well. Chickens and other animals don´t magically appear to your coops and sheds, you have to actively trade for them and take good care of them once they arrive. You have to ensure that the chain for their food supply and storage works as well all year around, just like with your villagers. Otherwise the reaper man will pay a visit and then you have to start the process from square one again.

+ Game is not easy and it is surprisingly well balanced at this stage already. Balancing the workload and food/supply distribution during different seasons was pleasantly hard. I didn´t live in an Ukrainian village in the 18th century, but I trust the devs that this is a fairly accurate video game depiction of those times. 

Not so great stuff:
- I´d like better notifications if some part of the production line is halted due to an ingredient missing or lack of workers/laborers. Maybe some more logs and controls for the villagers too?

- There is a bug where villagers just freeze and do nothing. This sometimes prevents the game from progressing, if the villagers were doing something crucial like in my case, taking clay from clay pit. One villager blocked others from using the pit, so all building was halted. I noticed that saving and restarting game seemed to fix this.

10/10 game even at alpha stage. Can´t wait to see the new things promised on their roadmap.",1627421517,1627421565,True,23,0,0.740003883838653564,0,True,False,True
773790,96434413,76561198287455611,148,1,15293,0,11543,1643832667,variety,1627351100,1627351100,True,1,0,0,0,True,False,True
773790,95921126,76561198324644945,0,1,18402,0,11365,1686407627,"After alpha 4 patch 5 update, I played ~10-15 hours and see no worker stuck problem. It seems to be solved.

This game is the most enjoyful city building game I have ever played. The developer continously upgrading the game.",1626552336,1627247118,True,0,0,0.476901203393936157,0,True,False,True
773790,96310936,76561198036233061,0,1,7052,152,374,1708912100,Great Game Great Devs,1627157854,1627157854,True,0,0,0,0,True,False,True
773790,96302463,76561199083862974,0,2,9978,0,5073,1705029624,very relaxing,1627146209,1627146209,True,0,0,0,0,True,False,True
773790,96279816,76561198299622901,0,3,4348,0,2026,1682041003,10/10,1627113032,1627113032,True,0,0,0.47433549165725708,0,True,False,True
773790,96278176,76561198007376468,0,18,649,0,369,1686257086,Can't survive this game,1627110040,1627110040,False,0,4,0.366172611713409424,0,True,False,True
773790,96254971,76561198030963360,0,8,5617,0,2626,1682911240,"Ostriv is a beautiful city builder. It's Early Access right now so it comes with bugs, especially late game. However the Dev is responsive and frequently updates. This game will be fantastic when finished!",1627070153,1627070153,True,7,0,0.584640979766845703,0,True,False,True
773790,96057289,76561199144500673,0,12,1177,0,713,1664264302,good game,1626759320,1626759320,True,0,0,0.47433549165725708,0,True,False,True
773790,95924964,76561198006786631,0,14,6325,0,1261,1707018141,"Knowing that its a work in progress, it seems like it has a ways to go but is has a very nice foundation. Its very compelling gameplay for me.",1626557668,1626557668,True,0,0,0.495901644229888916,0,True,False,True
773790,95907752,76561198050376147,0,40,3284,0,1707,1627089809,"Pretty solid game once you get over the traps. IE: Needing to build in the correct sequence or instant fail. 

Would benefit greatly from modding",1626535458,1626535458,True,0,0,0.495901644229888916,0,True,False,True
773790,83762681,76561198868801068,269,74,62,0,45,1641976646,Resident evil village,1609538546,1626423195,True,0,0,0.449054598808288574,0,True,False,True
773790,95762811,76561199026669980,0,9,7681,201,1462,1708650250,A fun and addicting game focused on building a colony from nothing,1626323398,1626323398,True,0,0,0.495901644229888916,0,True,False,True
773790,95750000,76561198055506171,0,9,522,0,522,1588551896,"The game is similar to Banished (and a bit clunkier, but definitely getting smoother) but with consistent update is definitely turning into a great game. The level of detailing is appreciated.",1626302189,1626302189,True,0,0,0.495901644229888916,0,True,False,True
773790,95529634,76561198078358724,0,11,5658,0,1401,1644330186,everytime i play the game around 1725 all villagers stop moving and game becomes unplayable,1625999990,1625999990,False,2,1,0.486677110195159912,1,True,False,True
773790,95512872,76561199101215163,0,1,20157,165,2959,1708858431,good,1625975894,1625975894,True,0,0,0.47433549165725708,0,True,False,True
773790,95506619,76561198032147593,266,39,8245,0,594,1675106641,"This is a tough game to get the hang of. I am a huge Banished fan, so I am constantly on the look out for something that challenged me the same way Banished did. I think I found the mark on this one.

The biggest hurdle here in the first few hours of learning the game, is figuring out how to prioritize your people. The rush to get housing in the first year has proven a real challenge. I have yet to get all the houses up before winter hits, which puts a strain on the workforce. I had to restart SEVERAL times, because I have come to realise you need all 10 of those families to get through the first 3 years.

Once you get those houses built, the tutorial stops helping you. Not that it does a lot to begin with. You find yourself scrambling to figure out what comes next. In Banished you didn't want to build houses up too fast, the concentration was food. Well, food is still a struggle in this game too. I LOVE that the houses have their own home gardens to supply them, but there is still everything else they need in supply. Oh look, their cloths are wearing down, they are running out of good shoes. 

And then.. the game killer. The Economy. My first game I got to year 5 before I was broke and my families started moving out. 

This is definitely a micromanaged game. And not gonna lie, the economy side of it may be what makes it less fun for me.

What I would like to see in future patches? How about we start with some stable animal. Chickens or goats or something to help us build those second tier needs like clothing. 
What's up with the limit on seeds for our farms? I have traders wanting onions and carrots ect, and only my houses are able to produce those?
How about a sandbox game for players like me who really could care less about micromanaging wages. I spend half my time firing people from positions trying to save gold in holds to be able to trade for things I can't even produce yet.

I am still working.. I am still trying to figure it out. And I really hope there is going to be workshop abilities and sandbox modes to this game. Plenty still to fine tune, and I am gonna stick around and see what happens.",1625966531,1625966531,True,0,0,0,0,True,False,True
773790,68665543,76561198218176556,0,39,7732,0,1963,1703816011,"*Update* - 1 Year after my last review.
Some patches have now passed. Let us look on the Game now :)

https://steamcommunity.com/sharedfiles/filedetails/?id=2539853014

Short summary. Much has changed, but old problems remain.

-> Finances:

- Same probs like an year before. Workers with an ordinary long way to work (..and also market) have so often no money or time to buy food quickly.
- Set prices, tax etc. (like an year before) to zero and you earn with your first export of year all costs for your settlement of an Ingame Year. (best: characoal, sunflower oil)

Is this a Problem? No... but its not an good Simulation.

Devs tries to fix this problem with the new ""farmer houses"". This Buildings can create more self-sufficient
by the villagers, when they plant their own food in the Garden. Good Idea, but not the great ""solution"" for the pathfinding/jobfinding probs in the Game.

-> Manager / school system:

- Nobody need it really. When i play a game, i will manage my farms (or everything else). Nobody want to play a Game with out anything to do in the map. Come on dev !
- When you dont play with managments, you also need no school system :P

-> Religion and Health system:

- After 1 year of alpha their is still no Health System in Game :(
- The topic of religion is implemented very well. Nobody needs it really, but the 2 buildings are sweet :P

-> Goods, transportation, storage, supply and demand:

- Here you can see the strength of the game. Lots of goods, lots of supply chains.
- As a player you have a lot to do here in order to have enough goods in the right place at the right time. Very well done devs.

https://steamcommunity.com/sharedfiles/filedetails/?id=2539852939

Conclusion:

Personally, i suspect that the game is now well beyond its own zenith.
New content comes in, but very slowly. It's almost as lengthy as the game plays itself.
However, if you are looking for a game that does not stress you, you want to switch off after work or you just want to watch the bustle on your map, then please continue to support the developer.

It is an soooo cute Game.
I´ll wait another year for the next review :)

Greetings E.

Hey,
I have spend 32h into this Game now.

https://steamcommunity.com/sharedfiles/filedetails/?id=2086736771

Game works fine and the graphic is cute enough, but...
in the Game absence so many statistics.

- How many payed a family real for food and other goods?
- Which business needs how many of my product ?
etc.

I have invest 12h to check the economic simulation
- Why are so many family rich, when others with the same Working Situation are every time in their lifetime poor?
- Why are family rich, only while they have an ordinary looooong way to go to work and they dont have enough time into month to buy any things at the market? Familys in the near of market and also in the near of their Work have so often no money. 

I´ve have start so many tries to find an balance between poor and rich, but the only concept which really works without any trouble is -> set Prices to zero and give them for work 0,10 gold. with the first export you´ve paid all costs for one year. Thats not really a hugh Simulation at the moment.

The Game is nice, i hope when it find the way into beta it works fine.
At the moment it isn't really a recommendation for that price.

Greetings E.",1588759372,1625658367,False,29,4,0.586549341678619385,10,True,False,True
773790,95087406,76561198006849311,344,47,16220,0,3950,1661144379,"great game and community, can't wait to see what the devs will do.",1625467876,1625467876,True,2,1,0.509470164775848389,0,True,False,True
773790,95039927,76561198866610530,64,17,887,0,818,1677913382,Keep up the good work,1625410425,1625410425,True,1,1,0.508928596973419189,0,True,False,True
773790,95032278,76561198110132853,76,2,2965,0,667,1706579046,"Really in depth look at a civilisation city builder. Farming, animal production, trading and overall management. Quite a niche game but insanely easy to sink hours into.",1625403461,1625403461,True,1,0,0.508928596973419189,0,True,False,True
773790,95025840,76561198403695351,0,3,2168,4,1213,1708285029,good game but there is too little resorese like lime and ston,1625396693,1625396693,True,0,0,0,0,True,False,True
