773790,159334194,76561198875344810,0,1,1882,1882,1825,1709043871,my favourite Game at the moment.,1708965135,1708965135,True,0,0,0,0,True,False,True
773790,159285287,76561197984870834,212,11,1903,493,1845,1709052135,I could watch the villagers build for hours.  This game is a cozy Colony Builder with a lot to offer.  there is so much depth in the production chain.   I love this game so much!,1708901270,1708901270,True,1,0,0.523809552192687988,0,True,False,True
773790,159276800,76561198007867021,0,1,337,0,337,1706225678,"Very fun and in-depth game game,super animations. Thanks for making that game.",1708893364,1708893364,True,0,0,0,0,True,False,True
773790,146079018,76561198023639212,0,29,1315,84,1315,1708780176,"It seems the only way to start this game is to follow one of the few proven Guides. The in-game one is misleading in the extreme. 
Deviate even slightly from a guide and your settlement fails. Great if you want to join the sheep.
I guess there comes a point when your settlement is large enough to handle a few setbacks, allowing you a little room to make your own decisions, but I got bored long before that.
Buildings menu is poorly laid out, it can take a long time to find the one you need. Pause is your only friend here, which makes the game last longer while adding zero interest.
UPDATE:  Seen a number of releases since my first review, my opinion however remains unchanged. Even if you ithrow in every available cheat the game still manages to kill any ""free will"" by imposing conditions as to which order things have to be built. People complain about diet before you've had a chance to sow any crops - try to get around that by establishing a fishing industry because it seems easier to get production under way and the game ignores you. It seems the devs anticipated a certain path and the game can only deal with that with no room for ""deviation"".
A really horrible game, yet it looks so good I'm totally disappointed every time I come back, hoping it's been improved.
The game looks so good it may well take more than 2 hours to realise you've bought a turkey.
",1694376531,1708858198,False,2,0,0.432361721992492676,0,True,False,True
773790,159225170,76561198329486263,0,1,1563,1020,1086,1708878987,"When I first time encountered this game, it was the evening. Then I came back to conscious state at the dawn.",1708851410,1708851410,True,0,0,0,0,True,False,True
773790,159198211,76561198058649377,0,16,5078,481,4937,1709003953,"One of the best if not the best peaceful and chill city-town builders. 

The best part is the sheer depth, every part of each building needing to be collected and put to use - 1 plank at a time. Getting to see the constructions come together piece by piece, with the workers taking little breaks in between, it all slowly coming together in this way.. it's very satisfying to watch and each town/village/city you create will always have a natural and organic feel to it due to the way the paths form over time through ""usage"" and being walked on. I love building up around the naturally forming paths, rather than planning too far ahead before hand. Not trying to use any meta or particular rigid build order or placement makes the game feel extremely fresh on each new town. 

Once you have the basics set up and are self-sustaining food wise, you can continue to increase sustainability by expanding your farms and goods, importing cows for leather, building a shoeshop to eventually supply your citizens with their own boots and clothing.. or you can specialise in something, maybe Sunflower oil - guaranteeing a steady income from trading it in bulk. 

This game can really bring out anyones creative side and without the pressure/threat of raids or natural disasters it allows you to just play it in peace, either at 1x, 2x, or 3x speed if you want to get things done. I've never spent so much time in a city-builder type game simply just admiring and observing the little NPC's going about their day. 

Citizens will be born, grow up, play, work and live out their lives until death in your town, and you'll be there overseeing it all! 

One of the most underrated games on the market and 100% worth the asking price, I would recommend this to anybody looking for a game to just relax with or for an indepth city management / building game. 

9/10 but can only get better. 

With larger or randomized maps and no invisible walls/borders, (Please let us hide the big red line!) I would give this a 10!",1708821398,1708821398,True,3,0,0.545454561710357666,0,True,False,True
773790,159103303,76561198450107677,0,1,6438,1765,6237,1708746870,This game is quickly learned but yet takes some time to lock in to an overall approach for success.  Highly recommend if you like economy games without warfare distractions.,1708734732,1708734732,True,0,0,0,0,True,False,True
773790,66627892,76561198090275586,0,2,6067,13,6067,1708733414,"Clay pits can't be placed due to many factors for a good village build and low wear and tear on carts.  COME ON~~~~  Get your game together and actually consider what it's like for a player.  

Game keeps cutting out.  Can't build a building or do anything. Refund?

Can't keep pigs alive and the resources are a joke.  Now the game keeps cutting out due to the size of my town. 

fix this, sad game play.  So stressful.",1586040299,1708733507,False,1,2,0.385822385549545288,0,True,False,True
773790,159091098,76561199228842635,0,1,5881,0,5881,1700879756,One of my favorite games.,1708722682,1708722682,True,0,0,0.467980295419692993,0,True,False,True
773790,159078368,76561199059994622,139,2,32444,650,31807,1709001925,"Great game, One i get excited to see an update for.",1708712099,1708712099,True,0,0,0.467980295419692993,0,True,False,True
773790,158981300,76561198020489169,0,40,993,522,470,1709037830,"Beautiful, super in-depth game, very dedicated developers.
Just try it!",1708617215,1708617215,True,2,0,0.523809552192687988,0,True,False,True
773790,158973675,76561198354019769,0,1,5162,2890,4969,1709067182,Nice game even in the alpha version. We are waiting for the expansion of opportunities,1708611100,1708611100,True,0,0,0,0,True,False,True
773790,135793517,76561197986625918,0,32,9349,1924,7425,1709075629,If someone would tell me that I can only play one game for the rest of my life. This one would be it.,1680259222,1708604483,True,0,0,0.489745199680328369,0,True,False,True
773790,158965563,76561198283293264,105,2,8623,4043,7144,1708942431,great game. Hope the game keeping updating from great to perfect.,1708603183,1708603183,True,0,0,0,0,True,False,True
773790,158962975,76561199029622245,0,9,2312,2312,938,1709068086,Very fun game,1708600342,1708600342,True,0,0,0,0,True,False,True
773790,158956388,76561198114535694,0,6,3298,3298,2398,1708907569,"I've played every other city builder out there, and this one just seems a perfect fit, resource management and finance control are sweet perfection",1708591822,1708591822,True,0,0,0,0,True,False,True
773790,158948495,76561198057559840,0,10,6797,3,6797,1708580416,"very fun and calming game, lovely ambiance",1708580452,1708580452,True,0,0,0,0,True,False,True
773790,158936963,76561198978163028,0,5,4240,4240,3050,1709076838,"Best builder I have played.   Very addictive,",1708566430,1708566430,True,0,0,0,0,True,False,True
773790,158936921,76561198986188387,0,2,9728,798,8929,1708828911,I LOVE this game sooooo much!!,1708566387,1708566387,True,0,0,0,0,True,False,True
773790,158923523,76561198343051844,0,5,5214,1,5214,1708546731,"I love this game, its so relaxing and easy to pick up. I've played a lot of it and it is updated regularly so there is often new and interesting things.",1708551936,1708551936,True,0,0,0,0,True,False,True
773790,158906755,76561197994567653,279,1,1334,42,1330,1709018476,"Nostalgia fuel, 11/10, would recommend.",1708537280,1708537280,True,0,0,0,0,True,False,True
773790,158891629,76561198024714000,509,4,360,1,360,1708140206,Nice banished/like game. Better and much deeper than some similar games,1708524013,1708524013,True,0,0,0,0,True,False,True
773790,158890745,76561198154809644,0,2,18345,2971,15513,1709077062,Great game in ongoing development. Love the slow paced nature of it. Certainly worth it if you like citybuilding and resource management games.,1708523212,1708523212,True,0,0,0,0,True,False,True
773790,158847573,76561198143895297,0,2,3772,3772,2316,1709075319,Good game!!!,1708473865,1708473865,True,0,0,0,0,True,False,True
773790,158778660,76561198151419888,0,1,2930,1356,2523,1708914381,"This is one of my favorite games now. For me Ostriv is the best game in its genre. On Steam Deck it runs good.
But I really want and hope that developers will add a full day cycle. Please.",1708402867,1708402867,True,0,0,0,0,True,False,True
773790,158731985,76561198103907756,0,1,20496,3253,19284,1709057594,"Good game in my opininion, however relatively difficult to get into, it needs a better tuitorial. Also some industries are highly profitable while some others seem to be almost completelly useless, it still needs some work.",1708363378,1708363378,True,0,0,0,0,True,False,True
773790,158695308,76561197981901180,0,7,3023,203,2991,1708386225,"A fun resource management game set in 18th century Ukraine. Check out the Ostriv website for a production roadmap and tons of more information! Youtube tutorials will be important when you are learning the ropes, after that its quite fun and remains challenging.",1708320437,1708320437,True,0,0,0,0,True,False,True
773790,158602042,76561198054201029,0,1,160,160,154,1708272316,"Game has good visuals, seems to have good game mechanics. really needs a tutorial to get started. Commands are not intuitive. needs work.",1708238198,1708238198,False,0,0,0,0,True,False,True
773790,158600016,76561198005774360,0,5,2446,142,2304,1709031401,"This game keeps sucking me back into its world.
Give it a go; it'll crush you, and then you'll want more Horilka or at least more Iron.

But in all seriousness. This game is freaking awesome. Lots of nuance.
If you like management, you'll love this.",1708235758,1708235758,True,0,0,0,0,True,False,True
773790,158578498,76561198800676235,0,4,3376,929,2872,1709073629,"Wow wow wow I play (played) previous 'city builders' but the progression curve on those compared to this! .. Everything has a cost and you are forced to trade but also to really think about the production queue and manpower without it being too overwhelming ..kinda lol. I'm on my fourth or 5th restart just learning as I go. You don't have the massive death waves or the catastrophes of some of them .. not yet had anything but ox starve lol and you get hand outs in the early days when trading in serious figures is just a pipe dream. The urge is very much build this build that ... but people are people and will go to the jobs they enjoy or get paid well at so unless you have enough free people that building will not function! ...looking at you saddlery, i see you",1708215160,1708215160,True,0,0,0,0,True,False,True
773790,157672392,76561198048349786,0,6,3299,1654,2249,1708320544,"The game has a learning curve. It is not as simple as it appears, but it is lots of fun with unlimited replay value.",1707165993,1708033339,True,0,0,0,0,True,False,True
773790,158367196,76561198004563991,145,5,56682,2997,53876,1709009737,Worth a look,1707995465,1707995465,True,1,1,0.493821918964385986,0,True,False,True
773790,158357745,76561198855871192,85,1,436,434,284,1708044939,Low key and relaxing.,1707981556,1707981556,True,0,0,0,0,True,False,True
773790,158230086,76561198096850296,0,6,2732,127,2604,1707938311,"This game is great, the amount of work that clearly went into making the game as in depth as possible is amazing. I cant wait to see where this goes next, I am happy to wait for the slow development pace because its worth it.",1707832427,1707832427,True,0,0,0,0,True,False,True
773790,158190333,76561198082371246,194,15,1768,127,1108,1708047570,"it's good. will elaborate when i have a few more hours played. 

But i recommend!",1707778230,1707778230,True,0,0,0,0,True,False,True
773790,158075665,76561198251024678,0,1,3662,1,3370,1707903791,This is an awesome game! I am really proud that am Ukrainian! Thanks for this!,1707655920,1707655920,True,3,0,0.522931218147277832,0,True,False,True
773790,157703398,76561198083783914,24,5,379,0,379,1707172575,Labor management is obtuse. Workers leave their assigned post at any time. It would be a good game if labor management was better and more concise.,1707211861,1707211861,False,1,0,0.465880244970321655,0,True,False,True
773790,157684717,76561198020914379,236,7,4050,0,4050,1706460021,Cool game... but please give us a bigger ui text size option...,1707180945,1707180945,True,5,0,0.59369814395904541,0,True,False,True
773790,157578126,76561198106285542,77,4,1427,0,390,1707442166,"Absolutely love this game. I don't leave many review but this game is so relaxing to play and aesthetically beautiful. I love seeing my village expand and grow as more people pile in and the intricate resource making. I love ukrainian culture and ancient slavic buildings as well so the visual aspect of this game combined with the graphics is so cool. I absolutely love the direction this game is heading and because it is one developer i do not care how long it will take for full release. 

Some additional things i wish were added but don't need to be
-War i wish i could like rebuild after a war and see buildings be pillaged and stuff
-Additional Diplomacy with other towns and like a kingdom 
-More Government options like laws and stuff idk something immersive
-Visitors to towns that just stay for a bit and leave
-More buildings (but dont rush) i love the buildings in the game i wish there were a bit more like bigger orthodox churches and wooden castles and such and more bridges (i love the rowhouses) fountains too
-map customization
-more wildlife (instead of that fucking bird i keep mistaking for a bug on my screen)",1707055700,1707055700,True,3,0,0.565217375755310059,0,True,False,True
773790,157567535,76561199062584301,0,1,2629,68,2561,1708119457,"Прекрасний сіті білдер про українське село. Оглядаючи на те, що гра була створена однією людиною, то взагалі не може бути ніяких нарікань. Але треба зважати на те, що гра ще поки не дуже добре збалансована, - певні виробництва не мають сенсу, і вигідніше купувати готові ресурси, в той час як за рахунок виробництва інших можна завжди тримати скарбницю повною. Поки не вдалося налаштувати процеси так, щоб гра не вимагала мікро-менеджменту. 
Задоволення від гри отримано, тож чекаю на апдейти від автора)",1707045428,1707045428,True,3,0,0.498098880052566528,1,True,False,True
773790,157534771,76561198139822348,0,2,26071,0,26071,1707005932,.,1707005962,1707005962,True,0,0,0.477707028388977051,0,True,False,True
773790,157400157,76561199146328739,0,5,5468,524,1443,1709042882,"No matter what I do or how diligently I try to manage everything and meet everyone's needs, eventually everyone leaves my settlement. Either the learning curve is very steep and I'm doing something wrong here or there needs to be a way to manually bring in more people to allow players to recover from mistakes instead of having these game breaking issues that ruin hours of progress and time invested. Either way it's a deal breaker for me.",1706871646,1706871646,False,2,0,0.484328716993331909,0,True,False,True
773790,157382732,76561198346268660,0,1,24925,0,24917,1707630546,Slava to Ukraine!,1706847846,1706847846,True,0,0,0.430848538875579834,0,True,False,True
773790,157368438,76561198878348550,0,5,890,0,890,1706764105,its pretty chill. Its not exciting but it feels awesome when you are able to keep the productions going and more people start coming to your village. I enjoy it.,1706829568,1706829568,True,0,0,0,0,True,False,True
773790,157295918,76561198007397767,144,1,1044,0,1044,1706666350,"Ostriv is a truly special city-builder game. 

The best part of the game is the gridless building setup. Being able to set your buildings down in however you please and watch your town grow in a organic and asymmetric style over the years is really enjoyable and captures the realities of towns and cities in the time period (18th century). I am especially pleased when I am able to surprisingly fit a building in a space that I would normally think nothing could fit in. You can create beautifully cramped or open towns that look unique in each attempt. The only other game I've seen capture this well is Foundation.

Other nice things that Ostriv does that I haven't seen other games do is the farming. The quintessential way to amass food in any city-builder, farms are amazingly represented in Ostriv. The nutrient usage requiring crop rotation and fallow seasons is something I have only seen done in Farthest Frontier. It's a great layer of realism and strategy added to the city-builder category. The grid-locked farms create beautiful enclosures that grow to something resembling the same landscape you would see flying over some farms.

A few things that I would like to see Ostriv have is a random map generation, more towns to trade with, and more types of buildings and progressively more complex buildings and industries. Also, steam workshop support is always great for smaller games. Everyone compares these building games to Banished, but most people forget that Banished was never really officially worked on after its release. The Banished modding community did a fantastic job continuing to keep interest in the game and innovate on game mechanics.

TL;DR - Ostriv is a fantastic game if you are looking for a historical city-builder and felt a strong attachment to Banished. It captures those emotions of creating a thriving little town on the cusp of greatness and expounds upon the genre with things like free-form building placement, seasonal hiring, and intuitive farming.",1706750757,1706750757,True,4,0,0.579234957695007324,0,True,False,True
773790,157254828,76561197992384197,1281,34,2365,0,2132,1707545474,Great game.,1706704875,1706704875,True,0,0,0.497639656066894531,0,True,False,True
773790,154155175,76561198131705815,0,1,4325,63,3265,1707872525,Very interesting in Alpha,1703275450,1706627885,True,1,0,0.521453976631164551,0,True,False,True
773790,156932929,76561198081785393,0,82,182,0,182,1696970430,My gambling addict friend said if I post a review on ostriv and it gets 350 likes and 150 Awards that he will buy me a case of beer and some vodka So im just gonna leave this here.,1706345360,1706345360,True,66,3,0.574501395225524902,0,True,False,True
773790,156807107,76561198075092171,0,1,2783,51,783,1709050845,"Has a lot of promise, definitely one of the better city builders out there.",1706209838,1706209838,True,1,0,0,0,True,False,True
773790,156672813,76561198017709853,0,45,212,0,212,1650738041,🔱💙💛🔱🤟,1706066582,1706066582,True,2,0,0.527235090732574463,0,True,False,True
773790,156671026,76561198119497581,0,4,13083,744,4607,1708638238,"Ostriv is a City Builder that has come a long way.  The develop plan foretells much more, both in features and balance.  Relaxing to play, yet challenging.  Animation is first rate.  New players should be mindful this game is still in Alpha, so some patience improves your experience.  This is already a good game and promises to become a great one.",1706064384,1706064384,True,0,0,0,0,True,False,True
773790,156624810,76561198947315035,0,4,1873,0,1873,1706014103,"This game is being in development by a Ukrainian person solo and sense there is conflict in that region, the game has been put on Holt for the time being. It is in Early development witch means bugs, such as random crashes or game not starting up entirely, overall it has a solid foundation for being really good for the future. it is a little repetitive and your first year is rough, like really rough, but once you establish priority it becomes a lot easier. It is a great relaxing game that I would recommend anyone giving it a shot. once again, it is in development, I cannot critique it too much outside of the bugs that I have come across.",1706014660,1706014660,True,0,0,0,0,True,False,True
773790,156584968,76561199029722971,25,4,2092,0,1871,1706135755,"It's a good game if you like both city building/micromanagement games, and an element of 17th century charm and difficulties. The trading element ties the game in well together, however I feel it would be better if it had more variety to it's set up. Something as well that would be cool is if your town could be prone to invasions of other tribes and wars; nothing like a full battle style game but just something that adds flare to the already in depth world of the game. 8/10",1705964336,1705964336,True,0,0,0,0,True,False,True
773790,98090372,76561198875583127,0,3,41069,1078,39120,1709064414,"Ostriv is a masterpiece. It´s not like most of the city builders with a grid system, you can build naturally and you can create an organic villasge that looks so real and beautiful. Graphics are amazing, the music is amazing, it looks so good. It´s still in Alpha but you already can play the game and do a lot of things. It´s my favourite city builder and i can´t wait to be complete, it will be stunning.",1629721358,1705942014,True,0,0,0,0,True,False,True
773790,139237398,76561198109756987,0,11,1467,0,1121,1699344965,"Entertaining and great little city builder. I find this to be incredibly fun. But, the one bad thing about this entertaining game is theres no objectives just building to grow. I cant wait to see this game progress and I hope for the better. I would definitely recommend this game to players who enjoy city builders. Although, for the price I would personally say to wait for a sale",1685398236,1705816170,True,0,0,0,0,True,False,True
773790,156408903,76561198300834304,0,12,1422,19,742,1709026237,<3,1705783801,1705783801,True,0,0,0.494186043739318848,0,True,False,True
773790,156378413,76561199415432186,0,1,420,0,420,1705758705,"The detalisation is wonderful, very beutiful. There are bugs, definitely, but that's OK for the current stage of development",1705758766,1705758766,True,1,0,0.505813956260681152,0,True,False,True
773790,156371425,76561197961968199,0,10,2491,71,2245,1708808641,"This is an incredibly detailed and very well crafted city builder, with attention to accuracy and beautiful presentation.",1705751905,1705751905,True,0,0,0,0,True,False,True
773790,156366424,76561198038649636,71,9,628,0,358,1706207399,"This game is absolutely fantastic! A breathtaking atmosphere of a village, meditative gameplay and audio.
I've found myself completely addicted to growing my pigs and cows :D
The aesthetics is also top notch. Houses have different forms and visuals.
If you are a city-building fan - this game will almost certainly captivate you. 

Слава Україні! ❤️",1705746797,1705746797,True,1,0,0.47826087474822998,0,True,False,True
773790,156253284,76561197993921058,0,8,7610,0,7610,1705572428,"This game is amazing and the development process impresses me with how finely balanced and carefully thought through every aspect of this game is. The balance is perfect, the historical accuracy is top-notch, the graphics are very good. The tech tree progression is so natural and interesting and just keeps the game going, while avoiding the problem lots of games have where expanding the game just makes it impossible with too many spinning plates after awhile; as long as you keep your people and livestock fed, your people housed, your labor base appropriately sized, and your treasury managed, the game keeps getting more complicated and your village looks more alive and real without really getting harder, it just progresses! I can think of where Anno 1800 became unmanageable after the mid-game and made me stop, or Cities:Skylines where the simulation breaks at ~90k cims no matter what you do because it's a bad simulation. Not here in Ostriv! It's such a finely honed and balanced while being a delightfully pleasant challenge, I love this game and have been impressed with how every update makes it better. Buy Ostriv!!",1705609190,1705609190,True,1,0,0,0,True,False,True
773790,156113659,76561198834077116,0,1,9973,0,7278,1705719913,This game just keeps getting better and better.,1705431708,1705431708,True,1,0,0,0,True,False,True
773790,156083862,76561198313934171,0,21,387,0,258,1705537290,Colonization is fun!,1705389422,1705389422,True,0,0,0,0,True,False,True
773790,156050789,76561198118020488,0,2,10451,0,10451,1705344543,Building game taking place in the 1700's.,1705344684,1705344684,True,1,0,0,0,True,False,True
773790,155997146,76561198278066209,168,18,2173,0,965,1706360194,"If you've enjoyed Banished but you were looking for ""something more"" then this is it.
I have found it a bit more challenging than Banished & Farthest Frontier so far but that's a good thing.
The attention to detail is incredible & the game runs as smooth as a hot knife through butter.

One thing I would really love to be added into the game would be support for ""windowed mode"". At the moment playing it at 3840x2160 is not ideal. The ""Borderless window"" option is not much different, Windowed mode for the win...here's to hoping.

Overall though, this has been a game I was missing in my collection and I couldn't recommend it enough to those who enjoy peaceful but challenging city/settlement/simulation games. It also seems that the developer has drops updates/patched quite regularly which is encouraging.",1705269833,1705269833,True,2,0,0,0,True,False,True
