773790,73830810,76561198963643309,0,4,5662,579,1872,1709076819,"This is a beautiful rendition of life. The designer's sensitivity has included names, ageing, children and the ravages of rural living. All of which contributes to an involvement with the people that you have inflicted life chis on. You can watch as a villager appears first born and follow them through to childhood and watch them playing, then into adulthood, old age and finally death and burial. It is immersive, and in an emotional way, for instance clicking on a grave stone shows you the memorial and you can remember when that person first arrived in the village and so on. I hope that eventually the game includes the ceremonies of baptism, marriage and burial in the church we can build. Schools are yet to come and that will add to our care and concern for villagers. Truly a work of art and worthy of our best endeavours for the people of 'Our Town'.",1596658351,1596658351,True,0,0,0,0,True,False,True
773790,73643905,76561198123047163,76,3,6877,0,2417,1685553526,I've played 40+ hours of this game and I still enjoy it and enjoy the new features that come out every so often. Definitely worth investing your money into a game where the developer is very active and listens to the community as well.,1596354759,1596354759,True,1,0,0.523809552192687988,1,True,False,True
773790,73618764,76561198148122315,42,4,5431,97,163,1709076277,"You guys need to put a gravery, schools, horses as a transport to carry stuff, horses carrying carts, or cows. Also need to put more decoration as, flags, flowers. And add more ways to gain money.",1596305355,1596305355,True,0,0,0,0,True,False,True
773790,73568971,76561198173087970,0,28,1125,0,670,1605701533,"I would mildly recommend this game to others  but once the game is fully created I will give my full thumbs up because there is a lot of potential in this game and a lot of hard work is going in from the developers. If you buy this game at this stage it would be a great support for the developers and we ultimately will have a great game to play. 
I would like to point out a few things from my experience of playing city building games.
1. There is no bakery as yet. If I am producing flour then a bakery should be there.
2. if there is a lack of laborers, things are not fetched by workers. like for dried fish you need salt. but the fishermen do not get it from the granary or the trade house. this should not be the case. if there is no item then the worker should be triggered to get it.
3. There are no prosperity triggers as yet. once the village reaches a certain stature the wants and needs of the populace should become diverse and buildings should become upgradable etc.
4. It lacks any kind of events. Without events like natural calamities  or looter attack etc. the game is not all challenging and will bore the player once he/she has built everything. 
5. why can't we mine iron? its only available by trade....why?
I am playing the game and found out these for now. I will continue giving suggestions. Looking forward to a great end product.",1596215113,1596215113,True,0,0,0,0,True,False,True
773790,73544475,76561197961301629,0,3,118,0,118,1596167774,"It feels like a project someone started but lost interest, just as I did.

Some very basic mechanics of the game have not been addressed and at least a third of the options in the build tree are still ""being worked on"". I feel at fault for buying games that aren't complete, but at what point do developers realize they are releasing trash and asking people for money. 

As far as the couple of hours I have played, the game is dreadfully boring with no real outside ambition to move you into the next phase. Refunded.",1596168385,1596168953,False,4,0,0.395309120416641235,0,True,False,True
773790,73535407,76561198154654258,80,15,1720,0,479,1653733461,"For an early access game, created by a small studio, it's kinda noice job. I chose to support you by buyin it, my pleasure. Continue what you do with it as until now, its the right way! :)",1596149473,1596149473,True,3,0,0.547635376453399658,0,True,False,True
773790,73525529,76561198048387869,0,3,4887,0,544,1683556801,"It's a Alfalfa, however, it's still excellent. Do read the Fandom Wiki on how to play which is excellent. If you only buy one 18th century Ukraine Village building simulation game this year buy Ostriv.",1596132515,1596132515,True,0,0,0.484764575958251953,0,True,False,True
773790,73505016,76561198107539126,0,2,17986,0,2426,1705595563,"Always loved Banished and this game has potential to be greater! 
Even game is not finished, it still fun to play and chalanging  right now! 
",1596100052,1596100052,True,0,1,0,0,True,False,True
773790,73485930,76561198801482031,30,4,1168,0,524,1667146415,"For an early access game, created by a smaller studio, it's impressive how many options there are and how well it does.
However, like any game, whether it is in early access or not, it needs a few tweaks to make it really good. These are:
1- Optimization. A critical point for this game, it really needs a complete adjustment in both ram, cpu and gpu performance.
2-Food and Money. This also needs some adjustments, not as severe as in optimization but it does need them. The money is spent too much, leaving you with the only option to make really big adjustments to your population if you want them not to move due to lack of money to buy food. With food, it is spent too fast, a family coming to consume (in my games) much more than they need, leaving the possibility of buying from the others.
OPTIONAL:
1- Rebellions. This would be great, and you are surely wondering: ""what is it based on?"". Well my dear user of Steam, it would be based on the fact that populations that do not have access to food, water or that do not have money, will rebel against their corrupt or inefficient mayor and go after their head.
2-Creation of Kingdom. This would also be good. Once your game has reached x population number, you have the possibility to create a kingdom and put yourself as its King.
3-Invasions. This for me would have to be put in another update. In the game map you can see several cities, so that as your city grows, it is pressured by other cities to join their kingdom. If those pressures reach a critical point, that city will invade you, and you, as the person in charge of your people, could defend it until death, or be a coward and surrender or escape.
8/10. Fierce of those adjustments, a very good game that promises a lot when it leaves the access.
Buy it if you want to try it, or wait until it leaves the access.
Greetings and have a good day / afternoon / night.",1596061035,1596061035,True,0,0,0,0,True,False,True
773790,73445875,76561199043518660,0,1,1391,0,1044,1599548833,fun once i got the hang of it. not too hard but did take a few tries.  excited to see what else they do with the health and education,1595992589,1595992589,True,0,0,0,0,True,False,True
773790,72797027,76561198060210639,0,8,10087,348,2470,1709071831,"Overall this game is very fun and will be very addicting as more content comes along. People who thumbs down this game should of never bought it as it is an alpha. It is fun and has a very bright future as a city/Economy builder. If the 25 bucks to purchase the product will set you back don't buy it. If it won't hinder your life support the game and spend the money. It is a work in progress but certainly better than any alpha I have ever experienced. It does need more town stuff to expand on the experience and play-ability. Schools, taverns, fire house, police station, eateries a bunch of things that would make it more realistic as a town.",1594919548,1595957202,True,0,0,0.476190477609634399,0,True,False,True
773790,73421875,76561198832029226,112,2,24112,365,5730,1708936958,i love the game.,1595951710,1595951710,True,1,0,0,0,True,False,True
773790,73420578,76561199050603648,0,1,18513,0,483,1648071983,Excellent Game,1595949824,1595949824,True,0,0,0,0,True,False,True
773790,73418729,76561198064174034,0,3,5409,0,1163,1680959031,"Really good village builder, better than banished. better controls. highly recommend. still in early access.",1595947093,1595947093,True,0,0,0,0,True,False,True
773790,73351381,76561198054049424,0,3,6111,0,972,1703712597,love this game . obviously it needs a few things like a bakery but im really enjoying it so far and cant wait to see where they take this game.,1595844302,1595844302,True,0,0,0,0,True,False,True
773790,73327954,76561199053613105,0,4,5305,271,193,1708822158,Awesome game,1595795343,1595795343,True,0,0,0,0,True,False,True
773790,73295230,76561198996959043,11,6,32730,0,3431,1704027351,"Good game, I like it!",1595743029,1595743029,True,0,0,0,0,True,False,True
773790,73287737,76561198143885795,0,2,1693,0,130,1679830668,"the game not running 
the developer not helpful 
not series with dealing with problem issue 
if I have a wish I will refund my money and spelt on this game",1595728242,1595728242,False,0,1,0.415355563163757324,0,True,False,True
773790,73221173,76561198142090494,61,2,5355,0,1670,1683061794,"This game is quite frankly amazing, the concept and gameplay is fantastic. I cant wait for it to develop into a larger game with more content>",1595613975,1595613975,True,0,0,0,0,True,False,True
773790,73190659,76561198078949013,0,3,1149,0,634,1621285330,The whole goal is to keep your people alive.  Fortunately they brought enough supplies with them to survive the first two years of my attempts to help them. A fun city builder/survive in the wild game.  I am sticking with this game even though the people in my city are fleeing.  My only suggestion to the developer is to make the fonts on the popups adjustable.,1595560906,1595560906,True,0,0,0,0,True,False,True
773790,73161071,76561198869867163,0,3,3967,0,212,1690972073,"The game has started so strongly for me. I love the idea of city builders but outside of Tropico 4-6 I never quite got into any of them as things like traffic control is tedious - so a City Builder in this period was always going to be appealing to me.

At first I was confused as to what was important for the city. But the guide helps you understand what to build first, which was very useful. The first thing I noticed is just how enjoyable it is to watch something being built. Yes it may take forever for the required resources to arrive at the building; but the whole building process is enjoyable and a great mechanic. 

In my first attempt at the game I underestimated the value of ""Nails"" and so after the first hour I pretty much had to start again. This time, ensuring that the key materials for building and the maintenance of Carts was crossed off (after realising just how important carts were for carrying decent amounts of materials.) Upon my second attempt, the other issue I created for myself was importing far too many goods (cows, dried fish, flour etc), to the detriment of my town's bank balance. Before long, I was in deficit and couldn't send messengers anywhere to amend by exporting products. Although it didn't stop any of my villagers from doing their jobs because I had no money to pay them, which I don't think is supposed to happen. Note to self: Exporting is THE 2nd most important thing you can do.

I look forward to my 3rd attempt of getting this right. I understand this is a game in development so I expect there are a lot more options to come. But at this stage, I foresee myself getting mastering the economy section of the city builder, and then getting very bored. Hopefully this can be alleviated. 

A few considerations/suggestions: 
- Graphically, this game isn't outstanding at all, this is more about the gameplay and mechanics, if you came here for aesthetics, you'll be disappointed. 
- Could do with more variation in the soundtrack, not necessarily always music.
- Could have more weather variations than just sun and snow. (Rain, Thunder, Wind etc)
- Variation in trees and grass: thickness, height etc.
- One higher level of speed. (12x still isn't fast enough when your waiting for a building to be built) 
- Do children not work or go to school? We don't even see children in the game which is disappointing. 

All in all, love the game. Will definitely keep playing. Love the farming system as well. And I definitely love how it's a little bit of a puzzle/challenge. Keep up the good work.",1595510709,1595510709,True,0,0,0,0,True,False,True
773790,73061607,76561198165384847,331,1,2356,0,1582,1683582369,"fun game to play in your spare time, can be difficult to get all 9 houses at first but, with practice, you'll be able to do it every time",1595339591,1595339591,True,0,0,0,0,True,False,True
773790,73014645,76561198112499302,141,9,1393,0,1010,1705625947,"Despite it being in Alpha 3 , game has potential. It might even beat Anno 1800 if it gets good enough.",1595271688,1595271688,True,0,1,0,0,True,False,True
773790,73014230,76561197993988263,0,34,3981,0,270,1705789003,"- nice strategy game
- a lot of promising planned features for the future
- already playable at a good level of complexity",1595271099,1595271099,True,0,0,0,0,True,False,True
773790,73010009,76561199005884600,0,10,2900,0,187,1658883554,lovely relaxing game,1595264827,1595264827,True,0,0,0,0,True,False,True
773790,73006460,76561198231967248,100,28,5198,0,374,1682087176,"As long as you are grounded with this being an unfinished EA game, it's great! Some things are missing still, but as a single dev endeavour Ostriv is a great addition to city building games. In so far, I had encountered no bugs, and the game runs smooth, albeit a little slow and confusing at the start (probably due to the lack of a clear tutorial, which understandably isn't a priority at the moment.)

I'd say if you'd like to pick a dev to support, this is a good game to share some love.",1595259984,1595259984,True,6,0,0.565217375755310059,0,True,False,True
773790,72985253,76561198039675203,0,14,5343,0,2618,1704347833,"awesome...
great game...
great progress",1595223238,1595223238,True,1,0,0.501079916954040527,0,True,False,True
773790,72982587,76561198092589792,0,15,1878,0,1054,1639163355,Very nice,1595217797,1595217797,True,1,0,0.501079916954040527,0,True,False,True
773790,72971218,76561197965420161,0,1,3151,0,1717,1687139684,Love this game. Great game play you will love it also,1595196482,1595196482,True,1,0,0.501079916954040527,0,True,False,True
773790,72961001,76561197991994575,214,21,497,0,323,1641750987,"Add to your list of city builders, this has great potential.",1595181084,1595181084,True,1,0,0.501079916954040527,0,True,False,True
773790,66218094,76561198031927084,97,16,6855,0,3374,1636157868,"Great job with the new patch! everything is running smooth!

Fun game, very chill. lots to do even though it's EA",1585624770,1595101182,True,0,0,0,0,True,False,True
773790,72900835,76561198091966812,0,1,4844,0,3477,1688285076,Please keep working on this game :),1595086186,1595086186,True,0,0,0,0,True,False,True
773790,72874691,76561198130152031,32,4,9532,0,619,1650346520,This is a great relaxing game for a city builder.,1595044684,1595044684,True,0,0,0.476190477609634399,0,True,False,True
773790,72855925,76561198369568776,0,3,7260,0,632,1690816668,Much harder than it leads you to believe but very engaging.,1595013061,1595013061,True,0,0,0,0,True,False,True
773790,72855057,76561199070904206,0,6,264,0,248,1630882201,"The game is ok but i dont like having to adhere to timers or being forced to do certain tasks. I like relaxing and building things the way i want to. Game is not bad, just not for me i guess.",1595011807,1595011807,False,0,1,0.41095888614654541,0,True,False,True
773790,72804865,76561198040073882,55,3,8340,0,609,1704233510,To say this is in Alpha is an understatement. Unplayable nightmare.,1594930198,1594930198,False,2,1,0.413426965475082397,0,True,False,True
773790,72777643,76561197986180581,0,4,10302,0,3597,1625722373,historical economy building game....nice!!!,1594892385,1594892385,True,1,0,0,0,True,False,True
773790,72648944,76561197971170766,412,17,14924,0,2897,1705209929,"This is a fun title, a little brutal at first, but once you start to figure it out it's rewarding.

If you enjoy engaging and difficult city builders in the vein of Banished, this is your game!",1594689255,1594689255,True,2,0,0.547325074672698975,0,True,False,True
773790,72622243,76561198088882107,0,41,1433,0,259,1707493881,daMN GOOD,1594649640,1594649640,True,0,0,0.485008835792541504,0,True,False,True
773790,72595999,76561198448065212,0,3,3316,0,2120,1615431088,"its fun but gets repetitive quicly. Needs more trading availablitilty with other factions. maybe some hunting, animal attacks, defensice weapons. more food optons, more work related options.",1594605383,1594605383,True,0,0,0,0,True,False,True
773790,72479489,76561198027297065,0,6,2216,0,764,1653511735,"Please buy this game so they can keep adding more to it. It is a great sim, just needs more content to keep being added. I am excited to see where this game goes",1594444712,1594444712,True,0,0,0,0,True,False,True
773790,72471859,76561198030896774,0,10,5068,0,4987,1648335002,"I like it.  I haven't played in a few months and haven't tried the new updates.   There were a few glitches that made me stop but it has been months and the it is still in development.  I give them a break...   Going to try it again soon, and do recommend it despite the previous glitches.",1594433359,1594433359,True,0,0,0,0,True,False,True
773790,72458820,76561198006455520,2047,158,652,0,652,1594324932,"Ostriv is pretty good building sim.
Its still in early access you can see that the game is far from finished, but what is already in game is pretty good.
I loved the way buildings are built, its just awesome watching workers laying foundations, and erecting every single beam separately  etc.
Also the management mechanics in game are very interesting. The crops rotation is great, which other game forces you to take crop rotation into account. Option to use unemployed citizen as parttime laborers is great idea.  

The seasonal hiring mechanic is great. Let me explain what it means.
During sowing and harvesting season you need all your arms on fields. So you can set your non essential buildings to close down during these months so ppl go work on fields instead and then during winter when there is no work on fields or fishhouses you set those buildings to not employ anyone and instead put your ppl into buildings that are processing harvested crops, like weaver, tailor etc.
And you don't have to do this manually, you just set it up and then it will happen every year.

I am looking forward future updates. I have feeling this is going to be great game!",1594414169,1594414169,True,0,0,0,0,True,False,True
773790,72425797,76561198811187045,0,4,883,0,380,1642747706,game freezes after first winter,1594377275,1594377275,False,1,3,0.442122191190719604,0,True,False,True
773790,72359276,76561198075405949,0,2,1311,0,938,1690918131,Best base-building game for years. Love the details,1594294661,1594294661,True,1,0,0,0,True,False,True
773790,72305679,76561198026551972,436,17,1314,0,1314,1594147409,"Even if OSTRIV is an early access game, it offers players much content. It's basically high-end BANISHED. There is a few downsides, but I don't wanna mention them because hey, it's an early access. Dev responses fast, because of that I felt bug reporting is actually useful. The game is fun to play, shows a lot of promise. I recommend OSTRIV as a player of PHARAOH, ZEUS, CAESAR, BANISHED, INDUSTRIES of TITAN, SURVIVING the AFTERMATH, FROSTPUNK, RISE of INDUSTRY (and many many others).",1594223615,1594223615,True,48,0,0.742888510227203369,0,True,False,True
773790,72279402,76561198054596231,0,5,21997,89,1988,1708716767,the game is good. very engaging. the pnly problem is it crashes later on in the game,1594190586,1594190586,True,1,0,0.51086956262588501,0,True,False,True
773790,72265549,76561198053663364,0,1,2337,0,1422,1663463363,"This is a great example of a well though out, in-depth game in Alpha state. Sure, there might be some fine tuning/balancing that [i] could[/i] help how fun and intuitive some things are - but at the end of the day this 17th century city building game allows you to get detailed with design or focus completely on function and allow the AI to create some chaotic art :)",1594169835,1594169835,True,0,0,0,0,True,False,True
773790,72211691,76561198303029494,124,4,1675,0,625,1686938332,This is a great game. But if you aren't a veteran at city builder games DO NOT play. It's very in depth and takes a lot of thought. Even though there still needs to be work done and more stuff added this is a great game and I'd totally recommend this game to others.,1594103780,1594103780,True,0,0,0,0,True,False,True
773790,72117913,76561198058678911,151,32,15440,0,2017,1683151895,"So far I am very interested. I find, that the management level is well suited to my preferences, and the visual detail is a boost to the genre. Also, the slow pulse throughout the gaming experience is to my taste ..

I realize that this is an early access and therefore I am adjusting to a minor lack of content. I hope to see some more soon.",1593981583,1593981583,True,0,0,0,0,True,False,True
773790,72045270,76561198004900255,421,65,343,0,109,1593954481,"If there would be a ""wait for it"" button i would've said that.
The price is too high for an early access with that few content.
But im sure given time this game could become a Banish successor.",1593894498,1593894498,False,2,0,0.480113625526428223,0,True,False,True
773790,71937784,76561198050879716,0,6,507,0,312,1595423563,"looks like a great game in the making once any issues are corrected, how about the game maybe having the option of an easier level of play and a bakery would mean more bread from wheat for food before everyone leaves the town, animals available from the start would be great once again for food at beginning of game and more babies being born??",1593769425,1593884615,True,0,0,0,0,True,False,True
773790,71992618,76561198002189495,0,144,2994,0,304,1627617665,"https://youtu.be/K_K6XTv2Lx0

I'm enjoying the game so far. 
Positive:
A good amount of production buildings
Relaxed atmosphere
Fairly straightforward gameplay, but it's challenging
Runs well
Fun

Negative:
No random maps (the game comes with 4 maps)
The building variety could be better

Verdict:
It's a good game similar to Banished, but holds its own. I almost didn't buy it, but I'm glad I did. It's fun to play, but could use random maps and more building variety.",1593833848,1593833916,True,5,0,0.563485980033874512,0,True,False,True
773790,71946911,76561198005053695,0,11,5870,0,1444,1597123735,"So much fun, just as good as Banished.",1593780391,1593780391,True,3,0,0.490310251712799072,0,True,False,True
773790,71914371,76561199028221719,0,2,6400,0,1499,1615011814,"You are given a very hard task from the get go, always turn to failure you will drop or Do NOT BUY this game. one should enjoy your games this one, you are never given a chance.",1593735577,1593735577,False,0,1,0.297344684600830078,0,True,False,True
773790,71828236,76561198020474979,0,182,147,0,147,1587606114,"I paid full price for this game and was not disappointed. I have about a half a dozen or so city builder games. I am definitely going to have to get this banished game that many reviews compare games to. 
OSTRIV: You start the game off with all of your settlers. The way you get new ones is that they are born and grow up. You assign  workers to the buildings. Some buildings you put a manager in charge. The tutorial is helpful. There is a clear progression of what buildings you will need at the beginning of your colony. There is also trade with other towns. The trading feature cannot be ignored like other sim games. For example you want to have a chicken farm or milk from cows well you have to get some animals from your neighbors the game just does not give them to you.

Overall: The game is challenging so far. It looks great. I have encountered no bugs. Very unique setting for a city sim. It is worth the full price.",1593631512,1593631512,True,7,1,0.581691265106201172,0,True,False,True
773790,71735045,76561198135667848,117,8,1971,0,479,1705261072,innovative city builder,1593527558,1593527558,True,0,0,0.468589067459106445,0,True,False,True
773790,71643199,76561198068875097,306,16,2418,0,76,1705334075,Banished 2020.,1593427796,1593427796,True,86,13,0.77065509557723999,0,True,False,True
773790,71616094,76561198963388842,0,21,1823,0,494,1691404165,so fun but i kill everyone by winter,1593393220,1593393220,True,0,2,0.495454519987106323,0,True,False,True
773790,71482919,76561197995290897,0,14,3680,0,2284,1705185661,good game for early exes game,1593259054,1593259054,True,0,1,0.470242768526077271,0,True,False,True
